country,country_name,category,genre_id,rank,app_id,app_name,developer,url,price,averageUserRating,userRatingCount,primaryGenreName,description,launch_date,update_date
al,Albania,Finance,6015,22,994414655,TebMobile,TEB SHA,https://apps.apple.com/al/app/tebmobile/id994414655?uo=4,0.0,4.49111,3148,Finance,"Banking services for anytime and everywhere!

TebMobile is an electronic service, through which, clients have access to their accounts and other bank products, at any time and everywhere. TebMobile is user friendly, secure and an effective service which is offered to all clients. It is available for non-customer as well, offering different features. 

The chance of staying competitive in the market will be even higher through TebMobile services since the cross selling of different products such as accounts, loans, credit cards, payments, standing orders will increase. 

TebMobile will be available in two languages: English & Albanian

TEB Customers have these features available in TebMobile:

 Dashboard
	•	View total assets
	•	View total debts
	•	View future debts in calendar
	•	Define standing order in calendar
	•	View account in diagram
	•	View credit card in diagram
	•	View loan in diagram

  Accounts
 	•	View account transactions
	•	View account balances
	•	View account details
	•	IBAN extract 

  Credit Cards
	•	View credit card transactions
	•	View credit card debt
	•	View credit card details
	•	Apply for new credit card
	•	Apply for supplementary card
	•	Apply for credit card limit increase
	•	Change payment date for credit card
	•	Change payment method for credit card
	•	View credit card statement
	•	Pay credit card debt/another person
	•	Invoice payment with credit card

 Loans
	•	View loan payment plan/details
	•	Send  loan payment plan via email
	•	Apply for loan

  Payments
	•	Invoice payment with barcode reader
	•	Make institution payments from account or credit card
	•	Make payment for pre-paid services (IPKO)
	•	Make mobile top-up refill (IPKO, VALA, ZMOBILE)

  Transfers
	•	Quick transfers
	•	Transfer between my accounts
	•	Transfers to TEB accounts
	•	Transfers to other banks

  Investments
	•	View rates
	•	Foreign exchange (buying/selling)

  Non - Customers have these features available in Teb Mobile:
	•	View Branch/ATM locator
	•	View Campaigns
	•	Calculator for different currency (GBP, CHF, USD), deposit, loan
	•	View News & Events
	•	Apply for Loan
	•	Apply for Credit Card
	•	Contact Us
	•	New User Application

Security 

TebMobile uses SmartKEY for authetication. This technology uses multi-factor mechanism with the latest cryptographic methods to protect your transactions for a higher security. It provides a strong and transparent technology with a simple user experience to the users for mobile application and e-banking authentication. Also, TebMobile combines this technology with  Touch ID  to provide seamless user experience with finger print.",2015-06-11T18:10:14Z,2025-11-17T14:14:06Z
al,Albania,Finance,6015,23,6702027190,ProCredit Kosova,QUIPU GmbH,https://apps.apple.com/al/app/procredit-kosova/id6702027190?uo=4,0.0,4.82759,29,Finance,"Discover a new era of digital banking with the redesigned ProCredit Mobile application – created to make everyday banking easier, faster and more secure.
 
With an improved, intuitive design and many new innovative features, the new mobile banking application offers everything you need to manage your finances on the go.
 
Stay connected and informed with push notifications for every transaction, easily approve payments using your PIN or biometrics, and save time by creating templates for frequent transactions. You can now generate essential banking reports right from your mobile phone.
 
Take advantage of features like Request to Pay, Apply online for Overdraft, and communicate securely with the bank through the new in-app mailbox. With our referral program, you can even invite friends to open a bank account with us.
 
Personalize your experience by switching between dark and light mode, updating your profile picture or renaming your accounts based on your preferences. And if you’re ever on the move, quickly locate the nearest branch or ATM through the app.
 
Developed with the highest security standards, ProCredit Mobile application offers a seamless and safe banking experience – wherever you are.
 
Download the new app today and take full control of your banking, all from your mobile device.",2025-05-15T07:00:00Z,2025-11-03T15:08:11Z
al,Albania,Finance,6015,24,6504174558,Union Bank Business,Union Bank SHA,https://apps.apple.com/al/app/union-bank-business/id6504174558?uo=4,0.0,3.4,5,Finance,"Union Bank Business është aplikacioni i ri bankar i krijuar posaçërisht për nevojat e bizneseve – një zgjidhje moderne që i jep çdo sipërmarrjeje fuqinë për të menaxhuar financat në mënyrë të shpejtë, të sigurt dhe fleksibël, pa pasur nevojë të largohet nga zyra apo vendndodhja e punës. Në një realitet ku shpejtësia dhe kontrolli janë thelbësore për suksesin, Union Bank Business vjen si një partner i besueshëm për menaxherët financiarë, administratorët dhe çdo profesionist që kërkon të mbajë gjithmonë nën vëzhgim llogaritë e kompanisë. Me këtë aplikacion, qasja në informacion financiar është e menjëhershme dhe e organizuar – nga gjendja e llogarive, lëvizjet ditore dhe qarkullimi mujor, deri te detajet e pagesave dhe strukturat e kredisë. 




Aplikacioni ofron mundësi të avancuara për kryerjen e transfertave të brendshme dhe ndërkombëtare, autorizimin e pagesave në mënyrë hierarkike, si dhe rishikimin e detajuar të çdo transaksioni. Falë funksioneve të përshtatura për biznese të vogla, të mesme dhe të mëdha, Union Bank Business u lejon kompanive të marrin vendime më të informuara – në kohë reale. Një nga avantazhet më të mëdha të këtij aplikacioni është fleksibiliteti: administratorët mund të krijojnë nivele të ndryshme përdoruesish brenda kompanisë, duke deleguar akses sipas roleve dhe përgjegjësive, ndërsa të dhënat janë gjithmonë të mbrojtura me standardet më të larta të sigurisë bankare dhe autentifikimit. 

 

Union Bank Business flet gjuhën e biznesit modern – është praktik, i qartë, i sigurt dhe gjithmonë në dispozicion. Pavarësisht nëse je në zyrë, në terren apo jashtë vendit, gjithçka që të nevojitet për të menaxhuar marrëdhënien tënde me bankën ndodhet në një pajisje të vetme.Ky aplikacion është ndërtuar për të qenë më shumë sesa një shërbim – është një zgjatje natyrale e operacioneve të përditshme të biznesit. Me Union Bank Business, bankingu nuk është më një proces që të merr kohë, por një mjet që të ndihmon të ecësh përpara. 

 

Union Bank Business – banka që kupton biznesin tënd.",2025-07-23T07:00:00Z,2025-10-16T06:34:13Z
al,Albania,Finance,6015,25,1205990992,TradingView: Track All Markets,"TradingView, Inc.",https://apps.apple.com/al/app/tradingview-track-all-markets/id1205990992?uo=4,0.0,4.94057,1161,Finance,"In a nutshell, we’re where the world charts, chats and trades markets. Over 100 million people use our social network and supercharged supercharts to make better, brighter decisions when they trade. Download our app to access free charts, alerts, advanced watchlists, plus discuss latest trends with other traders and much, much more. Here’s a fuller feature set: 

World-leading charts
A trader’s rite of passage, charts power insight. Millions use ours – for free – to make better decisions in the markets. Our charts work on any device and outperform many desktop trading platforms. You’ll be able to search for stocks, currencies, cryptos, futures, CFDs and more. A wide range of drawing tools (like Gann Fans and Elliott Waves) and technical indicators will also help you analyze price action.

Simple Pine Script for complex tools
From coding to chart analysis, faster than ever before — we crafted our programming language to give you the power to create custom tools. Pine Script is elegantly minimalist, pre-integrated with data, and breaking your analysis limits.

Bar Replay to hit rewind on past insights 
Watch how pricing data unfolded historically. Rewind markets and review at speed and resolution you desire.

Unmissable alerts 
Trading alerts were never this powerful, flexible, and easy to use. Cloud-based, they are available on any device – get notified by email, app, desktop, or webhook when your alerts trigger.

Made to trade 
Trade directly on our charts – trade through top brokers integrated to our platform, or use Paper Trading to practice buying and selling securities without any of the risk.

One app to track them all
Get a comprehensive view of the financial markets with our app: live quotes, news, trends, financial statements, and fundamentals, all in one place at your fingertips – the fastest way to find all the data you need.

Total economics and corporate reports
Access the latest and upcoming economic events, world companies' earnings, and dividends, in one Calendar.

Watchlist what matters
Keep track of all your beloved stocks and currency pairs with our highly-customizable watchlists. Use them to see real-time price updates and be the first to know what’s moving in the markets – wherever you happen to be. 

Data. Data. Data, 
Gain access to real-time market data from exchanges in the US, Europe and Asia. Hundreds of thousands of financial symbols from 100+ exchanges are at your fingertips. Unless you have incredibly niche interests, you’ll find what you’re looking for.

Never trade alone again
Unleash your creativity onto the world markets by being part of the largest social network for traders and investors. With thousands of ideas and minds published daily and ability to customize and share your analysis, start building your following today.

Always at your fingertips
Our secure and reliable cloud-based infrastructure means you’ll always have access to the world of finance, 24/7. No unexpected downtime at a critical trading moment ever again.  

Terms of use: https://www.tradingview.com/policies/
Privacy policy: https://www.tradingview.com/privacy-policy/",2017-04-24T11:29:54Z,2025-11-18T06:23:37Z
