country,country_name,category,genre_id,rank,app_id,app_name,developer,url,price,averageUserRating,userRatingCount,primaryGenreName,description,launch_date,update_date
si,Slovenia,Productivity,6007,11,422689480,Gmail - Email by Google,Google LLC,https://apps.apple.com/si/app/gmail-email-by-google/id422689480?uo=4,0.0,4.73901,3935,Productivity,"The official Gmail app brings the best of Gmail to your iPhone or iPad with robust security, real-time notifications, multiple account support and search that works across all your mail.

With the Gmail app, you can:
• Make Gmail your default email app on iOS
• Use Gemini* in Gmail to summarise emails, craft or refine responses, or search your inbox to find what you're looking for
• Automatically block more than 99.9% of spam, phishing, malware and dangerous links from ever reaching your inbox
• Undo send, to prevent embarrassing mistakes
• Turn on Google Chat to connect, create and collaborate with others
• Get more done as a group in Spaces – a dedicated place for organising people, topics and projects
• Enjoy high-quality video calling with Google Meet
• Respond to emails quickly with Smart Reply suggestions
• Switch between multiple accounts
• Get notified of new mail fast, with notification centre, badge and lock screen options
• Search your mail faster with instant results, predictions as you type and spelling suggestions
• Organise your mail by labelling, starring, deleting and reporting spam
• Swipe to archive/delete, to quickly clear out your inbox
• Read your mail with threaded conversations
• Auto-complete contact names as you type from your Google contacts or your phone
• Respond to Google Calendar invites right from the app

Gmail is part of Google Workspace, allowing you and your team to easily connect, create and collaborate. You can:
• Connect with colleagues via Google Meet or Google Chat, send an invite in Calendar, add an action to your task list and more without leaving Gmail
• Use suggested actions – like Smart Reply, Smart Compose, grammar suggestions and nudges – to help you stay on top of work and take care of simple tasks, so you can be more efficient with your time
• Stay safe. Our machine-learning models block more than 99.9% of spam, phishing and malware from reaching our users

*Google One AI Premium subscription and Internet connection required. Language and country availability may vary. Check responses for accuracy.",2011-11-02T17:13:30Z,2025-11-17T19:37:28Z
si,Slovenia,Productivity,6007,12,586449534,Microsoft PowerPoint,Microsoft Corporation,https://apps.apple.com/si/app/microsoft-powerpoint/id586449534?uo=4,0.0,4.70199,1359,Productivity,"The PowerPoint app gives you access to the familiar slideshow maker tool you already know. Create, edit, view, present, or share presentations quickly and easily from anywhere.

Need to access your PowerPoint files quickly while on the go? PowerPoint provides a quick view of your recent slides and presentations for easy access on any device.

Worried about multiple file versions when you work on PowerPoint mobile? Syncing is seamless across devices via OneDrive.

PowerPoint lets you make a lasting impression with powerful and customizable slides and presentations that make you stand out. Create slideshows and present with confidence from anywhere.

Making a delightful and impactful presentation has never been easier. PowerPoint gives you templates to work from and automatic design ideas for your presentations.

Master your presentation with Presenter Coach, a AI tool designed to help with public speaking. Practice your presentation and get real-time suggestions to adjust your pacing, avoid “umms” and speak confidently. Requires an active Microsoft 365 subscription.

Customize your presentations on the go, collaborating with others in real time. Sync your PowerPoint documents via OneDrive, share with coworkers and create amazing presentations as a team.

Get the power of AI with Copilot1 in your favorite apps when you sign in with your Microsoft 365 subscription. Create, edit and share presentations with ease when you download Microsoft PowerPoint today.

Present with confidence
• Never miss a beat with PowerPoint on the go. You can make new presentations or continue working on existing ones.
• PowerPoint syncs your presentations to OneDrive, so you can start a presentation on your PC, then edit using PowerPoint mobile.
• A new Presenter Coach designed to provide feedback and assistance for your presentations.

Customizable Slideshow Maker
• With the powerful and highly customizable experience in PowerPoint, creating presentations that will make an impression and help you stand out is easy.
• Create a slideshow from a template or make a presentation from scratch.

Collaborate on Presentations
• PowerPoint makes it easy to collaborate with others.
• With 1-click sharing, quickly invite others to edit, view, or provide feedback on your slides.
• Easily manage permissions and see who’s working on your presentation.
• Stay on top of changes and feedback with integrated comments within the slides.
• Compare changes to see how your presentation has evolved over time.

Download Microsoft PowerPoint now and get the best way to create, edit and share slideshows and presentations from your iPhone or iPad.

To create or edit documents, sign in with a free Microsoft account on devices with a screen size smaller than 10.1 inches.
Unlock the premium Microsoft 365 experience with a qualifying subscription for your phone, tablet, PC, and Mac.

Monthly Microsoft 365 subscriptions purchased from the app will be charged to your App Store account and will automatically renew within 24 hours prior to the end of the current subscription period unless auto-renewal is disabled beforehand. You can manage your subscriptions in your App Store account settings.

This app is provided by either Microsoft or a third-party app publisher and is subject to a separate privacy statement and terms and conditions. Data provided through the use of this store and this app may be accessible to Microsoft or the third-party app publisher, as applicable, and transferred to, stored, and processed in the United States or any other country where Microsoft or the app publisher and their affiliates or service providers maintain facilities.

Please refer to the Microsoft Software License Terms for Microsoft 365. See “License Agreement” link under Information. By installing the app, you agree to these terms and conditions.",2014-03-27T19:39:54Z,2025-11-17T05:08:57Z
si,Slovenia,Productivity,6007,13,507874739,Google Drive – online backup,Google LLC,https://apps.apple.com/si/app/google-drive-online-backup/id507874739?uo=4,0.0,4.74773,12027,Productivity,"Google Drive, part of Google Workspace, lets you securely store, intelligently organise and collaborate on files and folders from anywhere, on any device.

With Drive, you can:
• Safely store and access your files anywhere
• Edit and store 100+ file types, including PDFs, Office files, videos and more
• Quickly access recent and important files
• Scan and upload paper documents using your device’s camera
• Search for files by name and content
• Filter files by type, last modified date and more
• Share and set permissions for files and folders
• View your content on the go while offline
• Receive notifications about important activity on your files

Google Workspace subscribers have access to additional Drive functionality, including:
• Security and management controls for admins to help meet data compliance needs
• Sharing files and folders directly with groups or teams within your organisation
• Creating a shared drive to store all of your team’s content

Learn more about Google Apps update policy: https://support.google.com/a/answer/6288871

Google accounts get 15GB of storage, shared across Google Drive, Gmail, and Google Photos. For additional storage, you can upgrade to Google Workspace or Google One as an in-app purchase.

Storage subscriptions purchased from the app will be charged to your iTunes Account, and automatically renew unless auto-renew is turned off at least 24 hours before the end of the current period. Subscriptions and auto-renewal may be managed by going to iTunes Account Settings after purchase.

Google Privacy Policy: https://www.google.com/intl/en_GB/policies/privacy
Google Drive Terms of Service: https://www.google.com/drive/terms-of-service

Follow us for more:
X: https://x.com/googleworkspace and https://x.com/googledrive
LinkedIn: https://www.linkedin.com/showcase/googleworkspace
Facebook: https://www.facebook.com/googleworkspace/",2012-06-28T17:40:50Z,2025-11-17T16:38:37Z
si,Slovenia,Productivity,6007,14,842842640,Google Docs,Google LLC,https://apps.apple.com/si/app/google-docs/id842842640?uo=4,0.0,4.76321,2479,Productivity,"Create, edit, and collaborate on online documents with the Google Docs app.

Work together in real time
• Share documents with your team
• Edit, comment, and add action items in real time

Create anywhere, anytime—even offline
• Capture spontaneous ideas on the fly
• Get things done, even on the go, with offline mode
• Save time and add polish with easy-to-use templates

Edit and share multiple file types
• Open a variety of files, including Microsoft Word files, right in Google Docs
• Frictionless collaboration, no matter which application your teammates use
• Convert and export files seamlessly

Google Docs is part of Google Workspace: where teams of any size can chat, create, and collaborate.
Google Workspace paid subscribers have access to additional Google Docs features, including:

Use Gemini in Docs to quickly draft and edit content
• Draft outlines, blog posts, briefs, and more on the go
• Improve your writing with AI-powered suggestions

Learn more about Google Docs: https://workspace.google.com/products/docs/

Follow us for more:
• X: https://x.com/googleworkspace
• Linkedin: https://www.linkedin.com/showcase/googleworkspace
• Facebook: https://www.facebook.com/googleworkspace",2014-04-30T16:02:23Z,2025-11-17T16:10:34Z
si,Slovenia,Productivity,6007,15,6755330566,MetricsStraightTool,Vo Thi Ha Giant,https://apps.apple.com/si/app/metricsstraighttool/id6755330566?uo=4,0.0,0,0,Productivity,"MetricsStraightTool is a handy app that helps you quickly check and understand your measurements. It lets you compare deviation against allowed tolerance and gives an instant Pass/Fail result. You can calculate percentage error, track drift over time, and see the average, minimum, and maximum of repeated readings. The app also gives you basic standard deviation and a simple combined uncertainty so you know how reliable your numbers are. A resolution vs tolerance checker shows if your instrument is fine enough for the job. For calibration work, you can do fast 2-point linear calibration to find slope and offset. You can also fit a straight line using 3 or more calibration points for better accuracy. An angle-to-offset calculator converts angle error into linear displacement, making alignment checks easy.",2025-11-15T08:00:00Z,2025-11-15T14:23:44Z
si,Slovenia,Productivity,6007,16,6755329446,ToleranceTimeMonitor,Horain satti Ali,https://apps.apple.com/si/app/tolerancetimemonitor/id6755329446?uo=4,0.0,0,0,Productivity,"ToleranceTimeMonitor is a smart app to make measurement and calibration tasks easier. It helps users check tolerance, accuracy, and repeatability with clear and quick tools. The app includes useful calculators like Tolerance Checker Pro, Resolution Adequacy Checker, and Smart Percentage Error for fast checks. You can also find tools to handle multiple readings, monitor drift over time, and calculate standard deviation. For calibration work, it offers 2-Point and Multi-Point Curve Builders along with a handy Correction Table Generator. The Uncertainty Budget Mini helps you estimate total measurement uncertainty with ease. Our goal is to save your time, reduce manual errors, and make every calculation simple, accurate, and reliable.",2025-11-15T08:00:00Z,2025-11-15T13:40:14Z
si,Slovenia,Productivity,6007,17,781537303,Tuš klub,Engrotu? d.o.o.,https://apps.apple.com/si/app/tu%C5%A1-klub/id781537303?uo=4,0.0,3.61538,221,Productivity,"TUŠ MOBILNA APLIKACIJA – odličen pomočnik pri nakupih!

S Tuševo brezplačno mobilno aplikacijo boš nakupe v Tušu opravljal še z večjim veseljem. Naj te tvoj telefon v vsakem trenutku usmeri v najbližjo Tuševo poslovalnico, te opremi s pregledom nad aktualnimi akcijami v trgovinah Tuš ter z enostavnim in praktičnim nakupovalnim seznamom poskrbi za učinkovite nakupe s še več prihranka. Tuš mobilna aplikacija je z vsemi informacijami na enem mestu nepogrešljivi pomočnik pri nakupih!


KAJ UPORABNIKOM OMOGOČA TUŠ MOBILNA APLIKACIJA

Številne funkcionalnosti za še prijaznejše nakupovanje v Tuševih poslovalnicah, predvsem pa:

TUŠ LOKATOR
Tuš lokator te v vsakem trenutku usmeri k najbližji Tuš poslovalnici in te ob tem opremi tudi z uporabnimi kontaktnimi podatki in podatki o delovnem času.

VIRTUALNA KARTICA
Osvobodi svojo denarnico neštetih kartic in telefon uporabi kot identifikacijo članstva za koriščenje izjemnih ugodnosti članstva v Tuš Klubu ter evidentiranje zbranega D*NAR-ja na svojem uporabniškem računu.  

TUŠ AKCIJSKA TRGOVINA
Bodi vedno obveščen o ugodnostih in izdelkih, ki jih v aktualnih akcijskih ponudbah dobiš po najboljših cenah in jih lahko enostavno dodaš na svoj nakupovalni seznam. Aktiviraj M10 izdelke.

EKSKLUZIVNE PONUDBE ZA UPORABNIKE
V vsakem trenutku preveri stanje tvojih kuponov ter vse podatke, ki jih potrebuješ za njihovo unovčevanje. Tako ne boš zamudil nobene priložnosti za dober in predvsem ugoden nakup. 

MOJ TUŠ KLUB
Kjerkoli in kadarkoli lahko enostavno upravljaš s svojim Tuš klub uporabniškim računom, spreminjaš uporabniške podatke, urejaš nastavitve, preverjaš stanje bonitet Tuš kluba in določaš, o čem želiš biti obveščen. 

ENOSTAVNA VČLANITEV V TUŠ KLUB
Preko Tuš mobilne aplikacije se včlani v Tuš klub zvestobe in koristi ugodnosti članstva. 

-----

TUŠ MOBILE APPLICATION – an excellent shopping experience!

With the free Tuš mobile application, shopping sprees can now become even more enjoyable. Let your mobile phone guide you to the nearest Tuš store, provide insight into current Tuš store discounts and enable an efficient shopping experience to bring savings with a practical shopping list. The Tuš mobile application provides complete information in one place and works as an indispensible shopping assistant! 


WHAT IS THE TUŠ MOBILE APPLICATION ABOUT

The application offers multiple functionalities for a more user-friendly shopping at the Tuš stores. And most importantly, it provides:

A SHOPPING LIST FEATURE
With the functionally designed shopping list feature, which offers multiple useful functionalities, shopping can become organised and well planned in advance. 

THE TUŠ LOCATOR
The Tuš locator can guide the user to the nearest Tuš store at any time. Besides, it also provides useful contact details and opening times information.

VIRTUAL CARD
You can now get rid of all those cards and use your telephone for membership identification to access numerous Tuš Club benefits and to keep a record of D*NAR points collected on your user account.  

THE TUŠ DISCOUNT STORE
You can now be informed about benefits and products from the most up-to-date discount offerings and the best prices, which can simply be added to any shopping list. Activate M10 products.

EXCLUSIVE OFFERINGS AVAILABLE TO USERS
At any time, every user can check their coupon status and details on cashing in their coupons. 

MY TUŠ CLUB
The Tuš Club user account allows simple management, user information changes, changing the account settings, checking the Tuš Club benefit status and selecting information a user would like to receive, at any time and from any place.  

JOINING THE TUŠ CLUB IS SIMPLE
You are welcome to simply join the Tuš customer loyalty club via the Tuš mobile application and access the club member benefits.",2014-01-13T08:00:00Z,2024-08-29T12:44:28Z
si,Slovenia,Productivity,6007,18,909319292,Google Calendar: Get Organised,Google LLC,https://apps.apple.com/si/app/google-calendar-get-organised/id909319292?uo=4,0.0,4.72961,233,Productivity,"The official Google Calendar app helps you stay organised and plan your day with easy event creation, multiple calendars, customisable views, widgets and tasks.

With Google Calendar, you can:
• Get events automatically added to your calendar from Gmail, including flight, hotel, concert and restaurant reservations.
• Go from using Calendar on your iPhone, iPad or Apple Watch to your computer without missing a beat when you're logged in to the same Google Account.
• Consolidate and view Google Calendar events side by side with other calendars on your device, including Exchange and iCloud.
• Keep family, friends and colleagues in the loop with shared calendars, so that they can view, add or modify events.
• Quickly switch between month, week and day views.
• Stay on top of to-dos by creating and managing tasks alongside your events in Calendar.
• Personalise your Google Calendar with light or dark mode or by colour-coding your events
• Always know what's next while on the go with Google Calendar on Apple Watch. Customise your watch face with Calendar complications or add widgets.

Google Calendar is part of Google Workspace, allowing you and your team to easily connect, create and collaborate across all your favourite Google tools. You can:
• Collaborate in a hybrid work environment by adding a Google Meet video call to a calendar event
• Get access to professional booking pages to easily book clients and customers*.
• Schedule meetings with teammates by checking their availability or layering their calendars in a single view
• Add your working location to your calendar to make it easier for your teammates to schedule meetings with you*.
• Keep everyone on track for a meeting by attaching meeting notes, pre-read materials and other documents directly to a calendar event.
• Use Google Calendar with confidence, knowing it's supported by Google's enterprise-level privacy, user safety and data security.

* Requires a Google Workspace or Google One AI Premium subscription",2015-03-10T16:50:41Z,2025-11-17T08:30:22Z
si,Slovenia,Productivity,6007,19,1569379048,WeTransfer: Transfer Files,WeTransfer BV,https://apps.apple.com/si/app/wetransfer-transfer-files/id1569379048?uo=4,0.0,4.87967,1471,Productivity,"WeTransfer is the simplest way to send (and receive) big files. Whether you’re at your desk or on the go, transfer up to 200 GB in one go. That’s about 2000 videos of your cat. Share photos and videos in their original format, including all the important EXIF metadata that originates from your camera. With WeTransfer, you can check the download status, forward, and delete transfers right from your phone. If you previously sent a transfer from your laptop, you can access the files and link in the app, so you can easily paste it into your favorite messaging app without needing to open your computer. Our Live Activity notifies you when a transfer finishes uploading, so you can multitask or play a quick game while sending huge files. Notifications let you know the minute you receive something so you can preview (or download) your files wherever you are.

About us
Having made our name in the game of quick and simple file-sharing, WeTransfer has grown into a collection of tools designed for and inspired by the creative process. Collect is the go-to app for saving and sharing inspiration in boards that organize your ideas. Portals makes it easy to request feedback on your in progress projects with Reviews that include asset markup and approval flows. WeTransfer is the original web platform, where creatives share their biggest files.

Terms of Service: https://wetransfer.com/legal/terms
Privacy policy: https://wetransfer.com/legal/privacy",2021-10-12T07:00:00Z,2025-11-17T09:17:09Z
si,Slovenia,Productivity,6007,20,1590978658,EquateAccess,Equatex AG,https://apps.apple.com/si/app/equateaccess/id1590978658?uo=4,0.0,0,0,Productivity,"EquateAccess is the companion security app for EquatePlus, the equity compensation platform offered by Computershare and Equatex, part of the Computershare Group.

EquateAccess provides multi-factor authentication (MFA) that simplifies your login and protects your EquatePlus account with an additional level of security.

How it works:
When your account is ready to begin using EquateAccess, you will receive an invitation to download the app. Once downloaded, follow the simple instructions to register it to your account.
After completing the easy setup, you will be prompted to scan a QR code each time you log in. Use EquateAccess to scan the code and authorise the login on your mobile device using Face ID, Touch ID, or by entering your EquateAccess PIN.

Requirements: 
• EquateAccess requires your mobile device’s camera to scan the QR codes. Please be sure to grant permission to the app when prompted.
• The enhanced login must be configured for your company. Make sure you have received an invitation before installing EquateAccess.",2021-11-11T08:00:00Z,2025-01-10T10:06:47Z
si,Slovenia,Productivity,6007,21,1559479889,AI Chatbot: AI Chat Smith 5.0,Vulcan Labs Company Limited,https://apps.apple.com/si/app/ai-chatbot-ai-chat-smith-5-0/id1559479889?uo=4,0.0,4.50774,258,Productivity,"Chat Smith, built on GPT-5, GPT-4o, GPT-4, DeepSeek-R1, Grok-4 and Gemini 2.5, brings powerful AI chat features including deep research, voice interaction, email writing, math solving, image generation, and smart conversations for all your needs. 

Discover Gemini 2.5 Flash Image Nano Banana – fast AI creativity with trending prompts, smart image generation, and the latest Gemini AI. Enjoy a personalized assistant experience with Chat Smith on your iOS device.

Our AI assistant chatbot Chat Smith can do many tasks with endless possibilities:

AI IMAGE GENERATOR
Create social-trending visuals in seconds! With OpenAI and Gemini 2.5 Flash Image Nano Banana, Chat Smith turns your photos or text into ultra-realistic 3D figurines, retro polaroids, “hug my younger self” nostalgic duets, or mixed-scene blends. 

GIVE INSTANT ANSWERS
Thanks to the latest AI model, Chat Smith gives impressive answers to any question using knowledge from top models like GPT-4o, Gemini, and more.

DEEP RESEARCH
Unlock deep insights with Pro Search and Deep Research. This guided AI search delivers accurate answers with sources and citations, offering advanced reasoning and detailed reports. Access real-time, updated data to explore complex topics effortlessly. Perfect for students, marketers, researchers, or anyone seeking truth beyond surface-level facts.

AI WRITING ASSISTANT
+ Generate outlines or paragraphs for essays
+ Write anything: tweets, emails, blogs, SEO, ads, captions, and more
+ Turn product descriptions into ad copy or catchy product names

REAL-TIME SEARCH
Powered by GPT-5, GPT-4o, GPT-4, DeepSeek-R1, Grok-4, and Gemini 2.5, this advanced feature lets you instantly access the latest and most relevant information online. From breaking news to niche queries, your AI chatbot ensures you stay updated and informed.

PDF MASTER
Summarize, rewrite, or translate any PDF document. Ask questions about the content and get instant answers.

YOUTUBE PRO
Paste any video URL to get summaries, rewrites, or translations of the content. Ask questions and get relevant insights.

AI KEYBOARD
Generate replies, improve grammar, and enhance writing without leaving your current app. Type smarter, faster, and more creatively.

PRACTICE ANY LANGUAGE
Translate standard English into any language using built-in multilingual capabilities. Perfect for travelers and language learners.

GRAMMAR AND SPELLING CHECKER
Quickly fix grammar, spelling, and punctuation mistakes in your writing.

EXPERT TEXT SUMMARIZER
Simplify long documents, meeting notes, or news articles into clear, concise summaries with key insights and smooth flow.

CODE GURU
Your coding copilot: generate, debug, or explain code in Python, JavaScript, HTML, and more. Ask coding questions or build simple apps using AI.

CV BUILDER
Generate a professional resume and cover letter. Optimize your LinkedIn profile or draft custom interview questions to help recruiters.

SPEECHWRITER & ANALOGY MAKER
Whether it’s for a business meeting or school project, get help writing short speeches, analogies, or social media intros that connect emotionally.

AI HOMEWORK HELPER
Give a topic and Chat Smith will create easy-to-remember study notes. Solve math homework, get writing help, or receive quiz prep support instantly.

You can choose to subscribe to our auto-renewing subscriptions:
• One week (USD $6.99), one month ($9.99), or one year ($39.99). After the free trial, the full amount will be charged to your iTunes Account. Subscription auto-renews unless canceled at least 24 hours before the end of the period. Your account will be charged for renewal within 24 hours before the period ends. Unused trial portions are forfeited after purchase. Offers apply only to the first billing term. Manage your subscription in iTunes Account settings.

We’d love your feedback to improve the app.
Terms of Use: http://vulcanlabs.co/terms-of-use/
Privacy Policy: http://vulcanlabs.co/privacy-policy/
Contact Us: support@vulcanlabs.co",2021-05-11T07:00:00Z,2025-11-19T02:38:11Z
