country,country_name,category,genre_id,rank,app_id,app_name,developer,url,price,averageUserRating,userRatingCount,primaryGenreName,description,launch_date,update_date
am,Armenia,Sports,6004,1,1564104447,Totogaming,Digitain LLC,https://apps.apple.com/am/app/totogaming/id1564104447?uo=4,0.0,3.35092,379,Sports,"Discover endless excitement with the TotoGaming App – your passport to an unparalleled universe of gaming thrills, all at your fingertips. Elevate your casino experience by immersing yourself in a vast array of cutting-edge games, from classic poker games to captivating slots that will keep you on the edge of your seat. Only two clicks away enjoy also the most intriguing sports events on the planet!

Go on an exciting adventure as you play a variety of slot games and LIVE Casino, each one more fun than the previous one. Discover prizes on the spinning wheels while you enjoy famous games like Shining Crown, 20 Burning Hot, Starlight Princess, and many others.

Key Features and Numbers:
 
 - More than 8200 games
 - LIVE Casino games - Roulette, Blackjack, Game Shows, Baccarat
 - Fast Games, TV Games, Skill Games, Virtual Games
 - Big Progressive Jackpots
 - Thrilling casino tournaments
 - Simple interface for safe deposits and withdrawals

Get help from our friendly Customer Service anytime

Start playing and winning with the TotoGaming App today.
It's where great design meets endless fun.
Download now!",2021-05-12T07:00:00Z,2025-08-15T16:05:24Z
am,Armenia,Sports,6004,2,6754331614,JB5,Bluelightsdigital Ltd,https://apps.apple.com/am/app/jb5/id6754331614?uo=4,0.0,0,0,Sports,"The official Jude Bellingham app has arrived.  
Step into the world of Jude Bellingham like never before with his brand-new, free official app.  

Whether you're a lifelong fan or just discovering Jude’s journey, this app brings you exclusive behind-the-scenes content, real-time match updates, and in-game stats straight from the pitch.  

Key features: 
•	Exclusive content – Access behind-the-scenes footage of Jude’s life away from the spotlight.  
•	Matches - Receive real-time match updates, Jude’s upcoming fixtures and in-game stats. 
•	Partnerships – Discover Jude’s latest brand collabs and shop his official merchandise all in one place. 
•	Videos – View interviews, training clips and personal moments you won’t find anywhere else. 
•	Jude’s Journey – Relive the highlights, key milestones and unforgettable moments of Jude’s career so far. 
•	Multi-language – Enjoy a seamless experience in your preferred language – choose from English, French, German, Spanish and Brazilian Portuguese. 

Wherever you are in the world, the Jude Bellingham app puts you at the heart of his story.  

Download now and stay connected to every moment.",2025-11-18T08:00:00Z,2025-11-18T19:26:31Z
am,Armenia,Sports,6004,3,1565323439,Vbet Easy,SOFT CONSTRUCT CJSC,https://apps.apple.com/am/app/vbet-easy/id1565323439?uo=4,0.0,4.34823,425,Sports,"VBET is a leading betting service offering the best odds for world sports events, live games. 
Our goal is to satisfy players and keep up with the standards of bookmaking in the sport and online casino industry. In the VBET application, you can bet on all major and minor leagues, cups, tournaments, various events and types of sports such as football, hockey, basketball, volleyball, boxing, tennis, table tennis, and many more. 

VBET offers: 

- Fast deposits/withdrawals via Visa, MasterCard, ArCa cards and other handy online wallets and payment systems
- Live bets in one click
- Fast bets on Sports
- eSports betting
- Match statistics
- Tournaments
- Achievements 

Bet on the most popular sports and virtual sports or visit the online casino to enjoy and benefit from 8000+ worldwide top games.",2021-05-17T07:00:00Z,2025-11-05T09:42:16Z
am,Armenia,Sports,6004,4,762283377,Globe Soccer,Globe Soccer DWC-LLC,https://apps.apple.com/am/app/globe-soccer/id762283377?uo=4,0.0,0,0,Sports,"The official app for Globe Soccer Awards.
Celebrities and prestigious nominees from the football world will once again attend the yearly event.

Also, don’t forget to tune in for the streaming video, live from the Awards gala.

The official app allows to:
- Vote for your favourite football stars
- Predict scores from the major leagues
- Keep track of the nominees and winners
- Get directions to the Event venue
- Explore the photo gallery and previous editions' Awards",2013-11-30T22:10:32Z,2025-11-19T21:41:48Z
am,Armenia,Sports,6004,5,1012871328,得物 - 得到美好事物,"Shanghai Dewu Information Group Co., Ltd.",https://apps.apple.com/am/app/%E5%BE%97%E7%89%A9-%E5%BE%97%E5%88%B0%E7%BE%8E%E5%A5%BD%E4%BA%8B%E7%89%A9/id1012871328?uo=4,0.0,4.75713,70,Sports,"得物App是集潮流装备、潮流商品鉴别、潮流生活社区于一体的新一代潮流网购社区。 
-鉴别服务开创者- 
得物App在传统电商模式的基础上添加“鉴别服务”，实现“先鉴别，后发货”的购物流程。“多道鉴别查验工序”的平台品控，为新世代消费者带来更安心的网购体验。 
-潮流网购- 
得物App签约了数百位业内具有多年以上经验的潮流商品鉴别师。鉴别师除了是骨灰大神级Sneaker玩家和潮人，更是潮流领域的“研究人员”。通过对球鞋、服装、配饰、潮玩、数码3C、美妆等产品进行系统性研究，包括资料收集、数据对比、档案建立、样本拆解和仪器检测等，力保鉴别的准确性。还设有独立的查验环节，对存在瑕疵的商品进行排查，拦截明显瑕疵商品，针对存在微小瑕疵的商品与用户提前一对一沟通，确保用户购买到经鉴别查验为无瑕疵商品。 
• 潮流单品：得物App目前支持交易的潮流单品品类丰富。 
• 竞价模式：得物App采取商品竞价出价的平台交易模式，竞价模式提供了每个用户获得公平交易机会。 
• 商品3D全息空间：得物App采集球鞋的3D影像展示。用户浏览实现可操控式自转，720度无死角查看单品的材质、图案、纹理、设计细节，为用户打造不一样的沉浸式购物体验。 
-潮流生活社区- 
得物App致力于打造年轻人的潮流生活社区，成为中国潮流文化风向标和年轻人的发声阵地。得物App社区聚集了一众明星以及潮流圈内数百位知名KOL。我们以球鞋和时尚话题作为潮流文化的切入点，持续沉淀潮流向内容，培育潮流文化沃土。得物App社区积极拓展符合年轻人消费观的品类内容，深度挖掘年轻人处于萌芽期的兴趣点。 

了解更多得物App相关，可通过以下方式： 
官方微博：得物App 
官方抖音：得物App 
微信公众号：得物App 
微信小程序：得物App 
意见反馈：打开得物App-我-设置-反馈与建议",2015-07-24T11:00:28Z,2025-11-12T02:01:06Z
am,Armenia,Sports,6004,6,1447215452,HryFine,"Shenzhen United Power Technology Co., Ltd.",https://apps.apple.com/am/app/hryfine/id1447215452?uo=4,0.0,3.66667,9,Sports,"****Hryfine bracelets are non-medical devices. The measurement data and results are for reference only, not for diagnosis and treatment. * * * * *

Special Reminder: APP data is for reference only and is not used as a medical diagnosis. You should consult your doctor before using APP and making any medical decisions.

1, Home Sports: record your exercise data, set exercise goals and calculate whether the goal is achieved, steps, distance, calorie consumption, etc.;

2. Sleep monitoring: it can record the sleep duration and sleep quality in the set period, and count the duration of deep sleep, light sleep and awake, so that you can improve the sleep quality;

3. When the phone searches for the bracelet, the bracelet vibrates. Find the phone through the bracelet, phone vibration and ring reminder, in case of loss.

4. It can remind the user of important information such as call, SMS, WeChat and so on when connecting with the bracelet, to prevent missing important information, etc.;

5. Set an intelligent alarm clock for the bracelet to remind you of sitting for a long time. The bracelet vibrates to remind you to reduce the problems caused by sitting for a long time

6, Remote control photography mode, anytime and anywhere to record the beautiful moment

7, statistics your daily, monthly, weekly exercise, sleep, data display at a glance

8. You can set the bracelet to turn the wrist to light up the screen and light up the screen easily

9. Sports data report: make statistics of your sports data and average data in the last 30 days, as well as your sports standards in the last seven days, and generate reports for easy viewing of sports trends",2018-12-19T07:49:20Z,2025-11-19T01:42:17Z
am,Armenia,Sports,6004,7,6444009263,Госуслуги Карта болельщика,"MINKOMSVYAZ ROSSII, FKU",https://apps.apple.com/am/app/%D0%B3%D0%BE%D1%81%D1%83%D1%81%D0%BB%D1%83%D0%B3%D0%B8-%D0%BA%D0%B0%D1%80%D1%82%D0%B0-%D0%B1%D0%BE%D0%BB%D0%B5%D0%BB%D1%8C%D1%89%D0%B8%D0%BA%D0%B0/id6444009263?uo=4,0.0,0,0,Sports,"Официальное приложение «Госуслуги Карта болельщика». Оформляйте карту, покупайте билеты, передавайте их родным, друзьям и посещайте спортивные мероприятия

ПОЛУЧИТЕ КАРТУ БОЛЕЛЬЩИКА
Оформите карту в приложении для себя и детей до 14 лет

ПОЛЬЗУЙТЕСЬ ЭЛЕКТРОННЫМИ БИЛЕТАМИ
Для прохода на стадион предъявляйте QR-код своего билета и билетов ваших детей

ПЕРЕДАВАЙТЕ БИЛЕТЫ СВОИМ ДЕТЯМ И ДРУЗЬЯМ
Назначайте билеты на себя и других людей, у которых есть карта болельщика. Создавайте детские билеты без места, привязанные к билету взрослого

СЛЕДИТЕ ЗА РАСПИСАНИЕМ МАТЧЕЙ
Выбирайте любимые команды и следите за расписанием матчей",2023-01-27T08:00:00Z,2025-10-30T08:27:37Z
am,Armenia,Sports,6004,8,766443283,Flashscore: Live Scores & News,Livesport s.r.o.,https://apps.apple.com/am/app/flashscore-live-scores-news/id766443283?uo=4,0.0,4.93394,1650,Sports,"Your ultimate live scores and sports news app. Goals, scores, and stories, all on Flashscore. Follow all the latest highlights across the world of sport, including football, tennis, basketball, hockey and much more. Choose from 30+ sports and 6000+ competitions and our tailored notifications will let you know about every important action of the match. 
 
Download Flashscore now and read the game like no one else!

Key features:
• Fastest live results: Get real-time updates with detailed statistics, xG data, unique player and team ratings, live standings and match updates.
• In-depth sports news: Stay informed with exclusive interviews, transfer news & rumours, and in-depth data analysis.
• Personalized favourites: Receive top news notifications, goal alerts, and customized reminders for your favourite teams, competitions or matches.
• Follow your favourite players: Add them to your list and allow notifications so that you never miss their presence in the starting lineup, goals, bookings or ratings.
• Expert match previews: Access selected opportunities and stats to enhance your sports prediction accuracy.
• Predicted lineups: Stay one step ahead and find out who is likely to start in the upcoming match given current form, unexpected injuries or lineup changes.
• Detailed player stats: Check out expected goals (xG), expected assists (xA), the number of shots, passes, touches, chances created, tackles, saves and other key statistics for all the players that appear on the pitch.

LIVE SPORTS SCORES & NEWS, FAST AND ACCURATE

• SPEED: Whether a goal is scored, red card issued, set or period is over, you will know at the same time as the live audience.

• DATA-DRIVEN NEWS: Breaking news and detailed coverage with unique sports data visualizations, tactical insights, expert opinions or featured articles.

• GREAT COVERAGE: You can find football live scores, tennis scores, basketball results, hockey online, golf leaderboard and more than 30 other sports (snooker, baseball, MMA ...) in our app. 


Coverage of major global events & local competitions: 
Football: Premier League, Championship, League One, League Two, FA Cup, LaLiga, Serie A, Bundesliga, Champions League (UCL), Europa League, Europa Conference League, Club World Cup
Tennis: ATP/WTA Tour tournaments including Grand Slams (Australian Open, French Open, Wimbledon, US Open), ATP Finals, Davis Cup
Basketball: NBA, Euroleague, ACB, LNB, Lega A, World Cup
Hockey: NHL, DEL, SHL, IIHF World Championship
Darts: PDC World Championship, Premier League Darts, PDC Grand Slam, World Matchplay, UK Open, World Grand Prix
Golf: British Open (The Open), Masters, US Open, PGA Championship, Ryder Cup, Players Championship
Baseball: MLB, KBO, NPB, KBO, LVBP, LMB, World Baseball Classic
Snooker: World Championship, UK Championship, The Masters
Volleyball: SuperLega, Nations League, Nations League Women, CEV Champions League
Badminton: BWF World Championships, Thomas Cup, Uber Cup, Sudirman Cup
Darts: PDC World Championship, Premier League Darts, PDC Grand Slam
Motorsport: Formula 1 (F1), MotoGP, Moto2, Nascar, Dakar
MMA: UFC, Bellator MMA, KSW, Оktagon MMA, PFL, ONE Championship


NO MORE MISSED MATCHES OR UPDATES

• FAVOURITE TEAMS AND MATCHES: Don’t waste your time, and follow only your favourite matches, teams and competitions.

• NOTIFICATIONS AND ALERTS: Match starts, line-ups, goals - you will not miss any of it again. Just select your favorite matches and wait for your mobile device to let you know.


LIVE RESULTS, TABLES AND MATCH DETAILS

• LIVE COMMENTARY: Unable to watch the match on TV? No problem: stay up-to-date with our detailed live text commentary.

• LIVE TABLES: One goal can change a lot. Our live standings will show you if a scored goal has changed the league ranking, as well as the current top scorers table.


Terms of Use: https://livesport.eu/terms-of-use/en-gb
Privacy Policy: https://livesport.eu/privacy-policy/en-gb",2013-12-06T04:50:49Z,2025-10-30T12:25:25Z
am,Armenia,Sports,6004,9,356928178,LiveScore: Live Sports Scores,LiveScore Ltd.,https://apps.apple.com/am/app/livescore-live-sports-scores/id356928178?uo=4,0.0,4.93944,611,Sports,"LiveScore keeps you up to date with the latest live sports scores and live sports action. Whether you are looking for scores, goals, fixtures or news, LiveScore is your one-stop destination for top football leagues. From Premier League and UEFA Champions League, to Eredivisie, Serie A, LaLiga and more, LiveScore has it all. Stay on top of the football season with live football scores!

LIVE NOTIFICATIONS
Get fast updates to keep track of live sports scores, goals, red cards and more for multiple matches and sports at the same time. Get all the details, football stats and live football scores for the Premier League, UEFA Champions League; scores for tennis matches and more. Manage your favourite sports & match notifications in your settings.

FOR YOU
Immerse yourself in a truly personalised experience when it comes to news and headlines. With all your favourites in one place, it’s the best way for you to cut the noise and stay informed on the teams and competitions that matter to you. Check the latest news and breaking headlines from across the world of sport. After all, it's made For You.

For You covers everything from the latest insights, football news, football stats, football results, post-match reviews, player transfers and previews of upcoming football fixtures from the PL, UEFA Champions League, LaLiga, Bundesliga, Serie A, Primeira Liga and Eredivisie.

COMPETITIONS
Search for competitions across the biggest sports. Including worldwide premier cups and leagues with match details and soccer and football scores for the PL, the FA Cup, UEFA Champions League, LaLiga, Serie A, Eredivisie and Bundesliga.

FAVOURITE LEAGUES AND TEAMS
Get to the scores, live results and sports match news you’re interested in. Favourite your team to follow their progress in the leagues and easily see past results or upcoming fixtures. Switch on live notifications for your favourited teams to keep track of all the action & news.

TEAM PAGES AND PLAYER STATS
View your team’s upcoming fixtures, live table standings, news, scores, videos of matches and Player Stats to check top scorers and more. Perfect for keeping up with news and scores of your favourite tennis players, or for your fantasy football team.

LIVE COMMENTARY (Unofficial) FROM LIVESCORE
Listen to live match commentary (unofficial) from the LiveScore team, covering everything from scores, assists, corners, cards and descriptions of the action on football matches.

WORLDWIDE SCORES AND SPORT
Find your international team and follow live football stats, football results and scores. More than 1,000 live football scores and football fixtures are followed every week.

LIVESCORE HORSE RACING
View horse racing results, upcoming race details, jockey, trainer and horse racing form details across UK, Ireland and international racecourses. Favourite upcoming horse races to easily view every horse and jockey in the field, receive live notifications with the winning horse.

DISCOVER AMERICAN FOOTBALL
New to LiveScore is American Football! Whether you're a seasoned fan or new to the game, we've got you covered with real-time game results, stats, and fixtures for your favourite teams and leagues, including the NFL & CFL. Stay updated on the action and follow every touchdown, tackle and triumph.

ABOUT LIVESCORE
Since 1998, LiveScore has been giving you real-time delivery of live sport scores & data. As leaders of live score updates, LiveScore is trusted and used daily by millions of users globally; specialising in the sports: football, soccer, tennis, cricket, basketball & hockey.",2010-02-22T20:51:15Z,2025-11-06T16:05:06Z
am,Armenia,Sports,6004,10,1471983807,Mostbet.com – Sports Betting,Bizbon N.V.,https://apps.apple.com/am/app/mostbet-com-sports-betting/id1471983807?uo=4,0.0,4.61111,90,Sports,"Mostbet is the ultimate betting app for sports and esports fans. You can bet on all kinds of sports: football, cricket, basketball and much more. Our cricket betting app offers a wide range of options, including cricket betting, live score, statistics, cash out, in-play betting, extended markets. Plus, our multilevel system of privileges rewards loyal customers with bonuses, freebets, and other prizes.

Mostbet betting app offers:

- one-click registration 
- user-friendly interface and easy navigation
- easy deposits & withdrawal
- multilevel system of privileges
- 24/7 customer support

Our online betting app also supports multiple languages, making it convenient for customers from different countries and cultures to use. And with 24/7 customer support, you can rest assured that any issues or questions will be promptly addressed.


Mostbet sports app also offers a separate esports product, including popular games like Counter-Strike, Dota 2, League of Legends, and Valorant, some of the most popular esports games in the world. Plus, our platform is fully licensed and regulated, ensuring that your personal and financial information is safe and that your bets are fair.


Experience the thrill of international sports betting and casino gaming at your fingertips with Mostbet. Download our app now and take advantage of our welcome bonus and other promotions available for new customers. Join the thousands of satisfied customers who have already recognized Mostbet as the best betting app. Profit from the best odds and instant withdrawals with Mostbet. Try it now and get a welcome bonus of up to 300 EUR.",2019-09-13T07:00:00Z,2025-10-10T12:33:51Z
am,Armenia,Sports,6004,11,1601630546,433 | The Home Of Football,433 BV,https://apps.apple.com/am/app/433-the-home-of-football/id1601630546?uo=4,0.0,3.375,8,Sports,"The 433 app is the ultimate football experience for every football lover. Whether you want to keep track of your team’s big match, stay up to date with all the latest news, kick back and watch some epic viral videos or simply test your footy knowledge with a variety of games… We’ve got you covered. Welcome to the home of football.


MATCH CENTRE
Find everything you need on matchday – fixtures, results, match stats, live line-ups – and get notifications when your teams score. Which team dominated possession? Who had the highest xG? How many of their shots were on target? How many yellow cards did the referee give? It’s all there, and more. 


PREDICTIONS
Think you ‘know ball’ better than your friends? Here’s your chance to prove it! Create leaderboards with your friends and go head-to-head in daily predictions of matches from across the world. Enter into the general leaderboards and compete against all 433 users, with the chance to win prizes.


WALLPAPERS
Need a new football background for your phone? This is the app for you. Wallpapers are released every week, covering all the biggest players, clubs and national sides.


QUIZZES
Put your football knowledge to the test with a series of quizzes, interactive games and brain teasers. Want to find out who knows more about football: You or your friends? You can! Add your friends, complete quizzes, and keep track of each other’s ‘ball knowledge’ with leaderboards.


NEWS
Stay on top of the news and never miss any breaking stories coming out of your favourite clubs and leagues. Keep track of your team’s transfer developments, injury updates, unmissable quotes and reactions from across the football world. Be the first to find out about trending stories or when a transfer is nearing that all important ‘Here we go!’


VIRALS
Want to see goals, saves, moments from games across the world? Want to feel the game from the fan’s perspective? Or do you just want to see some funny moments from famous players and coaches? Then look no further. Find daily uploads of viral moments from across the beautiful game!",2022-05-25T07:00:00Z,2025-10-23T08:20:11Z
am,Armenia,Sports,6004,12,534568162,UFC,"Zuffa, LLC",https://apps.apple.com/am/app/ufc/id534568162?uo=4,0.0,4.98261,115,Sports,"Step into the Octagon with the official UFC app—home to UFC FIGHT PASS, the exclusive streaming service of the UFC and your gateway to premier combat sports.

Experience the thrill of live UFC events, access an unrivaled fight library, and enjoy exclusive programming that brings you closer to the action.

UFC FIGHT PASS: The Ultimate Combat Sports Destination
	•	Live Events: Stream weekly UFC action and 200+ global combat sports events.
	•	Fight Library: Relive legendary bouts, full fight cards, and behind-the-scenes content.
	•	Historic Archive: Explore classics from PRIDE, Strikeforce, WEC, and 50+ organizations.
	•	Original Programming: Go deeper with hit series and original programming like Fightlore and Year of the Fighter.
	•	Multi-Device Access: Watch on smartphone, tablet, computer, or smart TV.

Subscription Menu
	•	UFC FIGHT PASS is available as a monthly or annual subscription plan.
	•	Payment will be charged to your iTunes/Apple Account at confirmation of purchase.
	•	All subscriptions auto-renew unless turned off at least 24 hours before the end of the current period.
	•	Subscriptions can be managed by the user, including disabling auto-renewal, in Account Settings.

UFC Pay-Per-View
	•	Watch the biggest UFC fights live with Pay-Per-View, available as a separate in-app purchase (availability varies by region).

Content & Availability
	•	Content and features vary by region, blackout restrictions, and holdback windows.
	•	Learn more: ufc.com/faq-ufctv-ufcfightpass
	•	Terms of Use: ufc.com/terms
	•	Privacy Policy: ufc.com/privacy-policy

Download the official UFC app today and unlock the ultimate combat sports experience—live fights, historic battles, and exclusive content, all in one place.",2012-06-29T20:14:09Z,2025-10-07T14:50:09Z
