country,country_name,category,genre_id,rank,app_id,app_name,developer,url,price,averageUserRating,userRatingCount,primaryGenreName,description,launch_date,update_date
ua,Ukraine,Sports,6004,25,6748471211,108 IN-SE,LUCKYSOFT OU,https://apps.apple.com/ua/app/108-in-se/id6748471211?uo=4,0.0,4.86486,37,Sports,"108 IN-SE - це багатофункціональна студія, яка обʼєднує в собі йога-практики, Функціональні тренування, апаратні та ручні сеанси масажів, beauty-процедури та трохи-більше-ніж-здорову кухню.

 

 

У додатку ти можеш зручно бронювати йога-практики, масажі (ручні та апаратні), beauty-процедури, поповнювати депозит, слідкувати за анонсами. 

 

Це твій цифровий простір для глибшого контакту з собою:

Власний кабінет 

Розклад на йогу для різних рівнів

Запис на процедури процедури

Особистий розклад і нагадування

 

 

Ми не обіцяємо “нового тебе за 7 днів” — ми створюємо простір, де все повертається на свої місця. Спокійно. Природно. Усвідомлено.",2025-07-11T07:00:00Z,2025-07-11T14:00:22Z
