country,country_name,category,genre_id,rank,app_id,app_name,developer,url,price,averageUserRating,userRatingCount,primaryGenreName,description,launch_date,update_date
ua,Ukraine,News,6009,1,1611955391,Повітряна тривога,AJAX SCIENTIFIC AND PRODUCTION ENTERPRISE LIMITED LIABILITY COMPANY,https://apps.apple.com/ua/app/%D0%BF%D0%BE%D0%B2%D1%96%D1%82%D1%80%D1%8F%D0%BD%D0%B0-%D1%82%D1%80%D0%B8%D0%B2%D0%BE%D0%B3%D0%B0/id1611955391?uo=4,0.0,4.73972,253749,News,"Встановіть застосунок Повітряна тривога, щоб миттєво отримувати сповіщення про повітряну тривогу у вибраному місті чи області України від системи цивільної оборони. 

За правильних налаштувань, застосунок буде голосно сповіщати про тривогу навіть у беззвучному режимі смартфона. Застосунок не потребує реєстрації, не збирає персональні дані або дані про геолокацію.

У застосунку доступні всі області України, а також додано можливість отримувати тривоги лише за обраним районом чи територіальною громадою.

Як працює застосунок: 

1. Оператор обласної державної адміністрації отримує сигнал про повітряну тривогу.
2. Оператор негайно передає інформацію на пульт.
3. Застосунок надсилає тривожне сповіщення користувачам, які обрали відповідну область.
4. Щойно оператор надсилає сигнал про відбій тривоги, користувачі застосунку отримують відповідне сповіщення.

Це єдиний застосунок, що підтримує критичні сповіщення. Це означає, що звук тривоги буде завжди надходити з максимальним рівнем гучності смартфону. Для цього надайте усі відповідні дозволи застосунку після встановлення. Важливо! Критичні сповіщення можна вимкнути в будь-який момент в налаштуваннях застосунку.

Бережіть себе та рідних. 

** Застосунок створено за підтримки Міністерства цифрової трансформації України. Автори ідеї застосунку — ІТ-компанія Stfalcon **",2022-02-27T08:00:00Z,2025-07-24T07:36:05Z
ua,Ukraine,News,6009,2,6741755459,Флюгер,Kostiantyn Zinchenko,https://apps.apple.com/ua/app/%D1%84%D0%BB%D1%8E%D0%B3%D0%B5%D1%80/id6741755459?uo=4,0.0,3.17337,323,News,"Флюгер – ваш персональний помічник під час повітряних загроз

Флюгер – це застосунок, який допомагає швидко оцінити ситуацію під час повітряних загроз. Він відображає орієнтовний напрямок і зону небезпеки, щоб ви могли вчасно відреагувати та підвищити свою безпеку.

Що вміє Флюгер?

Оповіщення про потенційну загрозу – отримуйте актуальну інформацію про напрямок руху повітряних об’єктів.
Орієнтація в просторі – застосунок вказує азимут і допомагає зорієнтуватися, де саме може бути небезпека.
Динамічне оновлення – інформація змінюється в реальному часі залежно від ситуації.
Приватність і безпека – Флюгер не потребує реєстрації, не зберігає особисті дані та запитує лише доступ до GPS для визначення вашого місцезнаходження.
Простий інтерфейс – зрозумілий навіть для тих, хто користується такими додатками вперше.

Флюгер – це волонтерська ініціатива, створена для підвищення поінформованості громадян. Додаток не є офіційним джерелом і не замінює державні системи оповіщення, але може стати додатковим інструментом для вашої безпеки.",2025-07-16T07:00:00Z,2025-07-17T22:45:19Z
ua,Ukraine,News,6009,3,6670303225,Блекаут Вінниця,Ivan Didyk,https://apps.apple.com/ua/app/%D0%B1%D0%BB%D0%B5%D0%BA%D0%B0%D1%83%D1%82-%D0%B2%D1%96%D0%BD%D0%BD%D0%B8%D1%86%D1%8F/id6670303225?uo=4,0.0,4.09091,22,News,"Додаток ""Блекаут Вінниця"" призначений для зручного доступу до Графіку Погодинних Відключень (ГПВ) з офіційної сторінки ВінницяОблЕнерго (https://voe.com.ua/).

Дисклеймер: Цей додаток не представляє жодну державну установу і не має офіційного дозволу на надання урядових послуг. Усі дані про відключення електроенергії отримуються з офіційного сайту ВінницяОблЕнерго.",2024-09-02T07:00:00Z,2025-11-10T22:58:11Z
ua,Ukraine,News,6009,4,333903271,X,X Corp.,https://apps.apple.com/ua/app/x/id333903271?uo=4,0.0,4.56771,79088,News,"Welcome to X (formerly known as Twitter), your trusted digital town square where conversations unfold in real time, and the world connects through breaking news, live events, podcasts, and everything in between.

Whether you're passionate about sports, tech, music, or politics, X is your front-row seat to what’s happening across the globe.

X isn’t just another social media app, it’s the ultimate destination for staying well informed, sharing ideas, and building communities. With X, you’re always in the loop with relevant trending topics and breaking news, delivered instantly to your screen, raw and unfiltered.

What You Can Do on X:
• Follow breaking news from around the world before it hits the headlines, and stay ahead of the curve with real-time updates on trending topics and viral conversations.

• Post your thoughts, photos, and videos with a global community. Join millions of users in shaping public dialogue across social, cultural, and political conversations.

• Discover Grok, the AI assistant powered by X’s real-time data. You can ask Grok to summarize trending news, explain videos, or give you more context about posts.

• Stream live video or go live with Spaces, our audio feature that enables you to host discussions, hold interviews, or start your next live podcast. Whether you're streaming a concert, a live game, or your thoughts on a hot topic, X keeps your audience engaged.

• Watch videos: from live breaking news and sports clips to podcasts and gaming sessions that last up to 3 hours long. Many of the world’s leading voices, in comedy, gaming, podcasting, and politics, all share their content on X.

• Connect and chat privately with friends, followers, customers, or collaborators through Direct Messages.

• Join and build communities tailored to your interests: from sports news, gaming, entertainment, crypto, entrepreneurship, tech, and more.

• Subscribe to X Premium to unlock exclusive features like a blue checkmark, boosted visibility, prioritized replies, fewer ads, longer videos, and post editing. X Premium also gives you access to creator revenue sharing and the ability to offer exclusive content to subscribers.

Why X?
In a world of constant change, X is your real-time source to stay ahead of the curve, connect with people, and explore diverse perspectives. From breaking live news and trending memes to top podcasts and live streams from your favorite creators, X brings it all together in one powerful social experience.

Privacy Policy: https://x.com/privacy
Terms and Conditions: https://x.com/tos",2012-06-09T11:09:51Z,2025-11-19T08:49:42Z
ua,Ukraine,News,6009,5,1064216828,Reddit,"REDDIT, INC.",https://apps.apple.com/ua/app/reddit/id1064216828?uo=4,0.0,4.82801,10268,News,"Welcome to Reddit, the heart of the internet.

Reddit is a social network with something for everyone: trending topics, anonymous group discussions, and diverse communities.

Joining Reddit means immersing yourself in brutally honest and wholesome conversations that span across every topic and interest you could imagine.  Beyond exclusive content straight from the source, you'll also find gaming communities, insightful bloggers, passionate TV fandoms, sports enthusiasts, support groups, AI forums, the latest in celeb news, and creators of all types.

If you’re into gaming and sport, you can discover the best Xbox and PS5 forums, talk Zelda, Call Of Duty, or minecraft strategy while discussing the latest Football news, Cricket matches, and Rugby games.

Reddit has over 100,000 online communities (forums where members post and comment) dedicated to discussing topics. Some of the most popular global communities are:
■ r/AskReddit, where users can ask and answer questions
■ r/funny, which is full of humorous content, jokes, hilarious memes
■ r/science, for scientific talks and daily news from the scientific community
■ r/gifs, with funny animated gifs for your fun  and viewing pleasure
■ r/music, r/fredagain, r/beyonce and other music forums where music fans gather to discuss their favourite artists and genres.

On Reddit you’ll find:
■ Thousands of community groups and interesting topics, and a wealth of original content. 
Latest news, entertainment news, social media news, book clubs, TV fan theories, technology forums, open AI discussions, conspiracy theories, gaming forums,debate forums, and personalised content, there's a community for everyone.

■ Loads of laughs
Find popular memes, witty humour, jokes and gags, oddly satisfying videos, comedy clips, funny cat videos, and more to help you lose track of time.

■ Pop culture buzz
Explore the latest trends at r/popculturechat and r/fauxmoi, or join the lively discussions at TV groups like r/loveislandtv, r/bigbrotheruk, and r/MAFS_UK.

■ AMAs, or ""Ask Me Anything""
Celebrities, politicians, and experts answer questions from users.

■ The best discussions on any topic
Reddit’s discussion threads are where community members jump in with humour and insights for top conversations about anything; science discoveries, pop culture, gardening, entertainment, or financial advice.

■ Post anonymously and get answers to all of your questions
Ask communities anything you want. Ask questions on relationships, mental health, parenting, career advice, fitness plans, and more.

■ Anonymous profiles
Connect with people about any topic, join interactive community groups, and chat with other redditors, all anonymously.

Voting and Karma:

Instead of likes and hearts, Reddit’s social media network runs on upvotes or downvotes. Voting on posts and comments increase or decrease the creator’s karma, and helps popular and relevant posts rise to the top, while filtering out low-quality or irrelevant posts.

While karma doesn't directly impact your ability to use Reddit, more karma can increase posts’ visibility and help you get noticed. Some communities require karma to post or comment, which helps maintain content quality and community standards.



Reddit Premium:

Purchase Reddit Premium to enjoy an ads-free experience and access to premium avatar gear, r/lounge, custom app icons, and more.

Payment will be charged on a recurring monthly or annual basis to your Apple account. Your monthly or annual Premium subscription will automatically renew unless you cancel at least 24 hours before your subscription ends. Cancel anytime in your device’s Account Settings. No partial refunds.

Privacy Policy: https://www.redditinc.com/policies/privacy-policy
User Agreement: https://www.redditinc.com/policies/user-agreement
Reddit Rules:https://redditinc.com/policies/reddit-rules

If you have any problems with the app, get support at RedditHelp.com",2016-05-18T06:01:47Z,2025-11-21T01:07:14Z
ua,Ukraine,News,6009,6,6478420211,Air Raid Alert Map of Ukraine,Mykhailo Goloborodko,https://apps.apple.com/ua/app/air-raid-alert-map-of-ukraine/id6478420211?uo=4,0.0,4.22449,49,News,"""Air Raid Alert Map of Ukraine"" - a volunteer-built real-time interactive map of air-raid alerts in Ukraine

The application is not official and not associated with the government.",2024-04-18T07:00:00Z,2025-06-24T17:30:04Z
ua,Ukraine,News,6009,7,1309467843,Портал ДТЕК,"DTEK SERVIS, TOV",https://apps.apple.com/ua/app/%D0%BF%D0%BE%D1%80%D1%82%D0%B0%D0%BB-%D0%B4%D1%82%D0%B5%D0%BA/id1309467843?uo=4,0.0,2.53571,112,News,"Meet the mobile application for DTEK Group employees - a single window to access the corporate services, electronic workflow and company news.

The mobile application allows you to:

- Receive payroll slips
- Approve annual leave
- Order certificates
- Quickly and conveniently use corporate services online
- Manage document flow and sign documents with an electronic digital signature 
- Connect and watch live direct lines with the company's management
- Receive key information and news about DTEK and your company from the original sources
- And that's not all! 

The mobile app is constantly evolving. With each update, we add new and convenient services for our employees. 

Do you have any suggestions on how to improve the mobile app or just found a bug? 

Contact the development team: developers@dtek.com",2017-11-29T21:18:13Z,2025-10-13T07:27:12Z
ua,Ukraine,News,6009,8,1611921749,eAlert: Ukraine Air Raid Alert,Wild Pluto Sp. z o.o.,https://apps.apple.com/ua/app/ealert-ukraine-air-raid-alert/id1611921749?uo=4,0.0,4.46568,7415,News,"eAlert (єТривога) is a volunteer-based application that sends push notifications to your phone about threats in your chosen area or city in Ukraine. You will receive an audible siren alert from the app when an air raid, missile strike threat, or artillery shelling is declared in your city or region. The app also notifies about explosions and planned explosive works, as well as other critically important information.

The project operates around the clock thanks to the support of over 30 volunteers who work on a voluntary basis. We closely monitor hundreds of information sources to ensure prompt and accurate notifications. All alerts are sent manually.

eAlert (єТривога) was developed by Ukrainian IT volunteers in Poland and is not affiliated with any Ukrainian government institutions, including the Ministry of Digital Transformation or the ""Diia"" platform.

For the latest news and updates, follow us on social media Twitter, Facebook, and Instagram — @eTryvoga, and on Telegram — https://t.me/UkraineAlarmSignal.

Terms of Use: https://www.apple.com/legal/internet-services/itunes/dev/stdeula/",2022-02-27T08:00:00Z,2025-10-24T18:58:04Z
ua,Ukraine,News,6009,9,6470827310,Мапа тривог віджет,"STFALKON, TOV",https://apps.apple.com/ua/app/%D0%BC%D0%B0%D0%BF%D0%B0-%D1%82%D1%80%D0%B8%D0%B2%D0%BE%D0%B3-%D0%B2%D1%96%D0%B4%D0%B6%D0%B5%D1%82/id6470827310?uo=4,0.0,3.57692,26,News,"Віджет ""Мапа тривог"" - це інноваційний інструмент, який надає користувачам зручний доступ до важливої інформації про різні види тривог прямо на робочому столі. Інформація оновлюється щохвилини. Завдяки цьому віджету, користувачі можуть швидко та ефективно слідкувати за п'ятьма основними видами тривог:

Ракетна небезпека: Візуальне оповіщення, яке активується у випадку потенційного ризику авіаудару або запуску ракет у напрямку населеного пункту чи області.
Артобстріл: Надає інформацію про можливі артобстріли в зоні, щоб користувач міг уникнути небезпечних місць.
Вуличні Бої: Попередження про бої в міських умовах, що можуть вплинути на безпеку громадян.
Хімічна Небезпека: Інформує про можливі викиди хімічних речовин, які можуть створити небезпечні ситуації.
Радіаційна Небезпека: Вказує на наявність радіаційної небезпеки та надає важливу інформацію щодо заходів безпеки.

Віджет забезпечує візуальне представлення даних на мапі, що допомагає користувачам оперативно реагувати на різні надзвичайні ситуації та забезпечує їхню безпеку. 

Нагадуємо, що ці розробки можуть служити додатковим засобом отримання сповіщень системи цивільної оборони, і рекомендуємо слідкувати за офіційними джерелами інформації та використовувати його спільно із вуличними сиренами для максимальної ефективності. Ми завжди вдячні за зворотний зв'язок і прагнемо вдосконалювати роботу, співпрацюючи з українськими громадянами та органами влади.",2024-02-15T08:00:00Z,2025-11-10T17:18:40Z
ua,Ukraine,News,6009,10,6443851995,DeepStateMap,Heorhii Karpenko,https://apps.apple.com/ua/app/deepstatemap/id6443851995?uo=4,0.0,4.69295,241,News,"DeepStateMap.Live is an interactive online map of the hostilities in Ukraine that allows you to follow the course of military operations in the Russian-Ukrainian war, the location of units and their movements.

The application supports the possibility of caching downloaded data.

The map has symbols:
territory of Ukraine liberated from occupation in the last two weeks;
liberated territory;
territory that needs to be clarified;
territory occupied by Russian troops;
territory of the occupied Crimea and ORDLO;
territory of Transnistria;
unit;
headquarters;
airfields;
fleet;
directions of attacks.

The territory is divided into zones, which are colored accordingly, and the locations of units and airfields are marked. The site also has a news feed and the ability to measure distances between points on the map. The site allows to enable the display of fire points based on data from the NASA Firms system and compare them with the front line. A special mode makes it possible to measure the range of various artillery systems: HIMARS, M777, CAESAR, etc. along the entire front line.",2023-04-27T07:00:00Z,2025-10-29T08:33:06Z
ua,Ukraine,News,6009,11,6443609848,Alarm Map Widget,Volodymyr Kovalchuk,https://apps.apple.com/ua/app/alarm-map-widget/id6443609848?uo=4,0.0,3.71429,7,News,The Alarm Map on your screen,2022-11-03T07:00:00Z,2025-04-17T20:51:25Z
ua,Ukraine,News,6009,12,1581650857,Substack,Substack Inc.,https://apps.apple.com/ua/app/substack/id1581650857?uo=4,0.0,4.89429,473,News,"Substack is a new media app that connects you with the creators, ideas, and communities you care about most.
- Support the creators you love: Subscribe for free or upgrade to view original work and connect directly with your favorite writers, artists, and podcasters.
- Enjoy ad-free videos and podcasts: Access short-form clips, video episodes, and  read-aloud articles without interruptions.
- Connect in real time: Join livestreams and live group chats, where top creators bring their biggest supporters into their world. 
- Explore independent ideas: Discover bold opinions and engaging views across food, sports, politics, fashion, comedy, finance, and more.

How it works:
1. Download the Substack app.
2. Claim your handle.
3. Explore the feed to enjoy notes, videos, and clips from creators. 
4. Subscribe to your favorites for free, tune into their livestreams and join private group chats.",2022-03-08T08:00:00Z,2025-11-17T17:28:36Z
ua,Ukraine,News,6009,13,6451442594,Щодня,"SVITKHIM-R, TOV",https://apps.apple.com/ua/app/%D1%89%D0%BE%D0%B4%D0%BD%D1%8F/id6451442594?uo=4,0.0,2.79452,73,News,"Магазин ""Щодня"" - ваша надійна адреса для покупки всього необхідного для дому, хімії, дитячих іграшок та дрібних речей. Ми пропонуємо широкий асортимент продукції, що відповідає вашим потребам у повсякденному житті. 

Оплачуйте покупки в Щодня та отримайте винагороду Бонусного рахунку за допомогою одного сканування картки в додатку. 

Зручно плануйте покупки та слідкуйте в додатку за оновленням акційних пропозицій: Краща ціна, Тижнева акція, Акція місяця. 

Переглядайте історію ваших покупок. 
Та отримуйте найгарячіші пропозиції за допомогою Push-сповіщень у додатку. 

Використовуйте сканер штрихкодів, щоб дізнатись ціну товару у вашому улюбленому магазині Щодня. 

Переглядайте місце розташування найближчого магазину Щодня від Вас. 

Магазин ""Щодня"" пропонує зручні способи оплати і швидку доставку, щоб зробити ваші покупки якомога приємнішими і зручнішими. Наші досвідчені співробітники завжди готові допомогти вам.",2023-09-03T07:00:00Z,2025-08-22T09:48:14Z
ua,Ukraine,News,6009,14,6695740675,Укренерго,"STFALKON, TOV",https://apps.apple.com/ua/app/%D1%83%D0%BA%D1%80%D0%B5%D0%BD%D0%B5%D1%80%D0%B3%D0%BE/id6695740675?uo=4,0.0,3.86207,29,News,"Ukrenergo mobile app gives an opportunity to quickly get information about the situation with electricity supply in every region of Ukraine. What is the probability of electricity cuts? Is there enough electricity to meet the needs of all consumers? Is it necessary to limit the use of powerful electrical appliances? You can easily find it out by logging in to the app or permitting it to send notifications. Ukrenergo app also offers to participate in surveys to help make the Ukrainian power system more
resilient to challenges. Thank you for being with us!",2024-12-25T08:00:00Z,2025-03-21T13:51:57Z
