country,country_name,category,genre_id,rank,app_id,app_name,developer,url,price,averageUserRating,userRatingCount,primaryGenreName,description,launch_date,update_date
gd,Grenada,Productivity,6007,1,6755475759,CNCFeedWizard,Junery Sausa,https://apps.apple.com/gd/app/cncfeedwizard/id6755475759?uo=4,0.0,0,0,Productivity,"CNCFeedWizard is a handy calculator app made for machinists, CNC programmers, and shop owners. It helps you quickly find the right cutting speed and RPM, feed rate, and chip load per tooth for your tools. You can also work out metal removal rate (MRR) to see how fast you’re really cutting. The app includes a tool life prediction calculator using the Taylor equation, so you can plan tool changes better. It can estimate cost per part by combining tooling cost and machine time. You also get tool life per edge or per corner to track insert usage more clearly. For quality control, CNCFeedWizard offers a simple surface finish estimator for turning and milling. It even handles radial chip thinning and spindle power needs, so your feeds and speeds stay safe, efficient, and easy to set.",2025-11-19T08:00:00Z,2025-11-19T13:07:15Z
gd,Grenada,Productivity,6007,2,6755465169,BoringBarCalc,Nguyen Thi Hieu,https://apps.apple.com/gd/app/boringbarcalc/id6755465169?uo=4,0.0,0,0,Productivity,"BoringBarCalc is a handy tool made to help machinists, programmers, and shop owners work faster and smarter. The app brings together many useful machining calculators in one easy place. You can quickly check boring bar overhang, tapping torque, thread milling speeds, and more with simple inputs. It also helps adjust feeds for helical moves, ramps, plunges, and corner cutting. Surface finish, heat input, and other cutting conditions can be understood in seconds. The app even supports planning tasks like tool consumption, reorder timing, and shift capacity. Our goal is to make machining calculations simple, accurate, and easy for everyone. With BoringBarCalc, you save time, avoid mistakes, and improve your machining results.",2025-11-19T08:00:00Z,2025-11-19T11:49:20Z
gd,Grenada,Productivity,6007,3,6755474140,BoosterPumpHeat,ZUNAIRA BIBI,https://apps.apple.com/gd/app/boosterpumpheat/id6755474140?uo=4,0.0,0,0,Productivity,"BoosterPumpHeat helps pump users see how elevation, weather, and water level change suction safety and NPSH margin. The app groups tools for altitude effects, daily pressure swings, tide or river level moves, and floating roof tank drawdown. Users can test strainers, fouling build-up, and suction line heat gain to balance protection, pressure loss, and temperature rise. Hot recirculation mixing, booster heater changes, and inlet velocity checks guide safer adjustments to flow and layout. Clear calculators show best and worst operating windows so cavitation risk becomes easier to spot. Simple inputs, quick graphs, and plain language make pump health checks fast for both operators and engineers. Use BoosterPumpHeat during design reviews, plant changes, or troubleshooting to keep suction conditions inside a safe zone. The app supports smarter, calmer pump decisions before problems appear in the field.",2025-11-19T08:00:00Z,2025-11-19T11:57:51Z
gd,Grenada,Productivity,6007,4,6448311069,ChatGPT,"OpenAI, L.L.C.",https://apps.apple.com/gd/app/chatgpt/id6448311069?uo=4,0.0,4.7782,514,Productivity,"Introducing ChatGPT for iOS: OpenAI’s latest advancements at your fingertips.

This official app is free, syncs your history across devices, and brings you the latest from OpenAI, including the new image generator.

With ChatGPT in your pocket, you’ll find:

· Image generation–Generate original images from a description, or transform existing ones with a few simple words. 
· Advanced Voice Mode–Tap the soundwave icon to have a real-time convo on the go. Settle a dinner table debate, or practice a new language. 
· Photo upload—Snap or upload a picture to transcribe a handwritten recipe or get info about a landmark. 
· Creative inspiration—Find custom birthday gift ideas or create a personalized greeting card.
· Tailored advice—Talk through a tough situation, ask for a detailed travel itinerary, or get help crafting the perfect response. 
· Personalized learning—Explain electricity to a dinosaur-loving kid or easily brush up yourself on a historic event.
· Professional input—Brainstorm marketing copy or map out a business plan.
· Instant answers—Get recipe suggestions when you only have a few ingredients.

Join hundreds of millions of users and try the app captivating the world. Download ChatGPT today.

Terms of service & privacy policy:
https://openai.com/policies/terms-of-use
https://openai.com/policies/privacy-policy",2023-05-30T07:00:00Z,2025-11-18T16:54:49Z
gd,Grenada,Productivity,6007,5,6755479064,CutterUsageTracker,Nguyen Chau Pha,https://apps.apple.com/gd/app/cutterusagetracker/id6755479064?uo=4,0.0,0,0,Productivity,"CutterUsageTracker is a app to keep track of every cutting tool you use on the shop floor. It lets you log tool life with fields like tool code, machine, material, cutting time, parts made, and wear condition so you can see when a cutter really needs to be changed. You can also keep a clean regrind history, noting each regrind number, date, shop, material removed, and current tool size to know how many good runs are left in a tool. Built-in converters help you switch between power, torque, and speed, and between coolant flow units like L/min and gal/min, plus bar and psi for pressure. The app also gives small calculators for engagement time per part, cycle time per part, and best step-over or step-down so you can tune your programs. With all tool and regrind data in one place, you can spot bad cutting conditions, catch root causes, and cut down on sudden tool breaks. CutterUsageTracker helps you use each cutter for the right time, lower tool costs, and keep your machines running more smoothly.",2025-11-19T08:00:00Z,2025-11-19T13:47:22Z
gd,Grenada,Productivity,6007,6,6477489729,Google Gemini,Google LLC,https://apps.apple.com/gd/app/google-gemini/id6477489729?uo=4,0.0,4.68333,60,Productivity,"Google Gemini app is your personal, proactive and powerful AI assistant.

With Gemini on your iPhone or iPad, you can:

– Go Live with Gemini to brainstorm ideas, simplify complex topics and rehearse for important moments. Share your camera or screen in Gemini Live conversations to talk with Gemini about anything that you see. Just click on the Gemini Live button in your Gemini app
– Bring your ideas to life with Canvas. From prompt to prototype, create apps, games, web pages, infographics, Audio Overviews and more
– Connect with your favourite Google apps, like Search, YouTube, Google Maps, Gmail and more
– Study smarter and explore any topic with quiz and flashcard creation, interactive visuals and real-world examples
– Turn any file into a podcast that you can listen to any time, anywhere
– Create and edit stunning images from just a few words
– Plan trips better and faster
– Get summaries, deep dives and source links, all in one place
– Brainstorm new ideas or improve existing ones

Try Nano Banana: State-of-the-art image generation and editing built on Gemini 2.5 Flash


Level up your Gemini app experience by upgrading to the Plus plan – unlock new and powerful features to boost your creativity and productivity:
– Get more access to our most powerful models, like 2.5 Pro
– Generate and dive into detailed reports on any topic with Deep Research powered by 2.5 Pro
– Turn words into high-quality, eight-second video clips with video generation with Veo 3.1 Fast and more.

Google AI Plus includes additional benefits. Gemini app, as part of Google AI Plus, will be available to qualifying Google Workspace business and education plans. Learn more: https://gemini.google/subscriptions/

Get even more out of your Gemini app experience by upgrading to the Pro plan, which helps you tackle complex tasks and projects. Enjoy an industry-leading 1M token context window (enabling Gemini to process up to 1,500 pages of text or 30k lines of code), and higher access to our most capable model 2.5 Pro, Deep Research on 2.5 Pro and video generation with Veo 3.1 Fast.

Gemini in Google AI Pro includes additional benefits as part of a Google AI Pro subscription. The Gemini app, as part of Google AI Pro, will continue to be available to qualifying Google Workspace business and education plans. Learn more: https://gemini.google/subscriptions/

Get the best of Gemini app by upgrading to the Ultra plan – unlock the highest level of access to the best of Google AI and exclusive features. Get the highest access to Google's most powerful model, like 2.5 Pro, features like video generation with Veo 3.1, Deep Research on 2.5 Pro and unlock Gemini 2.5 Deep Think. You'll also get early access to try our newest AI innovations as they become available, including Agent Mode.

Gemini in Google AI Ultra includes additional benefits as part of a Google AI Ultra subscription. Google AI Ultra for Business is available as an add-on to Google Workspace customers. Learn more: https://support.google.com/a/answer/16345165

The Google Gemini mobile app is available in selected languages and countries. Learn more:
g.co/gemini/iosrequirements

Gemini Live feature availability varies based on language. Learn more:
g.co/gemini/ioslanguages

While Gemini can help you with many tasks like checking the weather, giving directions, and finding and summarising information across the web and apps, Gemini does not yet support device actions like setting an alarm, sending a text message and others on iOS.

Review the Gemini Apps Privacy Notice:
g.co/gemini/privacynotice",2024-11-13T08:00:00Z,2025-11-20T01:10:16Z
gd,Grenada,Productivity,6007,7,6755430134,PressureLawCalc,Nguyen Thi Dao,https://apps.apple.com/gd/app/pressurelawcalc/id6755430134?uo=4,0.0,0,0,Productivity,"PressureLawCalc is a smart tool to help users understand pressure-related behaviour in pumps, liquids, and gases. It explains how dissolved gases turn into bubbles and how mixed vapour pressures change in real systems. The app helps you check air content, find the right place for air separators, and avoid gas pockets in suction lines. It also points out risky temperature ranges in hot-water systems and shows how tank blanketing pressure can improve safety. PressureLawCalc includes tools to see how dissolved solids affect boiling points and how start-up conditions change NPSH. It even guides you on how fast to ramp VFDs to avoid sudden pressure drops. Overall, the app gives clear, practical insights to help prevent cavitation and keep systems running smoothly.",2025-11-18T08:00:00Z,2025-11-18T15:17:16Z
gd,Grenada,Productivity,6007,8,6755356266,FlowRiskPassApp,Tran Thanh Dien,https://apps.apple.com/gd/app/flowriskpassapp/id6755356266?uo=4,0.0,0,0,Productivity,"FlowRiskPassApp is a simple and helpful app designed to check common pump and flow problems in an easy way. It helps users understand minimum flow needs, valve pressure drops, and cavitation risks without using complex formulas. The app also checks water hammer conditions, NPSH safety, and flashing risks in orifice plates. It can warn you about vortex formation, low-flow recirculation, and suction issues that may damage equipment. FlowRiskPassApp also supports surge tank and air-release sizing to keep pump suction pressure safe. It guides you in checking minimum submergence and sump approach velocity to avoid air entry and unstable flow. Overall, the app gives quick tools to make systems safer, more reliable, and easier to understand.",2025-11-16T08:00:00Z,2025-11-16T14:21:36Z
gd,Grenada,Productivity,6007,9,6755355335,SumpBaffleSelector,Sau Van Be Nguyen,https://apps.apple.com/gd/app/sumpbaffleselector/id6755355335?uo=4,0.0,0,0,Productivity,"SumpBaffleSelector is designed to help engineers make quick and confident decisions for pump and sump setups. Our app brings together easy tools that guide you in sizing baffles, checking inlet elbow effects, and reviewing how pumps interact. It also helps you understand suction boost, seal conditions, and proper flush settings to avoid cavitation problems. You can compare inducer upgrades, explore impeller coating benefits, and estimate cavitation wear in a simple way. The app also offers a basic material selector so you can choose the right metal for tough operating conditions. We focus on clear inputs, simple steps, and results that are easy to apply in real projects. SumpBaffleSelector aims to save time, improve reliability, and support better decisions in everyday pump system work.",2025-11-16T08:00:00Z,2025-11-16T13:30:03Z
gd,Grenada,Productivity,6007,10,586447913,Microsoft Word,Microsoft Corporation,https://apps.apple.com/gd/app/microsoft-word/id586447913?uo=4,0.0,4.62105,570,Productivity,"Generate a draft with Copilot

The trusted Word app lets you create, edit, view, and share your files with others quickly and easily. Send, view and edit Microsoft 365 docs attached to emails from your phone with this powerful word processing app from Microsoft.

With Word, your office moves with you. Whether you’re a blogger, writer, journalist, columnist, student, or a project manager working on documentation, Word is as handy as you want it to be.

Make impactful text documents, scripts, blogs, write-ups, or resumes. Customise your document, letter, CV or notes your way with robust tools that enable you to accomplish your best writing with the best format options and templates.

Get the power of AI with Copilot1 in your favorite apps when you sign in with your Microsoft 365 subscription. Create and edit documents, collaborate and share with ease when you download Microsoft Word today.


Create Documents

• Use AI to turn a blank document into a polished draft with Copilot

• Use rich formatting and layout options to note down your ideas and express them in writing.

• Document formats and layouts stay pristine and look great on any device.


 
Read, Write, & Edit Documents

• Reading view lets you read lengthy docs, letters, scripts, and more on your device with ease.

• Use familiar writing and editing tools as you’d find on a desktop word processor.

 
Collaborate Anywhere

• Share thoughts by commenting in docs right next to the text you’re discussing.

• Everyone can collaborate and stay on top of changes to the text, layout, and formatting.

• As you and your team make changes, you can revert to view earlier drafts with improved version history in Word.
 

Simplified Sharing

• Share files with a few taps to quickly invite others to edit or view your documents.

• Easily manage permissions and see who’s working in a document.

• Copy the content of your Word files directly into the body of an email message with its format intact or attach your docs to an email and make sharing easier.

Download Microsoft Word now and get the best way to create, share and edit documents from your iPhone or iPad.

To create or edit documents, sign in with a free Microsoft account on devices with a screen size smaller than 10.1 inches.

Copilot in Microsoft Word iOS languages not supported: Hindi, Malay

Unlock the premium Microsoft 365 experience with a qualifying subscription for your phone, tablet, PC, and Mac.
 
Monthly Microsoft 365 subscriptions purchased from the app will be charged to your App Store account and will automatically renew within 24 hours prior to the end of the current subscription period unless auto-renewal is disabled beforehand. You can manage your subscriptions in your App Store account settings.

This app is provided by either Microsoft or a third-party app publisher and is subject to a separate privacy statement and terms and conditions. Data provided through the use of this store and this app may be accessible to Microsoft or the third-party app publisher, as applicable, and transferred to, stored, and processed in the United States or any other country where Microsoft or the app publisher and their affiliates or service providers maintain facilities.
 
Please refer to the Microsoft Software Licence Terms for Microsoft 365. See “Licence Agreement” link under Information. By installing the app, you agree to these terms and conditions.",2014-03-27T19:38:37Z,2025-11-24T05:04:07Z
gd,Grenada,Productivity,6007,11,1503038374,Topup Flow,Cable & Wireless Holdings Inc,https://apps.apple.com/gd/app/topup-flow/id1503038374?uo=4,0.0,4.4532,203,Productivity,"Official Flow app to easily recharge any Flow phone or purchase plans using your credit/debit card or PayPal account

Top up any Flow number in a new and simple way. You will be able to Top up an amount or select a plan as you wish.
Top up the Flow number in just 3 simple steps:

1- Select Destination
2- Choose Amount or Plan
3- Enter your Payment details (Credit Card or Paypal)

That's all. Your phone will be topped up faster than ever. Once you have made your first Top Up you will be able to repeat it just entering your payment details.",2020-03-18T07:00:00Z,2025-11-19T21:09:10Z
gd,Grenada,Productivity,6007,12,422689480,Gmail - Email by Google,Google LLC,https://apps.apple.com/gd/app/gmail-email-by-google/id422689480?uo=4,0.0,4.64455,211,Productivity,"The official Gmail app brings the best of Gmail to your iPhone or iPad with robust security, real-time notifications, multiple account support and search that works across all your mail.

With the Gmail app, you can:
• Make Gmail your default email app on iOS
• Use Gemini* in Gmail to summarise emails, craft or refine responses, or search your inbox to find what you're looking for
• Automatically block more than 99.9% of spam, phishing, malware and dangerous links from ever reaching your inbox
• Undo send, to prevent embarrassing mistakes
• Turn on Google Chat to connect, create and collaborate with others
• Get more done as a group in Spaces – a dedicated place for organising people, topics and projects
• Enjoy high-quality video calling with Google Meet
• Respond to emails quickly with Smart Reply suggestions
• Switch between multiple accounts
• Get notified of new mail fast, with notification centre, badge and lock screen options
• Search your mail faster with instant results, predictions as you type and spelling suggestions
• Organise your mail by labelling, starring, deleting and reporting spam
• Swipe to archive/delete, to quickly clear out your inbox
• Read your mail with threaded conversations
• Auto-complete contact names as you type from your Google contacts or your phone
• Respond to Google Calendar invites right from the app

Gmail is part of Google Workspace, allowing you and your team to easily connect, create and collaborate. You can:
• Connect with colleagues via Google Meet or Google Chat, send an invite in Calendar, add an action to your task list and more without leaving Gmail
• Use suggested actions – like Smart Reply, Smart Compose, grammar suggestions and nudges – to help you stay on top of work and take care of simple tasks, so you can be more efficient with your time
• Stay safe. Our machine-learning models block more than 99.9% of spam, phishing and malware from reaching our users

*Google One AI Premium subscription and Internet connection required. Language and country availability may vary. Check responses for accuracy.",2011-11-02T17:13:30Z,2025-11-17T19:37:28Z
gd,Grenada,Productivity,6007,13,6483293628,Voicenotes AI Notes & Meetings,Coping Hard Inc.,https://apps.apple.com/gd/app/voicenotes-ai-notes-meetings/id6483293628?uo=4,0.0,5,4,Productivity,"Voicenotes is the easiest way to take notes — whether you’re in a meeting, on a walk, or processing a thought out loud.
Just hit record. Voicenotes transcribes your speech instantly, summarizes what matters, and lets you ask your AI to recall anything later.

Record everything. Remember anything.

Use Voicenotes to:
Record meetings, reflections, ideas, and conversations
Get accurate transcriptions in 100+ languages
Summarize long recordings into short, clear takeaways
Ask your AI to remember details, dates, and decisions
Create content directly from your notes
Search across everything you’ve recorded

Works across all your devices:
iOS
MacOS
WatchOS

Works with your favorite tools:
Notion
Todoist
Readwise
WhatsApp (via bot)
Zapier for custom workflows

Great for journaling, team meetings, personal reminders — or just getting your thoughts down.

Privacy Policy: https://help.voicenotes.com/en/articles/9196879-privacy-policy

Terms of Use: https://www.apple.com/legal/internet-services/itunes/dev/stdeula/

Reddit: https://www.reddit.com/r/Voicenotesai/

X: https://x.com/voicenotesai",2024-04-16T07:00:00Z,2025-11-13T05:12:25Z
gd,Grenada,Productivity,6007,14,6755429282,AccessLogCompanion,Talha Riaz khan,https://apps.apple.com/gd/app/accesslogcompanion/id6755429282?uo=4,0.0,0,0,Productivity,"AccessLogCompanion helps guards and site staff record contractor gate entries, exits, and authorizations. The app stores log ID, times, contractor names, companies, purpose of work, approving person, proof checks, plus notes on materials moving in or out. Induction records stay in order with worker names, badge numbers, contractor details, trade or role, module type, and pass or pending status. Quick angle tools change degrees to radians and slope percent for ramps, stairs, and small site checks. Length and height tools handle mm, cm, meters, inches, and feet, while area and volume tools cover m², ft², m³, and ft³. Load tools change kg and tons to kN estimates, helping with simple load checks on small works. Man-hour and speed tools turn people and time into clear totals, and show flow per minute or per hour for gates and barriers.",2025-11-18T08:00:00Z,2025-11-18T13:01:24Z
gd,Grenada,Productivity,6007,15,951937596,Microsoft Outlook,Microsoft Corporation,https://apps.apple.com/gd/app/microsoft-outlook/id951937596?uo=4,0.0,4.69632,787,Productivity,"Outlook lets you bring all your email accounts and calendars in one convenient spot. Whether it’s staying on top of your inbox or scheduling the next big thing, we make it easy to be your most productive, organised and connected self.

Here's what you'll love about Outlook for iOS:

- Focus on the right things with our smart inbox - we help you sort between messages you need to act on straight away and everything else.
- Swipe to quickly schedule, delete and archive messages.
- Share your meeting availability with just a tap and easily find times to meet with others.
- Find everything you're looking for, including files, contacts, and your forthcoming trips.
- View and attach any file from your email, OneDrive, Dropbox, and more, without having to download them to your phone.
- Open Word, Excel, or PowerPoint attachments to edit them directly in the corresponding app and attach them back to an email.
- Recap extra-long email threads in an instant with Summarise with Copilot*
- Type a few words to have Copilot* jump-start your writing with an outline or draft
- Before sending off your email, use Coaching with Copilot* to get tips and suggestions that help improve the overall tone, sentiment, and clarity
 
*Microsoft 365 Personal/Family subscription or business account enabled with Copilot required to use Copilot features

--

Outlook for iOS works with Microsoft Exchange, Office 365, Outlook.com (including Hotmail and MSN), Gmail, Yahoo Email, and iCloud.

--

To make an in-app purchase of an Office 365 Home or Personal subscription, open the app, go to Settings and tap on Upgrade next to your Outlook.com or Hotmail.com account. Subscriptions begin at USD 6.99 a month in the US, and can vary by region. With an Office 365 subscription, you get 1 TB of storage for each user, access to all features in Word, Excel and PowerPoint on iPad, iPhone and iPod touch, and you can install Word, Excel, PowerPoint, Outlook and OneNote on PCs or Macs.

Office 365 subscriptions purchased from the app will be charged to your iTunes account and will automatically renew within 24 hours prior to the end of the current subscription period, unless auto-renewal is disabled beforehand. To manage your subscriptions or to disable auto-renewal, after purchase, go to your iTunes account settings. A subscription cannot be cancelled during the active subscription period. Any unused portion of a free trial period, if offered, will be forfeited when the user purchases a subscription to that publication, where applicable.

Privacy and Cookies: https://go.microsoft.com/fwlink/?LinkId=521839 
Terms of Use: http://go.microsoft.com/fwlink/?LinkID=530144",2015-01-29T05:22:59Z,2025-11-19T17:36:59Z
