country,country_name,category,genre_id,rank,app_id,app_name,developer,url,price,averageUserRating,userRatingCount,primaryGenreName,description,launch_date,update_date
it,Italy,Graphics & Design,6027,1,1534785237,Pixelcut AI Photo Editor,Pixelcut Inc.,https://apps.apple.com/it/app/pixelcut-ai-photo-editor/id1534785237?uo=4,0.0,4.71915,8795,Graphics & Design,"Unisciti agli oltre 20 milioni di creatori di Pixelcut! L'editor di foto e grafico Pixelcut ti aiuta a creare immagini straordinarie in pochi secondi. Pixelcut è un editor completo che utilizza l'intelligenza artificiale per aiutarti a creare immagini facilmente.

STRUMENTO DI RIMOZIONE SFONDO — Rimuovi istantaneamente lo sfondo da qualsiasi foto nel tuo rullino fotografico. Cancella lo sfondo con un ritaglio perfetto.

GOMMA MAGICA — Rimuovi gli oggetti indesiderati e ripulisci le immagini.

SERVIZIO FOTOGRAFICO CON AI — Genera infinite foto di prodotti utilizzando AI Photo Shoot. Creare bellissime fotografie di prodotti per il tuo negozio di e-commerce non è mai stato così facile.

REEL MAKER – Crea facilmente un video per la tua attività!

MAGIC WRITER — Ora hai a portata di mano un Copywriter AI alimentato dalla stessa tecnologia di ChatGPT! Genera descrizioni dei prodotti, hashtag e didascalie di Instagram e molto altro ancora utilizzando GPT di OpenAI!

COLLAGE — Crea bellissimi collage dalle tue foto. Scegli tra dozzine di layout creativi!

SFONDI BIANCHI E A COLORI — Posiziona il tuo prodotto su un semplice sfondo bianco o scegli tra una tavolozza di colori e sfondi straordinari.

MODELLI — Scegli tra migliaia di modelli progettati appositamente per lo shopping.

OMBRE — Controlla l'ombra sul tuo prodotto per farlo sembrare reale.

STILI DI TESTO — Aggiungi testo con splendidi stili di font. Sovrapponi il testo alle immagini. Trasforma le tue citazioni in arte!

DISTINGUITI — Vendi di più e fai crescere la tua presenza su Instagram, Poshmark, Shopify e con i tuoi bellissimi post e storie sui prodotti.

SCOPRI — Cerca tra migliaia di modelli creati dalla community per te! Che sia per il tuo canale YouTube, podcast, Instagram o vetrina, la community ha ciò che fa per te!

Scarica Pixelcut e fai crescere il tuo brand oggi stesso!

Hai domande, problemi o feedback? Contattaci all'indirizzo support@pixelcut.app.

L'esperienza di abbonamento Pixelcut Pro
Pixelcut Pro è un abbonamento mensile o annuale che fornisce l'accesso a strumenti per aiutarti a vendere di più e far crescere la tua attività. L'abbonamento Pixelcut Pro ti offre rimozioni di sfondi illimitate e istantanee, centinaia di modelli, centinaia di font, sovrapposizioni e sfondi, tutti aggiornati mensilmente. L'abbonamento si rinnova automaticamente alla fine di ogni periodo (mese o anno a seconda dell'abbonamento), a meno che non venga annullato con 24 ore di anticipo. La quota di abbonamento viene addebitata sul tuo account iTunes alla conferma dell'acquisto. Puoi gestire il tuo abbonamento e disattivare il rinnovo automatico accedendo alle Impostazioni dopo l'acquisto. Non è consentito annullare l'abbonamento corrente durante il periodo attivo. Il pagamento verrà addebitato sull'account iTunes alla conferma dell'acquisto. L'account verrà riceverà l'addebito per il rinnovo entro 24 ore dalla fine del periodo corrente e identificherà il costo del rinnovo. Qualsiasi parte inutilizzata di un periodo di prova gratuito, se offerto, verrà annullata quando l'utente acquista un abbonamento a tale pubblicazione, ove applicabile.

Termini e condizioni: https://pixelcut.ai/terms
Informativa sulla privacy: https://pixelcut.ai/privacy",2020-11-03T08:00:00Z,2025-11-19T17:03:52Z
it,Italy,Graphics & Design,6027,2,6464476667,Home AI – Design d’Interni IA,HUBX YAZILIM HIZMETLERI ANONIM SIRKETI,https://apps.apple.com/it/app/home-ai-design-dinterni-ia/id6464476667?uo=4,0.0,4.59523,5287,Graphics & Design,"Progetta la tua casa con Home AI, il più potente strumento per design d’interni AI
Le solite vecchie pareti di casa ti hanno stancato? Vorresti ristrutturare completamente i tuoi ambienti ma non sai quale stile scegliere per arredare casa in modo originale ed elegante? Home AI è il tuo personale room planner, pronto ad assisterti per trasformare i tuoi spazi di vita e costruire case secondo i tuoi desideri con tutta la potenza dell’intelligenza artificiale

【Interior design facile sempre a disposizione】
●Per progettare casa immediatamente: scatta una foto di qualunque stanza e gli avanzati algoritmi del room planner Home AI genereranno istantaneamente per te vari splendidi progetti secondo gli stili più alla moda. Ti sorprenderai vedendo le tue idee prendere forma davanti ai tuoi occhi, per costruire case e ambienti come li hai sempre sognati.
●Un’amplissima gamma di stili per arredare casa: hai a disposizione un designer d’interni personale, grazie alla nostra grande libreria di oltre 10 diversi stili con cui progettare casa. Dal minimalismo essenziale di un arredamento moderno alla serenità di un ambiente ispirato all’estetica zen, Home AI è in grado di soddisfare tutti i gusti. Prova i vari stili, abbina elementi diversi e scopri il look perfetto con cui arredare casa esprimendo pienamente la tua personalità.
●Suggerimenti basati sull’AI perfetti in ogni dettaglio: Home AI non si limita a suggerirti un nuovo modo di arredare casa, ma ti fornisce consigli precisi su come abbinare mobili, decorazioni e colori a seconda dello stile che preferisci. Progetta la tua casa creando un ambiente armonioso e coerente, veramente accogliente e vivibile.

【Vai oltre la semplice visualizzazione delle tue idee per costruire case:】
●Salva e condividi le tue creazioni per arredare casa: conserva i tuoi progetti di interior design preferiti anche come riferimento per il futuro e comunicali agli interessati. Condividi le tue idee per progettare casa con amici, familiari e con architetti o arredatori professionisti per avere il loro parere, perfezionare quello che hai in mente e realizzarlo. Collabora facilmente per far diventare realtà i tuoi progetti.
●Trova ispirazione tra infinite possibilità per arredare casa: il room planner Home AI ti fornisce una serie di idee a cui ispirarti per progettare casa in maniera originale e creativa. Scopri i vari stili di progettazione e prova l’effetto che farebbero, per individuare il perfetto equilibrio che soddisfa i tuoi gusti e valorizza i tuoi ambienti.

【Home AI è lo strumento migliore e più avanzato per chiunque desideri:】
●Visualizzare senza fatica idee di arredamenti d’interni e vedere materializzarsi la propria casa ideale 
●Trarre ispirazione da un’ampia libreria di stili di interior design per trovare quello perfetto
●Arredare casa interamente o rinnovare lo stile di una singola stanza con facilità
●Collaborare con familiari, amici e professionisti per ottenere un ambiente su misura
●Dare spunto alla creatività e trovare innumerevoli idee per il design d’interni della propria casa
Scarica subito il room planner Home AI e sfrutta un intero universo di possibilità di design d’interni! Reimmagina i tuoi spazi e ridefinisci il tuo stile, creando la casa dei tuoi sogni con la potenza di un’avanzata tecnologia AI.

Usando l’app, confermi di conoscere e accettare la nostra Informativa sulla privacy e i Termini di utilizzo del servizio:
Informativa sulla privacy: https://homeinterior.ai/privacy
Termini del servizio: https://homeinterior.ai/terms
Hai una domanda da farci?
info@homeinterior.ai",2024-04-05T07:00:00Z,2025-11-20T17:07:05Z
it,Italy,Graphics & Design,6027,3,1472157401,Collage Foto: cornici e bordi,Fitness Labs SRL,https://apps.apple.com/it/app/collage-foto-cornici-e-bordi/id1472157401?uo=4,0.0,4.55483,16542,Graphics & Design,"Do you have some cool memories from your last holiday?
 Use Photo Collage Maker to combine the best of your experiences! Bring your ideas to life with this super fun and easy to use the app.
Equipped with a wide array of layouts, shapes, and styles, you can rotate, resize or rearrange freely the photos in the collage.
The great number of filters will help to enhance the aspect of your creation.
Be ready to share with the world a unique story!

No unnecessary features or complicated UI
Very flexible, quick, and simple workflow
Extensive collection of beautifully designed layouts
Mix your photos and choose the size and style that fits you best
Add a personalized touch by picking the right filter

----
Subscribe to take advantage of the features described above. Subscription length: weekly, monthly, yearly
By subscribing you get unlimited edits and access to our tools.Payment will be charged to iTunes Account at confirmation of purchase. Your subscription will automatically renews unless auto-renew is turned off at least 24-hours before the end of the current period. Your account will be charged for renewal within 24-hours prior to the end of the current period. Subscriptions may be managed and auto-renewal may be turned off by going to the Account Settings after purchase. No cancellation of the current subscription is allowed during active subscription period.
Any unused portion of a free trial period, if offered, will be forfeited when the user purchases a subscription to that publication, where applicable

For the Terms of service and privacy policy, please check: 
http://braincake.net/collage_privacy.html
http://braincake.net/collage_terms.html",2019-12-11T08:00:00Z,2025-11-23T08:30:43Z
it,Italy,Graphics & Design,6027,4,6475700817,AR Drawing - Draw Sketch App,BRALY COMPANY LIMITED,https://apps.apple.com/it/app/ar-drawing-draw-sketch-app/id6475700817?uo=4,0.0,4.20661,242,Graphics & Design,"Do you want to learn how to draw but don't know where to start? Or do you simply want to create unique artwork that combines reality and virtual elements? AR Drawing - Sketchar App is the perfect tool for you! 

Rated 4.5 stars by the community, AR Drawing is the most advanced and beloved camera-based drawing tool for everyone, from beginners to seasoned artists. AR Drawing - Sketchar App, the ultimate tool for learning to ar draw, ar draw sketch and trace anything

With AR Drawing with Sketchar App, Transform Your Real World into a Creative Canvas! Unleash your inner artist and transform any surface into your personal canvas using the power of augmented reality

Join 50 million users worldwide who are discovering the power of AR drawing and sharing unique AR artworks daily. You can draw unlimited pictures and share your magnificent results with friends and family as you like, mastering the art to ar draw, ar draw sketch and trace anything.

With advanced Augmented Reality (AR) technology, you can 
1. Draw through camera
- Place your phone on a stand, look through the screen, and sketch everything you see – from sample photos and surrounding objects to entire scenes!
- Easily draw unlimited characters you love, such as Hello Kitty, Pikachu, or Jujutsu Kaisen, right through your camera.
- Explore an endless array of today's hottest topics like Anime, Cartoon, Animal, Cute, Food, Chibi, People, Fanart, Vehicle, Flowers, Eyes, Christmas, Nature, and more.

2. Learn to Draw Easily
- Transform complex photos into simple outlines for tracing, an excellent way to practice your drawing skills.
- Discover a diverse range of lessons tailored to artists of all levels. Choose from three difficulty levels, each offering progressively challenging exercises to hone your skills and unleash your creativity.

3. Unlimited Creativity with AR Drawing
- Select from a diverse sample library or import photos from your own gallery.
- Enhance your drawings with advanced options: Adjust Opacity for the best display, Record video of your drawing process easily, Zoom in-out of the image as you wish, On-off flash, and Extend.
- Notably, detailed video tutorials are available for beginners on how to draw specific pictures.

4. Share Your Masterpiece
- Effortlessly share your finished artwork with the community and your friends.
- Download videos of your unique drawing process and enjoy watching them. 

Personalize your content and drawing experience.
- With your AR Drawing profile, track your drawing skill improvement journey, including time spent drawing and lessons completed.
- Access personalized sketch content tailored for your AR drawing and 'trace anything' experience.""

Download the AR Drawing - Sketchar App now and join millions of artists discovering a new way to draw.
If you have any questions or contributions to the app, do not hesitate to contact us via email: feedback.drawsketch@bralyvn.com. We value your contributions and will do our best to meet all requirements and improve product quality.

Terms of Use: https://bralyvn.com/term-and-condition.php
Privacy Policy: https://bralyvn.com/privacy-policy.php",2024-01-30T08:00:00Z,2025-11-22T13:26:14Z
it,Italy,Graphics & Design,6027,5,6446832902,WallPics - Sfondi animati 4K,IgKnight Technologies Ltd,https://apps.apple.com/it/app/wallpics-sfondi-animati-4k/id6446832902?uo=4,0.0,4.55065,1609,Graphics & Design,"Trasforma il tuo iPhone in un capolavoro personale con Wallpics – l’app definitiva per sfondi animati, creazioni di wallpaper fai-da-te (DIY), animazioni di ricarica, icone PFP, set di sfondi abbinati e sfondi in vera qualità 4K. Che tu voglia rinnovare la schermata di blocco o creare un tema coerente per schermo principale e di blocco, Wallpics ti offre tutto ciò di cui hai bisogno per personalizzare il tuo dispositivo.

Sfondi animati infiniti e qualità 4K
• Esplora una vasta libreria di sfondi animati dinamici in straordinaria qualità 4K – animazioni fluide che danno vita e profondità alla tua schermata di blocco e home.
• Scopri categorie come arte astratta, paesaggi naturali e città futuristiche – tutti in ultra alta definizione con colori vivaci e nitidi.
• Compatibilità perfetta con la funzione Live Photo di iOS e riproduzione senza interruzioni.

Editor di wallpaper fai-da-te (DIY)
• Dai spazio alla tua creatività con l’editor intuitivo di Wallpics. Mescola trame, colori e pattern per creare sfondi personalizzati in pochi minuti.
• Aggiungi testi, adesivi e sovrapposizioni – oppure parti da uno dei nostri modelli premium.
• Esporta le tue creazioni in risoluzione standard o 4K, pronte per l’uso o la condivisione.

Animazioni di ricarica ed effetti dinamici
• Rendi ogni ricarica un momento spettacolare: scegli tra una galleria di animazioni di ricarica che si attivano intorno all’icona della batteria.
• Da impulsi al neon a riempimenti liquidi e onde energetiche – tutti gli effetti sono personalizzabili e ottimizzati per iOS.

Icone PFP e set di sfondi abbinati
• Personalizza i tuoi profili social con una collezione curata di icone PFP – avatar stilizzati, loghi minimalisti e simboli al neon.
• Crea un look uniforme con set di sfondi abbinati – design coordinati per schermata di blocco e home.
• Esporta sfondi e icone PFP insieme per mantenere uno stile coerente su tutto il dispositivo.

Funzionalità principali

Sfondi animati: per schermate di blocco e home

DIY wallpaper: editor con modelli, testo e adesivi

Animazioni di ricarica: effetti visivi durante il collegamento

Icone PFP: avatar in vari stili e risoluzioni

Sfondi abbinati: set coordinati per entrambi gli schermi

Qualità 4K: sfondi ultra-HD ed esportazioni

Pronto a rivoluzionare l’esperienza del tuo iPhone? Scarica Wallpics oggi stesso e scopri un universo di sfondi animati, creazioni DIY, animazioni di ricarica, icone PFP, set coordinati e qualità 4K – tutto creato su misura per te.

Informazioni su pagamento e abbonamento:
Il pagamento verrà addebitato sulla carta di credito collegata al tuo account iTunes al momento della conferma dell’acquisto dell’abbonamento iniziale.
L’abbonamento si rinnova automaticamente, a meno che il rinnovo automatico non venga disattivato almeno 24 ore prima della fine del periodo di abbonamento corrente.
Il tuo account verrà addebitato per il rinnovo entro 24 ore dalla fine del periodo corrente e il costo sarà indicato.
Puoi gestire il tuo abbonamento e disattivare il rinnovo automatico nelle impostazioni dell’account dopo l’acquisto.
Eventuali periodi di prova gratuiti non utilizzati verranno annullati al momento dell’acquisto di un abbonamento, se previsti.

Scopri di più sui nostri termini e condizioni:
Privacy Policy: https://imageconverter.io/privacy-policy
Termini di utilizzo: https://imageconverter.io/terms-of-use
Contattaci: j.leisis.mba@gmail.com",2023-03-28T07:00:00Z,2025-11-19T02:57:43Z
it,Italy,Graphics & Design,6027,6,1076159017,Arredamento interni casa 3D,Room Planner Ltd,https://apps.apple.com/it/app/arredamento-interni-casa-3d/id1076159017?uo=4,0.0,4.63211,9019,Graphics & Design,"Se hai appena acquistato una casa o un appartamento o vuoi decorare la tua proprietà esistente, possiamo aiutarti a farlo più facilmente, con meno trambusto e ottenere risultati migliori in meno tempo per la piccola frazione della spesa totale.

Con l'applicazione è possibile:
- Visualizza i tuoi sogni e fatti un'idea migliore di come sarà
- Arricchisci la tua abitazione con i mobili di marchi famosi in tutto il mondo
- Cambia qualsiasi cosa nella foto, dai colori sui muri al layout dei mobili
- Condividi la tua visione con il tuo partner, coinquilini o costruttori
- Pubblica il tuo progetto nel portfolio

Inizia da uno dei progetti artigianali esistenti realizzati dai professionisti del settore o da una stanza vuota. Cambia i mobili, le decorazioni, aggiungi nuovi oggetti di molte marche, osserva la tua stanza da punti diversi, crea istantanee fotorealistiche e guarda come la tua immagine diventa realtà.

L'applicazione ha temi di design per la decorazione di soggiorno, camera da letto, cucina, bagno e molti altri.

Funzioni aggiuntive come i progetti pronti, il catalogo completo dei mobili (450 000 prodotti), l'esportazione di 3ds Max, il numero illimitato di camere e i rendering HD fotorealistici sono disponibili tramite un abbonamento auto-rinnovabile per una settimana, un mese o un anno. Il pagamento verrà addebitato sul tuo account iTunes alla conferma dell'acquisto. Le iscrizioni si rinnoveranno automaticamente a meno che il rinnovo automatico non venga disattivato almeno 24 ore prima della fine del periodo corrente. Il tuo account verrà addebitato per il rinnovo, in conformità con il piano, entro 24 ore prima della fine del periodo corrente. Puoi gestire o disattivare il rinnovo automatico nelle impostazioni del tuo account Apple lD in qualsiasi momento dopo l'acquisto. 

Termini d'uso: https://www.homeplannerapp.com/terms-and-conditions
Informativa sulla privacy: https://www.homeplannerapp.com/privacy-policy",2016-04-08T17:25:28Z,2025-11-21T01:16:20Z
it,Italy,Graphics & Design,6027,7,6448484908,AR Drawing: Sketch & Paint!,Digital Solutions Technologies Limited,https://apps.apple.com/it/app/ar-drawing-sketch-paint/id6448484908?uo=4,0.0,4.33671,1966,Graphics & Design,"Traccia semplicemente un'immagine proiettata su carta e colorala!

-Usa la fotocamera del tuo telefono per disegnare
-Tantissimi modelli: Animali, Auto, Natura, Cibo ecc.
-Torcia integrata
-Condividi il risultato con i tuoi amici

AR Drawing è un'app mobile innovativa che permette di creare disegni e dipinti sorprendenti utilizzando la tecnologia della realtà aumentata. Puoi disegnare qualsiasi cosa su qualsiasi superficie.

Che tu sia un artista esperto o un principiante, questa app è perfetta per liberare la tua creatività ed esplorare nuove possibilità artistiche. Allora, perché aspettare? Scarica AR Drawing: Sketch & Paint! oggi stesso e inizia a creare il tuo capolavoro!

Privacy Policy: https://ar-drawing.com/privacy/
Terms of Use: https://ar-drawing.com/terms/",2023-05-02T07:00:00Z,2025-11-11T17:51:04Z
it,Italy,Graphics & Design,6027,8,6502747597,DecAI™ - AI Design della Casa,COOL SUMMER LIMITED,https://apps.apple.com/it/app/decai-ai-design-della-casa/id6502747597?uo=4,0.0,4.53121,721,Graphics & Design,"Trasforma il tuo spazio con DecAI™: crea la casa dei tuoi sogni con una semplice foto!

► Design e decorazione d'interni con AI
Carica un'immagine della tua stanza, scegli lo stile desiderato e lascia che la nostra AI analizzi lo spazio per generare un progetto di design su misura. Dallo stile moderno al rustico, l’AI ti offrirà una visualizzazione dettagliata della disposizione dei mobili, combinazioni di colori e decorazioni perfette per te.

► Design esterno e ristrutturazione con AI
Trasforma l’esterno della tua casa e il giardino con strumenti di design AI. Carica una foto della tua casa, scegli lo stile che preferisci e ricevi un progetto personalizzato.

► Progettazione Giardino con AI
Carica una foto del tuo giardino, patio o terrazzo e guarda la nostra IA avanzata creare progetti di giardini personalizzati in pochi secondi - senza bisogno di pollice verde! Dalle oasi tropicali al fascino cottage, la nostra tecnologia adatta layout con fioriture stagionali, vialetti sinuosi e zone relax accoglienti, abbinandosi al tuo stile e alle dimensioni dello spazio.

► Sostituzione intelligente
Vuoi cambiare mobili o decorazioni? Con la funzione ""Sostituisci"", puoi rimuovere oggetti indesiderati e vedere una nuova versione del tuo spazio.

► Pulizia AI
Elimina facilmente oggetti indesiderati per un ambiente più ordinato e armonioso.

► Reskin – Cambia colori facilmente
Personalizza i colori di mobili e decorazioni con un solo tocco.

► Nuove pareti
Prova colori e texture diverse per le pareti senza bisogno di pittura reale.

► Anteprima nuovi pavimenti
Visualizza diversi tipi di pavimentazione, dal parquet alla ceramica, prima di prendere una decisione.

► Esplora idee di design
Lasciati ispirare da centinaia di idee di design per creare lo spazio perfetto.

► Interfaccia intuitiva e semplice da usare
Naviga facilmente tra le funzioni per sperimentare arredi e decorazioni.

◆ TERMINI DI SOTTOSCRIZIONE ◆
Titolo: Sottoscrizione di una settimana
Durata della sottoscrizione: 1 settimana
Prezzo: $5,99/settimana
Titolo: Sottoscrizione annuale
Durata della sottoscrizione: 1 anno
Prezzo: $39,99/anno
Titolo: Acquisto a vita
Prezzo: $49,99

• Il pagamento sarà addebitato sull'account iTunes al momento della conferma dell'acquisto
• La sottoscrizione si rinnova automaticamente a meno che l'auto-rinnovo non venga disattivato almeno 24 ore prima della fine del periodo corrente
• L'account verrà addebitato per il rinnovo entro 24 ore dalla fine del periodo corrente e verrà indicato il costo del rinnovo
• Le sottoscrizioni possono essere gestite dall'utente e l'auto-rinnovo può essere disattivato nelle impostazioni dell'account dopo l'acquisto
• Qualsiasi parte inutilizzata di un periodo di prova gratuito, se offerto, sarà annullata quando l'utente acquista una sottoscrizione a tale pubblicazione, se applicabile
• È possibile annullare una prova gratuita o una sottoscrizione in qualsiasi momento disattivando l'auto-rinnovo tramite le impostazioni dell'account iTunes. Questo deve essere fatto almeno 24 ore prima della fine del periodo di prova gratuito o della sottoscrizione per evitare addebiti. L'annullamento avrà effetto il giorno dopo l'ultimo giorno del periodo di sottoscrizione corrente e verrà ripristinato il servizio gratuito.

Per qualsiasi domanda, invia un'e-mail a coolsummerdev@icloud.com！

Privacy Policy: https://coolsummerdev.com/artgenerator-privacy-policy
Termini di utilizzo: https://coolsummerdev.com/artgenerator-terms-of-use
Linee guida della community: https://coolsummerdev.com/community-guidelines",2024-05-23T07:00:00Z,2025-11-21T02:59:35Z
