country,country_name,category,genre_id,rank,app_id,app_name,developer,url,price,averageUserRating,userRatingCount,primaryGenreName,description,launch_date,update_date
ru,Russian Federation,Navigation,6010,1,313877526,Яндекс Карты и Навигатор,DIRECT CURSUS COMPUTER SYSTEMS TRADING LLC,https://apps.apple.com/ru/app/%D1%8F%D0%BD%D0%B4%D0%B5%D0%BA%D1%81-%D0%BA%D0%B0%D1%80%D1%82%D1%8B-%D0%B8-%D0%BD%D0%B0%D0%B2%D0%B8%D0%B3%D0%B0%D1%82%D0%BE%D1%80/id313877526?uo=4,0.0,4.69215,1575706,Navigation,"Яндекс Карты построят маршруты на чём угодно. На общественном транспорте — с прогнозом прибытия на остановку. На автомобиле — с учётом пробок. Пешком — до входа в здание. А ещё найдут места и проведут офлайн, если скачаете карту.
Яндекс Карты — приложение к городу.

Маршруты на чём угодно

• На общественном транспорте. С информацией о том, где нужный автобус, троллейбус или трамвай находится и когда приедет на остановку
• На автомобиле — навигация с учётом дорожной ситуации и с голосовыми предупреждениями о камерах, поворотах и перестроениях на сложных развязках и магистралях
• Пешком — с голосовыми подсказками, чтобы гулять, не глядя в экран телефона
• На велосипеде — с предупреждениями о переходах и выездах на автомобильные дороги и голосовыми подсказками, когда повернуть. Чтобы лишний раз не доставать телефон
• На самокате — по возможности только по велосипедным дорожкам и тротуарам, без лестниц. Кстати, повороты тут тоже будут озвучены

Маршруты на разных видах транспорта и пешком можно сравнить друг с другом на одном экране. Так будет проще выбрать подходящий. Например, пойти пешком или сесть в метро, если на дорогах большие пробки.

Общественный транспорт

• Возможность онлайн отслеживать автобусы, трамваи, троллейбусы и маршрутки
• Для удобства на карте можно оставить только избранные маршруты
• Расписание общественного транспорта на месяц вперёд
• Прогноз прибытия на нужную остановку
• Важные транспортные объекты: остановки и станции метро
• Подсказки о загруженности станций метро, выходах и переходах
• А ещё можно узнать, нужен первый или последний вагон из центра — это мы тоже подскажем, если вы в Москве, Новосибирске или Санкт-Петербурге

Тот самый Навигатор

• Точные прогнозы пробок онлайн, чтобы ехать, а не стоять на месте
• Голосовые подсказки о поворотах, перестроениях, камерах, скоростных ограничениях, авариях и ремонтных работах, чтобы ориентироваться, не глядя в экран
• Алиса тоже здесь — найдёт место, построит маршрут или позвонит за вас на нужный номер из списка контактов
• Предложения более быстрых маршрутов, если ситуация на дороге изменилась
• Навигатор работает без интернета, если скачаете офлайн-карту
• Можно пользоваться на экране автомобиля — в CarPlay
• Поиск паркингов и оплата городских парковок
• А если всё это так понравилось, что теперь даже не хочется выходить из машины, — оплатить топливо прямо в приложении можно более чем на 8 000 заправок по России

Поиск мест и организаций

• Справочник организаций с фильтрами для удобного поиска, входами и подъездами
• Есть контакты, режим работы, а ещё список услуг, фото, отзывы посетителей и рейтинги
• Поэтажные схемы крупных торговых центров, вокзалов и аэропортов
• Поиск даже без интернета — с офлайн-картой
• Возможность сохранять кафе, магазины и другие места в закладки, составлять из них списки и потом делиться с друзьями, подписчиками в соцсетях — с кем захотите

Делаем города удобнее

• Можно без звонков записываться в салоны красоты в любое время дня и ночи
• Заказывать еду из кафе и ресторанов с собой — по пути домой или на работу
• Бронировать электросамокаты для прогулок по Москве и Краснодару
• Вызывать такси прямо из приложения

А ещё

• Скачивайте офлайн-карты для маршрутов на машине и поиска мест и адресов даже без интернета
• Смотрите панорамы улиц и пользуйтесь 3D-режимом — для лучшей ориентации в незнакомых местах
• Меняйте вид карты по настроению: на схему, спутник или гибрид и обратно
• Пользуйтесь приложением на русском, английском, турецком, украинском или узбекском языке
• Легко ориентируйтесь в Москве, Санкт-Петербурге, Новосибирске, Красноярске, Омске, Уфе, Перми, Тюмени и других городах

Мы всегда рады обратной связи — присылайте свои пожелания и комментарии на app-maps@support.yandex.ru, мы их правда читаем! И, конечно, отвечаем на них.

Лицензионное соглашение: apple.com/legal/itunes/appstore/dev/stdeula
Политика конфиденциальности: yandex.ru/legal/confidential",2009-05-13T07:00:00Z,2025-11-17T09:39:49Z
ru,Russian Federation,Navigation,6010,2,481627348,"2ГИС: карты, навигатор, друзья","LLC ""DoubleGIS""",https://apps.apple.com/ru/app/2%D0%B3%D0%B8%D1%81-%D0%BA%D0%B0%D1%80%D1%82%D1%8B-%D0%BD%D0%B0%D0%B2%D0%B8%D0%B3%D0%B0%D1%82%D0%BE%D1%80-%D0%B4%D1%80%D1%83%D0%B7%D1%8C%D1%8F/id481627348?uo=4,0.0,4.84341,654054,Navigation,"2ГИС — чтобы жить в городе было удобнее! Карта, навигатор, общественный транспорт, путеводитель и справочник под одной иконкой в телефоне. Покажет ваше местоположение, найдёт нужный адрес, поможет спланировать маршрут на машине, автобусе, велосипеде или пешеходный. А ещё в 2ГИС вы видите друзей прямо на карте!

Приложение бесплатное, работает онлайн или офлайн: используйте карты без Интернета, скачав нужный город или целый регион.

Навигатор для автомобиля. Приготовьтесь увидеть точно отрисованные дороги с тоннелями и многоуровневыми развязками в 3D. 2ГИС построит оптимальный маршрут с учётом пробок, ДТП и ремонтных работ. Покажет вашу скорость, чтобы не пришлось часто поглядывать на спидометр. Предупредит о камерах скорости и других типах камер, чтобы вы избежали штрафов. Покажет ближайшие парковки.

Приложение комбинирует gps-навигацию с другими технологиями, чтобы движение по маршруту было точным, даже в центре Москвы и при междугородних поездках, без Интернета. Включите 2ГИС в Apple CarPlay — это бесплатно.

Навигатор для велосипедов, самокатов и пешеходов. 2ГИС умеет строить маршруты по городу с учётом уклона и набора высоты, велодорожек и лестниц. Особенно удобно тем, кто на самокате или идёт на прогулку с коляской. 

Голоса звёзд. Навигатор сопровождает вас голосами Николая Дроздова, кота Матроскина, комика Чебаткова, актёра Петра Гланца, гуру озвучки 90-х Андрея Гаврилова и других героев.

Общественный транспорт. Стройте маршруты на метро, автобусе, маршрутке, троллейбусе, трамвае и электричке. Выбирайте кратчайшие или самые удобные, с пересадками и без. Включите отслеживание автобусов на карте в реальном времени. Ориентируйтесь на расписание, — включая расписание электричек, — и смотрите на реалистичный прогноз прибытия автобуса к остановке.

Друзья на карте. Добавляйте близких «в друзья» в 2ГИС — чтобы видеть друг друга на карте городе в реальном времени! Можно не спрашивать «где ты?», — а просто посмотреть геолокацию на карте. Так удобнее планировать встречи (особенно если кто-то опаздывает) или даже встречаться спонтанно! Отправьте другу эмодзи, чтобы предложить встречу, или сразу начните переписку в чате, не переходя в мессенджер.

Вы также можете отправлять любому человеку, не только другу, ссылку на свою геопозицию или маршрут, по которому едете. Управляйте видимостью своего местоположения. Это удобно, приватно и помогает всегда оставаться на связи.

Функция может служить как семейный локатор: добавьте «в друзья» своего ребёнка или бабушек и дедушек, чтобы не беспокоиться, если они не отвечают в мессенджере. И получить автоматический пуш, когда родственник дома.

Карты на максималках. 2ГИС это подробные карты более 1400 городов: с реалистичными моделями зданий, микрорайонами, дорогами, остановками — обозначены даже деревья в парке и входы в здания! Для торговых центров, вокзалов, аэропортов и других крупных объектов есть подробные поэтажные планы зданий — вы точно не заблудитесь! А также слои с недвижимостью, каршерингом и другими полезными сервисами.

Всё о городе. В поиске 2ГИС вы найдёте контакты компаний и организаций, адреса, время работы, меню ресторанов, информацию о товарах и услугах и даже цены с фотографиями. Данные обновляются регулярно.

Отзывы. 2ГИС помогает не только находить компании, товары и услуги, но и выбирать лучшие! В приложении собраны десятки тысяч отзывов, реальные фото от клиентов и показан честный рейтинг места.
Путеводители. Открывайте для себя интересные места в любом городе! С авторскими подборками, аудиогидами и 3D-достопримечательностями.

Приложение-компаньон для умных часов Apple Watch транслирует на экран часов карту и построенный на телефоне маршрут, а также показывает текущее местоположение. Вибросигнал предупредит о поворотах. Виджет Друзей на карте на главном экране часов подскажет, где сейчас близкие.

Вконтакте — https://vk.com/2gis 
Хабр — https://habr.com/ru/company/2gis 
Телеграм — https://t.me/twogis 

Техподдержка: dev@2gis.com",2011-12-18T17:59:27Z,2025-11-24T03:25:11Z
ru,Russian Federation,Navigation,6010,3,585027354,Google Карты,Google LLC,https://apps.apple.com/ru/app/google-%D0%BA%D0%B0%D1%80%D1%82%D1%8B/id585027354?uo=4,0.0,4.75208,300083,Navigation,"Узнавайте больше о мире вокруг с Google Картами. Данные о пробках и навигация помогут находить лучшие маршруты, как бы вы ни передвигались – на машине, велосипеде, общественном транспорте или пешком. А ещё на Картах отмечены более 250 млн ресторанов, магазинов, компаний и мест и можно посмотреть фотографии, отзывы и другую полезную информацию о них.

Путешествуйте как вам удобно:
• Стройте маршруты с минимальным расходом топлива.
• Находите лучшие маршруты и включайте навигацию по ним с голосовыми и экранными подсказками.
• Экономьте время: маршруты перестраиваются автоматически с учетом ситуации на дорогах, аварий и перекрытых участков.
• Узнавайте, когда приедет ваш автобус, поезд или автомобиль для совместной поездки.
• Находите велосипеды и самокаты для аренды.

Планируйте поездки и прогулки:
• Заранее изучайте в Просмотре улиц места, в которые направляетесь. Например, можно посмотреть, как выглядит парковка, или узнать, где находится вход.
• Знакомьтесь с достопримечательностями, парками и дорожками – и даже проверяйте погоду! – в реалистичном режиме.
• Создавайте списки любимых мест и делитесь ими с другими.
• Заказывайте еду с доставкой и навынос, бронируйте столики в ресторанах и номера в гостиницах.
• Скачивайте офлайн-карты, чтобы пользоваться ими там, где нет интернета.
• Ищите, куда пойти и чем заняться, и выбирайте места с учетом отзывов и фотографий.

Изучайте новые места, как местный житель:
• Получайте актуальную информацию о местах, которую добавляют более 500 миллионов пользователей.
• Проверяйте загруженность мест, чтобы избежать толп.
• Используйте Объектив в Картах, чтобы видеть пешеходные маршруты, наложенные на изображение с вашей камеры.
• Фильтруйте рестораны по типу кухни, ценам, времени работы, оценке и другим параметрам.
• Задавайте вопросы и получайте ответы о местах – от выбора блюд до наличия парковки.

Некоторые функции доступны не во всех странах и городах.
Навигация не предназначена для крупногабаритных и аварийно-спасательных транспортных
средств.",2012-12-13T04:21:00Z,2025-11-20T16:03:21Z
