country,country_name,category,genre_id,rank,app_id,app_name,developer,url,price,averageUserRating,userRatingCount,primaryGenreName,description,launch_date,update_date
mu,Mauritius,Food & Drink,6023,16,6670216494,Mob: Meal Planner and Recipes,Mouth Group Limited,https://apps.apple.com/mu/app/mob-meal-planner-and-recipes/id6670216494?uo=4,0.0,0,0,Food & Drink,"Mob makes it easy to cook simple, delicious meals that fit your schedule - whether you're planning ahead or looking for a last-minute meal.

From speedy weeknight dinners to preppable breakfasts and packed lunches, we help you cook without the stress.

Key features:

Smart shopping list – Add everything in one tap, neatly organised by supermarket aisle.

Pre-built meal plans – Save time with curated weekly plans.

Search by ingredients – Got something to use up? We’ll show you what to cook.

Family-friendly recipes – Meals everyone will actually want to eat.

Cook with ease – Step-by-step recipes with your screen unlocked while you cook.

Delicious, reliable recipes – Tested by our team of in-house chefs.

Our Mission:

Mob is on a mission to make weekly cooking easy, fun, and delicious. We do this because cooking changes lives. It improves your health, lifts your mood, and saves you money.

Whether you're looking for a healthy dinner after work, a packed lunch for tomorrow, or a prep-friendly breakfast to start the day, Mob is here to help you cook incredible meals throughout the week.

Today, we're a community of over 500,000 home cooks. We make everyday cooking exciting and aspirational—not a chore. Not just a boring task that needs to be done, but something to look forward to, that results in a delicious meal.

We're building a movement of people who have cooking as an embedded part of their weekly routine. It's part of their life.

They are proud to say: ""I'm a cook.""

Try Mob Premium free for 7 days!

Get access to Mob’s full recipe library and premium features.

If you choose to purchase Mob Premium, your Apple account will be charged, once your trial has elapsed. Auto-renewal can be turned off at any time in your App Store settings after purchase. Cancelling will stop future charges, but you’ll keep premium features until the end of the current period. Deleting the app does not cancel your subscription.

Privacy Policy: https://www.mob.co.uk/privacy-policy

Terms of Service: https://www.mob.co.uk/terms-of-service

Terms of Use: https://www.apple.com/legal/itunes/appstore/dev/stdeula",2024-09-06T07:00:00Z,2025-11-18T17:27:36Z
mu,Mauritius,Food & Drink,6023,17,1593779280,ReciMe: Recipe Manager,ReciMe Pty Ltd,https://apps.apple.com/mu/app/recime-recipe-manager/id1593779280?uo=4,0.0,4.75,16,Food & Drink,"ReciMe organizes all your favorite recipes in one place. Save recipes from Instagram, Pinterest, TikTok, and Facebook. Create grocery lists and meal plans. Calculate calories for every recipe.

FEATURES

- Save Recipes from Instagram, Pinterest, TikTok, Facebook – Download recipes from social media sites. The ingredients and method steps are saved in an easy-to-read format.
- Upload recipes from anywhere – Save your favorite recipes from your existing apps like Paprika, Notes app, Google Docs, Notion, Evernote, and more! Or add your own recipes.
- Grocery Lists – Create smart grocery lists to shop faster! Sort ingredients by supermarket aisle or by recipe.
- Meal Plan for the Week – Categorize meals for breakfast, lunch, or dinner.
- Nutrition Information – Calculate calories, protein, carbs, and fats for any recipe.
- Create Cookbooks – Organize your recipes into cookbooks. Customize recipes by meal type (breakfast, lunch, dinner), cuisine, diet, and more!
- Cloud Sync – All recipes are saved on the cloud.
- Access Across Multiple Devices – iOS and iPad.
- Adjust Ingredients – Scale ingredients to your desired serving size.
- Convert Measurements – Change recipe measurements between standard and metric.
- Cook with Ease – Keep your phone screen unlocked while you cook. Follow recipes step-by-step so you can focus in the kitchen.
- Share – Share recipes with your friends and family. Or send via email, SMS, WhatsApp, Messenger, or AirDrop.

OTHER FEATURES

- Add one photo to each recipe. Add multiple photos to every method step.
- Insert links to websites in each recipe.
- Add custom ingredients to your grocery list, or paste multiple ingredients.
- Share cookbooks with friends and family to follow your cooking journey.
- Rate recipes.
- Customize your profile – edit your bio and share links to your social media.

HOW DOES IT WORK?

ReciMe includes both a free version and a subscription version with premium features.

The premium version allows you to:

1.	Download unlimited recipes from social media, and

2.	Upload unlimited private recipes to your private recipe collection.

You can start a 7-day free trial to access these premium features. Unless you cancel at least 24 hours before the end of the free trial, you will be automatically charged the price indicated on the payment screen for your chosen subscription period. The ReciMe Premium subscription renews automatically at the end of each period (each month or year) until you cancel. Canceling your subscription means the automatic renewal will be disabled. However, you will still have access to all your subscription features for the remaining time of your then-current period. Note that deleting the app does not cancel your subscriptions.

Terms of Use: https://www.recime.app/terms-and-conditions

Privacy Policy: https://www.recime.app/privacy-policy

Have an idea to make your cooking experience with ReciMe better? Please email us at hello@recime.app so we can help!",2022-04-26T07:00:00Z,2025-11-18T09:27:47Z
mu,Mauritius,Food & Drink,6023,18,6469589169,Maribon,Gordon Campbell,https://apps.apple.com/mu/app/maribon/id6469589169?uo=4,0.0,4.47368,19,Food & Drink,"Made by foodies for foodies in Mauritius.

Maribon is the ultimate mobile application for foodies in Mauritius, offering an unparalleled dining experience. Discover top-notch restaurants, access detailed information, and enjoy groundbreaking features like food discovery and tracking, bookmarking, social interactions, and much more. Download Maribon now and elevate your food journey!

About:
Welcome to Maribon, the must-have mobile application for food enthusiasts in Mauritius! With Maribon, you can explore the vibrant culinary scene of the island like never before. Whether you're a local or a tourist, Maribon is designed to provide you with the ultimate dining experience, empowering you to discover, connect, and indulge in the finest restaurants and hidden gems across Mauritius.

Groundbreaking Features:
Maribon goes beyond being a mere restaurant discovery app. It introduces groundbreaking features that revolutionize your dining experience. Track your food's journey by liking and posting pictures at every meal. Bookmark your favorite restaurants for quick access and personalized recommendations. Connect with friends and fellow foodies, follow their dining adventures, and share your experiences through vibrant social features.

Discover and Explore:
Maribon offers an extensive collection of restaurants, curated to cater to every palate. From cozy cafes to elegant fine dining establishments, Maribon showcases a diverse range of culinary experiences. With our intuitive search and filter options, finding the perfect restaurant is a breeze. Explore by cuisine type, location, opening times, and more. Unleash your inner foodie and embark on a gastronomic adventure with Maribon!

Restaurant Details and Reviews:
Make informed decisions with detailed restaurant pages on Maribon. Get access to essential information such as menus, opening hours, contact details, and customer reviews. Maribon's user-friendly interface ensures you have all the information at your fingertips, helping you choose the ideal dining spot for any occasion. Read authentic reviews from fellow food lovers and contribute your own opinions to help others make the best choices.

Exclusive Promotions and Offers:
Unlock a world of exclusive promotions and offers with Maribon. Benefit from special discounts, loyalty rewards, and limited-time promos at participating restaurants. Maribon keeps you informed about the latest promotions, ensuring you never miss out on an opportunity to savor delectable meals while saving money or getting extra perks.

Download Maribon now and embark on a food journey you won't forget. Discover the best restaurants in Mauritius, access detailed information, enjoy groundbreaking features like food tracking and social interactions, book tables, order food online, and take advantage of exclusive promotions. Elevate your inner foodie with Maribon today!",2023-10-19T07:00:00Z,2024-09-03T19:41:03Z
mu,Mauritius,Food & Drink,6023,19,950873490,Eat App: Restaurant Bookings,Eat App E-Promotion W.L.L,https://apps.apple.com/mu/app/eat-app-restaurant-bookings/id950873490?uo=4,0.0,4.71429,7,Food & Drink,"Discover and book at thousands of the best restaurants across the Middle East with Eat App. Great for travellers or residents looking to find the perfect dining experience, we have the widest selection of bookable restaurants across the region. Filter and sort restaurants however you need and see menus, reviews and restaurant info. All your reservations are recorded and accessible in the app, and sharable with friends.

We also list thousands of individual restaurant experiences and promotions across the region so you know exactly what's happening in your city every night of the week.

Available in United Arab Emirates, Bahrain, Oman, Qatar, Jordan and the Kingdom of Saudi Arabia, start finding your new favorite place to eat.

Discover - Search and filter and find a great restaurant across the region.

Book - Get a confirmed reservation from the restaurant anytime you want. No need to call.

Experiences - from brunch to special promos and one-off events, find somewhere new to experience tonight. 


Download Eat App for free today.",2015-01-21T22:13:54Z,2025-07-24T02:16:06Z
mu,Mauritius,Food & Drink,6023,20,451001072,"Talabat: Food, grocery & more",Talabat General Trading and Contracting Company,https://apps.apple.com/mu/app/talabat-food-grocery-more/id451001072?uo=4,0.0,4.72973,74,Food & Drink,"Hey! Looking for the quickest food delivery? That’s easy with our new talabat app.

Whether you want a pizza, burger or groceries, choose from thousands of markets and restaurants in your city and put your hunger to an end. We’ve got it all – fast delivery, unlimited options, easy online payment and vouchers all at your fingertips.

Order your favorite food and get it delivered to wherever you are, but also get your groceries delivered to you with more cities to come. Your needs, done - simply download our app, choose your food or groceries and pay in a few taps via card or cash upon delivery. 

Browse a multitude of restaurant menus and order from countless stores. With our filters and smart search functions, you can find the exact menu or product you want in no time, available to personalize at your request.

""Pay online or in cash""
Add info to your account on our new talabat app to speed up your order process. Pay in cash or save card details to pay online, reorder your favorites anytime and save addresses so you’re ready for delivery wherever you are. Like planning ahead? Pick what time you want us to deliver to avoid hunger kicking in.

""Track your order from start to finish""
That’s right; follow your delivery from the moment it’s confirmed to the second we hand it to you. With notifications, you'll always be updated and our help center will answer any questions about your delivery – we’ve got you.

""Find exclusive deals""
Downloading the talabat app makes you a part of our fam. We’re more than food delivery; discover vouchers, promotions and deals and treat yourself to that midweek pizza or Friday night burger more often. By opting in for notifications, we'll also share new restaurants, supermarkets and stores in your area, so you’ll never miss out on the latest offers again.

Find us in Kuwait, the United Arab Emirates, Bahrain, Oman, Qatar, Jordan, the Kingdom of Saudi Arabia and Egypt.

Happy ordering.",2011-08-02T10:13:08Z,2025-11-20T06:58:24Z
mu,Mauritius,Food & Drink,6023,21,1419555996,Magic Stamp,Park Technology Ltd,https://apps.apple.com/mu/app/magic-stamp/id1419555996?uo=4,0.0,0,0,Food & Drink,"The Magic Stamp app is for people who love receiving rewards but don’t have room in their wallet for multiple stamp cards from all their favourite independent businesses.

The Magic Stamp app gives you access to digital stamp cards for your favourite independent businesses and keeps them all in one place, never to be lost again. 

HOW IT WORKS
We’ve created a unique stamp card experience with no QR codes, no IDs and no faff. Just get stamped and receive your rewards instantly.

Simply present your Magic Stamp Card in participating stores to receive a stamp from the vendor on your next purchase. 

You’ll be rewarded with free goodies as well as receiving exclusive gifts and discounts from your favourite independents.

More Magic Stamp Cards coming very soon...",2018-10-13T14:34:24Z,2025-11-21T09:43:12Z
mu,Mauritius,Food & Drink,6023,22,1481818660,CibouScan - You Scan,henri gil,https://apps.apple.com/mu/app/cibouscan-you-scan/id1481818660?uo=4,0.0,4.625,16,Food & Drink,"CIBOUSCAN: Scan Your BEAUTY & FOOD Products – Health Score, Nutri-Score, NOVA and Recipes

CIBOUSCAN is the must-have app to take care of your health, your skin and the planet.
Scan your beauty products and groceries in seconds to see their full ingredients, health score, Nutri-Score, NOVA, additives, and find better alternatives that suit you.

Beauty: your bathroom under control
	•	Scan your cosmetics (skincare, body care, hair care, makeup, perfume).
	•	Get a complete health score for each product: ingredients list, controversial additives, potential impact on your health.
	•	Check the compatibility with your skin type, specific needs or allergies.
	•	Read real user reviews to choose wisely before buying.
	•	Create your personalized beauty routine and get a routine score to track and improve your habits every day.

Food: scan, decode, cook
	•	Scan your food products to see their Nutri-Score, NOVA, and any additives.
	•	Discover personalized recipes based on your food preferences, favorite or blacklisted products, allergies, diet and the season.
	•	Easily view your scan history to track your consumption over time.
	•	Get smart flexitarian recommendations designed to reduce your environmental impact while eating deliciously.

Practical, complete and privacy-friendly
	•	No account required: use all features completely anonymously.
	•	Works with and syncs automatically to the CIBOULETTE app if you already have it.
	•	One smart assistant for your beauty choices, grocery shopping, Nutri-Score and NOVA – all in one app.

Why choose CIBOUSCAN?
	•	One app to scan both BEAUTY and FOOD products.
	•	Access to health scores, Nutri-Score, NOVA, additives, skin compatibility.
	•	Real user reviews to help you compare and decide.
	•	Personalized recipes for healthy eating without frustration.
	•	A flexible and kind approach: better choices without forbidding what you love.
	•	Everything is anonymous, practical and made for you.

Download CIBOUSCAN now and join the CIBOULETTE team to shop smarter, eat better and take care of yourself and the planet.

** CibouScan is not affiliated with any other apps

Try Premium:

Upgrade to Premium for an ad-free experience. Subscriptions are billed to your Apple account and auto-renew unless turned off in App Store settings. Any unused portion of the free trial is forfeited upon purchase of a subscription.

- PREMIUM SUBSCRIPTION -

Premium gives access to all the features of the application!

The subscription will be billed in a single payment. Payment is made through iTunes account at confirmation of purchase.
The subscription will renew automatically within 24 hours before the end of the subscription. Your account will be debited 24 hours before your existing subscription ends, at the same price you paid the first time.
You can manage your subscription and auto-renewal by receiving you in your account settings after purchase.
If you pay for your subscription before the trial period expires, the remaining free trial period will be forfeited.

CGU / CGV: https://weblogit.co.uk/cgu.html
Privacy: https://weblogit.co.uk/privacy.html



We keep in touch ?
- Instagram : https://www.instagram.com/ciboulette.app/
- Site : https://ciboulette.app/
- Mail : henri@ciboulette.app - lisa@ciboulette.app",2019-10-02T07:00:00Z,2025-11-17T11:29:05Z
mu,Mauritius,Food & Drink,6023,23,719972451,DoorDash - Food Delivery,"DoorDash, Inc.",https://apps.apple.com/mu/app/doordash-food-delivery/id719972451?uo=4,0.0,4.63999,50,Food & Drink,"Order meals and snacks from your favourite local and national restaurants, or get groceries, essentials and alcohol delivered to your door.
New users get 30% off your first 3 orders. T&C apply: New users only. Expires 30 days from new user’s first DoorDash order. Valid at participating stores only. 1 redemption per user for each category; national chain, local and grocery (3 in total). Max $20 discount per order. Fees apply.
YOUR FAVOURITE RESTAURANTS
Explore a wide variety of cuisines and get your meals faster with quick and easy ordering. From your local noodle place to your daily coffee fix to your go-to comfort food, find your favourites on DoorDash. National partners include McDonald's, Pizza Hut, Hungry Jack's, Subway, Domino's, KFC, Subway, Taco Bell, Nando's, Oporto, Grill'd, Sushi Sushi, Zambrero and more.
GROCERIES AND CONVENIENCE
Order from your local Coles, IGA or 7-Eleven and have thousands of items delivered when you need them. Top up the pantry, grab last-minute ingredients, stock up on snacks to share with mates or cool down with a slurpee. Get your groceries and everyday essentials delivered with DoorDash.
SUBSCRIBE TO DASHPASS AND SAVE
With a DashPass subscription, enjoy unlimited deliveries and pay $0 delivery fees at DashPass merchants (min. spend applies), plus get access to special offers from local restaurants.
DELIVERY OR PICKUP?
Get what you need straight to your door, schedule delivery for when it's most convenient for you, or order ahead with pickup for a fast and easy takeaway.
NO-CONTACT DELIVERY
Deliveries are left at your door, unless you choose ""Hand it to me"" when ordering. For contactless deliveries, your Dasher will leave your food in a safe place and let you know it's ready.
TRACK YOUR ORDER
Real-time tracking lets you see when your order will arrive. We've factored in food prep and handling times, traffic, weather and more so you'll know exactly when to set the table.
CONVENIENT PAYMENT
Pay with Apple Pay, credit or debit card, PayPal or Afterpay.
ABOUT DOORDASH
DoorDash is a technology company that connects people with the best in their cities. Since 2013, we've been building products and services to empower local businesses and in turn, generate new ways for people to earn, work and live.",2013-10-10T19:46:20Z,2025-11-24T06:09:06Z
mu,Mauritius,Food & Drink,6023,24,1595938390,Zest: Meal Planner & Helper,"Culi, Inc.",https://apps.apple.com/mu/app/zest-meal-planner-helper/id1595938390?uo=4,0.0,0,0,Food & Drink,"Tired of cooking the same 3 meals on repeat? Zest integrates a mind-blowing cooking education into your routine. Learn to cook with us through step-by-step explanations of foundational cooking concepts in fewer than 10 minutes and dishes that bring the concept to life. Our recipes are created by two former Michelin star chefs, distilled by a home chef, and cooked by you, the superstar home cook that you are (or will be). We don't assume any prior culinary knowledge. We meet you where you are and help you improve.
 
Stop copying traditional recipes - start learning from Zest. We've cooked those delicious Bon Appetit dinners. But when we took away the recipes we felt like lost puppies. Zest is designed to teach you the how's and why's of cooking. So when the recipe is gone you can confidently navigate the kitchen. The promise: Taste improvement after one dinner with Zest.

FEATURES:

STEP-BY-STEP INSTRUCTIONS
We've all tried cooking a TikTok recipe. You rewatch the video 13 times to figure out what the hell is going on. Zest embeds videos throughout recipes so you can click into content when you need it. No more pausing and restarting. Learn at your own pace.
 
CONCEPT VIDEOS
Watch a short video on a new concept at your own pace and then cook recipes that reinforce what you've learned. We dive into topics like the science of tasting and the basics of seasoning, sautéing, roasting and more!

SKILL VIDEOS
Don't know how to dice an onion? Don't be embarrassed, we got you covered. Skill videos are linked in each recipe to guide you along, so you don't have to watch Gordon Ramsey on YouTube (we love his accent too).

CURATED MENU
Choose a menu to fit your preferences. Tired of wasting produce? Search for dishes including what’s already in your fridge. Got allergies? Compile safe recipes in your menu to find them when you’re ready to get cooking. 

GROCERY LIST
Shop your menu with our automated grocery list. Plus, utilize our helpful tips while you shop. Don't know what a neutral oil is? We got you covered.

PERSONALIZED RECOMMENDATIONS
Rate the recipes you cook, so we can recommend similar ones.

Feedback? Technical Issues? Killer ideas you want to contribute to make our app better? Email us at support@zestapp.co. We're always here to help and would love to chef up new ideas together!

End User Licensing Agreement: https://www.apple.com/legal/internet-services/itunes/dev/stdeula/",2021-12-24T08:00:00Z,2025-11-19T15:34:09Z
mu,Mauritius,Food & Drink,6023,25,1662451643,Keeta - Food Delivery,Kangaroo Limited,https://apps.apple.com/mu/app/keeta-food-delivery/id1662451643?uo=4,0.0,0,0,Food & Drink,"Keeta – The World’s Leading Food Delivery Service
Craving pizza, fried chicken, sushi, or something new? We’ve got you covered! Whether you’re in the mood for indulgent treats or healthy choices like fresh salads and light meals, Keeta delivers your favourites straight to your door. 

Why Choose Keeta?
1.Easy to Use – Order in seconds!
2.Daily Deals – Free delivery and discounts on every order!
3.Global Cuisines – Explore various tasty options.
4.On-time Promise – Your food arrives fresh and fast. 

How It Works:
1.Download Keeta and pick a restaurant.
2.Select your dishes and checkout.
3.Sit back and enjoy!",2025-10-01T07:00:00Z,2025-11-21T08:51:35Z
