country,country_name,category,genre_id,rank,app_id,app_name,developer,url,price,averageUserRating,userRatingCount,primaryGenreName,description,launch_date,update_date
mu,Mauritius,Food & Drink,6023,1,6477953435,KFC Mauritius,Tictuk Technologies ltd,https://apps.apple.com/mu/app/kfc-mauritius/id6477953435?uo=4,0.0,4.55814,473,Food & Drink,"Ordering KFC has never been easier:
1. Choose your order mode for delivery or pickup.
2. Share your location to find a KFC near you.
3. Order online exclusive deals and more.
4. Pay cash or card.
Download the KFC Mauritius app now and don't forget to rate us!",2025-04-01T07:00:00Z,2025-07-03T10:39:50Z
mu,Mauritius,Food & Drink,6023,2,1217507712,McDonald's,McDonald's Global Markets LLC,https://apps.apple.com/mu/app/mcdonalds/id1217507712?uo=4,0.0,2.76471,17,Food & Drink,"Welcome to the new official McDonald’s app.

The app is filled with great offers specially tailored to you. Deals and discounts appear regularly so check back often to see what’s new.

The news section keeps you up to date with everything that’s going on in McDonald’s near you. Look here for new games and competitions.

The nutrition section provides information on our entire menu. We provide allergy advice and nutritional information on everything from the Big Mac to a single dip!

Use our restaurant finder to find your nearest McDonald’s. Filter your search based on opening hours, facilities and get directions from wherever you are.",2021-10-24T07:00:00Z,2025-11-21T13:12:09Z
mu,Mauritius,Food & Drink,6023,3,1484555557,Delivery Dodo,Alexander Schatz,https://apps.apple.com/mu/app/delivery-dodo/id1484555557?uo=4,0.0,3.18182,22,Food & Drink,"Delivery Dodo is a restaurant food delivery company that serves as an intermediary between customers and restaurants. Using our app or website, customers place and pay for an order, which is then conveyed to the participating restaurant. When the food is prepared, a Delivery Dodo courier will collect the food and deliver it to the customer in the comfort of their own home, office or wherever else they have chosen.",2019-11-14T08:00:00Z,2025-10-01T18:59:05Z
mu,Mauritius,Food & Drink,6023,4,1609304973,Domino's Pizza Mauritius,"Domino's Pizza, Inc.",https://apps.apple.com/mu/app/dominos-pizza-mauritius/id1609304973?uo=4,0.0,4.50171,293,Food & Drink,"Buy Domino’s Pizza online for those fun-filled times that demand something light and awesomely delicious, tease your taste buds with the vivid flavours of cheese-filled, crispy hand tossed crust. With fresh toppings, just ready to be ordered with a swipe. Our Domino’s pizza delivery app has the perfect recipe to build the mood right for any occasion – be it a get together, party, or simply spending time with friends or family.

Domino’s pizza delivery app comes with a quick selection menu, a smartly designed app-interface that lets you order food online of your choice with exclusive deals every day! 
With secure and easy to use payment gateway feasting on your favourite pizza is easy. Save on food order online by using our periodic coupons and find an excuse to order your favourite pizza with attractive offers everyday.

Features
Domino’s Pizza app brings fun in ordering pizza right on your phone & tablet. 
What makes us unique –
* Enhanced User Experience with Quick Swipe
* Find your nearest Domino’s on App
* Quick Buy from Easy Menus
* Improved Order Customisation
* Secure online payment with multiple payment options
* Real-time tracking of orders

Installation/Use of Domino’s Pizza delivery app

Domino’s pizza app requires access to system resources for smooth functioning. This food delivery app requests contact details and location data. Kindly allow the same while installing. 

How to Order?

Domino’s pizza app lets you order pizza online in few steps. 
On opening the app, you will be presented with our latest deals. You can either click on any offers you like or if you are choosy about your pizzas, or wish to browse through the different options, you may browse through the entire menu of assorted offerings. 
After choosing, you may add the selected pizza to the cart, customise it with selective toppings. To complement your order, you may add a bottle of your favourite beverage or dessert and finally go for checkout. 

We accept payment through our app, cash, credit cards and debit cards.

From where will I get the order?

Domino’s app will let you find and choose the nearest Domino’s pizza restaurants in your locality.

Our app will request access to several mobile features, kindly allow access for pizza ordering without any hassles. For any queries related to placing an order, compatibility with device, and other app operations, please visit our website www.dominos.mu or write to us at customercare@dominos.mu",2022-05-03T07:00:00Z,2022-05-04T00:34:37Z
mu,Mauritius,Food & Drink,6023,5,6648770244,Delivoo customer,Mascon Computer Services Private Limited,https://apps.apple.com/mu/app/delivoo-customer/id6648770244?uo=4,0.0,5,3,Food & Drink,Best Food and beverages delivery services in mauritius,2024-11-05T08:00:00Z,2025-08-12T10:04:47Z
mu,Mauritius,Food & Drink,6023,6,1500857296,Nando's Mauritius,CHICKENLAND PTY LTD,https://apps.apple.com/mu/app/nandos-mauritius/id1500857296?uo=4,0.0,4.75072,690,Food & Drink,"We like our app the way we like our chicken: Fired up and all things PERi-PERi. Order your  favourite Nando’s meals for delivery or collection. Not sure what to get? Tap ‘Surprise Me’ and treat your tastebuds to something different.

P.S. Opt-in for notifications to take advantage of free delivery, exclusive specials and fiery content.",2020-04-01T07:00:00Z,2024-12-09T10:01:47Z
mu,Mauritius,Food & Drink,6023,7,1489471146,hungrydodo,Nordic Venture Lab Ltd,https://apps.apple.com/mu/app/hungrydodo/id1489471146?uo=4,0.0,3.11538,26,Food & Drink,"Order food delivery online from a selection of restaurants in Mauritius with the hungrydodo app.
With the hungrydodo app, you can search for restaurants nearby by address, filter restaurants by cuisine type, select & browse the menu of the chosen restaurant, order food for delivery with just a few taps.

Features:
- View restaurants in Mauritius
- Full menu access
- View past orders
- View restaurant location and opening times
- Access saved delivery addresses
- Order for delivery / collection
- Order for now, or choose a delivery time that suits you",2020-01-03T08:00:00Z,2023-03-28T15:17:56Z
mu,Mauritius,Food & Drink,6023,8,960335206,Blinkit: Grocery in 10 minutes,BLINK COMMERCE PRIVATE LIMITED,https://apps.apple.com/mu/app/blinkit-grocery-in-10-minutes/id960335206?uo=4,0.0,4.7037,162,Food & Drink,"Blinkit is India’s last minute app. Trusted by millions, it is your everyday online grocery shopping app that home-delivers 10,000+ daily groceries in just a blink. Buy milk products, fresh fruits & vegetables, daily grocery, kitchen, home & office items by shopping for them online on Blinkit. Enjoy easy and smooth app experience with quick delivery.

- Best price and quality fresh fruits & vegetables
- Milk, curd, bread, butter, eggs, cheese, paneer & other daily grocery
- Snacks, biscuits, chips, ice cream, chocolates
- Cold drinks, ice, bottle opener
- Atta, rice, dal, oil, masalas, noodles
- Personal care, detergent, cleaning supplies
- Diapers & baby care
- Pet food
- Bulbs, batteries, mobile chargers
- Emergency medicines, thermometer
- Kitchen tools like chopper, blender, grinder
- Puja needs
- Stationery
- Smart watches, LED lights, Headphones



Beauty & skincare store
Makeup, luxury beauty brands & everyday skincare – now on Blinkit! Shop a huge range of authentic makeup, bath & body, hair care products, beauty accessories & much more!

Electronics store
Wireless or bluetooth earphones? Check. Smart watches? Yes. LED lights? Absolutely! Shop affordable and latest electronics online at best prices, only on Blinkit.

Safe and quick grocery delivery app
The average driving speed for Blinkit (formerly Grofers) delivery agents is 20kmph, since we have a grocery delivery store located every 2 km to instantly serve you.

Many safe payment options
Do your grocery shopping online on Blinkit & pay safely and securely for your groceries with UPI, COD or cards / wallets / netbanking / buy now pay later. We accept Sodexo meal pass and Paytm food wallet too.

Authentic phone accessories
We don’t want you to wait for the most premium and authentic phone accessories out there – which is why you can get them in minutes on Blinkit.

Printouts delivered in minutes
With Blinkit, you can get a printout of anything delivered in just minutes. With convenient options of both black & white and coloured prints, get all your documents sorted instantly!

Low prices, amazing offers
Blinkit (formerly Grofers) offers you big discounts and savings on daily grocery, bundles and bank offers. We give the best prices on online groceries with our monthly House Full Sale!

Live order tracking & helpful customer support
Track your grocery order online, right from your payment being confirmed to the delivery of your groceries. In case you need help, simply tap & chat with our customer support executives who are always ready to assist you.

Delivering groceries in 20+ cities
Instantly do your grocery shopping online! Get delivery of milk, vegetables, bread, snacks & more on the Blinkit app in Ahmedabad, Bengaluru, Chandigarh, Chennai, Delhi, Faridabad, Gurgaon, Hyderabad, Jaipur, Jalandhar, Kanpur, Kolkata, Lucknow, Ludhiana, Meerut, Mohali, Mumbai, Panchkula, Pune, Noida, Ghaziabad, Vadodara & Zirakpur.

Huge variety of local & international brands
Blinkit (formerly Grofers) grocery delivery app has a huge variety of shopping brands available online, including local specialities. In fact, Blinkit has brands you won’t find anywhere else. You can get delivery of daily grocery, festival special products, and even gourmet and international foods! Get the latest products from leading brands like boAt, The Wishing Chair, Ekam, MasterChow, The Body Shop, Farmley, Engage, The Whole Truth, The Moms Co, SuperBottoms, Tropicana, Nestle, Coca Cola, Lay’s, Harvest, Ferrero, Toblerone, Oreo, Nutella, Starbucks, Clinique, Kama Ayurveda, L'Occitane, Innisfree, Davidoff, Rage Coffee, Lindt, Starbucks, Blue Tokai, Sleepy Owl, Wingreens Farms, Bagrry's, Gunsberg, Jade Forest, Jimmy's Cocktails, Eveready, Nivea, Garnier, Lakmé, Haldiram's, Bikano, Heinz, Vahdam, Dettol, Cadbury, ITC, Colgate Palmolive, PepsiCo, Durex, Licious, Aashirvaad, Saffola, Patanjali, Fortune, 24 Mantra, TGL Co., Nestle, Amul, Dabur, & many more.",2015-03-04T05:39:34Z,2025-11-18T11:03:18Z
mu,Mauritius,Food & Drink,6023,9,1622529192,Pizza Inn Mauritius,SIMBISA INTERNATIONAL FRANCHISING LIMITED,https://apps.apple.com/mu/app/pizza-inn-mauritius/id1622529192?uo=4,0.0,3.25,16,Food & Drink,"Download the app from the App Store, choose your location and we'll present you with personalised location-based Pizza Inn restaurant offerings.
 
We offer the ability to order food for delivery from Pizza Inn. 

Enjoy ordering your favourite pizza with the convenience of delivery.",2022-06-01T07:00:00Z,2025-11-24T07:50:44Z
mu,Mauritius,Food & Drink,6023,10,6740312537,SIMPLY GOOD FOOD,SIMPLY GOOD FOOD LTD,https://apps.apple.com/mu/app/simply-good-food/id6740312537?uo=4,0.0,1,1,Food & Drink,"Simply Good Food - Your Trusted Food Delivery Partner

Discover the easiest way to enjoy delicious meals from your favorite restaurants in Mauritius with the Simply Good Food app!
With our user-friendly interface and efficient service, Simply Good Food brings convenience to your doorstep. Whether you're craving local delicacies, fast food, or gourmet cuisine, we’ve got you covered.

Features You'll Love:
Wide Selection: Browse menus from top restaurants across Mauritius.
Real-Time Tracking: Stay updated with live order tracking.
Secure Payment: Pay with confidence using multiple payment options.
Seamless Experience: Quick and hassle-free ordering with a few taps.
From daily meals to special occasions, Simply Good Food ensures your cravings are satisfied. Download now and experience the joy of hassle-free food delivery!
Eat Simply. Enjoy Good Food.",2025-04-29T07:00:00Z,2025-10-06T12:47:38Z
mu,Mauritius,Food & Drink,6023,11,1058959277,Uber Eats: Food & Groceries,"Uber Technologies, Inc.",https://apps.apple.com/mu/app/uber-eats-food-groceries/id1058959277?uo=4,0.0,4.7062,531,Food & Drink,"Get food delivery to your doorstep from thousands of amazing local and national restaurants. Find the meal you crave and order food from restaurants easily with the Uber Eats app. Track your order in real-time.

FIND YOUR FAVOURITE FOOD & RESTAURANTS
Order food from nearby restaurants and search by cuisine, restaurant name, dish, and meal. 
Food delivery options for you to order and enjoy such as pizza, burritos, burgers, sushi, fish and chips, doughnuts and Chinese takeout.
Prefer pickup? Skip the line and reservations and choose to pick up your order instead. Choose your favourite delivery options with the Uber Eats app now.

SUBSCRIBE TO UBER ONE
For £5.99 per month, Uber One subscribers enjoy £0 delivery fee and up to 5% off orders over £15 at participating non-grocery stores (and 5% off orders over £25 at participating grocery stores) available on Uber Eats. Members are also eligible for rewards, perks, coupons, and offers. View full Uber One Terms & Conditions in app.

ORDER ALMOST ANYTHING, ANYTIME
Order household needs from your favourite pharmacies, supermarkets, and pet shops. Baby food or nappies, pharmacy needs, beauty products and cosmetics. Grocery staples like bread and milk, bananas and produce, flowers and plants, packaged foods or frozen treats. 

You can even order alcoholic drinks including beer, wine, spirits and cocktails.*

SIMPLE DELIVERY ORDERING
Pick your food order from any menu and add it to your cart with a few taps. That’s it.
Uber Eats makes it easy to order food delivery online or through the app and have it delivered by restaurants and delivery people near you.
Or, schedule your order in advance for a delivery person to pick it up later. Your choice!

ORDER FOOD AHEAD WITH PICKUP
Now you can also order food ahead for Pickup instead of just ordering delivery. Select Pickup, add food items to your cart, and skip the lines to the restaurant to get your food.

REAL-TIME ORDER TRACKING
Track your food delivery order on a map as it heads your way.
See the estimated arrival time at your address.
Get notified when your order arrives.

FIND SOME OF YOUR FAVOURITE NATIONAL RESTAURANTS
Some of our food delivery partners include: Pizza Hut, Domino’s Pizza, Burger King, Dunkin', KFC, McDonald's, Starbucks, Subway, Taco Bell,Costa Coffee, Kaspas, Gourmet Burger Kitchen, Franco Manca, Dixy Chicken, Chipotle, Chaiiwala, Amigos Burgers Shakes, Papa John’s, Krispy Kreme.  

FIND PHARMACIES, GROCERY STORES, AND MORE
Order from grocery stores such as Asda, Sainsbury Supermarket, Waitrose, The Co-op, Iceland, M&S Food, and Londis. You can also order from pharmacies such as Boots via Uber Eats, as well as from other delivery partners in the convenience and retail spaces.

ABOUT UBER EATS
Uber Eats is the way to order the food you love through an easy delivery experience. Uber Eats is available in hundreds of cities around the world. Enter your delivery address to explore restaurant and grocery delivery options near you.

AVAILABLE INTERNATIONALLY

Join others in your city who use the Uber Eats app to order from their favourite restaurants and schedule delivery.

Uber Eats is currently available in cities and metro areas including Adelaide, Amsterdam, Atlanta, Auckland, Austin, Baltimore, Brussels, Cape Town, Chicago, Dallas, Denver, Johannesburg, Glasgow, London, Los Angeles, Madrid, Melbourne, Mexico City, Miami, Milan, Nashville, New Orleans, New York, Ottawa, Paris, Philadelphia, San Diego, San Francisco, Seattle, Stockholm, Sydney, Taipei, Tokyo, Toronto, Warsaw, and Washington DC. Uber Eats helps you find food delivery around the world. Order delivery in countries around the world. See full list of available countries on our website. Uber content/messages human- or machine-translated as per device settings; accuracy not guaranteed

*Alcohol is only available in select markets. Must be at least 18 to purchase. Item availability varies by market. See the Uber Eats app for details.",2016-06-06T21:35:56Z,2025-11-17T16:26:42Z
mu,Mauritius,Food & Drink,6023,12,434613896,Zomato: Food Delivery & Dining,Zomato Media Pvt. Ltd.,https://apps.apple.com/mu/app/zomato-food-delivery-dining/id434613896?uo=4,0.0,4.76271,472,Food & Drink,"Whether you’re chasing dreams, running meetings, or taking a break — Zomato is built for the ones who don’t slow down. Craving biryani between brainstorms? A cheesy burger after a long day? Or just a salad and chai to keep things steady? With lightning-fast delivery from over 3 lakh restaurants, your fuel is never far. Order in seconds, track every bite, and keep going. Hustle harder – we’ve got the food.

▪ Search and Discover Top Restaurants and Dishes
From butter chicken to sushi, dal makhani to dimsums – and legends like Domino’s, Pizza Hut, McDonald’s, Starbucks, and more – Zomato puts your cravings on speed dial. Just decisions, made easy.

▪ Access Restaurant Details
 Menus, ratings, reviews, photos – everything you need to decide fast and eat faster. Rate your meal to guide the next hungry hustler.

▪ Try Veg Mode
Veg Mode curates top vegetarian dishes, veg-only restaurants, and even veg-only delivery fleets. Clean eating with no compromise.

▪ Schedule Your Orders
 Time is currency. Lock in your lunch or dinner before the hunger hits. The scheduling feature lets you plan ahead and stay on track.

▪ Food on Train
 Even when you’re on the move, Zomato keeps up. Enter your PNR, pick your dish, and get your meal delivered to your seat at 130+ stations. No chaos, no compromises –  just food (and your schedule) right on track.",2011-05-24T18:02:45Z,2025-11-20T17:26:18Z
mu,Mauritius,Food & Drink,6023,13,1001501844,Deliveroo: Food & Shopping,ROOFOODS LTD,https://apps.apple.com/mu/app/deliveroo-food-shopping/id1001501844?uo=4,0.0,4.7302,341,Food & Drink,"Hungry? Get your favourite meals, takeaways and groceries delivered to your door in minutes with Deliveroo. From local gems to big-name brands, discover thousands of restaurants and supermarkets near you.

ALL YOUR FAVOURITES, DELIVERED:

- Restaurants: Big brands and local gems
- Grocery: Always fresh with our Freshness Promise
- Convenience: Beauty essentials, flowers, gifts, DIY and more in minutes

Order from the restaurants you’re craving...

- Sushi or pizza?
- A Chinese or Indian?
- Burgers, pasta, breakfast or something sweet?

All of your favourites are just a tap away from top brands like KFC, McDonald’s, Burger King, Subway, Nando’s, Wagamama, Popeyes, Papa John’s, Wingstop, Giggling Squid, Kokoro, Pizza Express, Five Guys, Franco Manca, Dishoom, Pho, Taco Bell, Starbucks, Gail's Bakery, Joe & the Juice, GBK and more!

Or Fancy something different? Discover thousands of local gems that deliver right to your door.

£0 DELIVERY FEE WITH DELIVEROO PLUS

Become a member and you’ll also unlock:

- Exclusive offers and member-only deals
- Monthly rewards that help your money go further
- Discounted service fees*
- Earn 10% back on restaurant orders over £30*

*Plus Gold members only

It’s the simplest way to save while enjoying what you love most.

SUPERMARKETS SORTED

Get groceries delivered fast from top supermarkets, including Waitrose, ASDA, Morrisons, M&S, Sainsbury’s, Co-Op, Amazon Fresh, Whole Foods, Spar, One Stop, Iceland and Majestic Wine.

MORE THAN FOOD

We’re here for the everyday essentials and little treats too. From Boots and Healf to Not On The High Street, B&Q, Screwfix, Accessorize and The Perfume Shop, we've got you covered.

WHY CHOOSE DELIVEROO?

- Track every order live from kitchen to doorstep
- Enjoy fast, reliable delivery when it matters
- Order for right now or schedule for later
- Pick up deals you won’t find anywhere else

Download the app today and let us bring the best of your neighbourhood straight to your door.

T&Cs apply. Visit the website for full details.",2016-08-03T05:54:44Z,2025-11-21T19:56:46Z
mu,Mauritius,Food & Drink,6023,14,1560974358,& burgers,Tea and Spice Ltd,https://apps.apple.com/mu/app/burgers/id1560974358?uo=4,0.0,5,4,Food & Drink,"Our burgers & wraps are cooked à la minute, instead of keeping you waiting, we have developed this app so you can order your favourite burgers easily.
Use this app to personalize your burgers with dozens of add-ons and just pick-up your order when you want, or even better: get it delivered.

Features:
- Online food ordering optimized for your mobile device.
- The checkout details are pre-filled, so you can order with just a few clicks.
- Save multiple addresses and pick the preferred one at checkout.
- Real time confirmation of the order - meaning that our team confirms your order right away, with the estimated ready-time.

No confusing calls or busy lines. Just order your burgers when you feel like it!",2021-04-06T07:00:00Z,2021-04-06T19:01:47Z
mu,Mauritius,Food & Drink,6023,15,6746683929,OnlyEat: Food Delivery,NOVA TECH LTD,https://apps.apple.com/mu/app/onlyeat-food-delivery/id6746683929?uo=4,0.0,4.66667,12,Food & Drink,"Hungry in Tamarin or Rivière Noire? If you're in the West of Mauritius and craving something tasty, OnlyEat is made for you. We connect you with the best local restaurants so you can enjoy your favorite dishes without moving an inch. 




OnlyEat delivers your favorite meals from local restaurants — fast, fresh, and with real-time tracking. Forget the wait and the stress. OnlyEat was built to make food delivery simple, quick, and transparent. We partner with trusted local restaurants to ensure your meals are freshly prepared and arrive just like they left the kitchen — hot and ready.





No more guessing where your food is. With OnlyEat, you get full visibility from kitchen to doorstep. Every order placed through OnlyEat comes with real-time tracking. You’ll see exactly when your meal is being prepared, when your delivery is on the move, and when it’s arriving — so you stay in control and never left wondering. 





Currently available in Tamarin & Rivière Noire (Mauritius) We’re starting strong in the West. OnlyEat is now live in Tamarin and Rivière Noire, two of the most vibrant food hubs on the island. More areas coming soon — stay tuned.





Why choose OnlyEat?
Real-time tracking
Get updates at every step of the journey. Know when your meal is leaving the restaurant, when your driver picks it up, and how close they are to your location.
Verified delivery partners
A trusted driver accepts your order, and you instantly see their name, photo, rating, and reviews. All our drivers are verified, trained, and approved — reliable people from your community.
Local restaurants
We support the neighborhood businesses you know and love. Discover new favorites and keep your go-to dishes just a tap away.
Fresh & hot
No pre-packed meals. Every dish is cooked fresh to order and delivered immediately, ensuring you get the quality you expect.
Pickup or delivery
Whether you want to pick it up on the go or enjoy a home delivery, you decide what suits your day best.
Easy to use
The app is clean, modern, and intuitive. It takes just a few taps to browse, order, and track — even on your busiest days.




Delivery options
• Home delivery – Get your food delivered to your door without delay
• Takeaway – Pick up your order directly from the restaurant at the time that suits you
• order ahead– Plan your meals in advance for convenience
• Track your order – Follow every step of the journey live in the app



Where we deliver
• Tamarin
• Rivière Noire
• (Flic en Flac and surrounding areas coming soon)
We’re gradually expanding across the West Coast of Mauritius to offer more people a seamless food ordering experience.



Built in Mauritius, for Mauritius OnlyEat is proudly developed by a local team, fully dedicated to improving how we eat and deliver on the island. Our goal: build a reliable, modern, and enjoyable delivery experience reflecting the Mauritian lifestyle. We live here, we eat here, and we deliver here — just like you.




Your trust matters

• We ensure secure and protected payments
• Our delivery system is built on reliability and punctuality
• Our support team is responsive and helpful
• Real-time tracking keeps you in control
• We believe in full price transparency — no hidden costs




What’s on the menu? Whether you’re in the mood for a juicy burger, fresh sushi, comforting Indian curry, crispy pizza, healthy vegetarian options or sweet desserts — OnlyEat has it all. From classics to specialties, explore your local food scene in one app.


Enjoy a seamless service, an intuitive interface, and hot meals delivered right to your chosen location. Track your order in real time and order with peace of mind. 

Download OnlyEat and discover a new way to order food in Mauritius.",2025-06-16T07:00:00Z,2025-11-15T19:45:28Z
