country,country_name,category,genre_id,rank,app_id,app_name,developer,url,price,averageUserRating,userRatingCount,primaryGenreName,description,launch_date,update_date
sb,Solomon Islands,Finance,6015,11,1510862201,Xero Verify,Xero Ltd,https://apps.apple.com/sb/app/xero-verify/id1510862201?uo=4,0.0,0,0,Finance,"This is the official authentication app developed by Xero Ltd. It's free to use, and Xero will never charge you for it.

At Xero, protecting your data is fundamental to everything we do. Just one easily guessed password can stop your business in its tracks. So Xero has put an extra deadbolt on the door to help keep your data secure.


This is why Xero uses MFA to secure logins. It significantly reduces the risk of someone gaining access to your account, even if they've managed to obtain your email and password through a phishing attack or malware.


The Xero Verify app is simple to use. You can receive push notifications for fast authentication, instead of having to open the app and enter a code into Xero when you login. Simply accept the notification on your device's home screen - it's that easy.


Features:

* Sign into your Xero account using push notifications on your device (if enabled).

* Generate six digit verification codes, even if you don't have a network or mobile connection.

* Use Xero Verify to authenticate your Xero account (it can't be used on other products outside Xero)

* Easy set up using QR code


Permission notice:

Camera: Needed to add accounts using QR codes

Push notifications: Accept to receive push notifications


Follow Xero on Twitter: https://twitter.com/xero/

Join the Xero Facebook Fan page: https://www.facebook.com/Xero.Accounting

Privacy policy: https://www.xero.com/about/legal/privacy/

Terms of use: https://www.xero.com/about/legal/terms/",2021-03-01T08:00:00Z,2025-08-29T02:24:59Z
sb,Solomon Islands,Finance,6015,12,1032467659,Wallet: Budget & Money Manager,BudgetBakers s.r.o.,https://apps.apple.com/sb/app/wallet-budget-money-manager/id1032467659?uo=4,0.0,5,1,Finance,"Wallet is a market-leading personal finance manager, built to help you save money, plan for the future, and see all your finances in one place. See where your money goes by tracking expenses automatically with bank synchronization across all your accounts, currencies and investments. Dive into reports on your spending, manage debt, and track bills. Share specific features with loved ones to get on top of your budgets together.

Wallet allows you to see your finances your way: anywhere, any time.

Why People Love Wallet by BudgetBakers
“Helped me a lot with saving money. It's easy to use and user-friendly.” - Yasin Geddi
“Super!! Super Good app! Is stylish and easy to use! Definitely recommended for those who want to keep track of his expenses!” - Cedric Chevalier
“Superb for student expense, business and travelling or anything actually” - Jakob Baumgartner

Who Should Use Wallet
Tracking your spending just got a whole lot easier.  Toss your notebooks and spreadsheets, and budget for clear, tangible goals that are easy to track in real time. Wallet by BudgetBakers is not just an expense tracker or a budgeting app. It’s all about getting things under control now, so that you can make wise decisions and plan for the future - a month, a year, or 10 years down the line.

Wallet is designed to help you get your finances under control from day one, giving you ongoing insight into your financial situation, and helping you stay in control for the long term.

Premium Features:
Automatic Bank Updates - Transactions are automatically and securely synced with your bank and smartly categorized. With 4,000 participating banks worldwide, you’ll save loads of time not having to track every penny.
Unlimited accounts - Create as many accounts as you like. Add your bank accounts, vouchers, club cards, money in your pocket and track your expenses based on each account.
Insightful reports - Easy-to-understand graphs and financial overviews give you actionable insights about the state of your finances, across bank accounts, credit and debit cards, debts, and cash.
Stock Tracking -  track your stock portfolio right in the app! Monitor the value of your stocks and  combine your holdings with other accounts and assets for an overview of your net worth.  Grow your wealth by building a diversified portfolio of stocks, ETFs and other funds.
Flexible Budgeting - set one-time or recurring budgets, combining any category you want, and monitor your results on a daily basis.


LIST OF OTHER FEATURES:
● Beautiful, clean & elegant design
● Detailed charts and reports
● Cloud synchronisation across all your devices and web interface
● Multiple currencies support
● Advanced record tracking
● Easy filtering and creating categories and templates
● Personalised category icons
● Full range of payment types
● Creating your own income/expense subcategories
Visit our Terms of Service and Privacy policy at: https://budgetbakers.com/terms/

HOW TO START USING WALLET
1. Download the app
2. Sign In Via Facebook or Email
3. Get going: budget and track expenses like a master!
Wallet is certified with eTrust",2015-10-04T18:31:16Z,2025-11-13T10:18:11Z
sb,Solomon Islands,Finance,6015,13,1471844924,Nagad,Bangladesh Post Office,https://apps.apple.com/sb/app/nagad/id1471844924?uo=4,0.0,0,0,Finance,"Nagad app facilitates your daily financial transaction needs like cash in, cash out, send money (P2P), mobile recharge etc. 

You will get notifications on your latest Nagad activity; see your transaction history, transaction summary etc. Nagad is soon to bring very exciting and innovative services in the market to meet customer needs and demands.

•	Languages: Support both Bangla and English
•	Secured Financial Service app: Nagad app is a very secured app. Nagad App requires your PIN number in two phases. First for login and second for every transaction you need to provide PIN number. 
•	Personalization: You can add your display name and can change your display picture.
•	No “send money” to wrong number: You can easily select the desired recipient from your contact list for fast and error-free money transfer. 
•	Scan QR Code for Cash out: Scan QR codes at Uddokta points for Cash Out
•	Mobile Recharge: Recharge mobile or pay postpaid mobile bills for the mobile network operators below:
o	Robi 
o	Airtel 
o	Teletalk 
o	Banglalink
o	Grameenphone 

For convenience, you can select frequently recharge amount from the screen. 
•	Statement: Exert greater control over your digital financial service account by accessing your detailed transaction history, and a monthly transaction summary.
•	One tap balance check: checking your balance is very easy through a single tap on the screen 
•	Notification: Receive notifications for your latest Nagad transactions.",2019-07-12T07:00:00Z,2025-09-22T18:06:42Z
sb,Solomon Islands,Finance,6015,14,1637067963,GoTyme Bank,GOTYME BANK CORPORATION,https://apps.apple.com/sb/app/gotyme-bank/id1637067963?uo=4,0.0,0,0,Finance,"There’s nothing more beautiful than a team you can bank on.
For #BankingMadeBeautiful, you can bank on us.
  
Switch to the fastest-growing bank in the Philippines. All you need is a Philippine mobile number, home address, and valid ID. Open an account in less than 5 minutes to enjoy simple, sustainable, and secure savings, shopping rewards, and the lowest bank transfer fee.

Bank on rewards points any way you pay.
Earn 1 point for every P100 spent in partner stores with your FREE Visa debit card, and 1 point for every P500 spend everywhere else (in-store, online or abroad). Then use those points to buy load or data, or pay for fees in the app, or even redeem it as cash you can either spend or save.

Bank on FREE transfers.
Use your Go Rewards points to cover the P8.00 InstaPay transfer fee (8 Go Rewards points = 1 free transfer).

Bank on convenient Mobile Check Deposits.
Deposit big amounts anytime up to P499,999.99 safely and conveniently by taking a photo of your check on the GoTyme Bank app. No deposit fees. Standard check clearing times apply.
  
Bank on simplified saving.
Open up to 5 savings accounts and earn high interest (vs traditional banks) with no minimum balance, no deposit caps. No missions, no limits. Stay on track with your goals using smart saving tools and reminders.

Speak to a helpful human for account-related help.
Contact us via any of our help channels: Chat with us in the GoTyme Bank app, call #GO8888 (#46888), or email help@gotyme.com.ph.

Secure your account through the following safety tips:
1. Use your own device to open an account.
2. Only install banking apps from official app stores.
3. Update your card PIN and passcode every 3 months.
4. Never share your OTP, PIN, or passcode with anyone. GoTyme Bank will never ask you for these.
5. Lock your card immediately in case of loss or theft.
6. Follow us for updates @gotymebank on Facebook, Twitter, Instagram and TikTok.

GoTyme Bank is regulated by the Bangko Sentral ng Pilipinas. Deposits are insured by PDIC up to P1 Million per depositor.",2024-05-06T07:00:00Z,2025-11-11T01:48:33Z
sb,Solomon Islands,Finance,6015,15,1317192647,People’s Wave,Peoples Bank of Sri Lanka,https://apps.apple.com/sb/app/peoples-wave/id1317192647?uo=4,0.0,0,0,Finance,"Mobile Banking 

Keep track of your finances anytime, anywhere With People’s Mobile Banking , 
you’ve got your Bank with you where ever you go. It’s ideal for banking on your Smart phone wherever you are in the world. It’s simple and saves time.

For whom?
•For any account holder of the People’s Bank 

What do you get?

•	Check your every day account balance with one simple swipe
•	Find your nearest branch or ATM via GPS
•	View upcoming payments, transfers and schedule new Payment
•	Digital Tips - Helps you make the most of your online journey with People’s Bank.
•	Top Transfers - Displays the transfers you complete most frequently so you can quickly repeat transfers with just one click​
•	Account Summary - Check your account balances and your latest transactions, also view your Loan and Credit Card Account, CASA Account, Pawning Account, Fixed Deposit details and activity inquiries all in one place.
•	Transaction History: Check your account  history & bill payment history
•	Cheque Services
•	Credit Card Summary - View and monitor your credit card spending habits with the spend distribution corner 
•	View credit card statements, including minimum payment and due date
•	Bill Payment - Pay your utility bills, insurance and more using quick bill payment mode, future date bill payment, favorite payment mode,.
•	Fund Transfer - Transfer funds between your accounts, within  People’s Bank or to other local banks using quick fund transfer mode, favorite, future dated, branch to branch (B2B) or recurring mode

Other Features:

•	Loan Calculators
•	Pension Calculators
•	Online Registration (No need to visit the Bank)
•	SMS/E-mail notifications (global & transaction level)
•	Saves time as no paperwork is involved
•	Up to date  Exchange Rates & Interest Rates
•	Minimized banking fees
•	Reset security password online
•	Secured personal account information.
•	Subscribe to paperless banking - Get your deposit or credit card statements on the cut-off date. No need to wait for Postal or Courier delivery
•	Loan & pawning - Loan & pawning repayment facility, pawning redemption request facility",2018-03-17T21:36:26Z,2025-11-19T06:23:17Z
sb,Solomon Islands,Finance,6015,16,6451187079,Otbasy Bаnk,NATIONAL SAVING BANK OF KAZAKHSTAN JSC,https://apps.apple.com/sb/app/otbasy-b%D0%B0nk/id6451187079?uo=4,0.0,0,0,Finance,"Ждем Ваших отзывов и предложений. Вот некоторые новые и улучшенные функции:

- Регистрируйтесь в приложении, авторизуйтесь на выбор посредством логина/пароля, биометрического датчика или пасс-кода из 4 цифр;
- Получайте исчерпывающую информацию о состоянии продуктов: депозитов, кредитов, детских депозитов, текущего счета, специального счета военнослужащего;
- Просматривайте баланс и движения по счетам за произвольный период, итоговые активы и обязательства;
- Пополняйте депозиты и погашайте платежи по кредитам картами любых банков, настраивайте авто-платежи (постоянные платежные поручения);
- Открывайте текущий счет и новые депозиты;
- Бронируйте посещение отделения, находите ближайшие к Вам точки обслуживания;
- Получайте персональные уведомления, читайте новости;
- Загружайте официальные справки о состоянии счетов и задолженности;
- Выбирайте графическую тему, персонифицируйте профиль",2023-12-22T08:00:00Z,2025-10-31T02:55:52Z
sb,Solomon Islands,Finance,6015,17,1496404455,Ton,PAGAR.ME INSTITUICAO DE PAGAMENTO S.A.,https://apps.apple.com/sb/app/ton/id1496404455?uo=4,0.0,0,0,Finance,"Oi! Eu sou o Ton e te ajudo a vender, gerenciar e crescer o seu negócio



VENDER
TapTon. Aproximou, vendeu! É pro seu celular aceitar cartão sem precisar de maquininha

Maquininha. Na rua, delivery ou no balcão, com Wi-fi, bluetooth e comprovante: tenho a maquininha certa pro seu negócio

Link de pagamento. Quer vender online? Crie e mande um link no zap pros seus clientes

Ahhh e lógico que eu aceito as principais bandeiras de cartão



GERENCIAR

Calculadora de Taxas. Aqui você sabe quanto deve cobrar e quanto vai receber por cada venda

Extrato. O que saiu, o que entrou e o que vai entrar das suas vendas, você vê aqui

Minhas Vendas. Pra você que quer ver todos os detalhes das suas vendas

Transferir. RECEBA! Mande seu saldo pro seu cartão pré-pago Ton ou pra sua conta bancária e receba em até 1 dia útil

Minha Loja. Adicione seus produtos e serviços no app e tenha um catálogo pra escolher rapidinho na hora de vender



CRESCER

Meus Cartões. Peça grátis o meu cartão internacional, compre onde quiser e faça saques na rede 24 horas

Renda Extra. Ganhar até R$300,00 por indicação das minhas maquininhas? É pra crescer ainda mais

Suporte. Chamou? Te dou o suporte rápido e inteligente que você precisa pelo chat



E aí, fechou essa parceria? Quero fazer seu negócio decolar

Da Stone para todos os empreendedores autônomos",2020-02-01T08:00:00Z,2025-11-21T12:11:49Z
sb,Solomon Islands,Finance,6015,18,956740142,Policybazaar-Compare.Buy.Save.,PB Fintech Limited,https://apps.apple.com/sb/app/policybazaar-compare-buy-save/id956740142?uo=4,0.0,0,0,Finance,"TAX SAVINGS SEASON:
Still, figuring out ways to reduce your income tax for this financial year? Don’t know where to invest in order to maximize your income tax savings?

Download the Policybazaar app now to:
1. Save up to Rs. 23,400 income tax by purchasing Health Insurance for you and your parents
2. Save up to Rs. 46,800 tax investing in ULIP Plans or by purchasing a Term Insurance plan

INTRODUCTION:
Policybazaar is India’s largest insurance comparison app. You can simply compare and buy from the widest range of insurance and investment products on the Policybazaar app. To experience all the features and purchase a product on the Policybazaar app you need to be either: 

A resident Indian;
A Non-Resident Indian;
Or a Person of Indian Origin

PRODUCT OFFERING:
With just a few clicks, the Policybazaar app allows you to purchase any of the following products: 

Life Insurance / Term Life Insurance / Term Insurance
Medical Insurance / Health Insurance 
Car Insurance / Motor Insurance
Two-wheeler or motorcycle Insurance
Travel Insurance
Investment Plans - ULIP, Child, Retirement, Pension & Tax Saving Plans
Home Insurance
Loss of Job and Income Insurance

KEY FEATURES:
With the Policybazaar app, you get access to essential features like Hospital Locator and Cashless Garage Locator. The other pioneering features of the app are: 

Compare: This feature helps understand the various features of every product so that you make an informed decision before you buy it. To compare, just shortlist the products that fit your budget and click compare.
Manage: Using this you can easily Buy, Store and Share all your products online with a single click.
Shortlist: You can view all your shortlisted insurance products by clicking on this button.
Profile: The dedicated Profile button on the app gives you access to your policy purchase history, your family members & vehicle information along with information of your other assets.
Claim Assistance: Whether you want to buy a product or need help with your existing purchases, the claim assistance feature will provide you hassle-free customer experience.
Insta Renew: This feature allows you to instantly renew your existing motor insurance policy with a single click.

OUR PARTNERS:
We have partnered with most of the leading insurers for your financial freedom.

For more details, please visit our website at https://www.policybazaar.com or call our Toll-Free number 1800-208-8787. You can also drop us an email at policybazaarmobileteam@gmail.com, in case you need any assistance or have any queries regarding any of our products. We are happy to help you.

Registered Office - Plot No.119, Sector - 44, Gurgaon, Haryana - 122001",2015-01-21T02:46:01Z,2025-11-10T08:42:05Z
sb,Solomon Islands,Finance,6015,19,6444388582,GCB Mobile App,GCB Bank PLC,https://apps.apple.com/sb/app/gcb-mobile-app/id6444388582?uo=4,0.0,0,0,Finance,"""GCB Mobile App is your choicest banking app in Ghana. It offers you a complete financial solution that lets you do everything from opening an account to investing in Term Deposits, all from your smartphone or tablet without visiting any branch. With GCB Mobile App, you can:
•  Secure your profile with your fingerprint or face ID
•  Pay your ECG bills conveniently using our ground-breaking solution for prepaid meters
•  Pay for various services to over a 100 billers
•  Customize your app with dark and light mode themes
•  Receive real-time receipts and alerts for every transaction
•  Invest and manage Term Deposits with high interest rates
•  Open an Instant account and start sending and receiving money from anywhere anytime.
•  Use a wide range of self service options including password reset, card transaction limits adjustment, PIN change and more.
•  Request debit, prepaid and virtual cards with ease.
•  Navigate the app easily with a user-friendly interface for varying user groups.
GCB Mobile App is safe, secure and easy to use. Download it today and enjoy the experience.""",2023-09-17T07:00:00Z,2025-11-06T06:07:45Z
sb,Solomon Islands,Finance,6015,20,1496733309,LDB Trust,Lao Development Bank,https://apps.apple.com/sb/app/ldb-trust/id1496733309?uo=4,0.0,0,0,Finance,"LDB Trust - Mobile Banking and Digital Wallet at your fingertip.
Now comes with a brand new design, easier to use than ever with more banking functionalities combining the security and reliability from LDB Trust with the ease of use and speed of LDB Wallet into a single app.

- No need to have LDB Account or Card, just register to get your Wallet
- Transfer to LDB and other banks via LAPNET with the Account number or Card number
- Bill Payment - Mobile Top-Up, Electricity bill, Water bill, Lao Social Security, Leasing, and many more
- Statement/History - Keep track of your money at any time.
Instantly block and unblock your credit card anytime for your own safety
- Bookmark - Your favorite functions right on the first page
- Scan QR Code of both the LDB Trust and LDB Wallet for Transfer, Payment, Cash out with LDB Agency
- And many more
- The ‘small-b’ function in the app is designated for Waste Payment, allowing users to efficiently handle and complete payments related to waste management.",2020-02-13T08:00:00Z,2025-08-18T07:47:41Z
sb,Solomon Islands,Finance,6015,21,1156875272,Suica,East Japan Railway Company,https://apps.apple.com/sb/app/suica/id1156875272?uo=4,0.0,0,0,Finance,"東日本旅客鉄道株式会社(JR東日本)が提供するSuicaをApple Payで利用するためのアプリです。Suicaの発行やチャージ、定期券の購入もアプリで完結します。スマホを「かざすだけ」で鉄道・バスの乗車やキャッシュレス決済をスムーズにご利用いただけます。「JRE POINT」に登録すれば、JR東日本の鉄道に乗るとポイントが貯まります。また、貯まったポイントをSuicaにチャージすることも可能です。

【Suicaアプリケーションでできること】
iPhone*とクレジットカードがあればSuicaアプリで簡単にキャッシュレス生活を始められます。お手元にSuicaカードがなくても、Suicaアプリにて新規発行することが可能です。Suicaカードをお持ちの場合は、iPhoneでApple Payに取り込んで利用できます。iPhoneとペアリングすることで、Apple Watch*でも利用可能です。

入会金、年会費、デポジット等はいただきません。
* iPhone 8以降のiPhone、Apple Watch Series 3以降のApple Watch、日本国内で発売されたiPhone 7及びApple Watch Series 2の機種が対象です。

決済手段は下記の2つが選べます。
・ Suicaアプリケーションに登録のクレジットカード*
・ Apple Payに設定したクレジットカード
　* ビューカードを登録いただくと「オートチャージ」も設定できます


■ 日本全国で使えます
・全国の鉄道・バスなどの交通機関*でご利用いただけます。
*Suica、PASMO、SAPICA、Kitaca、ICAS nimoca、icsca、りゅーと、TOICA、manaca、ICOCA、PiTaPa、SUGOCA、nimoca、はやかけん、OKICAの各エリア
・ICマークのある日本全国のお店やネットショッピングでのお支払いにもご利用いただけます。

■ Suicaへの入金（チャージ）、定期券、Suicaグリーン券、おトクなきっぷの購入もアプリで
Suicaアプリでは各種サービスを利用できます。
・ Suicaへの入金（チャージ）、オートチャージ設定
・ 電子マネー残高、利用履歴の確認
・ 定期券、Suicaグリーン券、おトクなきっぷの購入・払いもどし
・Suica定期券（カード）の取り込み
・ 領収書の印刷（会員向けウェブサイトにて）

【ご利用にあたって】
・ 困ったときにサポートを受けられるよう、モバイルSuica会員登録をお済ませください。
・ モバイルSuica会員は、紛失や端末故障時は会員向けウェブサイトから再発行登録（利用停止手続き）が可能です。
・ info@mobilesuica.comのメールを受信できるように設定してください。

◆ 重要なお知らせ ◆
【！】 端末を変更・交換する時は、以下の操作が必要です。
・ iPhoneは、旧端末のWalletで全てのSuicaを「削除」し、新端末で同じApple IDにサインイン後、Walletで「Suicaを追加」してください。
・ Apple Watchは、ペアリングを解除する前にiPhoneのWatch appまたはApple WatchのWalletで全てのSuicaを「削除」し、同じApple IDにサインインしているiPhoneと新端末をペアリング後、Watch appで「Suicaを追加」してください。
・Apple社製端末以外からの変更は、予め旧端末での手続きが必要です。iPhone/Apple WatchではSuicaを未設定のApple IDでサインインしお受け取りください。

【！】 端末の電源が切れた状態ではSuicaをご利用いただけません
　※鉄道のご利用中(改札内)に電源が切れた場合、ご利用区間の運賃等を現金でお支払いいただきます。

【！】 Suicaのエクスプレスカード設定を忘れずに
生体認証なしで自動改札を通るには「エクスプレスカード設定」が必要です。交通利用以外では生体認証が必要な場合があります。

【様々なアプリやサービスとの連携で、もっと便利に】
■ JRE POINT
「JRE POINT」にモバイルSuicaを登録することで、対象のJRE POINT加盟店やJR東日本の鉄道のご利用でポイントが貯まります。特に鉄道のご利用では、カードタイプのSuicaよりも多くポイントが貯まるのでおトクです。

■ タッチでGo!新幹線
Suicaアプリケーションで「タッチでGo!新幹線」のご利用登録が可能（Suicaカードの取り込みでも設定が引き継がれます）。チャージ残高で新幹線の自由席にご乗車いただけます（事前の予約は不要）。

■ 新幹線eチケットサービス
「えきねっと」に会員登録し、SuicaをICカード情報に登録すると、券売機やみどりの窓口できっぷを受け取ることなく、JR東日本の各新幹線をチケットレスでご利用いただけます。早めのお申込みでおトクな「えきねっとトクだ値」「お先にトクだ値」もご利用可能です。

■ エクスプレス予約
別途ご登録いただくことでとJR東海「エクスプレス予約」もご利用いただけます（有料サービス）。",2016-10-24T06:47:42Z,2025-09-04T05:00:28Z
