country,country_name,category,genre_id,rank,app_id,app_name,developer,url,price,averageUserRating,userRatingCount,primaryGenreName,description,launch_date,update_date
na,Namibia,Food & Drink,6023,1,6444767441,KFC Namibia,Tictuk Technologies ltd,https://apps.apple.com/na/app/kfc-namibia/id6444767441?uo=4,0.0,4.5259,1139,Food & Drink,Ordering KFC has never been easier: 1. Choose your order mode for delivery or pickup. 2. Share your location to find a KFC near you 3. Order online exclusive deals and more 4. Pay cash or card. Download the KFC Namibia app now and don't forget to rate us!,2023-07-25T07:00:00Z,2025-06-01T10:19:49Z
na,Namibia,Food & Drink,6023,2,6502401813,Dial-A-Meal Namibia,DIAL-A-MEAL CC,https://apps.apple.com/na/app/dial-a-meal-namibia/id6502401813?uo=4,0.0,2.23529,17,Food & Drink,"Dial-A-Meal is the premier take away delivery service in Namibia and has been in operation for many years. We have established a business with extremely high levels of service standards and customer satisfaction delivering from the best restaurants and fast-food outlets in Windhoek, Walvis Bay and Swakopmund. With many establishments on offer, the patron is sure to find a delectable meal to savour from a variety of cuisines.",2024-05-20T07:00:00Z,2025-01-28T01:17:09Z
na,Namibia,Food & Drink,6023,3,1503916684,Tap a Meal,GREEN ENTERPRISE SOLUTIONS PTY LTD,https://apps.apple.com/na/app/tap-a-meal/id1503916684?uo=4,0.0,2.84277,159,Food & Drink,"How does Tap a Meal Work?
• Pick an item from a restaurant, and place an order
• The restaurant accepts the order
• You track the progress via the app
• For a collection order you pick the order once it is ready for pick up
• For a delivery order, a Tap a Meal driver will collect the order and deliver to you anywhere in Windhoek (Namibia)

Delivery
Tap a Meal drivers deliver food straight to your doorstep. You will be able to track the order progress as it moves through the different stages. 

Feedback
Give feedback for each order you place to make sure that the restaurant knows what you think.

How far do we deliver?
Anywhere in Windhoek.

Payments
We use electronic payments. Simply add your bank card and place your order.",2020-04-01T07:00:00Z,2025-06-30T10:07:35Z
na,Namibia,Food & Drink,6023,4,1389162925,Debonairs Pizza Namibia,FAMOUS BRANDS MANAGEMENT COMPANY PTY LTD,https://apps.apple.com/na/app/debonairs-pizza-namibia/id1389162925?uo=4,0.0,4.37984,258,Food & Drink,"You can now order and pay for your favourite pizza through the official Debonairs Pizza app. Find your nearest restaurant, choose from our range of pizzas, subs & sides, customise your order and checkout.
 
Use this app to order from Debonairs Pizza restaurants in Namibia.
 
Features:
 
- Find nearby restaurants or search by area
- Browse the menu and latest promotions
- Customise your order with toppings and sauces
- Order for collection or delivery
- Create an account for quick and easy checkout
- View your recent orders and easily reorder
- Save your addresses to speed up future ordering",2018-10-03T18:28:47Z,2025-08-18T08:51:39Z
na,Namibia,Food & Drink,6023,5,1502686954,Bootlegger Coffee Company,Yoyo SA (PTY) Ltd,https://apps.apple.com/na/app/bootlegger-coffee-company/id1502686954?uo=4,0.0,4.66667,6,Food & Drink,"Earn Loyalty
You will be earning a % back for every purchase made with the app, using in-app payments or regular payment methods (credit card etc)
 
Contactless Payment
You have the ability to load your card onto the Bootlegger APP, earn & pay in one transaction. (All secured through WiGroup)
 
Sending Vouchers
Gift voucher sending is now enabled. You can send friends & family value based vouchers to their app/phone numbers and they will be able to redeem them at any nearby Bootlegger store.
 
Store Locator
Find the nearest store to you will all the relevant details, including address, number & trading hours.",2020-07-08T07:00:00Z,2025-11-19T07:15:52Z
na,Namibia,Food & Drink,6023,6,1058959277,Uber Eats: Food & Groceries,"Uber Technologies, Inc.",https://apps.apple.com/na/app/uber-eats-food-groceries/id1058959277?uo=4,0.0,4.75856,1081,Food & Drink,"Get food delivery to your doorstep from thousands of amazing local and national restaurants. Find the meal you crave and order food from restaurants easily with the Uber Eats app. Track your order in real-time.

FIND YOUR FAVOURITE FOOD & RESTAURANTS
Order food from nearby restaurants and search by cuisine, restaurant name, dish, and meal. 
Food delivery options for you to order and enjoy such as pizza, burritos, burgers, sushi, fish and chips, doughnuts and Chinese takeout.
Prefer pickup? Skip the line and reservations and choose to pick up your order instead. Choose your favourite delivery options with the Uber Eats app now.

SUBSCRIBE TO UBER ONE
For £5.99 per month, Uber One subscribers enjoy £0 delivery fee and up to 5% off orders over £15 at participating non-grocery stores (and 5% off orders over £25 at participating grocery stores) available on Uber Eats. Members are also eligible for rewards, perks, coupons, and offers. View full Uber One Terms & Conditions in app.

ORDER ALMOST ANYTHING, ANYTIME
Order household needs from your favourite pharmacies, supermarkets, and pet shops. Baby food or nappies, pharmacy needs, beauty products and cosmetics. Grocery staples like bread and milk, bananas and produce, flowers and plants, packaged foods or frozen treats. 

You can even order alcoholic drinks including beer, wine, spirits and cocktails.*

SIMPLE DELIVERY ORDERING
Pick your food order from any menu and add it to your cart with a few taps. That’s it.
Uber Eats makes it easy to order food delivery online or through the app and have it delivered by restaurants and delivery people near you.
Or, schedule your order in advance for a delivery person to pick it up later. Your choice!

ORDER FOOD AHEAD WITH PICKUP
Now you can also order food ahead for Pickup instead of just ordering delivery. Select Pickup, add food items to your cart, and skip the lines to the restaurant to get your food.

REAL-TIME ORDER TRACKING
Track your food delivery order on a map as it heads your way.
See the estimated arrival time at your address.
Get notified when your order arrives.

FIND SOME OF YOUR FAVOURITE NATIONAL RESTAURANTS
Some of our food delivery partners include: Pizza Hut, Domino’s Pizza, Burger King, Dunkin', KFC, McDonald's, Starbucks, Subway, Taco Bell,Costa Coffee, Kaspas, Gourmet Burger Kitchen, Franco Manca, Dixy Chicken, Chipotle, Chaiiwala, Amigos Burgers Shakes, Papa John’s, Krispy Kreme.  

FIND PHARMACIES, GROCERY STORES, AND MORE
Order from grocery stores such as Asda, Sainsbury Supermarket, Waitrose, The Co-op, Iceland, M&S Food, and Londis. You can also order from pharmacies such as Boots via Uber Eats, as well as from other delivery partners in the convenience and retail spaces.

ABOUT UBER EATS
Uber Eats is the way to order the food you love through an easy delivery experience. Uber Eats is available in hundreds of cities around the world. Enter your delivery address to explore restaurant and grocery delivery options near you.

AVAILABLE INTERNATIONALLY

Join others in your city who use the Uber Eats app to order from their favourite restaurants and schedule delivery.

Uber Eats is currently available in cities and metro areas including Adelaide, Amsterdam, Atlanta, Auckland, Austin, Baltimore, Brussels, Cape Town, Chicago, Dallas, Denver, Johannesburg, Glasgow, London, Los Angeles, Madrid, Melbourne, Mexico City, Miami, Milan, Nashville, New Orleans, New York, Ottawa, Paris, Philadelphia, San Diego, San Francisco, Seattle, Stockholm, Sydney, Taipei, Tokyo, Toronto, Warsaw, and Washington DC. Uber Eats helps you find food delivery around the world. Order delivery in countries around the world. See full list of available countries on our website. Uber content/messages human- or machine-translated as per device settings; accuracy not guaranteed

*Alcohol is only available in select markets. Must be at least 18 to purchase. Item availability varies by market. See the Uber Eats app for details.",2016-06-06T21:35:56Z,2025-11-17T16:26:42Z
na,Namibia,Food & Drink,6023,7,1595820533,RocoMamas Africa,Byron Verreyne,https://apps.apple.com/na/app/rocomamas-africa/id1595820533?uo=4,0.0,3,4,Food & Drink,"The Rocomamas Africa app. 

You can order your favourite meal for delivery or collection, send gift vouchers, settle a bill by linking the app to your bank cards, locate your nearest restaurant.  

Do so much more with one app. 

Available in Zambia, Botswana, Zimbabwe & South Africa

Coming soon to Mauritus, Kenya.",2021-11-16T08:00:00Z,2025-06-13T22:34:28Z
na,Namibia,Food & Drink,6023,8,1389164218,Steers Namibia,FAMOUS BRANDS MANAGEMENT COMPANY PTY LTD,https://apps.apple.com/na/app/steers-namibia/id1389164218?uo=4,0.0,4.52857,140,Food & Drink,"You can now order and pay for your flame-grilled meals through the official Steers app. Find your nearest restaurant, choose from our range of products, customise your order and checkout.
 
Use this app to order from selected Steers restaurants in Namibia.
 
Features:
 
- Find nearby restaurants or search by area
- Browse the menu and latest promotions
- Customise your order with extras and sauces
- Order for collection or delivery
- Create an account for quick and easy checkout
- View your recent orders and easily reorder
- Save your addresses to speed up future ordering",2018-10-03T18:29:46Z,2025-08-19T09:04:43Z
na,Namibia,Food & Drink,6023,9,1592758295,Spur Africa,Byron Verreyne,https://apps.apple.com/na/app/spur-africa/id1592758295?uo=4,0.0,1,1,Food & Drink,"The Spur Africa app will reward you for every order you place. 

Every time you order a meal with Spur, you'll be earning cashback in Spur points,  which you can use to pay for your favourite meals. To earn points simply order on the app or scan your Spur bill. 

You can also order your favourite meal for delivery or collection, send gift vouchers, settle a bill by linking the app to your bank cards, locate your nearest restaurant and get app only special offers, vouchers and discounts.  

Do so much more with one app. 

The Spur Africa app allows you to: 
- Order your favourite Spur meal
- Purchase gift cards for your family and Friends
- Earn loyalty points off each order 
- Enjoy application only discounts and promotions
- Fined your favourite store and get your meals delivered to your door

Available in Zambia,Botswana, Zimbabwe & South Africa

Coming soon to Mauritus, Kenya, Nigeria",2021-11-16T08:00:00Z,2025-06-13T23:02:32Z
na,Namibia,Food & Drink,6023,10,1586973178,Panarottis Africa,Byron Verreyne,https://apps.apple.com/na/app/panarottis-africa/id1586973178?uo=4,0.0,1,2,Food & Drink,"The Panarottis Africa app will reward you for every order you place. 

Every time you order a meal with Panarottis, you'll be earning cashback in Panarottis points,  which you can use to pay for your favourite meals. To earn points simply order on the app or scan your bill. 

You can also order your favourite meal for delivery or collection, send gift vouchers, settle a bill by linking the app to your bank cards, locate your nearest restaurant and get app only special offers, vouchers and discounts.  

Do so much more with one app. 

The Panarottis app allows you to: 
- Order your favourite Panarottis Pizza
- Purchase gift cards for your family and Friends
- Earn loyalty points off each order 
- Enjoy application only discounts and promotions
- Fined your favourite store and get your Panarottis pizza's delivered to your door

Available in Zambia, Botswana,Zimbabwe & South Africa

Coming soon to Mauritus, Kenya",2021-11-16T08:00:00Z,2025-06-13T23:38:04Z
na,Namibia,Food & Drink,6023,11,1532896808,Arebbusch Pizza,Nienaber Group Pty Ltd,https://apps.apple.com/na/app/arebbusch-pizza/id1532896808?uo=4,0.0,0,0,Food & Drink,"The Arebbusch Pizzeria is located on Arebbusch Travel Lodge in Windhoek, Namibia and falls under the umbrella of the Arebbusch Travel Lodge Restaurant. 

Use this app to order the pizzas that are made by the Arebbusch Pizzeria as well as play the Arebbusch Pizzeria scratch and win competition and to receive regular push notifications from the Arebbusch Pizzeria. 


App Features:
- Order your food and then come and collect it yourself. 
- Order your food and have it delivered to your door step (selected areas of Windhoek apply). 
- Regular specials for all take-outs.
- Competitions. 
- Updates about specials.",2020-09-25T07:00:00Z,2021-06-26T10:12:20Z
na,Namibia,Food & Drink,6023,12,1297169989,Dineplan,Dineplan,https://apps.apple.com/na/app/dineplan/id1297169989?uo=4,0.0,0,0,Food & Drink,"Download the free Dineplan app to browse availability & instantly book your favourite restaurants in South Africa.

SEARCH & BROWSE RESTAURANTS
==========================

Search through our comprehensive list of restaurants by availability, name, area or show available restaurants based on your current location. 

To help you decide where to make your reservation, browse and explore restaurants by their customer rating, cuisines on offer, location, opening hours and various other booking options.

INSTANT & REQUEST BOOKINGS
========================

There are two types of restaurants booking categories: INSTANT BOOKINGS (watermelon colour label) and REQUEST A BOOKING (turquoise label). Click on the 'Book Now' or 'Request' buttons to select a date, party size and time for your reservation.

Bookings at Instant restaurants are instantly confirmed. 
Request type bookings need to be accepted or declined by the restaurant. Note: keep a lookout for the 'medal icon' awarded to restaurants that respond promptly to booking requests. The restaurant's Average Response time is provided when tapping the turquoise label - top right on request restaurants.

YOUR BOOKINGS
=============

View your upcoming and past booking reservations, from the bookings tab. Share, edit or cancel any of your upcoming bookings; and review past bookings.

FAVOURITES
==========

Tap the 'heart icon' to save your favourite restaurants for quick & easy future bookings.

NOTIFICATIONS
============

Instant bookings are confirmed via SMS and/or email. A reminder SMS is also sent 1 day prior and on the day of your booking reservation. Guests can confirm or cancel bookings by simply replying Confirm or Cancel to this SMS/Email message.

KEY PERKS & FEATURES
==================

•	Real-time bookings
•	Quick restaurant availability search
•	Confirmation and reminders of your reservations
•	Manage your reservations on the go
•	Share your reservation and the restaurants Google Map directions with your party
•	Create a list of your favourite restaurants, for easy booking",2017-12-02T18:02:53Z,2025-10-15T07:25:17Z
na,Namibia,Food & Drink,6023,13,1031141698,Mr D - Groceries & Takeaway,Mr Delivery (Pty) Ltd,https://apps.apple.com/na/app/mr-d-groceries-takeaway/id1031141698?uo=4,0.0,4.79839,248,Food & Drink,"Mr D is Mzansi’s favourite convenience delivery service, here’s why:

• 11000+ restaurants/stores and over 300 Pick n Pay grocery stores all on one app
• 2600+ areas across South Africa
• Find favourites like KFC, McDonalds, Chicken Licken, Burger King, Nando’s, Spur, Simply Asia, Wimpy, Steers, RocoMamas, Roman’s Pizza, Kauai and Pick n Pay Liquor.
• Get Pick n Pay groceries at in-store prices delivered within an hour.
• Shop from a wide range of over 10,000 Pick n Pay products and earn Smart Shopper points.
• No nasty hidden fees at checkout.
• Pay with cash, card, eBucks or EFT. Simple and safe.
• Get daily deals and regular promotions from your favourite restaurants and Pick n Pay groceries.
• Get daily deals and regular promotions from restaurants, Pick n Pay groceries, TakealotNOW, and shops!
• Track every step of your order in real time.",2016-07-27T23:24:32Z,2025-11-21T11:09:04Z
na,Namibia,Food & Drink,6023,14,6444406396,Yango Deli: food delivery,WindMobilityTechnologyLtd,https://apps.apple.com/na/app/yango-deli-food-delivery/id6444406396?uo=4,0.0,5,1,Food & Drink,"FOOD DELIVERY IS NOW ON THE YANGO APP    
GO TO THE YANGO APP AND GET K20 OFF 3 ORDERS AT ALL RESTAURANTS    
    
    
Food delivery service from grocery stores, cafes and restaurants    
    
You can order both burgers and steaks, as well as products from grocery stores. Free delivery for your first order!    
    
ALL NEARBY GROCERIES AND RESTAURANTS IN ONE APP    
    
Get your groceries delivered from both popular stores and local markets. And for those who don't want to cook, you can find your favorite dishes from cafes and restaurants. In Yango Deli, you can order a cooked pizza or ingredients for it.    
    
ORDER FAST DELIVERY TO YOUR ADDRESS    
    
Enter the delivery address — we will find the nearest store or restaurant to you and deliver the order as quickly as possible. On average food is delivered in 32 minutes after placing an order — even faster than you would get ready to go shopping.    
    
TRACK YOUR ORDER    
    
In the app, you can find out the status of the order and the location of the courier.    
    
USE FILTERS TO FIND EVERYTHING YOU NEED    
    
With filters you can find a specific cuisine or dish with one click. “Burgers”, “Sushi”, “Pizza” — Yango Deli has sets for every occasion.    
    
DISCOUNTS AND SPECIAL OFFERS EVERY DAY    
    
In the app, you can place an order profitably: for example, get free delivery or a dish as a gift. In the section “Promotions” we collect the best offers from shops and restaurants every day.",2022-12-16T08:00:00Z,2025-10-27T14:54:36Z
na,Namibia,Food & Drink,6023,15,1117047151,Woermann SmartBuy,Adriana Schwieger,https://apps.apple.com/na/app/woermann-smartbuy/id1117047151?uo=4,0.0,0,0,Food & Drink,"With Woermann SmartBuy you will be up-to-date with the latest special offers, get to enter into exclusive competitions and more.All from the leading Nambian retail and wholesale group. There's always more instore!",2016-05-25T23:23:37Z,2017-03-11T18:36:36Z
na,Namibia,Food & Drink,6023,16,758103884,foodpanda: Food & Groceries,Internet Services Polen Sp. z o.o.,https://apps.apple.com/na/app/foodpanda-food-groceries/id758103884?uo=4,0.0,4.58824,34,Food & Drink,"Discover the local choice for meals, groceries, and food delivery with foodpanda!

Life can get overwhelming, but we’re here to help! Whether you need daily meals, groceries, or shopping essentials, foodpanda has got you covered with convenient food delivery.

Order Your Favourite Food with Just 3 Simple Taps!

With foodpanda, you can easily choose the food you love, and we’ll deliver it right to your door. Serving millions across over 400 cities in 11 Asian markets — Singapore, Hong Kong, Thailand, Malaysia, Pakistan, Taiwan, the Philippines, Bangladesh, Laos, Cambodia, and Myanmar — foodpanda is your go-to for everyday food delivery.

Endless Food and Grocery Delivery Choices at Your Fingertips!
Hungry for wood-fired pizza, a classic burger or fried chicken? We know the best restaurants near you – big famous brands and tiny local faves. Best part? We've got exclusive discounts and promos waiting for all new foodies. With a simple click, your food and groceries are on their way with fast delivery!

Need Groceries? We’ve Got You Covered!
Want to cook but short on time? Imagine having fresh produce, pantry staples, frozen goods, personal care items, your cute pets' needs, and much more, delivered in a flash — everything you need for a hassle-free home-cooked meal, all available through our speedy groceries delivery service from foodpanda shops and pandamarts.

Best Food and Grocery Delivery Deals Just for You!
Looking for the best savings on groceries and food? We regularly update our daily deals, personalised just for you! Here’s a tip: skip the queue and choose self pick-up for extra savings on your grocery orders, or enjoy the convenience of our food delivery options.

Save on tasty takeaways.
On the go? Try pick-up! Skip the queue and save up when you self-collect your order.

Worry-free package delivery.
Need to send or receive a parcel? Go with pandago. Our reliable fleet and on-demand delivery service will safely deliver it for you in no time.

Our tech is shaped by you.
Explore personalised offers and delicious picks just for you. Dish out what you feel about your order and let foodies know what’s yum. 

Want More? Join pandapro!
Unlock even greater savings on food delivery and grocery options with our pandapro membership today!

Live like a panda and let us take care of the rest — let’s do it the panda way with seamless food delivery!

For more info, please visit our website.",2013-11-25T18:13:11Z,2025-11-22T08:33:03Z
na,Namibia,Food & Drink,6023,17,1507786821,FoodShiner: Pantry Companion,Idriss Mrabti,https://apps.apple.com/na/app/foodshiner-pantry-companion/id1507786821?uo=4,0.0,0,0,Food & Drink,"FoodShiner – Your Fridge’s New Best Friend!

Tired of finding expired yogurt in the back of your fridge? Bought a third bottle of ketchup because you forgot you already had two? We’ve all been there. FoodShiner is here to help!

With FoodShiner, you can easily track everything in your fridge, freezer, and pantry—so you waste less food, save money, and avoid those “what’s that smell?” moments.

Why FoodShiner?

Unlike other apps, we believe food management is your business. That’s why your data stays private—no accounts, no tracking, no creepy data collection. Everything is stored only on your device or iCloud, safe and sound.

Awesome Features You’ll Love:
- Unlimited Lists – Organize your pantry, fridge, freezer, or even your secret snack stash.
- iCloud Sync & Sharing – Keep everything up to date across devices and share with family or roommates.
- SmartLists – Instantly see what’s expiring soon, already expired, or already opened.
- Barcode Scanner – Just scan, and boom! Product added.
- Expiration Reminders – Because throwing out food is throwing out money.
- Dark Mode Support – Because your midnight snack tracking should look good.
- Food Waste Score & Achievements – Challenge yourself to waste less and save more!
- Face ID & Touch ID Lock – Because your snack inventory is top secret.
- Backups & Files Integration – Your food list, always safe.
- Full iPadOS Support – Split view, trackpad, keyboard shortcuts… all the good stuff.

FoodShiner is completely FREE! No hidden fees, no subscriptions—just a better way to manage your food. If you love the app and want to support us, you can always leave a tip. No pressure, just appreciation!",2020-05-01T07:00:00Z,2025-09-20T04:25:07Z
na,Namibia,Food & Drink,6023,18,6751251151,PantryMind,Mateen Aminian,https://apps.apple.com/na/app/pantrymind/id6751251151?uo=4,0.0,0,0,Food & Drink,"PantryMind – Smarter Pantry Management for Every Household

Take control of your kitchen with PantryMind, the AI-powered pantry manager that tracks your groceries, monitors expirations, builds shared shopping lists, and syncs across devices. Reduce waste, save money, and keep your household effortlessly organized.",2025-10-03T07:00:00Z,2025-10-31T23:10:09Z
