country,country_name,category,genre_id,rank,app_id,app_name,developer,url,price,averageUserRating,userRatingCount,primaryGenreName,description,launch_date,update_date
vn,Viet Nam,Sports,6004,1,6479625228,ALOBO – Sports Field Booking,DOCUMENT EASY COMPANY LIMITED,https://apps.apple.com/vn/app/alobo-sports-field-booking/id6479625228?uo=4,0.0,4.94248,12812,Sports,"ALОBО – Smart Sports Field Booking

ALОBО is the ultimate app for booking sports fields with ease. Whether it’s football, badminton, tennis, basketball, or other sports, ALOBO connects you with hundreds of trusted venues nearby – anytime, anywhere.

Key Features:

+ Search for fields by location, sport, and time

+ Real-time availability & instant booking

+ Secure and flexible payment options

+ Manage your playing schedule & share with friends

+ Read and leave reviews from the sports community

No more phone calls or waiting around – with ALOBO, booking a sports field is fast, simple, and transparent.

Download ALOBO now and enjoy a smarter way to book your game!",2024-03-21T07:00:00Z,2025-11-18T14:55:38Z
vn,Viet Nam,Sports,6004,2,1601962266,VietRace365,Le Le Thi,https://apps.apple.com/vn/app/vietrace365/id1601962266?uo=4,0.0,2.30345,145,Sports,"VietRace365 luôn đồng hành cùng bạn qua các sự kiện thể thao. Ứng dụng của chúng tôi sẽ giúp bạn ghi lại các kết quả của buổi tập, theo dõi kết quả, chia sẽ với bạn bè và tham gia các sự kiện thử thách đầy thú vị. Chỉ cần cầm điện thoại trên tay bạn đơn giản nâng cao sức khỏe sức bền thể chất thông qua các hoạt động chạy bộ, đi bộ, đạp xe. Hãy thử thách để tạo động lực cho bản thân giúp bạn trãi nghiệm cuộc sống  đầy thú vị và ý nghĩa.

Tải ngay VietRace365 để trải nghiệm và gia nhập cộng đồng thể thao phong trào Việt Nam.",2022-04-19T07:00:00Z,2023-11-30T17:09:17Z
vn,Viet Nam,Sports,6004,3,6749922792,PVNA – Xếp Hạng Pickleball,Khang Nguyen,https://apps.apple.com/vn/app/pvna-x%E1%BA%BFp-h%E1%BA%A1ng-pickleball/id6749922792?uo=4,0.0,4.68,25,Sports,"PVNA – Xếp Hạng Điểm Pickleball Số 1 Việt Nam
Ứng dụng xếp hạng và quản lý giải đấu Pickleball chuyên nghiệp.

PVNA là nền tảng dành riêng cho cộng đồng Pickleball Việt Nam, giúp bạn dễ dàng:

Xếp hạng công bằng và minh bạch theo kết quả thi đấu.
Đăng ký và tham gia giải đấu chỉ với vài thao tác.
Quản lý sự kiện, tạo bảng đấu và bốc thăm tự động.

Tính năng nổi bật:
Xếp hạng tự động
Thuật toán minh bạch, cập nhật điểm ngay sau mỗi trận đấu.

Đăng ký giải đấu nhanh chóng
Tìm và tham gia giải phù hợp trình độ trong vài giây.

Quản lý sự kiện hiệu quả
Tạo bảng, bốc thăm và theo dõi kết quả realtime.

Lịch đấu & giờ thi
Nhắc lịch đấu và giờ thi đấu sắp tới để bạn không bỏ lỡ.

Phân tích thành tích
Báo cáo thắng–thua, hiệu số điểm và biểu đồ tiến độ xếp hạng.

Cộng đồng tin cậy
Xếp hạng dựa trên dữ liệu minh bạch, phản ánh chính xác trình độ.

Tải PVNA ngay để có điểm xếp hạng công bằng, tìm giải đấu phù hợp và khẳng định vị thế của bạn trên bản đồ Pickleball Việt Nam!",2025-09-22T07:00:00Z,2025-11-18T00:45:01Z
vn,Viet Nam,Sports,6004,4,6744911455,VFF App,FANZEAL VIETNAM JOINT STOCK COMPANY,https://apps.apple.com/vn/app/vff-app/id6744911455?uo=4,0.0,4.56799,125,Sports,"The Official Vietnam Football Federation (VFF) App offers exciting experiences and connects you with the football community. With the VFF app, you can:

* Stay updated with exclusive news and content: Get the latest information on events, matches, and activities from the Vietnam National Football Team.
* Join exciting games: Take part in predicting match results, answering quizzes, voting and other captivating games to gain special rewards.
* Loyalty Program: Collect points, receive gifts, and enjoy exclusive rewards for VFF fans.
* Official Merchs: The official online store for VFF’s Merchandise & Match ticket

The VFF app is a must-have for every football fan in Vietnam. Download it now to stay connected with the team and enjoy special rewards from VFF!

This application complies with Apple’s Standard End User License Agreement (EULA). You can view the details here: https://www.apple.com/legal/internet-services/itunes/dev/stdeula/",2025-09-04T07:00:00Z,2025-11-18T03:12:11Z
vn,Viet Nam,Sports,6004,5,1323924315,Reclub - Social Sports Nearby,Reclub PBC,https://apps.apple.com/vn/app/reclub-social-sports-nearby/id1323924315?uo=4,0.0,4.85953,1018,Sports,"Looking for a pickleball club near you? Maybe a swing coach to improve your game? Maybe you’re new to the city and want to join a volleyball league. Reclub is the app that’s powering the global sports community.

Use Reclub to:

DISCOVER. Find sports near you. Pick your city + sport to find other players who love the game as much as you do.
MEET. Make an activity. Play a round robin. Invite your friends to come to the court and join the fun.
RUN A CLUB. Club management made easy. Round robins, leagues and social drop-ins, all done in a few taps.
COMPETE. Setup pickleball tournaments. football competitions, or any other sport in a snap. Brackets, leagues and registration all in one place.
CHAT. Connect with the other athletes. Setup a drop-in with club members.

Terms of service: https://reclub.co/terms-of-service
Privacy policy: https://reclub.co/privacy",2018-08-04T02:27:10Z,2025-11-05T03:34:05Z
vn,Viet Nam,Sports,6004,6,463243024,Scorekeeper XL,Matt Rix,https://apps.apple.com/vn/app/scorekeeper-xl/id463243024?uo=4,0.0,5,7,Sports,"Scorekeeper XL is a great app for keeping score when playing board games or party games with your friends. 

----------------------------

How to use:

Top left button: add player.
Top right button: sort lowest-to-highest.
Bottom right button: toggle volume.
Bottom left button: reset scores to 0.

When editing a player, you can use the skull and crossbones to delete that player. 

To increase a player's score, simply tap on the plus and minus buttons next to their score. If you hold the button it'll count up a lot quicker. 

That's about it, have fun!",2011-09-30T07:00:00Z,2017-09-02T22:25:45Z
vn,Viet Nam,Sports,6004,7,1477171291,AiScore - Livescore for Sports,ALLSPORTS TECHNOLOGY PTE. LTD.,https://apps.apple.com/vn/app/aiscore-livescore-for-sports/id1477171291?uo=4,0.0,4.68684,5470,Sports,"AiScore is your Live score expert, bringing to you more information, more statistics and a completely new experience on your smartphone. Here you are even informed faster than the TV viewers!

With In-depth coverage of football, basketball, tennis and snooker, AiScore brings you live score,goals, yellow or red cards, H2H, fixtures, match live, team and player stats, standings, lineups and other important stats from English Premier League, Spanish La Liga, UEFA Champions League, NBA, FIBA, Basketball Champions League, ATP tennis, WTA tennis, World Snooker Championship - major or small leagues and competitions all over the world!

TOP HIGHLIGHTS:

*All Games - Follow all today's matches in real time. Also, you can check out the matches on specific day by DateTime Picker.

*Live - Stay up to date with all the latest scores and results from hundreds and thousands of games worldwide. Every score at a glance. Just tap the matchup for Box Score or Lineups, H2H and Match Live.

*Favorites - Choose your favorite team and competition on matchup and always be up-to-date.

*Instant Notification - Get instant notifications of goal, corner, red or yellow card, start, starting lineups and final results for all live or your followed matches. A pop-up window will appear to inform you of score changing when you turn on the ""Score Reminder”.

*Leagues - In-depth coverage of leagues, cups and tournaments from over 200 countries. Check out latest rankings, standings, team or player stats and more.

Football: Over 2,600 different football matches, over 37,000 teams (including Premier League, Champions League, Serie A, La Liga, Bundesliga, MLS, FA Cup, League Cup, Europa League, Championship and many more)

Basketball: Over 500 tournaments including FIBA Basketball World Cup, NBA, BCL

Tennis: Complete source for worldwide tennis matches including ATP, WTA

Snooker: Complete source for worldwide snooker matches including World Championship, UK Championship, Masters

*Chatroom - Get connected with other sports fans from all over the world. No game is boring if you can chat live.

*Language - 28 (more will be added)

""Need help? Email service@aiscore.com or Tap ""Feedback""

We are affiliated with aiscore.com

Stay Tuned:

Facebook: @Aiscoreapp

Twitter: @aiscoreofficial

Instagram: @aiscore_official

""Subscribe to “Get AiScore Premium” through the app. If you choose to subscribe, you will be charged a yearly or monthly subscription fee according to your country. The subscription fee will be shown in the app before you complete the payment. Your subscription will automatically renew every year or month at the then-current subscription fee unless auto-renew is turned off at least 24 hours before the end of the then-current subscription period. Your iTunes account will automatically be charged within 24 hours prior to the end of the then-current period. The subscription fee will be charged yearly or monthly. You can turn off auto-renew at any time from your iTunes account settings.

Privacy policy: https://m.aiscore.com/policy
Terms of use: https://www.apple.com/legal/internet-services/itunes/dev/stdeula/""

For developers, please contact www.thesports.com for sports data solution.

For business inquiry, email business@aiscore.com",2019-09-25T07:00:00Z,2025-11-17T05:49:20Z
vn,Viet Nam,Sports,6004,8,1569805145,Sacombank Runners,SAIGON THUONG TIN COMMERCIAL JOINT STOCK BANK,https://apps.apple.com/vn/app/sacombank-runners/id1569805145?uo=4,0.0,3.46667,15,Sports,"Sacombank Runners là ứng dụng cho phép thành viên của CLB tham gia, lưu trữ hoạt động từ các giải chạy được tổ chức trên website sacombankrunnersclub.com. 
Sacombank Runners Club được thành lập vào ngày 11/05/2019, với hơn 10,000 thành viên thường xuyên hoạt động để cùng lan tỏa thông điệp Người Sacombank “Khỏe thể chất - Mạnh tinh thần”",2021-06-05T07:00:00Z,2022-06-13T22:51:38Z
vn,Viet Nam,Sports,6004,9,6477529992,Sport Connect,Dong Dang Hoang,https://apps.apple.com/vn/app/sport-connect/id6477529992?uo=4,0.0,3.9,10,Sports,"SportConnect là nền tảng công nghệ tiên tiến được phát triển nhằm thúc đẩy phong trào thể thao, kết nối cộng đồng người chơi và nâng cao trải nghiệm thể thao một cách toàn diện. Ứng dụng hỗ trợ đa dạng nhu cầu của người dùng, từ khám phá các bộ môn thể thao, kết nối bạn bè để thành lập câu lạc bộ, đến quản lý quỹ, điểm số, cũng như mua sắm và trao đổi trang thiết bị, dụng cụ thể thao. Không chỉ dừng lại ở đó, SportConnect còn là cầu nối giúp các vận động viên dễ dàng tìm kiếm, tham gia và tổ chức các sự kiện thể thao. Với SportConnect, việc giao lưu, thi đấu và chia sẻ niềm đam mê thể thao trở nên thuận tiện hơn bao giờ hết.",2024-04-27T07:00:00Z,2025-11-20T08:46:31Z
vn,Viet Nam,Sports,6004,10,6444272838,8 Pool Clash,Tenyoko Entertainment Inc,https://apps.apple.com/vn/app/8-pool-clash/id6444272838?uo=4,0.0,4.49191,803,Sports,"8 Pool Clash is an online pool game for two. Do you want to compete with billiards players all over the world? We will match you with the right opponent. Download 8 Pool Clash and give it a try, you'll have more fun than ever.
  
  Players with good control can easily win at billiards. 8 Pool Clash simulates the real feeling of hitting a ball, allowing you to be there and enjoy the fun of billiards at home. As the number of battles increases believe that your skills will continue to improve; you will meet stronger opponents and defeat them! Go to the next level and win more rewards.
  
  In each PvP game, both sides invest a certain amount of gold to win the game, and all the chips are yours! With the coins you win, you can buy items in the shop.
  After completing a certain number of rounds, a treasure box will be presented, open the treasure box, and there will be a lot of prizes waiting for you!
  
  You can log in for free with your Facebook account to save your game data. You can also type and communicate during the game, taunt the opponent when he hits the ball, and don't let him hit the ball successfully!
  The perfect ranking mechanism makes all players want to rush to higher rankings; we will wait and see who will become the champion!",2022-12-17T08:00:00Z,2024-09-26T04:53:20Z
vn,Viet Nam,Sports,6004,11,1667458517,Score Counter - Point Counter,Chuong Le,https://apps.apple.com/vn/app/score-counter-point-counter/id1667458517?uo=4,0.0,4.6044,91,Sports,"The best SCORE COUNTER - POINT COUNTER app you can find in the store

You want to keep scores for your games, activities, sports, points but hard to find a pen and paper, hard to keep score in your mind, tired to be a person who will keep score of a game, match? 

Let's try Score Counter, this app will keep score, count score quickly. You just need to tap to screen and Score Counter will do everything automatically, simple, intuitive.

WHY CHOOSE SCORE COUNTER - POINT COUNTER?
• Easy to use
• Intuitive and simple design
• Quickly adding any amount of points
• Suitable for any game
• Custom increments
• Works for big numbers

TOTALLY FREE

IF YOU WANT TO SUPPORT US
- You can support us by:
  + Using application
  + Giving us feedback
  + Rating and leave a comment for application

Thanks so much!!",2023-01-26T08:00:00Z,2025-10-28T15:09:37Z
vn,Viet Nam,Sports,6004,12,6479625204,ALOBO - Quản lý sân thể thao,DOCUMENT EASY COMPANY LIMITED,https://apps.apple.com/vn/app/alobo-qu%E1%BA%A3n-l%C3%BD-s%C3%A2n-th%E1%BB%83-thao/id6479625204?uo=4,0.0,3.75,20,Sports,"ALOBO viết tắt của ALO BOOKING - Phần mềm chuyên biệt về Quản lý Lịch đặt và Quản lý bán hàng dành cho sân thể thao: Cầu lông, sân bóng đá, sân tennis, sân pickle balls, sân cỏ nhân tạo, sân bóng mini.
ALOBO Là Phần mềm tiên phong trong việc số hoá quy trình quản lý & đặt lịch cho sân thể thao.

CÁC CHỨC NĂNG CHÍNH CHUYÊN BIỆT CHO SÂN THỂ THAO :

1. ĐẶT LỊCH TRỰC TUYẾN : Như đặt vé xem film, khách sẽ xem lịch trống - chọn khung giờ và thanh toán
2. XEM TRẠNG THÁI SÂN và quyết định nhận lịch khách trong vòng 5s là xong
3. QUẢN LÝ LỊCH ĐẶT cho sân thể thao
4. QUẢN LÝ BÁN HÀNG các dịch vụ kèm theo như nước - cầu ....tất
5. THỐNG KÊ để tránh thất thoát
6. IN HOÁ ĐƠN qua máy in hoặc gửi hoá đơn online
7. ĐỒNG BỘ HOÁ DỮ LIỆU trên tất cả thiết bị và không  giới hạn số lần đăng nhập
7. QUẢN LÝ LỢI NHUẬN & TỒN KHO
9. QUẢN LÝ KHÁCH HÀNG & CÔNG NỢ : Danh sách khách hàng sẽ được lưu lại để tiện theo dõi và chăm sóc, truy xuất công nợ của khách hàng chưa thanh toán.


Privacy & Policy:
https://www.alobo.vn/privacy-policy/
 
Terms of Use:
https://www.alobo.vn/terms-of-user/",2024-03-21T07:00:00Z,2025-11-19T01:34:44Z
vn,Viet Nam,Sports,6004,13,1447215452,HryFine,"Shenzhen United Power Technology Co., Ltd.",https://apps.apple.com/vn/app/hryfine/id1447215452?uo=4,0.0,2.51872,187,Sports,"****Hryfine bracelets are non-medical devices. The measurement data and results are for reference only, not for diagnosis and treatment. * * * * *

Special Reminder: APP data is for reference only and is not used as a medical diagnosis. You should consult your doctor before using APP and making any medical decisions.

1, Home Sports: record your exercise data, set exercise goals and calculate whether the goal is achieved, steps, distance, calorie consumption, etc.;

2. Sleep monitoring: it can record the sleep duration and sleep quality in the set period, and count the duration of deep sleep, light sleep and awake, so that you can improve the sleep quality;

3. When the phone searches for the bracelet, the bracelet vibrates. Find the phone through the bracelet, phone vibration and ring reminder, in case of loss.

4. It can remind the user of important information such as call, SMS, WeChat and so on when connecting with the bracelet, to prevent missing important information, etc.;

5. Set an intelligent alarm clock for the bracelet to remind you of sitting for a long time. The bracelet vibrates to remind you to reduce the problems caused by sitting for a long time

6, Remote control photography mode, anytime and anywhere to record the beautiful moment

7, statistics your daily, monthly, weekly exercise, sleep, data display at a glance

8. You can set the bracelet to turn the wrist to light up the screen and light up the screen easily

9. Sports data report: make statistics of your sports data and average data in the last 30 days, as well as your sports standards in the last seven days, and generate reports for easy viewing of sports trends",2018-12-19T07:49:20Z,2025-11-19T01:42:17Z
vn,Viet Nam,Sports,6004,14,6744100028,VAR PLUS,CLELA TRADING - SERVICE COMPANY LIMITED,https://apps.apple.com/vn/app/var-plus/id6744100028?uo=4,0.0,4.94545,165,Sports,"VAR Plus : The all-in-one, free football app for real fans.

VAR Plus is your ultimate tool to stay updated on all the latest developments in the football world, from live scores and VAR incidents to expert analysis – all consolidated into one lightweight, smooth, and highly accurate application.

VAR Plus provides comprehensive and timely pre-match information, match results, and detailed data updates for top leagues including Premier League, Champions League, Serie A, La Liga, Bundesliga, MLS, FA Cup, League Cup, Europa League, Euro, World Cup, and more.

Key features of VAR Plus include:

LiveScore: With this feature, you can update scores and football results from all tournaments around the world in real time. Helping you accurately grasp the developments of each match you care about.

Match Analysis: The app provides evaluations, in-depth analysis, and match predictions from football experts, helping you better understand the teams before they take the field.

Prediction: VAR Plus provides a feature that predicts football match outcomes using AI based on statistical information and system evaluations.

Match Data: You can view detailed information about matches, including head-to-head (H2H) history, starting lineup statistics, red cards, yellow cards, number of corners, and many other real-time data.

Watch Football Live: Follow match developments via tactical graphics with real-time commentary.

Follow and Receive Notifications: Receive direct notifications from your favorite teams and tournaments: match start, key developments during the game, and many other updates you care about.

Match Schedule: View the schedule of your favorite tournaments and teams to make sure you don’t miss any important matches.

Standings: Update standings of all tournaments, with full statistics of top scorers, assists, cards... of top players in the tournament.

Football News: Provides daily football news to help you stay updated with the hottest information on and off the pitch.

VAR Plus: A comprehensive football app that keeps the whole football world within your reach.",2025-04-04T07:00:00Z,2025-10-07T02:26:36Z
vn,Viet Nam,Sports,6004,15,6498545004,Fishmap,Truong Vu,https://apps.apple.com/vn/app/fishmap/id6498545004?uo=4,0.0,4.21429,42,Sports,"Fishmap giúp bạn khám phá các điểm câu cá mới, nhận dự báo và tìm thời điểm tốt nhất để câu cá. Fishmap cung cấp  cho bạn bản đồ vị trí pha bắt chính xác và công cụ bạn cần để cải thiện kỹ năng câu cá của mình. Bạn có thể theo dõi các pha bắt cá của mình thông qua nhật ký câu cá. Kết nối những người câu cá và chia sẻ các pha đánh bắt của bạn

TÌM ĐỊA ĐIỂM CÂU CÁ MỚI VÀ TỐT NHẤT

Fishmap là cách nhanh nhất và dễ dàng nhất để tìm địa điểm câu cá. Khám phá hàng ngàn vùng nước đánh cá và biết chính xác nơi cá đang được đánh bắt bằng bản đồ Fishmap. Tìm hiểu các loài cá nào đang được đánh bắt gần bạn. Với các lớp bản đồ nâng cao và các tùy chọn giúp bạn xác định điểm câu cá tiếp theo của mình.

NHẬN THÔNG TIN DỰ BÁO CÂU CÁ

Hãy là người đầu tiên biết thông tin câu cá trong khu vực của bạn. Nhận hình ảnh và thông tin cập nhật từ những người câu cá tại địa phương. Hãy xem công cụ và mồi câu nào sẽ đánh bắt được nhiều cá nhất. Kiểm tra điều kiện thời tiết, bảng thủy triều, áp suất không khí... để dự đoán thời điểm câu cá tốt nhất.

NHẬT KÝ CÂU CÁ CỦA BẠN

Theo dõi tất cả các chuyến đi câu cá và sản lượng đánh bắt của bạn. Lưu giữ thông tin chi tiết mỗi lần đánh bắt như loài cá, ngày giờ, kích cỡ, vị trí, công cụ được sử dụng và điều kiện thời tiết. Ghi lại tất cả những khoảnh khắc câu cá yêu thích của bạn và chia sẻ sản phẩm đánh bắt của bạn với cộng đồng những người câu cá.

Chức năng thống kê cá nhân giúp bạn cải thiện khả năng câu cá. Ghi lại các công cụ và mồi câu bạn đã sử dụng từ đó phát hiện loại mồi nào hiệu quả nhất trong các điều kiện cụ thể.

Bạn có toàn quyền kiểm soát cài đặt quyền riêng tư của mình. Bạn có thể chọn chia sẻ thông tin đánh bắt của mình hoặc giữ nó ở chế độ riêng tư giữ kín về các điểm câu cá yêu thích của mình.

CỘNG ĐỒNG CÂU CÁ

Fishmap quy tụ những người đam mê câu cá từ khắp nơi. Kết nối với hàng triệu người câu cá và tìm những người bạn câu cá mới. Tham gia trò chuyện, trao đổi kinh nghiệm, tham gia các nhóm câu cá và tìm hiểu các kỹ thuật câu cá mới.

HỘP CÔNG CỤ CÁ NHÂN

Theo dõi công cụ và mồi câu cá thường sử dụng của bạn. Lưu giữ công cụ và mồi câu sử dụng trong mỗi lần đánh bắt. Nhận đề xuất về loại công cụ và mồi câu nên sử dụng cho từng loài cá.

BẢN ĐỒ CÂU CÁ

Bản đồ Fishmap với các dạng bản đồ và các chế độ lọc năng cao tăng khả năng tiếp cận điểm câu cá. Thông tin chi tiết về vùng nước đánh cá, bao gồm hình ảnh và thông tin chi tiết các pha bắt gần đây. Đề xuất mồi câu cá hiệu quá dựa trên thống kê các pha bắt cá từ cộng đồng. Số liệu thống kê tự động cập nhật mỗi khi có pha bắt mới.",2024-04-23T07:00:00Z,2025-09-18T10:56:04Z
