country,country_name,category,genre_id,rank,app_id,app_name,developer,url,price,averageUserRating,userRatingCount,primaryGenreName,description,launch_date,update_date
vn,Viet Nam,Sports,6004,16,356928178,LiveScore: Live Sports Scores,LiveScore Ltd.,https://apps.apple.com/vn/app/livescore-live-sports-scores/id356928178?uo=4,0.0,4.82285,9269,Sports,"LiveScore keeps you up to date with the latest live sports scores and live sports action. Whether you are looking for scores, goals, fixtures or news, LiveScore is your one-stop destination for top football leagues. From Premier League and UEFA Champions League, to Eredivisie, Serie A, LaLiga and more, LiveScore has it all. Stay on top of the football season with live football scores!

LIVE NOTIFICATIONS
Get fast updates to keep track of live sports scores, goals, red cards and more for multiple matches and sports at the same time. Get all the details, football stats and live football scores for the Premier League, UEFA Champions League; scores for tennis matches and more. Manage your favourite sports & match notifications in your settings.

FOR YOU
Immerse yourself in a truly personalised experience when it comes to news and headlines. With all your favourites in one place, it’s the best way for you to cut the noise and stay informed on the teams and competitions that matter to you. Check the latest news and breaking headlines from across the world of sport. After all, it's made For You.

For You covers everything from the latest insights, football news, football stats, football results, post-match reviews, player transfers and previews of upcoming football fixtures from the PL, UEFA Champions League, LaLiga, Bundesliga, Serie A, Primeira Liga and Eredivisie.

COMPETITIONS
Search for competitions across the biggest sports. Including worldwide premier cups and leagues with match details and soccer and football scores for the PL, the FA Cup, UEFA Champions League, LaLiga, Serie A, Eredivisie and Bundesliga.

FAVOURITE LEAGUES AND TEAMS
Get to the scores, live results and sports match news you’re interested in. Favourite your team to follow their progress in the leagues and easily see past results or upcoming fixtures. Switch on live notifications for your favourited teams to keep track of all the action & news.

TEAM PAGES AND PLAYER STATS
View your team’s upcoming fixtures, live table standings, news, scores, videos of matches and Player Stats to check top scorers and more. Perfect for keeping up with news and scores of your favourite tennis players, or for your fantasy football team.

LIVE COMMENTARY (Unofficial) FROM LIVESCORE
Listen to live match commentary (unofficial) from the LiveScore team, covering everything from scores, assists, corners, cards and descriptions of the action on football matches.

WORLDWIDE SCORES AND SPORT
Find your international team and follow live football stats, football results and scores. More than 1,000 live football scores and football fixtures are followed every week.

LIVESCORE HORSE RACING
View horse racing results, upcoming race details, jockey, trainer and horse racing form details across UK, Ireland and international racecourses. Favourite upcoming horse races to easily view every horse and jockey in the field, receive live notifications with the winning horse.

DISCOVER AMERICAN FOOTBALL
New to LiveScore is American Football! Whether you're a seasoned fan or new to the game, we've got you covered with real-time game results, stats, and fixtures for your favourite teams and leagues, including the NFL & CFL. Stay updated on the action and follow every touchdown, tackle and triumph.

ABOUT LIVESCORE
Since 1998, LiveScore has been giving you real-time delivery of live sport scores & data. As leaders of live score updates, LiveScore is trusted and used daily by millions of users globally; specialising in the sports: football, soccer, tennis, cricket, basketball & hockey.",2010-02-22T20:51:15Z,2025-11-06T16:05:06Z
vn,Viet Nam,Sports,6004,17,6475382945,Uniscore - Live Sports Scores,Unity Future Bright Sport Limited,https://apps.apple.com/vn/app/uniscore-live-sports-scores/id6475382945?uo=4,0.0,4.47706,109,Sports,"UniScore is an app that provides real-time live score updates, fast and accurate down to the second, with extensive information on sports results, match statistics, and live streaming experience.

You will know the score, goals, instant goal notifications, red cards, yellow cards, H2H, match schedules, football results today, team & player statistics, and more for a variety of sports: Football, Basketball, Tennis, Baseball, American Football, Badminton, along with sports predictions faster than TV viewers!
UniScore covers a wide range of sports events, from major to minor tournaments worldwide, including Premier League, Serie A, La Liga, Bundesliga, Ligue 1, and more.

Key Features
•  All Matches: Real-time updates for all matches today; easily check match info from previous days.
•  Ongoing Matches: Continuously update scores & results from thousands of global sporting events. Just tap to view stats, team lineups, H2H, live simulation.
•  Favorites: Follow your favorite teams and matches to get real-time updates.
•  Instant Notifications: Faster than live broadcast – customize notifications for goals, lineups, results, red cards, yellow cards, corners, and more.
•  Tournaments: Detailed database from over 200 countries – check match details, teams, players, stats, and real-time results anytime.
•  Heatmap: Visually display player activity and contributions on the field.
•  Player & Team Comparison: Compare player and team stats for a comprehensive view.
•  Search Function: Quickly search for teams, players, tournaments, or matches you are interested in.
•  Pre-match Analysis & Stats: Provides comprehensive historical data and performance comparisons to assist in predictions.
•  Match Highlights: Watch key moments such as goals, red cards, yellow cards… right after the event via official YouTube highlight videos from the tournament.

Why Choose UniScore
•  Faster than TV: Instantly update every goal, card, substitution.
•  In-depth & Accurate Stats: From historical data to detailed player and team statistics.
•  Smart Analysis: Compare, view heatmaps, and pre-match analysis to easily predict outcomes.
•  Global Coverage: Over 200 countries, thousands of major and minor tournaments.
•  Personalized Notifications: Customize to never miss the moments that matter to you.
•  User-friendly Interface: Easy to use, optimized for daily sports following.

More Sports
•  Football: Over 2,600 football leagues, more than 37,000 teams (including Premier League, UEFA Champions League, Serie A, La Liga, Bundesliga, MLS, National Cup, FA Cup, English League Cup, Europa League, League One, Coppa Italia, etc.)
•  Basketball: NBA, EuroLeague, FIBA World Cup, Stoiximan Basket League (Greece), Serie A (Italy), Liga ACB (Spain)
•  Tennis: ATP Tour, WTA Tour, Grand Slam (Australian Open, French Open, Wimbledon, US Open), Davis Cup
•  Baseball: MLB, LMB (Mexico), Pro Yakyu - NPB (Japan)
•  Badminton: BWF World Tour, BWF World Championships, Thomas Cup, Sudirman Cup
•  American Football: NFL, NCAA (College Football)

Need Support or Have Feedback?
•  Please email us at: info@uniscore.com",2024-04-16T07:00:00Z,2025-11-08T01:49:54Z
vn,Viet Nam,Sports,6004,18,6747909464,VDPR,Truong Tran Xuan,https://apps.apple.com/vn/app/vdpr/id6747909464?uo=4,0.0,4.66667,12,Sports,"Tham gia giải đấu VietNam doubles pickleball ranking, xem bảng xếp hạng, vinh danh thành viên đạt thành tích, tìm huấn luyện viên, trọng tài, giao lưu với các vận động viên pickleball trên khắp lãnh thổ Việt Nam.",2025-08-05T07:00:00Z,2025-11-08T20:15:23Z
vn,Viet Nam,Sports,6004,19,1005593631,Melbet: Live Sports Betting,Pelican Entertainment B.V.,https://apps.apple.com/vn/app/melbet-live-sports-betting/id1005593631?uo=4,0.0,2.98936,188,Sports,"Melbet: Your All-in-One Sports Hub
The Melbet app brings together the excitement of sports and the thrill of live betting — all in one sleek, powerful platform. Follow your favorite teams, place bets on major sporting events, and watch live broadcasts right from your phone.

Whether it’s football, basketball, cricket, or eSports. Melbet gives you instant access to a wide range of matches and tournaments, making it easy and exciting for both new players and experienced bettors.

Installation takes just minutes — with a stable internet connection, you’ll be ready to join the action in no time. Create a new account or log in with your existing one, then enjoy smooth navigation, full coverage of sports events, and never miss a match again.

What You Can Do with Melbet

- Bet on Every Sport You Love: Football, basketball, cricket, eSports, and more.
- Watch Live, Bet Live: Stream matches and place bets in real time.
- Fast & Secure Betting: Licensed, protected, and optimized for seamless play.
- Daily Rewards & Promotions: Get access to exclusive offers and bonuses.

Designed for You

- Play in Your Local Currency: Easy deposits and withdrawals.
- Trusted Payment Options: Local and international methods available.
- Choose Your Language: Available in English, French, Arabic, Hindi, Spanish and Vietnamese.
- 24/7 Support: Get help anytime you need it.
- Bet Local, Win Global: Access tournaments and matches close to home.

Download Melbet today and experience the ultimate mix of sports action and live betting — anytime, anywhere.",2023-02-23T08:00:00Z,2025-10-24T06:59:17Z
vn,Viet Nam,Sports,6004,20,6745506058,1xBet - Sports Betting Online,Lemureda,https://apps.apple.com/vn/app/1xbet-sports-betting-online/id6745506058?uo=4,0.0,3.57143,7,Sports,"Unlock your winning potential with 1xBet, where exceptional betting meets extraordinary rewards! Join millions of passionate sports bettors worldwide who trust our secure, licensed platform to deliver an unmatched betting experience.

Begin your journey with a variety of exciting bonuses and seasonal promotions designed to maximize your opportunities and keep the excitement going all year round. From generous welcome bonuses to unique seasonal offers, 1xBet continually delivers thrilling incentives to boost your bets and enhance your overall experience.

As a globally recognized brand, 1xBet is honored to sponsor leading sports clubs and renowned events including FC PSG, FC Barcelona, Serie A, and the prestigious CAF Africa Cup of Nations. These partnerships underscore our commitment to excellence, ensuring you have direct access to the elite action and thrilling opportunities.

Our advanced sportsbook platform delivers exceptional functionality, providing you with extensive betting options, highly competitive odds, and real-time live scores. Feel the thrill of live sports action by streaming your favorite football matches, captivating UFC bouts, and exciting MMA events seamlessly through our integrated match streaming service.

Stay ahead of the competition with in-depth sports statistics and up-to-the-minute football results. From Premier League excitement and Bundesliga intensity to the prestige of the Champions League and the thrill of the NBA, NHL, UFC, and esports competitions, 1xBet arms you with precise information and expert insights.

Don't wait for another moment—download the 1xBet app today, sign up quickly, and join an exclusive global community of sports betting winners. Step into the action with 1xBet and transform every bet into a winning opportunity!",2025-10-07T07:00:00Z,2025-10-10T17:53:05Z
vn,Viet Nam,Sports,6004,21,1123926884,GPS Altimeter - Altitude & Map,ExaMobile S.A.,https://apps.apple.com/vn/app/gps-altimeter-altitude-map/id1123926884?uo=4,0.0,4.78723,94,Sports,"Altimeter is a smart tracking device, used to altitude measure. It is perfect app for people who love hiking, skiing, mountain biking and other outdoor activities. Any time and with high precision you can check altitude, elevation or localization coordinates. It works online and offline.

This altimeter app, to measure altitude uses:
- GPS satellites triangulation - works without internet connection, 
- barometer pressure sensor (if available in your device) - high accurate data; if internet connection is available it calibrates itself to improve accuracy, 
- online networks location services (wifi and other) - need internet connection.

You can use each sensor separate or all together.

App altitude meter includes the following features:
- accurate measurement of altitude - indication in meters or feet
- recording sports activities with a map of the route traveled
- record of: lowest (low), highest (max) altitude
- smart mini compass
- full GPS coordinates - latitude and longitude
- current localization name and state
- results of measurements are shown in the chart
- ability to stop and record the results of measurements at any time
- invert background color (black and white)
- sharing with others your achievements (photo taking function with the current altitude above sea level)

You can activate in app the Premium version which includes:
- No ads in the entire application
- Activity stats (speed, calories, etc.)
- Checkpoints
- Analog drum-type aircraft altimeter
- Full history and archives of measurements
- Tracking map with altitude chart
- Sunrise and sunset times
- No watermark on the picture
- Copying and sharing coordinates and map link

Information:
This apps works in the background to proper operation uses GPS. Continued use of GPS running in the background can dramatically decrease battery life.

Enjoy with this altimeter app !",2016-07-21T21:57:09Z,2025-09-10T04:50:30Z
vn,Viet Nam,Sports,6004,22,766443283,Flashscore: Live Scores & News,Livesport s.r.o.,https://apps.apple.com/vn/app/flashscore-live-scores-news/id766443283?uo=4,0.0,4.8731,14050,Sports,"Your ultimate live scores and sports news app. Goals, scores, and stories, all on Flashscore. Follow all the latest highlights across the world of sport, including football, tennis, basketball, hockey and much more. Choose from 30+ sports and 6000+ competitions and our tailored notifications will let you know about every important action of the match. 
 
Download Flashscore now and read the game like no one else!

Key features:
• Fastest live results: Get real-time updates with detailed statistics, xG data, unique player and team ratings, live standings and match updates.
• In-depth sports news: Stay informed with exclusive interviews, transfer news & rumours, and in-depth data analysis.
• Personalized favourites: Receive top news notifications, goal alerts, and customized reminders for your favourite teams, competitions or matches.
• Follow your favourite players: Add them to your list and allow notifications so that you never miss their presence in the starting lineup, goals, bookings or ratings.
• Expert match previews: Access selected opportunities and stats to enhance your sports prediction accuracy.
• Predicted lineups: Stay one step ahead and find out who is likely to start in the upcoming match given current form, unexpected injuries or lineup changes.
• Detailed player stats: Check out expected goals (xG), expected assists (xA), the number of shots, passes, touches, chances created, tackles, saves and other key statistics for all the players that appear on the pitch.

LIVE SPORTS SCORES & NEWS, FAST AND ACCURATE

• SPEED: Whether a goal is scored, red card issued, set or period is over, you will know at the same time as the live audience.

• DATA-DRIVEN NEWS: Breaking news and detailed coverage with unique sports data visualizations, tactical insights, expert opinions or featured articles.

• GREAT COVERAGE: You can find football live scores, tennis scores, basketball results, hockey online, golf leaderboard and more than 30 other sports (snooker, baseball, MMA ...) in our app. 


Coverage of major global events & local competitions: 
Football: Premier League, Championship, League One, League Two, FA Cup, LaLiga, Serie A, Bundesliga, Champions League (UCL), Europa League, Europa Conference League, Club World Cup
Tennis: ATP/WTA Tour tournaments including Grand Slams (Australian Open, French Open, Wimbledon, US Open), ATP Finals, Davis Cup
Basketball: NBA, Euroleague, ACB, LNB, Lega A, World Cup
Hockey: NHL, DEL, SHL, IIHF World Championship
Darts: PDC World Championship, Premier League Darts, PDC Grand Slam, World Matchplay, UK Open, World Grand Prix
Golf: British Open (The Open), Masters, US Open, PGA Championship, Ryder Cup, Players Championship
Baseball: MLB, KBO, NPB, KBO, LVBP, LMB, World Baseball Classic
Snooker: World Championship, UK Championship, The Masters
Volleyball: SuperLega, Nations League, Nations League Women, CEV Champions League
Badminton: BWF World Championships, Thomas Cup, Uber Cup, Sudirman Cup
Darts: PDC World Championship, Premier League Darts, PDC Grand Slam
Motorsport: Formula 1 (F1), MotoGP, Moto2, Nascar, Dakar
MMA: UFC, Bellator MMA, KSW, Оktagon MMA, PFL, ONE Championship


NO MORE MISSED MATCHES OR UPDATES

• FAVOURITE TEAMS AND MATCHES: Don’t waste your time, and follow only your favourite matches, teams and competitions.

• NOTIFICATIONS AND ALERTS: Match starts, line-ups, goals - you will not miss any of it again. Just select your favorite matches and wait for your mobile device to let you know.


LIVE RESULTS, TABLES AND MATCH DETAILS

• LIVE COMMENTARY: Unable to watch the match on TV? No problem: stay up-to-date with our detailed live text commentary.

• LIVE TABLES: One goal can change a lot. Our live standings will show you if a scored goal has changed the league ranking, as well as the current top scorers table.


Terms of Use: https://livesport.eu/terms-of-use/en-gb
Privacy Policy: https://livesport.eu/privacy-policy/en-gb",2013-12-06T04:50:49Z,2025-10-30T12:25:25Z
vn,Viet Nam,Sports,6004,23,6737461794,VGC Caddie,VIET NAM GOLF SERVICES CORPORATION,https://apps.apple.com/vn/app/vgc-caddie/id6737461794?uo=4,0.0,5,1,Sports,"Caddie App is a comprehensive solution designed specifically for caddies in golf tournaments. Key features include:
Live Score Entry: Easily record scores for tournaments and matches.
VGA Code and Membership Fee Transactions: Quick, transparent, and hassle-free trading.
Sales Tracking: Clear and intuitive insights into sales performance from VGA code and membership fee transactions.

The VGC Caddie application is developed with the vision of building a strong caddie community in Vietnam, connecting over 70,000 caddies in the golf industry. We aim to create a comprehensive environment where caddies can work, learn, exchange expertise, share experiences, and participate in in-depth forums about golf and caddie-related work.

This is the first version, focusing on core functionalities such as entering scores for golfers. In future updates, we plan to expand the app with exciting features such as a dedicated social network, live chat, event organization, and expert insights within the field.

Our goal is to popularize the application not only across Vietnam but also to expand to international markets, becoming a platform that connects the global caddie community.",2025-02-04T08:00:00Z,2025-09-17T05:58:41Z
vn,Viet Nam,Sports,6004,24,1012871328,得物 - 得到美好事物,"Shanghai Dewu Information Group Co., Ltd.",https://apps.apple.com/vn/app/%E5%BE%97%E7%89%A9-%E5%BE%97%E5%88%B0%E7%BE%8E%E5%A5%BD%E4%BA%8B%E7%89%A9/id1012871328?uo=4,0.0,4.86644,599,Sports,"得物App是集潮流装备、潮流商品鉴别、潮流生活社区于一体的新一代潮流网购社区。 
-鉴别服务开创者- 
得物App在传统电商模式的基础上添加“鉴别服务”，实现“先鉴别，后发货”的购物流程。“多道鉴别查验工序”的平台品控，为新世代消费者带来更安心的网购体验。 
-潮流网购- 
得物App签约了数百位业内具有多年以上经验的潮流商品鉴别师。鉴别师除了是骨灰大神级Sneaker玩家和潮人，更是潮流领域的“研究人员”。通过对球鞋、服装、配饰、潮玩、数码3C、美妆等产品进行系统性研究，包括资料收集、数据对比、档案建立、样本拆解和仪器检测等，力保鉴别的准确性。还设有独立的查验环节，对存在瑕疵的商品进行排查，拦截明显瑕疵商品，针对存在微小瑕疵的商品与用户提前一对一沟通，确保用户购买到经鉴别查验为无瑕疵商品。 
• 潮流单品：得物App目前支持交易的潮流单品品类丰富。 
• 竞价模式：得物App采取商品竞价出价的平台交易模式，竞价模式提供了每个用户获得公平交易机会。 
• 商品3D全息空间：得物App采集球鞋的3D影像展示。用户浏览实现可操控式自转，720度无死角查看单品的材质、图案、纹理、设计细节，为用户打造不一样的沉浸式购物体验。 
-潮流生活社区- 
得物App致力于打造年轻人的潮流生活社区，成为中国潮流文化风向标和年轻人的发声阵地。得物App社区聚集了一众明星以及潮流圈内数百位知名KOL。我们以球鞋和时尚话题作为潮流文化的切入点，持续沉淀潮流向内容，培育潮流文化沃土。得物App社区积极拓展符合年轻人消费观的品类内容，深度挖掘年轻人处于萌芽期的兴趣点。 

了解更多得物App相关，可通过以下方式： 
官方微博：得物App 
官方抖音：得物App 
微信公众号：得物App 
微信小程序：得物App 
意见反馈：打开得物App-我-设置-反馈与建议",2015-07-24T11:00:28Z,2025-11-12T02:01:06Z
vn,Viet Nam,Sports,6004,25,1567932355,DUPR,DUPR LLC,https://apps.apple.com/vn/app/dupr/id1567932355?uo=4,0.0,4.7027,37,Sports,"DUPR uses an innovative rating algorithm engineered to grow the sport of pickleball with a commitment to accuracy, transparency, and adaptability.


LOG MATCHES

Start increasing your rating today by registering and recording all your matches!
Log your recent matches. Once you’re done, your opponent will be prompted to verify scores via email.


GET YOUR DUPR
 
Your rating will be updated immediately once your scores are verified by your opponent 
You may review your match history at any time.
 

FIND PLAYERS NEARBY 

Browse DUPR user profiles - see the match history, ratings, and approximate location of potential opponents and teammates.


Subscription Information

DUPR offers in-app subscriptions that provide exclusive features, an ad-free experience, and other benefits.


EULA

https://www.apple.com/legal/internet-services/itunes/dev/stdeula/",2022-11-08T08:00:00Z,2025-11-17T15:15:41Z
