country,country_name,category,genre_id,rank,app_id,app_name,developer,url,price,averageUserRating,userRatingCount,primaryGenreName,description,launch_date,update_date
ye,Yemen,Social Networking,6005,23,6448329713,Yaahlan,Mana Games HK Limited,https://apps.apple.com/ye/app/yaahlan/id6448329713?uo=4,0.0,4,7,Social Networking,"Welcome to Yaahlan!
Yaahlan is an exclusive social and entertainment hub designed specifically for Arabic users, featuring real-time voice chat, a variety of popular games, and continuous online gatherings. Here, you can freely converse and enjoy fun times with your friends.
Whether you're looking to pass the time or have fun, Yaahlan has everything you need!
Yaahlan offers a selection of the most popular games for you and your friends, including Ludo, Carrom, Snakes and Ladders, Quiz, and more—all free to play. Plus, you can engage in voice chats with friends while you play.

Amazing Features
[VOICE CHAT ROOM]
Join a group chat room and chat with friends anytime, anywhere.
Create your own chat rooms and invite friends to share enjoyable moments together.
Experience real-time voice chat with fascinating gifts.

[VARIOUS FUN GAMES]
Discover an expansive selection of games including Ludo, Carrom, Snakes and Ladders, Quiz, Domino, Eightball, Chess, and more—all available for you to play for free with friends.
Easily find fellow gamers to join as partners or challenge in competition.
Enjoy gaming within a chat room environment, enhancing your fun and interactive experience.

[STUNNING GIFTS EFFECTS]
Explore a variety of unique and extraordinary gifts, exclusively curated to let you showcase your personality and show support to your friends.
Experience cool entrance effects that ensure all eyes are on you, making you feel like a true rock star.

[FUNNY ACTIVITIES]
Join us for a variety of activities held weekly and during festivals. With Yaahlan, there's always something interesting to discover and endless opportunities for happiness.

Experience the thrill of Yaahlan! Engage in voice chats online, enjoy free real-time discussions, and join group chat rooms. Dive into exciting PK challenges, send cool gifts, and explore amusing games. 
Start your unique and delightful journey with us. Join Yaahlan now!

Stay updated and connected! Follow us on social media:
Facebook: https://www.facebook.com/profile.php?id=61568419767074
Instagram: https://www.instagram.com/yaahlan_official
X: https://x.com/YaahlanOfficial
TikTok: https://www.tiktok.com/@yaahlan_official
Youtube: https://www.youtube.com/@YaahlanOfficial/shorts
Email: yaahlanteam@outlook.com",2023-05-30T07:00:00Z,2025-11-21T02:43:10Z
ye,Yemen,Social Networking,6005,24,6736635978,Saada - Live Chat Party,FUNI. PTE. LTD.,https://apps.apple.com/ye/app/saada-live-chat-party/id6736635978?uo=4,0.0,3.78261,23,Social Networking,"Welcome to Saada!
 
In Saada, we offer you:

Real people connection: In Saada, you will be building connections with real people through texting, and voice chatting. All the information is verified so that a safe and reliable social life is guaranted.

Live Group Voice Chatroom: In Saada, every member can join any room that appeals to them or they can creat their own unique room for other intrigued people to join. Come and get in various chatrooms that  sparks you passion and brings you joy with interesting people around the world!

Fascinating  gifts and medals: In Saada, you will have access to all delicate and fascinating giftd and medals to show your adoration on any special occasion. Show them your love with our distinguished gifts!

Peaceful and respectful community: In Saada, we are dedicated to creating and mainting the harmony in our community. Everyone will have to obey the rules and respect each other. Any harm to others will not be tolerated.

Authenticity and reliability: In Saada, we truly value your experience with us. Every registered user must be strictly verified of their authenticity and reliability for the safety and harmony of our community.

Come and join Saada community and help us build the loving family together!",2024-10-27T07:00:00Z,2025-11-17T02:33:17Z
ye,Yemen,Social Networking,6005,25,1484366079,TwitterIt for Twitter X,BEST SOCIAL APPS DEVELOPMENT LTD,https://apps.apple.com/ye/app/twitterit-for-twitter-x/id1484366079?uo=4,0.0,4.28713,303,Social Networking,"Enhance your experience with Twitter X using this app. TwitterIt is the all-in-one tool designed to give you more control, better performance, and a smoother way to explore and post content. Whether you’re a content creator, social media enthusiast, or just a casual user, this app adds the features you’ve always wanted — all in one streamlined interface.

Key Features:

1. Smart Hashtag Suggestions
Struggling to get your posts noticed? This app analyzes your content in real time and offers intelligent hashtag recommendations based on popularity, relevance, and current trends. No more guessing — just effective, optimized visibility.

2. Advanced Search Tools
Quickly find exactly what you’re looking for. This app allows you to search content by username, keyword, hashtag, or specific dates. Whether you’re hunting for old posts, tracking conversations, or researching a topic, it’s all accessible and easy to filter.

3. Custom Fonts for Unique Posts
Want to make your content stand out in the feed? This app includes a set of stylish, creative fonts that you can use to give your text personality and flair. Express yourself beyond the standard format — no technical knowledge needed.

4. Download Media from Posts
Save images, GIFs, and videos from any public post directly to your device. Whether it’s for inspiration, reference, or sharing elsewhere, you can collect and organize media easily and securely — with no third-party downloaders or links.

5. Live News & Updates Feed
Always stay in the loop. This app aggregates the latest news, articles, and feature updates related to the platform — including changes to features, policy shifts, and cultural trends. It’s a central place to stay informed without having to jump between multiple websites.

6. Intuitive User Experience
This app is built with clarity and speed in mind. No clutter, no confusing menus — just a clean design with smart tools that feel like a natural extension of the official platform.

7. Lightweight & Privacy-Focused
There are no trackers, no unnecessary background activity, and no login required to access most features. You stay in control of your data while enjoying powerful capabilities.

Why You’ll Love This App:
	•	Saves you time when writing and publishing
	•	Helps your content reach more people with relevant hashtags
	•	Makes your posts visually unique and more engaging
	•	Simplifies media collection and content organization
	•	Gives you a clearer understanding of what’s happening on the platform
	•	Offers a smoother, more powerful interface to interact with the social space you already use

This app is perfect for influencers, marketers, community managers, trend hunters, or anyone who enjoys diving deeper into online conversations.

Disclaimer:
This app is not affiliated with, endorsed by, or officially connected to X Corp. The use of any references to “Twitter” or “X” is solely for descriptive purposes to indicate compatibility. All trademarks and brand names belong to their respective owners.

Terms of Use:
https://www.freeprivacypolicy.com/live/0df9eab2-acb2-42fc-bb47-5d3335501e94
Privacy policy:
https://www.freeprivacypolicy.com/live/77cf3e03-5741-47b8-8926-20d82f800077",2019-10-28T07:00:00Z,2025-10-26T13:02:29Z
