country,country_name,category,genre_id,rank,app_id,app_name,developer,url,price,averageUserRating,userRatingCount,primaryGenreName,description,launch_date,update_date
ye,Yemen,Finance,6015,25,283646709,"PayPal - Send, Manage, Pay","PayPal, Inc.",https://apps.apple.com/ye/app/paypal-send-manage-pay/id283646709?uo=4,0.0,4.63265,98,Finance,"There’s never been a better time to check out PayPal, the trusted way to pay
Say hello to PayPal+, our free loyalty programme that helps you make the most of your money every time you shop with PayPal

SEND & RECEIVE MONEY​
A simple, secure way to quickly send & receive money to friends and family. With encryption technology, we go the distance to help make sure your money transfers are secure

ITS LOYALTY FOR ALL. AND ITS ALL FOR FREE
PayPal+ is the loyalty programme that rewards you with more points, in more ways. Use them almost anywhere PayPal is accepted. And it’s all for free, with no fees and no caps*​
*Rewards are earned as points under the PayPal+ rewards programme. To start earning, you must be enrolled in PayPal+. If you are not yet enrolled, you can sign in the PayPal app. PayPal+ Terms and conditions apply.

MULTIPLY YOUR POINTS WITH THE PAYPAL DEBIT CARD​
Earn up to 10x PayPal+ points when you pay with your PayPal Debit Card, everywhere Mastercard® is accepted. Add it to your mobile wallet, use it in person, and at PayPal checkout to watch your points grow*​
* Set up and activation required. Terms and conditions apply

BUY NOW, PAY LATER​
Keep track of all your PayPal Pay in 3 repayments.* Plus, earn points whenever you use Pay in 3
*Pay in 3 subject to status. Unregulated credit. Available for purchases £20-£3000. Consider if affordable and impact on other borrowing

SEND MONEY GLOBALLY
Send money to friends and family abroad in over 110 countries – or get even more delivery options with Xoom
*Fees and restrictions apply. Transaction, currency conversion, and other fees may apply

MANAGE YOUR SUBSCRIPTIONS ​
Keep track of your different subscriptions at the subscription hub. Easily view, update, or cancel subscriptions, while enjoying updates on recurring payments. Manage recurring payments all in one place. 

POOL MONEY TOGETHER​
Collect money in advance for group gifts, shared experiences, and more and skip the hassle of reimbursement afterward.​
*An account with PayPal is required to create a Pool. Terms and limits apply

PAY HOW YOU WANT​
Add your debit or credit cards* or link your bank accounts for extra flexibility at checkout. You’ll even be able to continue collecting rewards points**
*Using your credit card through your PayPal wallet may impact your rights under Section 75 of the Consumer Credit Act. This means you may lose the right to hold the merchant or your credit card provider jointly liable if you don’t get the goods or services you paid for (if they cost between £100 and £30,000)​
**Subject to issuer’s applicable reward programme terms and conditions

PayPal UK Ltd is authorised and regulated by the Financial Conduct Authority (FCA) as an electronic money institution (firm reference number 994790); in relation to its regulated consumer credit activities (firm reference number 996405); and for the provision of cryptocurrency services (firm reference number 1000741). Some products and services, such as PayPal Pay in 3 and PayPal Working Capital, are not regulated by the FCA and may offer a lower level of protection. Please read product terms for further details. PayPal UK Ltd's company number is 14741686. Its registered office is 5 Fleet Place, London, United Kingdom, EC4M 7RD",2019-02-03T08:00:00Z,2025-11-17T16:24:16Z
