country,country_name,category,genre_id,rank,app_id,app_name,developer,url,price,averageUserRating,userRatingCount,primaryGenreName,description,launch_date,update_date
ms,Montserrat,Entertainment,6016,22,936971630,YouTube Kids,Google LLC,https://apps.apple.com/ms/app/youtube-kids/id936971630?uo=4,0.0,5,3,Entertainment,"Inspire your children to uncover their unique interests
Help your children explore video content that they love and that parents trust, in an app made just for children. With easy navigation tools and a suite of features, you can help your children spend time online uncovering new interests, unleashing their imagination and building their confidence in their own unique world.

Help your children grow at their own pace
Your children are unique, so they should only see content that they're ready to explore. Decide what videos will help them make the most of their time online, then personalise individual profiles using custom content filters as they grow.

– Help your youngest children learn their ABCs, nurture their curiosity and more in 'Preschool' mode.
– Expand your children's interests to songs, cartoons or DIY crafts in 'Younger' mode.
– Give your older children the freedom to search popular music and gaming videos in 'Older' mode.
– Or, hand-pick the videos, channels and collections that your children can see in 'Approved content only' mode.

Rewatch videos and bond over favourites
Quickly find your children's favourite videos and the content that you've shared with them in the 'Watch it again' tab.

Shape your children's viewing experience with parental controls
Parental control features help you limit what your children watch, and better guide their viewing experience. Our blocking process aims to help keep videos on YouTube Kids family-friendly and safe – but each family's preferences are unique. Don't like a video or channel, or see inappropriate content? Flag it for our team to review.

Set a screen-time limit
Encourage your children to take a break in between exploring content. Use the 'Timer' feature to freeze the app when screen time is up so that your children can apply their new skills to the real world.

See important information
– Parental setup is needed to ensure the best experience for your family.
– Children may see commercial content from YouTube creators that are not paid ads.
– See the Privacy Notice for Google Accounts managed with Family Link for information on our privacy practices for signing in with a Google Account.
– If your children use the app without signing in with their Google Account, the YouTube Kids Privacy Notice applies.",2021-09-30T07:00:00Z,2025-11-17T17:59:24Z
ms,Montserrat,Entertainment,6016,23,421997825,Talking Tom Cat 2,Outfit7 Limited,https://apps.apple.com/ms/app/talking-tom-cat-2/id421997825?uo=4,0.0,3.33333,3,Entertainment,"The legend is back! Talking Tom Cat 2 is better, cooler, and funnier than ever before!

With over a billion downloads and counting, Talking Tom Cat 2 is popular all over the world. Don’t miss all the fun this cool game has to offer. Get your own cute and funny virtual pet now!

Talk to Talking Tom, play with him, poke him, and dress him in cool outfits. Customize his home. And make funny videos and share them with your friends! Adopt him as your very own virtual pet and get instant fun in return!

ENJOY YOUR DAY WITH TOM
- TALK TO TOM: Speak and he repeats what you say in a hilarious voice. It’s so funny!
- PLAY WITH TOM: Stroke him, poke him, make him explode a paper bag, smash a pillow or even fart! The fun never ends with Tom.
- CUSTOMIZE TOM: Dress Tom up with new accessories, clothes, and outfits! How about Cowboy Tom or Pirate Tom?
- RECORD TOM: Record videos of what Tom does and send them to your friends.

Download the app now and join the fun!

To see what Tom’s up to, follow Talking Tom on Facebook: http://www.facebook.com/TalkingTom

This app is PRIVO certified. The PRIVO safe harbor seal indicates Outfit7 has established COPPA-compliant privacy practices to protect your child’s personal information. Our apps do not allow younger children to share their information.

This app contains:
- Promotion of Outfit7's products and advertising;
- Links that direct customers to Outfit7’s websites and other apps;
- Personalization of content to encourage users to play the app again;
- Videos of Outfit7's animated characters via YouTube integration; and
- The option to make in-app purchases.

Please note, we do not process all the data disclosed on the label for users under the age of digital consent. For more information, please check our Privacy Policy.

Terms of use: https://talkingtomandfriends.com/eula/en/
Privacy policy for games: https://talkingtomandfriends.com/privacy-policy-games/en
Customer support: support@outfit7.com",2011-07-10T10:40:24Z,2025-10-16T06:05:53Z
ms,Montserrat,Entertainment,6016,24,1477175837,MyID – One ID for Everything,"TELECOM INTERNATIONAL MYANMAR CO.,LTD",https://apps.apple.com/ms/app/myid-one-id-for-everything/id1477175837?uo=4,0.0,3,3,Entertainment,"MyID - Your one stop place for all your digital needs!

The more you use, the more you benefit! MyID will change how you live your digital life! 

MyID will change the way you connect;
-	You can send a message or make a high quality phone
-	Connect with your friends & family with Call-out & SMS to all Mytel subscribers
-	Thousands friends are around you. Enjoy the music together with new friends with exciting “Dating” feature.

MyID will change the way you entertain:
-	Never run of out entertainment! A large selection of entertainment built into MyID with thousands of songs, music video & video clips
-	Always keep up-to-date with all the hot trends and your favourite idols

MyID will change the way you are taken care:
-	Now you can manage many Mytel accounts and services at the same time. So convenient!
-	Earn points and exchange loyalty points for many benefits from Mytel and our partners. The higher you rank, the more benefit you gain!

Your one stop place for all your digital needs! The more you use, the more you benefit with many MyID features! It will change the way you live your digital world! Live more, get more with MyID. Set up your account today!

(*) MyID is a product of Mytel Telecom Myanmar.
(*) Hotline:
(*) Email:",2019-09-25T07:00:00Z,2025-11-19T03:23:33Z
ms,Montserrat,Entertainment,6016,25,1446075923,Disney+,"Disney Electronic Content, Inc.",https://apps.apple.com/ms/app/disney/id1446075923?uo=4,0.0,1,1,Entertainment,"Bring home a world of endless entertainment with Disney+, bringing you the latest releases from Disney, Pixar, Marvel, Star Wars, National Geographic and more.
 
Stream must-see Originals like The Mandalorian, Loki and The Bear, blockbusters like Encanto, Avatar and Guardians of the Galaxy as well as binge-worthy series like The Simpsons, Criminal Minds and Modern Family.
 
With Disney+, you'll enjoy:
• Brand new Originals, blockbusters and epic series added frequently
• Personalised recommendations based on your viewing preferences
• Robust parental controls for family-friendly viewing
• No hidden costs and the ability to cancel at any time*
 
For help with Disney+, please visit: http://help.disneyplus.com. 
For our Subscriber Agreement and other policies, please visit: https://disneyplus.com/legal/subscriber-agreement 
*Effective at the end of the billing period. 
The content available on Disney+ may vary by region.
Some titles shown above may not be available in your country.",2020-11-16T08:00:00Z,2025-11-13T02:13:47Z
