country,country_name,category,genre_id,rank,app_id,app_name,developer,url,price,averageUserRating,userRatingCount,primaryGenreName,description,launch_date,update_date
id,Indonesia,Sports,6004,1,1323924315,Reclub - Social Sports Nearby,Reclub PBC,https://apps.apple.com/id/app/reclub-social-sports-nearby/id1323924315?uo=4,0.0,4.89571,4104,Sports,"Looking for a pickleball club near you? Maybe a swing coach to improve your game? Maybe you’re new to the city and want to join a volleyball league. Reclub is the app that’s powering the global sports community.

Use Reclub to:

DISCOVER. Find sports near you. Pick your city + sport to find other players who love the game as much as you do.
MEET. Make an activity. Play a round robin. Invite your friends to come to the court and join the fun.
RUN A CLUB. Club management made easy. Round robins, leagues and social drop-ins, all done in a few taps.
COMPETE. Setup pickleball tournaments. football competitions, or any other sport in a snap. Brackets, leagues and registration all in one place.
CHAT. Connect with the other athletes. Setup a drop-in with club members.

Terms of service: https://reclub.co/terms-of-service
Privacy policy: https://reclub.co/privacy",2018-08-04T02:27:10Z,2025-11-05T03:34:05Z
id,Indonesia,Sports,6004,2,1539581877,AYO: Super Sport Community App,PT Ayo Indonesia Maju,https://apps.apple.com/id/app/ayo-super-sport-community-app/id1539581877?uo=4,0.0,4.92079,2891,Sports,"Ayo Indonesia is a super sport app that connects players, fans, communities, and sports venue owners from all over Indonesia in one platform.

Through AYO App, you can book your favourite sports venues, find sparring partners, pick up games, competitions, while all your sport statistics such as goals and assists will be recorded!

What are the features available on AYO app?

SPORT VENUE BOOKING
- You no longer need to wait for the response from venue admins to find out venue availability, book directly from AYO app! 
- Large variety of sport venues available on Ayo App from different sports such as football, futsal, mini soccer and tennis. 
- You can choose to pay through down payment or full payment. 
- Various promotions are available when booking venues. 
- Payments can be made through Gopay, Alfamart and Virtual Bank Accounts. 

SPARRING
- Sparring platform with thousands of football, mini soccer, and futsal teams registered.
- Keep track of all your scores and key stats on our platform
- Gamified levels system to rank the quality of teams and players
- Keep playing and win more matches to level up!

OPEN PLAY
- Discover pick up games around your area to join.
- Want to host your own private or public matches? You can do that here!
- Online payment system to ensure all players have paid their match fee.

PROFILES, LEADERBOARD AND BADGES
- Keep track of all the activities and stats on your individual and team profiles.
- Level up through winning games and scoring more goals or assists!
- See how you and your team stack up against other teams on our leaderboard.
- Collect badges and show them off on your profile!
- Watch out for some cool badges to be earned!",2020-12-05T08:00:00Z,2025-11-04T14:41:53Z
id,Indonesia,Sports,6004,3,6737027746,Courtside. - Padel App,PT GIM MENYATUKAN BANGSA,https://apps.apple.com/id/app/courtside-padel-app/id6737027746?uo=4,0.0,4.70587,17,Sports,"Love playing padel but hate spending hours looking for a venue across 10 different websites, apps, and neighborhoods?

Join Courtside, the super sports app that connects padel players to coaches, events, and venues all over Indonesia in one user-friendly app.

Whether you already have friends to play with or are open to meeting new people on the court, Courtside gives you the opportunity to connect with like-minded players and existing friends in exciting venues anywhere in the +62 region. Courtside gives you the ability to create private matches and track who’s coming -  oh, and keep track of their scores as well! 

Playing Padel has never been easier! Search by location , and all that’s left to do is book, pay, and play – in as little as 3 minutes. Cover your court fees and pay via local payment partners. The slot you want is taken? No problem, just let the app notify you when it’s next available. You can also share your next booking through WhatsApp making it easier to remember.

If you’re on the hunt for exciting padel events, Courtside has you covered. Join events all over the country, showcase your mad skills, and have fun with new players all while exploring different clubs and venues. Communities grow, you get better as a player - win-win!

Come see what we have to offer - join us courtside.",2024-10-22T07:00:00Z,2025-11-18T21:00:46Z
id,Indonesia,Sports,6004,4,1447215452,HryFine,"Shenzhen United Power Technology Co., Ltd.",https://apps.apple.com/id/app/hryfine/id1447215452?uo=4,0.0,2.97076,171,Sports,"****Hryfine bracelets are non-medical devices. The measurement data and results are for reference only, not for diagnosis and treatment. * * * * *

Special Reminder: APP data is for reference only and is not used as a medical diagnosis. You should consult your doctor before using APP and making any medical decisions.

1, Home Sports: record your exercise data, set exercise goals and calculate whether the goal is achieved, steps, distance, calorie consumption, etc.;

2. Sleep monitoring: it can record the sleep duration and sleep quality in the set period, and count the duration of deep sleep, light sleep and awake, so that you can improve the sleep quality;

3. When the phone searches for the bracelet, the bracelet vibrates. Find the phone through the bracelet, phone vibration and ring reminder, in case of loss.

4. It can remind the user of important information such as call, SMS, WeChat and so on when connecting with the bracelet, to prevent missing important information, etc.;

5. Set an intelligent alarm clock for the bracelet to remind you of sitting for a long time. The bracelet vibrates to remind you to reduce the problems caused by sitting for a long time

6, Remote control photography mode, anytime and anywhere to record the beautiful moment

7, statistics your daily, monthly, weekly exercise, sleep, data display at a glance

8. You can set the bracelet to turn the wrist to light up the screen and light up the screen easily

9. Sports data report: make statistics of your sports data and average data in the last 30 days, as well as your sports standards in the last seven days, and generate reports for easy viewing of sports trends",2018-12-19T07:49:20Z,2025-11-19T01:42:17Z
id,Indonesia,Sports,6004,5,6478476238,Persija,"PERSIJA JAYA JAKARTA, PT",https://apps.apple.com/id/app/persija/id6478476238?uo=4,0.0,4.74638,138,Sports,"Halo, Jak

Selamat datang di Persija Apps, gerbang revolusioner Anda ke dunia digital Persija. Aplikasi ini akan membawa koneksi kamu dengan Macan Kemayoran ke level berikutnya.

Informasi Terkini, Tangan Pertama : Dapatkan berita terbaru, wawasan mendalam, dan semua yang perlu Anda ketahui tentang Persija. Rasakan denyut nadi klub setiap saat.

Tiket & Pertandingan Live di Ujung Jari : Tidak ada lagi ketinggalan momen emas! Dengan tiket mudah diakses dan update langsung pertandingan, Anda selalu menjadi bagian dari aksi.

Video Persija TV, Lebih Dekat dengan Tim: Langkah ke dalam dunia Persija dengan video eksklusif, wawancara, dan konten di balik layar yang hanya bisa Anda temukan di sini.

Transaksi Mudah dengan QRIS: Nikmati kemudahan bertransaksi, dari pembelian merchandise hingga tiket, dengan metode pembayaran QRIS yang cepat dan aman.

Persija Access : Program Loyalitas untuk Fans Sejati, setiap dukungan kamu untuk Persija kini berbalas. 

Kumpulkan poin loyalitas dan tukarkan dengan tiket gratis, merchandising eksklusif dan berbagai pengalaman tak terlupakan bersama Macan Kemayoran.

Unduh dan Jelajahi Sekarang. Jadilah bagian dari evolusi digital Persija. Persija Apps bukan hanya aplikasi, tapi jembatan yang menghubungkan Anda dengan setiap detak dan semangat Persija. Ayo, bergabunglah dengan kami dan rasakan revolusi digital Persija.",2024-03-05T08:00:00Z,2025-09-09T21:25:00Z
id,Indonesia,Sports,6004,6,1240095475,Persib,"PERSIB BANDUNG BERMARTABAT, PT",https://apps.apple.com/id/app/persib/id1240095475?uo=4,0.0,2.67646,2893,Sports,"Draw yourself closer to the Blue Prince with the Official PERSIB App! All PERSIB membership services, games, official latest news, live matches, goals, fixtures, league tables, player profiles, statistics and more are now at your fingertips.

Features:
- PERSIB match updates and notifications
- Registration and services for Official PERSIB Membership Card
- PERSIB TV: all official videos and player highlights
- Various games with prizes including Official PERSIB Merchandise",2017-06-06T13:51:34Z,2025-11-10T22:37:10Z
id,Indonesia,Sports,6004,7,1536633475,Americano Padel,Perkodar AB,https://apps.apple.com/id/app/americano-padel/id1536633475?uo=4,0.0,4.91038,279,Sports,"Did you try to play Americano with you Padel-friends? It's awesome!

This app will help you to organize your Americano tournament.

You just have to enter some basic information like the player names, how many courts you are playing on and how many points you are playing from. The app fixes the rest.
All matches are set up for all the rounds necessary for all players to play together with everyone.

The app now support 7 different kinds of Americanos. You can play;
* Normal Americano - All players plays one time with every player
* Mixed Americano - Every round is played with one woman and a man in every team, you play until all women have played in the same team as all men.
* Team Americano - You play as a team, you play until every team has played 1 time against every team
* Mexicano - A fun form of play with the premise that the matches should be as even as possible. The first match is drawn for the participants. After that, the matches are based on the scoreboard.
* Mixicano - Like Mexicano but you will always be drawn a woman and a man in each team!
* Team Mexicano - Like Mexicano but with fixed teams!
* Super Mexicano - Like Mexicano but you can get extra points the closer to the leader-court you are.
You can configure how many super-points you should get, and from what round it should happen.

Americano Padel is designed to support a versatile range of tournament sizes with optimum functionality for groups evenly divisible by 4, ensuring a smooth and enjoyable gaming experience for up to 32 players. For odd-numbered groups, the app is finely tuned to accommodate up to 9 players exceptionally well. There's no cap on participant numbers when diving into any Mexicano format or playing Team Americano, providing endless fun for everyone.

To play on more than one court a premium purchase is required 
Terms of Use: https://perkodar.se/terms",2020-10-22T07:00:00Z,2025-10-02T11:56:22Z
id,Indonesia,Sports,6004,8,356928178,LiveScore: Live Sports Scores,LiveScore Ltd.,https://apps.apple.com/id/app/livescore-live-sports-scores/id356928178?uo=4,0.0,4.85562,8603,Sports,"LiveScore keeps you up to date with the latest live sports scores and live sports action. Whether you are looking for scores, goals, fixtures or news, LiveScore is your one-stop destination for top football leagues. From Premier League and UEFA Champions League, to Eredivisie, Serie A, LaLiga and more, LiveScore has it all. Stay on top of the football season with live football scores!

LIVE NOTIFICATIONS
Get fast updates to keep track of live sports scores, goals, red cards and more for multiple matches and sports at the same time. Get all the details, football stats and live football scores for the Premier League, UEFA Champions League; scores for tennis matches and more. Manage your favourite sports & match notifications in your settings.

FOR YOU
Immerse yourself in a truly personalised experience when it comes to news and headlines. With all your favourites in one place, it’s the best way for you to cut the noise and stay informed on the teams and competitions that matter to you. Check the latest news and breaking headlines from across the world of sport. After all, it's made For You.

For You covers everything from the latest insights, football news, football stats, football results, post-match reviews, player transfers and previews of upcoming football fixtures from the PL, UEFA Champions League, LaLiga, Bundesliga, Serie A, Primeira Liga and Eredivisie.

COMPETITIONS
Search for competitions across the biggest sports. Including worldwide premier cups and leagues with match details and soccer and football scores for the PL, the FA Cup, UEFA Champions League, LaLiga, Serie A, Eredivisie and Bundesliga.

FAVOURITE LEAGUES AND TEAMS
Get to the scores, live results and sports match news you’re interested in. Favourite your team to follow their progress in the leagues and easily see past results or upcoming fixtures. Switch on live notifications for your favourited teams to keep track of all the action & news.

TEAM PAGES AND PLAYER STATS
View your team’s upcoming fixtures, live table standings, news, scores, videos of matches and Player Stats to check top scorers and more. Perfect for keeping up with news and scores of your favourite tennis players, or for your fantasy football team.

LIVE COMMENTARY (Unofficial) FROM LIVESCORE
Listen to live match commentary (unofficial) from the LiveScore team, covering everything from scores, assists, corners, cards and descriptions of the action on football matches.

WORLDWIDE SCORES AND SPORT
Find your international team and follow live football stats, football results and scores. More than 1,000 live football scores and football fixtures are followed every week.

LIVESCORE HORSE RACING
View horse racing results, upcoming race details, jockey, trainer and horse racing form details across UK, Ireland and international racecourses. Favourite upcoming horse races to easily view every horse and jockey in the field, receive live notifications with the winning horse.

DISCOVER AMERICAN FOOTBALL
New to LiveScore is American Football! Whether you're a seasoned fan or new to the game, we've got you covered with real-time game results, stats, and fixtures for your favourite teams and leagues, including the NFL & CFL. Stay updated on the action and follow every touchdown, tackle and triumph.

ABOUT LIVESCORE
Since 1998, LiveScore has been giving you real-time delivery of live sport scores & data. As leaders of live score updates, LiveScore is trusted and used daily by millions of users globally; specialising in the sports: football, soccer, tennis, cricket, basketball & hockey.",2010-02-22T20:51:15Z,2025-11-06T16:05:06Z
id,Indonesia,Sports,6004,9,1591724001,eFHUB 25,Nova Software Studio LTD,https://apps.apple.com/id/app/efhub-25/id1591724001?uo=4,0.0,3.60377,106,Sports,"Unofficial Companion App
This app is not a game. It is a powerful companion tool designed for football game enthusiasts who want to get more from their experience. Packed with databases, calculators, tutorials, and build tools everything you need to plan your dream team.

PLAYER DATABASE
Explore a detailed player database with smart tools to help you find top talent and understand their strengths.

View player stats at max level.

See dribbling skills with controller animations.

Understand how condition affects stats and ratings.

Instantly spot top 6 key stats on every player card.

Track player form throughout the season.

MANAGER DATABASE
Stay ahead with up-to-date manager formations and tactics.

Find managers who have changed tactics weekly.

Search based on offensive and defensive playstyles.

Use the formation search tool to find your perfect setup.

SQUAD BUILDER
Build squads like a pro, with full control over strength and cost.

Automatically calculate team strength for 2, 3, or 4-star builds.

Position players under different managers.

Save unlimited squads and experiment freely.

Use Auto Build for quick team generation.

Track contract cost totals for better squad planning.

GAME PLAN
Simulate off-the-ball movement in attack and defense to spot tactical strengths and weaknesses in your squad.

HIDDEN GEM FINDER
Discover underrated players with high potential and low contract renewal cost — perfect for long-term builds.

MY TEAM
Save your favorite players and managers to access quickly when building squads or browsing stats.

SKILL MOVE TUTORIALS
Learn how to perform dribbling skills step-by-step with controller animations — for both mobile and console players.

Disclaimer
This is an app designed for learning and planning purposes. It is not affiliated with or endorsed by any football game developer or publisher.",2021-11-04T07:00:00Z,2025-04-11T23:44:39Z
id,Indonesia,Sports,6004,10,1115211914,beIN SPORTS,"beIN Media Group, LLC",https://apps.apple.com/id/app/bein-sports/id1115211914?uo=4,0.0,4.64196,1349,Sports,"beIN SPORTS is the ultimate destination for sports fans — bringing you the latest news, videos, highlights, live scores, standings, and expert analysis on the teams, leagues, and stars you love.



What makes us different?



- Personalized for you: Select your favorite sports, leagues, and teams — we’ll serve the content that matters most.
- Stay in the game: Get real-time push notifications for goals, match updates, and key moments from your favorite teams.
- Exclusive access: Watch the latest highlights and goals from the world’s top leagues, only on beIN SPORTS.
- At a glance: Our news & results widget keeps the top stories and live scores just one tap away.",2017-05-15T10:52:24Z,2025-09-29T04:35:36Z
id,Indonesia,Sports,6004,11,6449657600,JETE CONNECT,Jhonny Thio Doran,https://apps.apple.com/id/app/jete-connect/id6449657600?uo=4,0.0,3.16867,83,Sports,"Jete connect is Jete smartwatch companion app
feature:
- Health Chart
- Sport
- Strava sync",2023-06-25T07:00:00Z,2025-11-20T21:28:01Z
id,Indonesia,Sports,6004,12,1477171291,AiScore - Livescore for Sports,ALLSPORTS TECHNOLOGY PTE. LTD.,https://apps.apple.com/id/app/aiscore-livescore-for-sports/id1477171291?uo=4,0.0,4.62521,1729,Sports,"AiScore is your Live score expert, bringing to you more information, more statistics and a completely new experience on your smartphone. Here you are even informed faster than the TV viewers!

With In-depth coverage of football, basketball, tennis and snooker, AiScore brings you live score,goals, yellow or red cards, H2H, fixtures, match live, team and player stats, standings, lineups and other important stats from English Premier League, Spanish La Liga, UEFA Champions League, NBA, FIBA, Basketball Champions League, ATP tennis, WTA tennis, World Snooker Championship - major or small leagues and competitions all over the world!

TOP HIGHLIGHTS:

*All Games - Follow all today's matches in real time. Also, you can check out the matches on specific day by DateTime Picker.

*Live - Stay up to date with all the latest scores and results from hundreds and thousands of games worldwide. Every score at a glance. Just tap the matchup for Box Score or Lineups, H2H and Match Live.

*Favorites - Choose your favorite team and competition on matchup and always be up-to-date.

*Instant Notification - Get instant notifications of goal, corner, red or yellow card, start, starting lineups and final results for all live or your followed matches. A pop-up window will appear to inform you of score changing when you turn on the ""Score Reminder”.

*Leagues - In-depth coverage of leagues, cups and tournaments from over 200 countries. Check out latest rankings, standings, team or player stats and more.

Football: Over 2,600 different football matches, over 37,000 teams (including Premier League, Champions League, Serie A, La Liga, Bundesliga, MLS, FA Cup, League Cup, Europa League, Championship and many more)

Basketball: Over 500 tournaments including FIBA Basketball World Cup, NBA, BCL

Tennis: Complete source for worldwide tennis matches including ATP, WTA

Snooker: Complete source for worldwide snooker matches including World Championship, UK Championship, Masters

*Chatroom - Get connected with other sports fans from all over the world. No game is boring if you can chat live.

*Language - 28 (more will be added)

""Need help? Email service@aiscore.com or Tap ""Feedback""

We are affiliated with aiscore.com

Stay Tuned:

Facebook: @Aiscoreapp

Twitter: @aiscoreofficial

Instagram: @aiscore_official

""Subscribe to “Get AiScore Premium” through the app. If you choose to subscribe, you will be charged a yearly or monthly subscription fee according to your country. The subscription fee will be shown in the app before you complete the payment. Your subscription will automatically renew every year or month at the then-current subscription fee unless auto-renew is turned off at least 24 hours before the end of the then-current subscription period. Your iTunes account will automatically be charged within 24 hours prior to the end of the then-current period. The subscription fee will be charged yearly or monthly. You can turn off auto-renew at any time from your iTunes account settings.

Privacy policy: https://m.aiscore.com/policy
Terms of use: https://www.apple.com/legal/internet-services/itunes/dev/stdeula/""

For developers, please contact www.thesports.com for sports data solution.

For business inquiry, email business@aiscore.com",2019-09-25T07:00:00Z,2025-11-17T05:49:20Z
id,Indonesia,Sports,6004,13,766443283,Flashscore: Live Scores & News,Livesport s.r.o.,https://apps.apple.com/id/app/flashscore-live-scores-news/id766443283?uo=4,0.0,4.87504,9115,Sports,"Your ultimate live scores and sports news app. Goals, scores, and stories, all on Flashscore. Follow all the latest highlights across the world of sport, including football, tennis, basketball, hockey and much more. Choose from 30+ sports and 6000+ competitions and our tailored notifications will let you know about every important action of the match. 
 
Download Flashscore now and read the game like no one else!

Key features:
• Fastest live results: Get real-time updates with detailed statistics, xG data, unique player and team ratings, live standings and match updates.
• In-depth sports news: Stay informed with exclusive interviews, transfer news & rumours, and in-depth data analysis.
• Personalized favourites: Receive top news notifications, goal alerts, and customized reminders for your favourite teams, competitions or matches.
• Follow your favourite players: Add them to your list and allow notifications so that you never miss their presence in the starting lineup, goals, bookings or ratings.
• Expert match previews: Access selected opportunities and stats to enhance your sports prediction accuracy.
• Predicted lineups: Stay one step ahead and find out who is likely to start in the upcoming match given current form, unexpected injuries or lineup changes.
• Detailed player stats: Check out expected goals (xG), expected assists (xA), the number of shots, passes, touches, chances created, tackles, saves and other key statistics for all the players that appear on the pitch.

LIVE SPORTS SCORES & NEWS, FAST AND ACCURATE

• SPEED: Whether a goal is scored, red card issued, set or period is over, you will know at the same time as the live audience.

• DATA-DRIVEN NEWS: Breaking news and detailed coverage with unique sports data visualizations, tactical insights, expert opinions or featured articles.

• GREAT COVERAGE: You can find football live scores, tennis scores, basketball results, hockey online, golf leaderboard and more than 30 other sports (snooker, baseball, MMA ...) in our app. 


Coverage of major global events & local competitions: 
Football: Premier League, Championship, League One, League Two, FA Cup, LaLiga, Serie A, Bundesliga, Champions League (UCL), Europa League, Europa Conference League, Club World Cup
Tennis: ATP/WTA Tour tournaments including Grand Slams (Australian Open, French Open, Wimbledon, US Open), ATP Finals, Davis Cup
Basketball: NBA, Euroleague, ACB, LNB, Lega A, World Cup
Hockey: NHL, DEL, SHL, IIHF World Championship
Darts: PDC World Championship, Premier League Darts, PDC Grand Slam, World Matchplay, UK Open, World Grand Prix
Golf: British Open (The Open), Masters, US Open, PGA Championship, Ryder Cup, Players Championship
Baseball: MLB, KBO, NPB, KBO, LVBP, LMB, World Baseball Classic
Snooker: World Championship, UK Championship, The Masters
Volleyball: SuperLega, Nations League, Nations League Women, CEV Champions League
Badminton: BWF World Championships, Thomas Cup, Uber Cup, Sudirman Cup
Darts: PDC World Championship, Premier League Darts, PDC Grand Slam
Motorsport: Formula 1 (F1), MotoGP, Moto2, Nascar, Dakar
MMA: UFC, Bellator MMA, KSW, Оktagon MMA, PFL, ONE Championship


NO MORE MISSED MATCHES OR UPDATES

• FAVOURITE TEAMS AND MATCHES: Don’t waste your time, and follow only your favourite matches, teams and competitions.

• NOTIFICATIONS AND ALERTS: Match starts, line-ups, goals - you will not miss any of it again. Just select your favorite matches and wait for your mobile device to let you know.


LIVE RESULTS, TABLES AND MATCH DETAILS

• LIVE COMMENTARY: Unable to watch the match on TV? No problem: stay up-to-date with our detailed live text commentary.

• LIVE TABLES: One goal can change a lot. Our live standings will show you if a scored goal has changed the league ranking, as well as the current top scorers table.


Terms of Use: https://livesport.eu/terms-of-use/en-gb
Privacy Policy: https://livesport.eu/privacy-policy/en-gb",2013-12-06T04:50:49Z,2025-10-30T12:25:25Z
