country,country_name,category,genre_id,rank,app_id,app_name,developer,url,price,averageUserRating,userRatingCount,primaryGenreName,description,launch_date,update_date
mg,Madagascar,News,6009,1,333903271,X,X Corp.,https://apps.apple.com/mg/app/x/id333903271?uo=4,0.0,4.48813,1475,News,"Welcome to X (formerly known as Twitter), your trusted digital town square where conversations unfold in real time, and the world connects through breaking news, live events, podcasts, and everything in between.

Whether you're passionate about sports, tech, music, or politics, X is your front-row seat to what’s happening across the globe.

X isn’t just another social media app, it’s the ultimate destination for staying well informed, sharing ideas, and building communities. With X, you’re always in the loop with relevant trending topics and breaking news, delivered instantly to your screen, raw and unfiltered.

What You Can Do on X:
• Follow breaking news from around the world before it hits the headlines, and stay ahead of the curve with real-time updates on trending topics and viral conversations.

• Post your thoughts, photos, and videos with a global community. Join millions of users in shaping public dialogue across social, cultural, and political conversations.

• Discover Grok, the AI assistant powered by X’s real-time data. You can ask Grok to summarize trending news, explain videos, or give you more context about posts.

• Stream live video or go live with Spaces, our audio feature that enables you to host discussions, hold interviews, or start your next live podcast. Whether you're streaming a concert, a live game, or your thoughts on a hot topic, X keeps your audience engaged.

• Watch videos: from live breaking news and sports clips to podcasts and gaming sessions that last up to 3 hours long. Many of the world’s leading voices, in comedy, gaming, podcasting, and politics, all share their content on X.

• Connect and chat privately with friends, followers, customers, or collaborators through Direct Messages.

• Join and build communities tailored to your interests: from sports news, gaming, entertainment, crypto, entrepreneurship, tech, and more.

• Subscribe to X Premium to unlock exclusive features like a blue checkmark, boosted visibility, prioritized replies, fewer ads, longer videos, and post editing. X Premium also gives you access to creator revenue sharing and the ability to offer exclusive content to subscribers.

Why X?
In a world of constant change, X is your real-time source to stay ahead of the curve, connect with people, and explore diverse perspectives. From breaking live news and trending memes to top podcasts and live streams from your favorite creators, X brings it all together in one powerful social experience.

Privacy Policy: https://x.com/privacy
Terms and Conditions: https://x.com/tos",2010-02-18T13:41:25Z,2025-11-24T03:35:31Z
mg,Madagascar,News,6009,2,1064216828,Reddit,"REDDIT, INC.",https://apps.apple.com/mg/app/reddit/id1064216828?uo=4,0.0,4.54639,97,News,"Welcome to Reddit, the heart of the internet.

Reddit is a social network with something for everyone: trending topics, anonymous group discussions, and diverse communities.

Joining Reddit means immersing yourself in brutally honest and wholesome conversations that span across every topic and interest you could imagine.  Beyond exclusive content straight from the source, you'll also find gaming communities, insightful bloggers, passionate TV fandoms, sports enthusiasts, support groups, AI forums, the latest in celeb news, and creators of all types.

If you’re into gaming and sport, you can discover the best Xbox and PS5 forums, talk Zelda, Call Of Duty, or minecraft strategy while discussing the latest Football news, Cricket matches, and Rugby games.

Reddit has over 100,000 online communities (forums where members post and comment) dedicated to discussing topics. Some of the most popular global communities are:
■ r/AskReddit, where users can ask and answer questions
■ r/funny, which is full of humorous content, jokes, hilarious memes
■ r/science, for scientific talks and daily news from the scientific community
■ r/gifs, with funny animated gifs for your fun  and viewing pleasure
■ r/music, r/fredagain, r/beyonce and other music forums where music fans gather to discuss their favourite artists and genres.

On Reddit you’ll find:
■ Thousands of community groups and interesting topics, and a wealth of original content. 
Latest news, entertainment news, social media news, book clubs, TV fan theories, technology forums, open AI discussions, conspiracy theories, gaming forums,debate forums, and personalised content, there's a community for everyone.

■ Loads of laughs
Find popular memes, witty humour, jokes and gags, oddly satisfying videos, comedy clips, funny cat videos, and more to help you lose track of time.

■ Pop culture buzz
Explore the latest trends at r/popculturechat and r/fauxmoi, or join the lively discussions at TV groups like r/loveislandtv, r/bigbrotheruk, and r/MAFS_UK.

■ AMAs, or ""Ask Me Anything""
Celebrities, politicians, and experts answer questions from users.

■ The best discussions on any topic
Reddit’s discussion threads are where community members jump in with humour and insights for top conversations about anything; science discoveries, pop culture, gardening, entertainment, or financial advice.

■ Post anonymously and get answers to all of your questions
Ask communities anything you want. Ask questions on relationships, mental health, parenting, career advice, fitness plans, and more.

■ Anonymous profiles
Connect with people about any topic, join interactive community groups, and chat with other redditors, all anonymously.

Voting and Karma:

Instead of likes and hearts, Reddit’s social media network runs on upvotes or downvotes. Voting on posts and comments increase or decrease the creator’s karma, and helps popular and relevant posts rise to the top, while filtering out low-quality or irrelevant posts.

While karma doesn't directly impact your ability to use Reddit, more karma can increase posts’ visibility and help you get noticed. Some communities require karma to post or comment, which helps maintain content quality and community standards.



Reddit Premium:

Purchase Reddit Premium to enjoy an ads-free experience and access to premium avatar gear, r/lounge, custom app icons, and more.

Payment will be charged on a recurring monthly or annual basis to your Apple account. Your monthly or annual Premium subscription will automatically renew unless you cancel at least 24 hours before your subscription ends. Cancel anytime in your device’s Account Settings. No partial refunds.

Privacy Policy: https://www.redditinc.com/policies/privacy-policy
User Agreement: https://www.redditinc.com/policies/user-agreement
Reddit Rules:https://redditinc.com/policies/reddit-rules

If you have any problems with the app, get support at RedditHelp.com",2016-04-14T19:12:21Z,2025-11-21T01:07:14Z
mg,Madagascar,News,6009,3,666249144,RFI Pure radio,France Medias Monde,https://apps.apple.com/mg/app/rfi-pure-radio/id666249144?uo=4,0.0,5,2,News,"Because we wanted to provide you a smoother experience, we have made every effort to simplify access to your favorite programs, both live and in podcasts.
-	We created a new homepage that allows you to find your favorite shows or discover podcasts.
-	We simplified access to the programs you are looking for by creating a search engine for shows and a search by themes.
-	We integrated a module to download selected episodes. It allows you to listen to the episodes you have downloaded whenever you want, with or without a network.",2013-07-03T00:35:31Z,2025-10-30T10:48:49Z
mg,Madagascar,News,6009,4,551782765,Radio France Internationale,France Medias Monde,https://apps.apple.com/mg/app/radio-france-internationale/id551782765?uo=4,0.0,0,0,News,"Follow the latest international, French and African top stories and headlines thanks to our selection of articles, listen to live streaming and on-demand radio news and music programs. 
RFI (Radio France Internationale) is a news radio broadcasting worldwide from Paris, France. 
2 live 24/7 programs to choose from: 
- RFI in French 
- RFI English 
Download this FREE app now, and listen to the latest daily international news and music programs, in one of these languages: English, French, Cambodian, Chinese, Hausa, Swahili, Spanish, Persian, Portuguese, Portuguese do brazil, Russian, Ukrainian, Vietnamese. 
Features: 
- LIVE streaming of news bulletins, shows, interviews, music programs and chronicles 
- On-demand service to catch-up with past news and music programs 
- A rich multilingual service with 16 languages to choose from
- Subscribe to breaking news alerts
- Follow the latest international, French and African top stories and headlines thanks to our selection of articles and live radio news programmes
 We are striving to create a great mobile experience for you, and welcome your feedback: applis@rfi.fr",2012-10-19T11:58:42Z,2025-11-23T19:10:39Z
mg,Madagascar,News,6009,5,623725053,Gujarat Samachar Gujarati News,LOK PRAKASHAN LIMITED,https://apps.apple.com/mg/app/gujarat-samachar-gujarati-news/id623725053?uo=4,0.0,0,0,News,"Gujarat Samachar is the biggest and the best source for News in Gujarati. 

Enhanced UX includes all editions of Gujarat Samachar ePaper, videos, and news from Gujarat to across the globe. 

Epaper: All print editions of Gujarat Samachar, the largest-selling Gujarati Newspaper at your fingertips completely free.

Videos: From celebrities to controversies, from Bollywood, Chandrayan 3 to Political leaders, you will get the best of videos on the app.

National: We have the best coverage of national – political, crime, social, and human interest stories – in Gujarati.

Sports: Live updates on cricket matches, ICC World Cup or major global sports events like FIFA World Cup, Wimbledon, and Olympics. 

Gujarat News: From our correspondents across the state, get maximum coverage of local and state news round the clock. 

Politics: Our eyes and ears are always open to getting the political news and views from the Netas at the city unit, state or National, Gujarat Samachar covers all. 

Business and Finance: Read the best business news in Gujarati from BSE to NYSE, from gold to crude oil. Our team will give the best coverage of stock news, stocks, corporate, and commodities updates. 

Bollywood and OTT: Stay updated on the latest Bollywood releases, news and video updates on what celebrities – Salman, Shahrukh, Deepika, Alia and Amitabh Bachchan are doing. Our coverage includes the latest updates on OTT platforms – Amazon Prime, Netflix, SonyLiv and others. 

Astro: From astrological, astrophysical and planetary movements that can change your course of life to daily Rashifal and Panchang, Gujarat Samachar has it all.",2013-03-27T01:22:59Z,2025-11-13T12:45:22Z
mg,Madagascar,News,6009,6,1581650857,Substack,Substack Inc.,https://apps.apple.com/mg/app/substack/id1581650857?uo=4,0.0,4.78571,14,News,"Substack is a new media app that connects you with the creators, ideas, and communities you care about most.
- Support the creators you love: Subscribe for free or upgrade to view original work and connect directly with your favorite writers, artists, and podcasters.
- Enjoy ad-free videos and podcasts: Access short-form clips, video episodes, and  read-aloud articles without interruptions.
- Connect in real time: Join livestreams and live group chats, where top creators bring their biggest supporters into their world. 
- Explore independent ideas: Discover bold opinions and engaging views across food, sports, politics, fashion, comedy, finance, and more.

How it works:
1. Download the Substack app.
2. Claim your handle.
3. Explore the feed to enjoy notes, videos, and clips from creators. 
4. Subscribe to your favorites for free, tune into their livestreams and join private group chats.",2022-03-08T08:00:00Z,2025-11-17T17:28:36Z
mg,Madagascar,News,6009,7,720291153,Radio App,Firetruck Productions Ltd.,https://apps.apple.com/mg/app/radio-app/id720291153?uo=4,0.0,4.06667,45,News,"Easily tune in to local radio stations and to radio stations from all over the world, using a unique analog-like tuner. 

• Internet Connection Required

Features: 
• Unique analog-like FM/AM tuner 
• Use remote control to seek stations 
• Supports multiple countries at the same time 
• Name of playing song when available 
• Favorite stations 
• Alarm clock 
• Sleep timer

Privacy Policy: https://www.theradioapp.com/privacy-policy
Terms of Use: https://www.theradioapp.com/terms-of-use",2013-11-12T00:09:36Z,2025-11-23T23:19:14Z
mg,Madagascar,News,6009,8,459182288,Google News,Google LLC,https://apps.apple.com/mg/app/google-news/id459182288?uo=4,0.0,4.83333,6,News,"Google News is a personalised news aggregator that organises and highlights what’s happening in the world so that you can quickly catch up and discover more about the stories that matter to you.

With Google News, you’ll find:

YOUR BRIEFING: It can be nearly impossible to keep up with every story that you care about; Your Briefing makes it easy to stay in the know about what’s important and relevant in your world. It updates throughout the day to bring you the top local, national and world headlines, plus personalised news tailored to your interests.

LOCAL NEWS: Explore your community through stories and articles from news outlets in your local area. Customise and choose multiple locations so that you can know what’s happening near you or wherever home is.

FULL COVERAGE: Dive deeper into a story with multiple perspectives. The Full coverage feature organises everything online about a story, surfacing and highlighting coverage from different outlets and mediums. With just a tap, you’ll uncover how the story is unfolding and how everyone is reporting on it.

STORIES FOR YOU: The For You section delivers personalised news related to your interests. Take control and customise the articles that you see by following the topics and sources that you care about.

ACCESS FROM ANY DEVICE: Stay up to date on the news, no matter where you are. Pair the Google News mobile app with our desktop website, news.google.com, and enjoy your personalised content across all your devices.",2012-04-11T17:30:21Z,2025-10-07T13:44:35Z
mg,Madagascar,News,6009,9,6740634400,daily.dev,Daily Dev Ltd,https://apps.apple.com/mg/app/daily-dev/id6740634400?uo=4,0.0,0,0,News,"The professional network for developers.
daily.dev is where developers come to connect, grow, and discover. Stay up to date on the latest tech trends, join thriving developer communities, and build a standout profile that showcases your skills and achievements. Whether you’re leveling up your career, exploring new tools, or sharing knowledge with others, daily.dev is designed to help developers thrive.

Why developers love daily.dev:
* Hyper-personalized feed: Tutorials, news, and insights tailored to your tech stack and interests.
* AI search: Get accurate answers to technical questions and explore topics quickly.
* Developer communities: Join Squads to collaborate, share knowledge, and network with like-minded developers.
* Build your profile: Highlight your skills, projects, and achievements to stand out in the tech world.
* All-in-one discovery: Discover the latest tools, open-source projects, and product updates, all in one place.

Trusted by developers worldwide:
Join the global developer community shaping the future of technology. 1 in 50 developers worldwide is already active on daily.dev.

Privacy policy: https://r.daily.dev/privacy-policy
Terms of Service: https://daily.dev/tos",2025-01-30T08:00:00Z,2025-06-06T11:19:40Z
mg,Madagascar,News,6009,10,553476229,Architecture Magazine,Digital Edition Technology Ltd,https://apps.apple.com/mg/app/architecture-magazine/id553476229?uo=4,0.0,5,1,News,"Architecture Magazine is the leading product and technology magazine for architects. With the Architecture Magazine App you can receive every issue and stay up to date with the latest architecture news, products, and trends.

You may view our privacy policy at https://mediaone.co.uk/privacy-policy",2012-09-21T20:18:18Z,2025-07-15T21:48:42Z
mg,Madagascar,News,6009,11,358801284,Flipboard: The Social Magazine,"Flipboard, Inc.",https://apps.apple.com/mg/app/flipboard-the-social-magazine/id358801284?uo=4,0.0,4.41463,41,News,"An award-winning app that curates news and information for all your interests.  With thousands of national and local sources, as well as magazines with stories curated by the community, Flipboard is one place to stay connected to the stories that matter every day. You can personalize it for the news you care about; follow business, health, tech, sports teams, cooking, travel and more to get up-to-the-minute developments as well as insightful longreads and inspiration.

You can also collect stories you like by using the + button to add them to your own Flipboard Magazine. Make your magazine public to share ideas and insights with your community.

USE FLIPBOARD TO:

- Keep up on the latest stories from the world’s leading publishers, including The New York Times, National Geographic, TIME, The Atlantic, BBC, and thousands more. 
- Follow Local feeds for regional news, weather, commute, sports, and dining.
- Create personalized news feeds based on your interests in “Smart Magazines”
- Curate stories to share with others: Use the + (plus) on any article to add them to your own Flipboard Magazine to collect for yourself or share ideas with friends.
- Enjoy expertly curated collections from our editorial team, including The Daily Edition, 10 for Today, The Tech Digest, The Tastiest, and more.

SOME OF THE PUBLISHERS ON FLIPBOARD:

- News & Politics: The New York Times, CNN, The Washington Post, Politico, Axios
Technology & Science: TechCrunch, Wired, Fast Company, Popular Science, National Geographic, ReCode
- Business & Entrepreneurship: The Wall Street Journal, Bloomberg, Fortune, Forbes, Inc. Magazine, Entrepreneur
- Wellness & Lifestyle: Brit + Co., Self, Greatist, Prevention, Women's Health, Men's Health
Entertainment: People, Entertainment Weekly, Rolling Stone, PopSugar,Hollywood Reporter, Variety
- Food & Cooking: Bon Appetit, Food & Wine, Food52, Serious Eats, Eater
- Travel: Travel + Leisure, Condé Nast Traveler, Lonely Planet, Budget Travel, AFAR
- Sports: ESPN, CBS Sports, Fox Sports, SB Nation, Bleacher Report
- Home & Gardening: ELLE DECOR, House Beautiful, Dwell, Remodelista, Gardenista
- Style: Vogue, Refinery29, GQ, Elle, Glamour, Esquire, Harper's Bazaar, W Magazine
- Outdoor Adventure: Outside, Bicycling Magazine, Runner's World, Snowboarder Magazine, Powder Magazine, Canoe & Kayak

And many, many more...

KEEP UP WITH FLIPBOARD:
For product updates and the latest from our blog, including tips on how to use Flipboard, follow us on:
www.twitter.com/@flipboard
www.facebook.com/Flipboard
https://www.instagram.com/flipboard/

We’d love to hear what you think! Reach out to our support team under Settings > Help & Feedback. For any other technical issues or questions, contact us at http://flip.it/support.",2010-07-21T04:18:32Z,2025-09-15T16:25:24Z
mg,Madagascar,News,6009,12,364147881,BBC: World News & Stories,BBC Studios Distribution Ltd.,https://apps.apple.com/mg/app/bbc-world-news-stories/id364147881?uo=4,0.0,4.16667,6,News,"THE BBC APP: News, stories, audio, videos and live coverage from our trusted global network of journalists.

BBC STORIES: The latest, breaking news headlines, articles, podcasts and videos, including coverage of world News, UK News, elections, BBC Verify, BBC In-Depth and more. Stories and videos covering business, innovation, culture, arts, travel, Earth, and much more.

LIVE COVERAGE: Follow live news updates and live global sport in our Live section.

BBC AUDIO: Listen to, save, and follow BBC podcasts such as The Global Story and World of Secrets. Browse schedules and live stream BBC Radio 4 or BBC World Service. From news, politics and culture to true crime, history and science, you can find the latest episodes or dive into the BBC audio archive.

WATCH BBC NEWS: Users in the US and Australia can stream live breaking news from around the world 24 hours a day on the BBC News channel.

BBC VIDEOS: Watch BBC News videos, BBC Sport videos, and video stories about climate, sustainability, science, health, technology, entertainment, and history.

BREAKING NEWS ALERTS: Sign up for breaking news notification alerts from BBC News, delivered straight to your mobile device.

FEATURES:
• Log into your BBC Account to save articles, podcasts and videos for later on the app and BBC.com
• Watch videos and listen to audio over both cellular and wifi
• Follow podcasts, save & download episodes to your mobile device or tablet 
• Download and listen to podcast episodes offline  
• Choose your settings to allow the app to automatically update in the background
• Control audio playback with sleep timer and live rewind
• Increase your font size for improved readability
• Choose dark mode for a dark-background reading experience
• Share stories, podcasts, and videos to social platforms like Facebook and WhatsApp, and send to friends via SMS and email
• Opt-in or opt-out of breaking news push notifications, you decide

ADDITIONAL INFO:
If you choose to receive push notifications, a unique identifier relating to your device will be stored by Airship on behalf of the BBC to provide you with the service. You can choose to unsubscribe from push notifications from BBC in your device’s ‘Notifications’ screen.

Our data processor AppsFlyer collects information on behalf of the BBC for attribution and analysis purposes. You can opt out from AppsFlyer tracking by filling out their ‘Forget My Device’ form: https://www.appsflyer.com/optout

The BBC will keep your information secure and not share it with anyone else in accordance with the BBC’s Privacy and Cookies Policy. To read BBC’s Privacy Policy go to https://www.bbc.com/usingthebbc/privacy/

If you install this app you accept the BBC Terms of Use at https://www.bbc.co.uk/usingthebbc/terms",2010-04-01T21:34:38Z,2025-11-10T13:34:10Z
mg,Madagascar,News,6009,13,6739125289,Syft: AI-Native News Agent,Orion Arm Pte. Ltd,https://apps.apple.com/mg/app/syft-ai-native-news-agent/id6739125289?uo=4,0.0,0,0,News,"Syft – Your smarter way to stay informed

No more clickbait, ads, or endless scrolling. 
Syft delivers trusted news from around the world – clear, fast, and in your language.

Why choose Syft?
Personalized feed: Pick your topics—finance, tech, culture, or even niche interests—and Syft builds your news around you.
 Daily briefing: Get the 3 most important stories every morning, so you’re always in the loop.
 Real-time updates: Stay informed anytime, anywhere, across every language and perspective.
 Quality control: Filter, block, or add your go-to websites and RSS feeds.
 No noise: No hidden ads, no algorithm manipulation — just direct and relevant content.

With a simple, lightweight design and smart AI filters, Syft keeps you in control of your information. Stay on top of what matters—your way.

Download now and take back control of your news.",2025-03-27T07:00:00Z,2025-11-13T18:18:16Z
