country,country_name,category,genre_id,rank,app_id,app_name,developer,url,price,averageUserRating,userRatingCount,primaryGenreName,description,launch_date,update_date
tr,Türkiye,Shopping,6024,24,610957461,Boyner – Online Shopping,Boyner Buyuk Magazacilik A.S.,https://apps.apple.com/tr/app/boyner-online-shopping/id610957461?uo=4,0.0,4.82007,427683,Shopping,"These Are All Boyner!

We keep working to offer you a flawless online shopping experience. At Boyner, which has transformed into a marketplace, you can now reach even more brands and categories — from shoes to clothing and bags — with just one click and express your style freely. Thanks to the “Ready-to-Spend Limit,” you can shop from our partner brands now and start paying 30 days later. Come on, because these are all Boyner!

The Key to Flawless Style Is at Boyner

The most enjoyable way to reflect your style on cool autumn days is waiting for you at Boyner. With knit sweaters, long-sleeved shirts, soft cardigans, and modern-cut trousers that match the season’s spirit, comfort and elegance come together. In women’s and men’s collections, leather jackets, tracksuits, and sweatshirts take the spotlight. Complete your style with boots, bags, and scarves.

With world-famous brands like Desigual, Guess, Karl Lagerfeld, Valentino, Calvin Klein, and Armani Exchange, as well as favorites such as Fabrika, Discovery Expedition, Aéropostale, and People by Fabrika, you can create your perfect look. At Boyner, you’ll also find essentials from brands like Ugg, Levi’s, GAP, U.S. Polo Assn., and Camper.

Amazing November Deals Await You at Boyner

The most exciting shopping season of the year is here! Now’s the time to fill your cart before the Amazing November discounts. This November, with Boyner, you can bring the season’s energy to your wardrobe, add warmth to your home, and choose unforgettable gifts for your loved ones.

Get ready for the Price Protection Advantage with Boyner! If the price of a product you bought drops within 30 days, the difference is added to your Hopi account as Gift Points. Elegant coats, waterproof jackets, trendy boots, and suede bags are all waiting for you. You’ll also find captivating perfumes, skincare that gives your skin a radiant glow, and makeup for flawless looks. For cozy home moments, soft blankets, lighting, and aromatic candles are perfect. Complete your style with silver jewelry, leather wallets, and chic hats. This November, full of advantages, Boyner invites you to an inspiring shopping experience!

The Newest Makeup, Skincare & Perfume Options

For a dazzling look, find foundations, powders, blushes, eyeliners, eyeshadows, and mascaras at Boyner. Discover must-have skincare — cleansers, masks, moisturizers, and sunscreens. Thousands of perfumes that make you feel special are here too. Estée Lauder, Lancôme, Clinique, Dior, and Korres (exclusive to Boyner) await you. Plus, Murad, Foreo, and Dear Klairs are now part of the Boyner marketplace!

For Those Who Live Life Actively

If you lead an active lifestyle, Boyner has you covered with brands like Jack Wolfskin, Salomon, The North Face, Garmin, and Shimano. Enjoy nature with fishing, mountaineering, skiing, and camping gear.

The Destination for Home & Electronics

Make every moment at home more enjoyable with Boyner’s wide range! From tea and coffee machines to air purifiers, robot vacuums to sound systems — practical solutions await you. Add warmth with bed linens, tableware, and decorative accessories.

Boyner Now – At Your Door in 90 Minutes

Special November discounts in dozens of categories await you at Boyner Now. We deliver your selected products from the nearest store in just 90 minutes. With scheduled delivery, you can receive your order at your chosen time. Add gift wrapping and a personalized note to make your surprise unforgettable. Choose the address, add your favorites to your cart, and receive them in 90 minutes or at your scheduled time. With Boyner Now’s November discounts, bring joy to yourself and your loved ones!",2013-03-22T22:43:11Z,2025-10-22T16:06:58Z
tr,Türkiye,Shopping,6024,25,828339291,Beymen,Beymen Magazacilik AS,https://apps.apple.com/tr/app/beymen/id828339291?uo=4,0.0,4.83249,72980,Shopping,"Türkiye’nin tek dijital lüks platformu olan Beymen.com uygulaması, dünyanın en iyi markalarını parmaklarının ucuna getiriyor. Farklı kategorilerdeki birbirinden kaliteli ürünlere Beymen.com uygulaması ile dilediğin yerden ulaşabilirsin. 2010 yılından bu yana global trendleri online olarak kullanıcılarına sunan Beymen.com, “Koşulsuz Müşteri Mutluluğu” için çalışıyor.

New Balance, Adidas, Skechers, Academia, Vans, Alexander Mcqueen, Academia, Alexander Wang ve daha birçok marka ayakkabı modelleri ile Beymen.com uygulamasında seni bekliyor. Her sezona damga vuran tasarımlarıyla Canada Goose, Alpha Industries, Prada, Valentino Garavani, Versace, Fendi, Yves Saint Laurent ve Palm Angels da bu uygulamada.
Beymen kalitesini yaşamın her alanında hissedebilirsin. Beymen.com uygulaması üzerinden Luna, Bakır İstanbul, Kuhn Rikon, Pip Studio, The Mia, POT ART gibi markaların mutfak ürünlerine ulaşmak oldukça kolay. Mutfak şefi, kahve makinesi, kettle, ekmek kızartma makinesi ve daha birçok mutfak ürünü Beymen.com ile parmaklarının ucunda!

En yeni teknolojik ürünler de Beymen uygulamasında! Ankarsrum, Miele, Gaggia, Apple, Harman Kardon, Lenco, Philips, Dyson ve daha fazlası için uygulamayı hemen kullanmaya başlayabilirsin. Teknoloji devi markaların yanında kozmetik ürünlerine de göz atmayı unutma. Akıllarda yer eden ikonik parfümler, cilt bakımı ve makyaj ürünleri ile Beymen Exclusive ürünleri hızlı ve güvenilir bir alışveriş deneyimi ile kapına kadar gelsin.
Bildiğin Beymen kalitesini bilmediğin ürünlerle deneyimlemek istersen Beymen uygulamasını hemen kullanmaya başlayabilirsin. Kadın, erkek, çocuk, kozmetik, teknoloji, anne-bebek, ev&mobilya, yaşam, outlet ana kategorilerinde yer alan yüzlerce ürüne bu uygulamayla zahmetsizce ulaşabilirsin.
Beymen.com uygulamasındaki kadın, erkek ve çocuk kategorilerinde giyim, çanta, ayakkabı ve aksesuara dair pek çok seçenek bulabilirsin. Bunların yanı sıra stil önerileri de seni bekliyor. Son trendlere uygun önerilerle Beymen.com uygulamasında alışverişten çok daha fazlasını deneyimleme şansın bulunuyor.
Beğendiğin ürünleri daha sonra incelemek istersen uygulamadaki “Favorilerim” bölümünden yararlanman mümkün. Bunun için yapman gereken oldukça kolay! Favoriye eklemek istediğin ürünün sayfasındaki kalp ikonuna tuşlaman yeterli.
Profil sayfandaki “Adreslerim” alanına birden fazla teslimat adresi ekleyebilirsin. Uygulama üzerinden kendin için alışveriş yapabileceğin gibi hediye gönderimi yapman da mümkün. Ayrıca aktif ve geçmiş siparişlerini görmek istersen yine profil sayfandaki “Siparişlerim” sekmesini tıklayabilirsin.
Uygulama üzerinden yapacağın alışverişleri Beymen X-PRESS aracılığı ile hızlıca teslim alman mümkün. İstanbul ve Ankara için geçerli olan bu hizmetle alışverişin özel araç filosu ve deneyimli personel aracılığıyla kapına kadar geliyor. Beymen X-PRESS ile eşsiz ve hızlı bir alışveriş deneyimi bu uygulamada seni bekliyor.
Alışveriş sepetini sevdiklerinle paylaşabileceğini biliyor musun? Almayı düşündüğün ürünleri alışveriş sepetine ekledikten sonra arkadaşlarına ya da fikrini almak istediğin aile bireylerinle paylaşabilirsin. 
Uygulama üzerinden oluşturduğun siparişi sadece adrese teslim almak durumunda değilsin. Sipariş aşamasında “Adrese Teslim” ya da “Mağazadan Teslim” seçeneklerinden birini tercih edebilirsin. Şehir ve mağaza seçimlerini ilgili kutucuklara ekledikten sonra siparişini tamamlama adımına geçebilirsin.
Beymen.com uygulamasında The One Card ayrıcalıklarından yararlanman da mümkün. Profilim bölümündeki ilgili alana kartını tanımladıktan sonra dilediğin alışverişte kullanarak puan kazanabilir ya da var olan puanları harcayabilirsin.
Ücretsiz kargo, ücretsiz tadilat, 30 gün içerisinde iade hakkı, özgün ve ayrıcalıklı hizmet anlayışından yararlanmanın şimdi tam sırası! Hobi&eğlence, kitap, kozmetik, spor&outdoor, giyim, ayakkabı, çanta ve daha birçok kategoride lüks alışveriş deneyimini yaşamak için hemen şimdi Beymen.com uygulamasını kullanmaya başlayabilirsin.",2014-03-05T00:57:37Z,2025-11-13T22:36:35Z
