country,country_name,category,genre_id,rank,app_id,app_name,developer,url,price,averageUserRating,userRatingCount,primaryGenreName,description,launch_date,update_date
tr,Türkiye,Shopping,6024,16,1436146422,Instreet,FLO MAGAZACILIK VE PAZARLAMA ANONIM SIRKETI,https://apps.apple.com/tr/app/instreet/id1436146422?uo=4,0.0,4.82638,20937,Shopping,"Ayakkabı alışveriş keyfinizi mağaza ya da bilgisayar ile sınırlı tutmayın! İnstreet uygulamasını indirerek en trend sneaker ayakkabı modelleri ile onlarla uyumlu giyim ve aksesuarları tek tıkla satın alma imkanına sahip olun . Dahası Nike, Adidas, Reebok, Puma ya da New Balance gibi dünyaca ünlü markaların en popüler modellerini özel indirim ve taksit imkanlarıyla gittiğiniz her yerde, istediğiniz her saatte satın alın.

In street mobil uygulamada neler var?

İhtiyacınız olan her şeyi instreet mobil uygulamasında bulmanız mümkün! Erkek, kadın ve çocuk için farklı kategorilerde onlarca markanın ürünleri yer alıyor. Sneaker, spor ayakkabı, koşu ve yürüyüş ayakkabısı, günlük ayakkabı, bot, çizme, sandalet, terlik ve outdoor ürünler in street mobil uygulamasında sizi bekleyenler arasında...

Kadın ayakkabı modelleri ve daha fazlası

Instreet mobil uygulamasında kadınların ayakkabı tutkusunu fazlasıyla tatmin edecek pek çok alternatif mevcut. Her mevsim kullanabileceğiniz günlük modellerin yanı sıra kış için bot ve çizme seçenekleri, yaz içinse rengarenk sandalet ve terlik çeşitleri arasından seçim yapabilirsiniz. Instreet’in kadın giyim kategorisinde t-shirt, sweatshirt, eşofman, polar, şort
ve tayt modelleri yer alıyor. Kombinini gözlük, çanta, şapka, atkı, bere ya da eldiven gibi detaylarla tamamlamak isteyenler ise aksesuar kategorisindeki ürünleri incelemeli.

En trend erkek ayakkabı modelleri

Hem hafta sonu hem de hafta içi rahatlığı tercih eden erkekler için pek çok spor ayakkabı seçeneği sunan ınstreet mobil uygulamasında Nike, Vans, Hummel, Skechers, New Balance ya da Adidas gibi markaların en trend modellerini bulabilirsiniz. Yaz ayları için sandalet ve terlik tercih edenler de unutulmuyor. Crocs, Kinetix, Nike, Birkenstock, Havaianas, Lumberjack, U.S. Polo Assn ya da Dockers gibi markaların tasarımları arasından tarzınıza uygun seçimler yapabilirsiniz. Instreet mobil uygulamasında erkekler için özel olarak basketbol ayakkabıları ile halı saha ayakkabısı ve krampon seçenekleri bulunduğunu da belirtmek gerek. Erkek giyim kategorisindeyse tüm ayakkabılarınıza en iyi şekilde eşlik edecek farklı renk ve beden ölçülerinde t-shirt, sweatshirt, eşofman, mont, polar, yağmurluk, şort, bermuda ve forma bulmanız mümkün.

Çocuklar için en renkli seçenekler

Çocukları adına her zaman en iyisini isteyen ebeveynler için oluşturulan ın street çocuk kategorisinde hem erkek hem kız çocuklar için farklı seçenekler yer alıyor. Spor ayakkabıdan bot ve çizmeye, sandalet ve terlikten günlük ayakkabıya kadar aradığınız her modelin en renkli ürünlerini bu kategoride görebilirsiniz.

Onlarca marka bir arada!

Nike, Adidas, Reebok, Puma, Vans, Kinetix, New Balance, Skechers, Asics, Lumberjack, Superga, Palladium, Us Polo, DC, Etnies, Tommy Hilfiger ya da Dockers gibi kendi alanlarında lider onlarca markaya İnstreet mobil uygulaması sayesinde tek tıkla ulaşabilir; güvenilir, kolay ve hızlı alışverişin tadını çıkarabilirsiniz.

İndirim fırsatları cebinizde

Instreet mobil uygulama ile tüm fırsat ve indirimlerden her an haberdar olabilirsiniz. Uygulamanın bildirim seçeneklerini açık tuttuğunuz takdirde size özel uygulanacak indirimi anında yakalayabilir, dünyaca ünlü markaların ayakkabı, giyim ve aksesuar modellerine en avantajlı fiyatlarla sahip olabilirsiniz. Dilerseniz Outlet kategorisine girerek farklı indirimlerden de yararlanabilirsiniz.

Ücretsiz kargo imkanı

Instreet mobil uygulamasından yaptığınız alışverişlerde ücretsiz kargo fırsatı var. 300TL ve üzeri tüm alışverişlerinizde kargo ücreti alınmıyor.

Taksitli alışveriş seçeneği

Uygulama üzerinden alışveriş yaptığınızda farklı ödeme seçeneklerini değerlendirebilirsiniz:

• Kredi kartı ve / veya banka kartı ile tek ödeme
• Kredi kartı ile taksitli ödeme
• Kapıda nakit ödeme

Kredi kartı ile ödemelerde anlaşmalı bankaların kredi kartlarına taksit imkanı da sağlanıyor.",2018-09-22T20:27:59Z,2025-11-08T00:34:47Z
tr,Türkiye,Shopping,6024,17,1547965580,Karaca: Ev & Yaşam Alışverişi,KARACA ZUCCACIYE TICARET VE SANAYI A.S.,https://apps.apple.com/tr/app/karaca-ev-ya%C5%9Fam-al%C4%B1%C5%9Fveri%C5%9Fi/id1547965580?uo=4,0.0,4.74135,122252,Shopping,"Karaca: Evin İçin Tek Uygulama!  

Evini güzelleştirmek, mutfağını yenilemek ve günlük yaşamını daha konforlu hale getirmek için ihtiyacın olan her şey Karaca Uygulaması’nda. Airfryer, kahve makinesi, çeyiz seti, yemek takımları, süpürge, mutfak gereçleri, ev tekstili ve dekorasyon ürünleri gibi yüzlerce seçenek tek bir uygulamada seni bekliyor.  

Üstelik “Oyna Kazan” ile sürpriz kuponlar kazanabilir, AR teknolojisiyle ürünleri evinde nasıl duracağını önceden görüntüleyerek alışverişine yeni bir boyut katabilirsin.  

Karaca Uygulaması ile Alışveriş Daha Kolay!  

- Geniş Ürün Yelpazesi: Mutfaktan oturma odasına, küçük ev aletlerinden dekorasyona kadar binlerce ürün.  
- Özel Kampanyalar ve Kuponlar: “Oyna Kazan” ile anında indirim kuponları kazan, alışverişinde avantaj sağla.  
- Artırılmış Gerçeklik (AR) Teknolojisi: Ürünleri satın almadan önce evinde nasıl duracağını gör.  
- Hızlı ve Güvenli Alışveriş: Siparişini oluştur, kolay ödeme yöntemleriyle anında tamamla ve hızlı teslimat avantajından faydalan.  
- Favori Ürünlerini Takip Et: Beğendiğin ürünleri favorilere ekle, fiyat düştüğünde anında haberdar ol.  
- Sezonluk ve Özel Gün Fırsatları: Black Friday, Anneler Günü, yılbaşı kampanyaları gibi dönemsel indirimlerden ilk sen haberdar ol.  

Mutfağında Şıklık ve Fonksiyonellik  

Mutfakta daha pratik ve keyifli bir deneyim için Karaca’nın yenilikçi ürünleriyle tanış.  

- Kahve Keyfi: Türk kahvesi makineleri, filtre kahve makineleri ve çaycılarla her an lezzetli içecekler hazır.  
- Hızlı ve Sağlıklı Yemekler: Airfryer, tost makineleri, blender setleri ve mutfak robotlarıyla yemek yapmayı daha kolay hale getir.  
- Profesyonel Pişirme Deneyimi: Tencere ve tava setleriyle mutfağında şıklığı ve kaliteyi bir arada yaşa.  

Dekorasyon ve Ev Tekstili  

Karaca, evini sıcak, şık ve konforlu bir hale getirmen için geniş bir dekorasyon ve tekstil koleksiyonu sunuyor.  

- Nevresim takımları, yatak örtüleri ve yastıklarla yatak odana zarafet kat.  
- Sofra takımları ve sunum aksesuarlarıyla yemek masanı tamamla.  
- Mevsime özel ev dekorasyon ürünleriyle her sezon yeni bir atmosfer yarat.  

Ayrıca, AR teknolojisi ile ürünleri satın almadan önce evinde nasıl duracağını görebilir, en doğru seçimi yapabilirsin.  

Çeyiz Setleri ile Yeni Başlangıçlar  

Evlilik hazırlığında mısın? Karaca’nın eksiksiz çeyiz setleriyle hayalindeki mutfağı ve evi oluştur.  

- Tam kapsamlı çeyiz setleri: Yemek takımlarından çatal-bıçak setlerine, tencerelerden kahve makinelerine kadar her şey tek pakette.  
- Evlilik hediyesi arayanlar için özel koleksiyonlar.  
- Zarif ve şık tasarımlar, uzun ömürlü kullanım garantisiyle.  
- Kararsız mısın? Karaca Uygulaması üzerinden mağazadan çeyiz randevusu alabilir, uzman danışmanlardan destek alarak en doğru seçimi yapabilirsin.  

Hemen Karaca Uygulaması’nı İndir!  

- Oyna Kazan ile sürpriz kuponlar kazan, özel indirimlerden faydalan.  
- AR teknolojisiyle alışveriş deneyimini bir üst seviyeye taşı.  
- Güvenli ve hızlı teslimat avantajlarından yararlan.  
- Çeyiz alışverişini mağazada deneyimlemek için uygulama üzerinden randevu oluştur.  

Şimdi Karaca Uygulaması’nı indir, fırsatları kaçırma.",2021-04-20T07:00:00Z,2025-11-20T12:19:31Z
tr,Türkiye,Shopping,6024,18,6467634418,Trendyolmilla,DSM Grup Danismanlik Iletisim ve Satis Tic. A.S.,https://apps.apple.com/tr/app/trendyolmilla/id6467634418?uo=4,0.0,4.6029,216698,Shopping,"Modanın yeni adresi Trendyolmilla'ya hoş geldin! Yıllardır tanıdığın, sevdiğin, her anında yanında olan Trendyolmilla ürünleri şimdi kendi özel uygulamasında! Son moda parçalar, özel koleksiyonlar, sürekli yenilenen tasarımlar ve çok daha fazlası seni bekliyor.

Son Trendleri Keşfet

Sürekli yenilenen tasarımlar, son trendlere göre şekillenen koleksiyonlar Trendyolmilla uygulamasında seni bekliyor! Göz alıcı kombinler için gardrobunda görmek isteyeceğin, pantolondan kabana, tişörtten iç giyime tüm parçalar bir arada!

Trend İş Birlikleri ve Koleksiyonlar

Dünyaca ünlü markalar ve çok özel tasarımcılarla iş birlikleriyle ortaya çıkan özgün koleksiyonları kaçırma! Her sezon yepyeni koleksiyonlarla, ""üstündekine bayıldım"" cümlesini çok sık duymaya hazır ol!

Favorile, İstediğinde Al

Beğendiğin ürünleri, hediye fikirlerini, kararsız kaldığın parçaları favorilerine ekle, istediğin zaman geri dön ve kararını ver, siparişini tamamla! Alışveriş keyfin kesintisiz sürsün.

Hızlı Teslimat & Kolay İade

Sen de siparişini verdikten sonra geleceği anı iple çekenlerdensen, beklemeye gelemeyenlerdensen, Trendyolmilla ürünleri hızla kapına gelsin! Hızlı Teslimat ve Kolay İade süreçleriyle, giyim alışverişinin tadını çıkar.

Kullanıcı Yorumlarıyla Güvenilir Alışveriş

Rengi fotoğraftaki gibi mi? Kalıbı bol mu, dar mı? Aklına takılanlar için binlerce gerçek kullanıcının fotoğraflı yorumları da Trendyolmilla uygulamasında. Satın almadan önce yorumları oku, ürünün kalıpları, kumaşı ve diğer detayları hakkında gerçek deneyimlerden gelen bilgilere sahip ol.

Farklı yaş, cinsiyet, tarz ve beden tiplerine özel markalar

Farklı yaşlar ve tarzlar için oluşturulmuş özel markalar Trendyolmilla, Trendyol Man, Trendyol Curve, Trendyol Modest ve Edit by Trendyol ile tam istediğin parçaları Trendyolmilla uygulamasında kolayca bulursun.",2023-12-18T08:00:00Z,2025-11-05T20:33:19Z
tr,Türkiye,Shopping,6024,19,6744902175,Pazmanya,PAZMANYA GRUP DANISMANLIK ILETISIM VE SATIS TICARET ANONIM SIRKETI,https://apps.apple.com/tr/app/pazmanya/id6744902175?uo=4,0.0,4.76471,17,Shopping,"Pazmanya – Alışverişin Yeni Dünyasına Hoş Geldiniz!

Pazmanya, en sevdiğiniz markaları ve binlerce ürünü tek bir çatı altında toplayan modern ve kullanıcı dostu bir alışveriş platformudur. Akıllı öneri sisteminden hızlı teslimat seçeneklerine, kampanyalardan kişiselleştirilmiş deneyime kadar her detay sizin için düşünüldü.

Öne Çıkan Özellikler:
	•	Kişiselleştirilmiş Alışveriş Deneyimi: İlgi alanlarınıza göre önerilen ürünler ve satıcılar.
	•	Gelişmiş Arama & Filtreleme: Kategori, ürün, marka bazlı akıllı arama ve autocomplete destekli filtreleme.
	•	Favori Satıcılar: Beğendiğiniz satıcıları takip edin, yeni ürünlerinden ilk siz haberdar olun.
	•	Karşılaştır & Karar Ver: Ürünleri özelliklerine göre karşılaştırın, en uygun olanı seçin.
	•	Sepete Ekle & Devam Et: Ürünleri kolayca sepetinize ekleyin ve alışverişinize kaldığınız yerden devam edin.
	•	Kampanyalar & Kuponlar: Size özel fırsatlarla her alışverişte tasarruf edin.
	•	Güvenli Ödeme: Güvenli ve hızlı ödeme sistemleriyle gönül rahatlığıyla alışveriş yapın.
	•	Sipariş Takibi & Bildirimler: Kargonuz nerede, siparişiniz ne aşamada? Anında bildirimlerle her şey kontrolünüzde.

Sade, Hızlı ve Etkileyici Tasarım

Pazmanya’nın modern ve minimalist arayüzü sayesinde alışveriş yapmak artık çok daha kolay ve keyifli. Turuncu renk temasıyla enerjik ve güven veren bir kullanıcı deneyimi sunuyoruz.

Sen de Pazmanya ile tanış, alışverişin yeni dünyasını keşfet!",2025-05-16T07:00:00Z,2025-11-15T14:18:50Z
tr,Türkiye,Shopping,6024,20,779590051,n11-Online Shopping,N11 ELEKTRONIK TICARET VE BILISIM HIZMETLERI ANONIM SIRKETI,https://apps.apple.com/tr/app/n11-online-shopping/id779590051?uo=4,0.0,4.7016,726562,Shopping,"Discover the n11 iPhone app, your gateway to hundreds of thousands of stores and millions of products — from fashion and electronics to groceries and automotive goods. Enjoy exclusive campaigns and special discounts, only on mobile!
Catch Daily Mobile-Exclusive Deals
Every day between 08:00 and 20:00, explore the unmissable offers section for daily discounts and find exactly what you’re looking for at unbeatable prices. With mobile-only deals that update daily, shopping has never been more rewarding!

Categories
•	Electronics Explore thousands of products from top brands like Samsung, Apple, Xiaomi, Oppo, Realme, TCL, LG, Monster, MSI, Dell, Lenovo, Asus, Acer, Huawei, Canon, Nikon, Sony, JBL, Bosch, Philips, and Tefal. Find everything from smartphones, laptops, and TVs to white goods, small kitchen appliances, cameras, and accessories — all in one place.
•	Fashion Shop shoes from Moda Flo, Lumberjack, Nine West, Polaris, Greyder, Scooter, Lacoste, and more. Discover women’s and men’s fashion from brands like Mavi, Penti, Altınyıldız, Colin’s, Avva, Hatemoğlu, Koton, Jack & Jones, Kiğılı, Levi’s, and Ramsey. Also find bags, sunglasses, and special occasion outfits.
•	Cosmetics & Personal Care From fragrances by Avon, Burberry, Dior, Giorgio Armani to hair, face, and skincare, explore a wide range of products — including salon and hairdresser essentials — all available on the n11 app.
•	Automotive & Motorcycle Browse auto accessories, tuning products, and spare parts for Volkswagen, Ford, BMW, Toyota, Audi, and more. Discover Meguiar’s and Sonax car care, TomTom and Garmin navigation devices, and tires by Michelin, Pirelli, Goodyear. Motorcycle gear from Alpinestars, Revit, Arai, and Shoei is also at your fingertips.
•	Mom & Baby Everything for mom and baby — from baby food, clothing, and strollers to health products and maternity essentials — is conveniently gathered in this category.
•	Jewelry & Watches Explore quarter, half, and full gold coins, silver jewelry, Seiko and Michael Kors watches, and diamond rings and necklaces by Altınbaş, Gülaylar, Atasay, and Ariş. Whether you're into collectibles or everyday elegance, this category has it all.
•	Sports & Outdoor Whether you're into fitness, outdoor adventures, or sportswear, find gear from Voit, Dynamic, Adidas, Nike, Puma, The North Face, Columbia, Lafuma, and more. Also shop fishing, hunting, cycling, and marine equipment easily from the app.
•	Books, Music, Movies & Games Dive into video games and consoles by Sony and Nintendo, toys from Lego, Hasbro, Mattel, drones from DJI, books from Pegasus and Epsilon, and stationery from Faber-Castell, Bic, Edding, and Noki.
•	Home & Living Discover everything for your home — furniture, decor, lighting, home textiles by Taç, Merinos, Saray Halı, kitchenware by Schaffer and Korkmaz, and even construction supplies from 3M and Bosch.

App Features
•	Safe & Secure Payments
•	Easy Returns
•	Access to Best Sellers
•	Daily Unmissable Offers
•	Instant Discounts",2013-12-19T02:16:40Z,2025-11-21T10:23:44Z
tr,Türkiye,Shopping,6024,21,503451073,Alibaba.com B2B Trade App,"Hangzhou Alibaba International Information Technology Co., Ltd.",https://apps.apple.com/tr/app/alibaba-com-b2b-trade-app/id503451073?uo=4,0.0,4.64825,71658,Shopping,"What is Alibaba.com?
Alibaba.com is one of the world’s leading B2B ecommerce marketplaces. Our app allows you to source products from global suppliers, all from the convenience of your mobile device.

Purchase with confidence
Our Trade Assurance service protects your orders and payments on the platform, letting you purchase securely and conveniently with extended support.

Customizable products
Meet suppliers with years of customization and order fulfillment experience for sellers on Amazon, eBay, Wish, Etsy, Mercari, Lazada, and more.

Easy sourcing
Discover millions of ready-to-ship products in every industry category. Tell suppliers what you need and get quotes quickly with Request for Quotation services.

Fast shipping
Alibaba.com partners with major freight forwarders to provide land, sea, and air shipping solutions with on-time delivery services, end-to-end tracking, and competitive prices.

Livestreams and factory tours
Interact with manufacturers in real-time via product demos and tours of manufacturing facilities, providing insight and oversight on how your products are made.

Popular categories and trade shows
Source a wide range of popular items – from trending consumer goods to raw materials – and join our annual trade shows for niche product highlights and discounts.

Quality control
Choose Alibaba.com Production Monitoring and Inspection Services to reduce production delay and quality risks.

Discounts and promotions
Unlock new discounts and promotions from featured manufacturers and suppliers.

Stay updated
Use the Alibaba.com app to stay up to date on new products and promotions from your favorite suppliers.

Language and currency support
Alibaba.com supports 16 languages and 140 local currencies. Use our real-time translator to communicate with sellers in your mother tongue.",2012-02-24T16:58:30Z,2025-11-19T07:38:21Z
tr,Türkiye,Shopping,6024,22,986339882,letgo: Buy & Sell Used Stuff,Letgo Global B.V.,https://apps.apple.com/tr/app/letgo-buy-sell-used-stuff/id986339882?uo=4,0.0,4.31625,842170,Shopping,"Why letgo?

We believe no dream should take second place. Let second-hand shopping be the powerful catalyst, igniting the opportunities for you to live every one of your dreams. So why shop for  new? When you can save with letgo! For us, it's about smart choices that fuel our dreams. We're not narrowing our lives or our world—we're expanding them, making space for what truly matters. That's why we say: “Live your dreams!”

Sell Your Items Easily

From computers to sofas, laptops to tablets, cars to phones, baby strollers to toys, washing machines to refrigerators – list on letgo for free, easily reach buyers, and sell quickly. Generate funds to meet your needs – or even to achieve your dreams. To sell your listing faster, you can increase its visibility and reach more buyers by purchasing our renewed ""Vitamin"" products.

Buy What You Need at a Great Price

Millions have already downloaded letgo and started listing their items! Whether it's second-hand phones, sofas, strollers, washing machines, televisions, or wardrobes, you can find a wide range of products at prices that suit your budget. With its location-based search feature, letgo easily shows you nearby listings and helps you filter to find exactly what you're looking for. Start using letgo now!

For Buyers: Cüzdanım Guvende

From tablets to phones, from computers to dresses… Pay for the product you like using a credit or debit card, and have it delivered right to your door. Enjoy secure payment, shipping, easy returns and purchasing in installments. Remember, if the product you want isn't sold with Cüzdanım Güvende, you can request it from the seller.

For Sellers: Cüzdanım Guvende

When listing your items, select the “Cüzdanım Güvende” option; sell your unused items—such as phones, computers, wardrobes, and baby strollers—to buyers across Turkey, ship them via our partnered courier, and receive your payment securely.

Stay tuned for brand new features and an even better second-hand experience! Visit our website for the Terms & Conditions and Privacy Policy. For feedback or questions, contact us at support@letgo.com.",2015-05-10T15:47:28Z,2025-11-12T15:22:13Z
tr,Türkiye,Shopping,6024,23,927394856,Mavi,MAVI GIYIM SANAYI VE TICARET A S,https://apps.apple.com/tr/app/mavi/id927394856?uo=4,0.0,4.26192,21281,Shopping,"Mavi App ile Siz Nerede Mavi Mağazası Orada!
 
Mavi App ile dilediğiniz zaman, dilediğiniz yerde Mavi alışverişinin keyfini yaşayın. Kartuş Kart’a üye olup sezon alışverişlerinizden puan kazanın, Mavi Mağazalarında kart taşımadan alışveriş yapın ve puanlarınızı kullanın.

- Mavi App ile yüzlerce ürüne dilediğiniz zaman, dilediğiniz yerde ulaşabilir, beğendiğiniz ürünleri hemen sepete ekleyebilirsiniz.
- Kartuş’a üye olup sezon alışverişlerinizden puan kazanabilir, kazandığınız puanları uygulama içerisinden takip edebilir ve sonraki alışverişlerinizde kullanabilirsiniz.
- Kartuş Kartınızı uygulamaya kaydedebilir, Mavi Mağazalarında kart taşımadan alışveriş yapmanın ve puanlarınızı kullanmanın keyfini yaşayabilirsiniz.
- Mavi.com’a üye olarak veya Mavi.com hesabınıza giriş yaparak konforlu alışverişin tadını çıkarabilirsiniz. Mavi.com’da oluşturduğunuz sepeti görüntüleyebilir, güncelleyebilir ve daha önce verdiğiniz siparişleri takip edebilirsiniz.
- Kapıda ödeme, havale ve kredi kartı ödeme yöntemleriyle sipariş verebilir, kredi kartınızı Masterpass güvencesi ile saklayabilir, alışverişinizi hızlı ve güvenli biçimde tamamlayabilirsiniz.
- Bildirim ve Lokasyon izinlerinizi vererek Mavi’deki en güncel fırsat, kampanya ve avantajlardan anında haberdar olabilirsiniz.
- Bulunduğunuz konuma göre size en yakın Mavi Mağazasına tek tıkla ulaşabilirsiniz.
- Beğendiğiniz ürünü barkodla veya sesli arama ile aratarak bulabilir, hemen satın alabilirsiniz. Veya ‘Mağazada Bul’ fonksiyonunu kullanarak size en yakın Mavi Mağazasında kolayca bulabilirsiniz. 
- Instagram’da beğenilen ürünlere ‘Keşfet’ sekmesi altından ulaşabilir, stiliniz için ilham veren parçaları hemen satın alabilirsiniz.",2014-12-02T06:01:23Z,2025-10-24T08:02:35Z
