country,country_name,category,genre_id,rank,app_id,app_name,developer,url,price,averageUserRating,userRatingCount,primaryGenreName,description,launch_date,update_date
sk,Slovakia,Food & Drink,6023,1,1451492388,Bolt Food,BOLT TECHNOLOGY OU,https://apps.apple.com/sk/app/bolt-food/id1451492388?uo=4,0.0,4.6801,10741,Food & Drink,"Craving something delicious? Whether it's pizza, tacos, or your favourite fast food from Burger King and KFC, Bolt Food delivers straight to your door.

WHY CHOOSE BOLT FOOD?
- Real-time tracking: track your order and courier’s location from the restaurant to your doorstep.
- Convenient scheduling: plan ahead and order food or groceries in advance.
- Pickup options: prefer to grab your meal yourself? Use our pickup feature for easy collections.
- Takeaway deals and discounts: save on your favourite meals and snacks.
- Seamless payments: pay effortlessly using Google Pay, Apple Pay, or credit/debit cards.

HOW TO GET STARTED:
1. Set your delivery address.
2. Browse and pick meals, groceries, or snacks from your favourite local restaurants or stores.
3. Place your food order and pay securely.
4. Track your order in real-time.
5. Sit back and enjoy!

DISCOVER LOCAL AND GLOBAL FAVOURITES:
Explore a culinary world at your fingertips with Bolt Food. From beloved local restaurants to renowned fast food chains like McDonald's, get meals from your favourite restaurants delivered to your door.

*BOLT MARKET - QUICK GROCERY DELIVERY:
Need groceries or essentials delivered? Bolt Market brings everyday items like milk, bread, and coffee, as well as speciality products like pet supplies, cosmetics, or alcohol, right to your doorstep. Forget the long supermarket queues and shop smarter with Bolt Market.

*BOLT PLUS
With Bolt Plus, you can access exclusive benefits that save you time and money. For example, you can enjoy priority delivery for your orders, even during the busiest hours.

*GO OUT AND SAVE WITH DINEOUT
As convenient as it is to get food delivered to your door, some moments are worth making the trip out for. Find tables at nearby DineOut restaurants and get a discount off your meal. Just open the app, search for what you crave, and switch to the DineOut tab for in-restaurant offers. 

Bolt Food was created by the European super-app Bolt. It’s challenging the efficiency of the food and grocery delivery industry while helping restaurants and stores get more orders and enabling couriers to earn money.

Become a Bolt Food Courier partner:
Have a car, bike, or motorbike? Earn money delivering meals with Bolt Food: https://bolt.eu/en/food/courier/.

Partner with Bolt Food:
Are you a restaurant or grocery store? Boost your sales by joining Bolt Food: https://bolt.eu/en/food/partner/.

Get in touch with us via food@bolt.eu

Follow us on Facebook: https://www.facebook.com/boltfood.

- - - - - - - - - - - - - - - - - - - - - - - - - - - - - - - - - - - - - - - -
*Only available in selected markets.",2019-08-19T07:00:00Z,2025-11-18T08:35:04Z
sk,Slovakia,Food & Drink,6023,2,943905271,Wolt Delivery: Food and more,Wolt Oy,https://apps.apple.com/sk/app/wolt-delivery-food-and-more/id943905271?uo=4,0.0,4.87016,17360,Food & Drink,"Enjoy your favorite restaurants and stores, all in one place.
The Wolt app makes it easy to discover and order (almost) anything from your city. From delicious food and fresh groceries to pharmacy and pet supplies. Search by category, cuisine, restaurant or item! You can easily browse popular restaurants including McDonald's, KFC, Domino's, Pizza Hut, Papa Johns, Burger King and many more. Enjoy food delivery of burgers, pizza, sushi and other delicious items. If you prefer, you can pick up your order from the restaurant or store!

Order (almost) anything, on-demand.
Need to stock up on groceries? Can’t make it to the city? Wolt has you covered with groceries and essentials at your fingertips. Browse through the categories on Wolt and order anything, from pharmacy items to pet supplies. Anything you need, we’ve got you covered with our 40 000+ restaurants and stores. 

Top offers, only on Wolt.
Discover great offers on food, groceries and more! Browse hand-picked deals in the Wolt app and enjoy great savings. There’s offers on everything from food and groceries to electronics and homewares. Find the freshest deals in the app, including up to 50% off your order and €0 delivery fees!


Subscribe to Wolt+
If you’re looking for even bigger savings, Wolt+ is our popular subscription service offering €0 delivery fees, plus much more. As a Wolt+ member, you’ll unlock unbeatable deals and exclusive perks.

Make every occasion special with Wolt
We’ve made it easy to order and enjoy whatever you need. Get gifts for your loved ones, schedule orders for groceries and food, and save with deals on clothing and more! Wolt has you covered with everything to make moments special. Browse the selection of lovely flowers, chocolates, baked treats and more – delivered to your door in one hour or less.

Double Order
Need to order groceries and dinner? Now you can! Combine two local venues in one order with the same delivery fee. Place a Double Order and enjoy more convenience, for less!

Track every step
With every order, you can enjoy real-time tracking, and a minute-by-minute countdown. Whether you keep an eye on the tracker, or have other things to do, we'll keep you notified, so you know when your order is about to arrive.

Customer support
If something doesn’t go as planned, we’re ready to help – with customer support available 24/7. Our friendly team is there to help the 25+ countries we operate in and are ready to respond in seconds.

Payment
We think ordering Wolt should be as simple as possible. That’s why you can pay conveniently and securely with your credit card or Apple Pay. Whatever works for you.

Life simplified. Joy delivered. 
Wolt is currently available in 170+ cities located in Azerbaijan, Croatia, Cyprus, Czechia, Denmark, Estonia, Finland, Georgia, Germany, Greece, Hungary, Israel, Japan, Kazakhstan, Latvia, Lithuania, Malta, Norway, Poland,  Serbia,  Slovakia, Slovenia, Sweden. More are added all the time! Download Now and Unlock Essentials at your fingertips.

Wolt is an Editors’ Choice! 
Recognized by Apple as a top-rated app, Wolt delivers more than just food. Enjoy a seamless experience, from browsing our curated selection of restaurants to tracking your order in real-time.",2015-06-24T15:09:19Z,2025-11-18T16:49:42Z
sk,Slovakia,Food & Drink,6023,3,1217507712,McDonald's,McDonald's Global Markets LLC,https://apps.apple.com/sk/app/mcdonalds/id1217507712?uo=4,0.0,2.33509,758,Food & Drink,"Welcome to the new official McDonald’s app.

The app is filled with great offers specially tailored to you. Deals and discounts appear regularly so check back often to see what’s new.

The news section keeps you up to date with everything that’s going on in McDonald’s near you. Look here for new games and competitions.

The nutrition section provides information on our entire menu. We provide allergy advice and nutritional information on everything from the Big Mac to a single dip!

Use our restaurant finder to find your nearest McDonald’s. Filter your search based on opening hours, facilities and get directions from wherever you are.",2018-01-12T09:58:02Z,2025-11-21T13:12:09Z
sk,Slovakia,Food & Drink,6023,4,1528038390,Munch: Save tasty food!,Munch Europe Szolgaltato Korlatolt Felelossegu Tarsasag,https://apps.apple.com/sk/app/munch-save-tasty-food/id1528038390?uo=4,0.0,3.88889,9,Food & Drink,"(B)eat food waste and get yourself some tasty bites!
With Munch application you can get unsold products of great quality at a discounted price from local restaurants, bakeries, hotels and grocery stores.
Explore more than 3000 partners' packages in the whole country and purchase for even 50-70% off!
All of the surprise packages contain high-quality food, so you're not only doing good for the environment or your wallet, but also for yourself.
With the Munch application, you can not only save food at a discount at your favourite places, but also get to know new shops, bakeries or restaurants.
Follow these few easy steps and start (b)eating food waste with a few clicks:
1. Download the app
2. Explore the available discount packages
3. Purchase and pay for them easily via the app
4. Get the package in the specified time slot
5. Enjoy delicious food that you just saved from waste
You are only one registration away from stepping on the path of sustainability where we can (b)eat food waste together!",2020-08-21T07:00:00Z,2025-11-04T10:03:28Z
sk,Slovakia,Food & Drink,6023,5,1419555996,Magic Stamp,Park Technology Ltd,https://apps.apple.com/sk/app/magic-stamp/id1419555996?uo=4,0.0,2.16667,6,Food & Drink,"The Magic Stamp app is for people who love receiving rewards but don’t have room in their wallet for multiple stamp cards from all their favourite independent businesses.

The Magic Stamp app gives you access to digital stamp cards for your favourite independent businesses and keeps them all in one place, never to be lost again. 

HOW IT WORKS
We’ve created a unique stamp card experience with no QR codes, no IDs and no faff. Just get stamped and receive your rewards instantly.

Simply present your Magic Stamp Card in participating stores to receive a stamp from the vendor on your next purchase. 

You’ll be rewarded with free goodies as well as receiving exclusive gifts and discounts from your favourite independents.

More Magic Stamp Cards coming very soon...",2018-10-13T14:34:24Z,2025-11-21T09:43:12Z
sk,Slovakia,Food & Drink,6023,6,828925849,Bistro.sk,Bistro.sk a.s.,https://apps.apple.com/sk/app/bistro-sk/id828925849?uo=4,0.0,4.81046,50839,Food & Drink,"With the Bistro.sk app, you can order whatever you love, wherever you are. With a wide variety of restaurants, supermarkets and convenience stores to choose from, you can enjoy everything from burgers, pizza, pasta, sushi, salads and loads more, and get it all delivered to your door.

Need some bits from the supermarket? Just open the app, choose ‘groceries’ and fill your basket. Whether it’s baby food, flowers, beer, wine, beauty products, ice cream, chocolate, milk, fruit and bread, our partners have it all.

How it works:
Ordering is easy. You can either pick a saved address, fill in your postcode/street name or let the app find your location automatically. You can then choose your favourite restaurant or store and select whatever you fancy. 

Follow your order to your doorstep:
Track your order from the kitchen or store straight to your doorstep with our Food Tracker®. We'll even send you push notifications to update you about the status of your order. It usually takes 30-45 minutes to deliver your food or groceries.

What you get with our app:
- Quick and hassle-free ordering
- Great offers and discounts
- Choose to pick up your order at the restaurant or store
- Re-order the same delicious meal with one tap of a button
- Browse grocery stores, cuisines, offers, best-rated restaurants, nearby spots and vegetarian/halal options
- Get regular updates on your order with our handy Food Tracker®
- Choose from multiple payment options

Order from big brands or local heroes. 
Bistro.sk has it all!",2014-03-30T06:41:36Z,2025-11-11T10:02:08Z
sk,Slovakia,Food & Drink,6023,7,6504561628,TasteTown,TasteTown s.r.o.,https://apps.apple.com/sk/app/tastetown/id6504561628?uo=4,0.0,4.85083,362,Food & Drink,"Stuck at the same spots? No time to read reviews and spend ages finding where to eat? We make it easy! With TasteTown, you can discover hundreds of top venues nearby—simply and clearly. Plus, enjoy perks you’ll love:

- Exclusive discounts: Buy one, get one free; up to 50% off; or free drinks.

- No commitments: Try one DEAL free, no payment details needed.

- Membership: Unlimited discoveries with a monthly or annual subscription—the investment usually pays off after the first use.

- Invite friends: Get one month free for each friend!

So what are you waiting for? Download TasteTown and explore your city’s flavors with benefits!",2024-09-03T07:00:00Z,2025-10-20T08:38:58Z
sk,Slovakia,Food & Drink,6023,8,878645433,Tesco Online nákupy SK,Tesco Plc,https://apps.apple.com/sk/app/tesco-online-n%C3%A1kupy-sk/id878645433?uo=4,0.0,4.08592,547,Food & Drink,"Online shopping is easier than ever. From Tesco Online Shopping mobile, you can easily and flexibly manage your daily shopping from anywhere online. Choose your favorite products or simply repeat your previous order. Have you run out of some basic food from the fridge? Just check the barcode of the products you want to buy with your mobile phone! Choose the delivery time range and use it to have your order delivered to your door!

Benefits of Tesco Online Shopping:
- Choose from 13, 500 high quality products!
- Buy at the same price as the store!
- Save easily! More than 3,500 promotions await you every week.
- Choose the most convenient delivery time interval for you, from 8 am to 10 pm every day!

We are constantly expanding our delivery areas. You can access information about the availability of the service on our website.",2014-06-03T18:14:23Z,2025-10-21T07:16:18Z
sk,Slovakia,Food & Drink,6023,9,421369701,foodora -  Food Delivery,OnlinePizza Norden AB,https://apps.apple.com/sk/app/foodora-food-delivery/id421369701?uo=4,0.0,4.57143,112,Food & Drink,"We know where you can find the flavours that fit you.  If there's one thing we know it’s food delivery. It’s our mission to bring tasty food from your favourite local restaurant right to your door so you can eat good food everyday. We'll go the extra mile to make your order the greatest food experience in the world. Hungry for wood-fired pizza, a classic burger or the freshest sushi? We know the best food for every cuisine that your city has to offer. foodora is the best food delivery and take away service in your city -- so let's take the first bite!

Check if we're in your city by downloading the app.

SO WHAT’S THE DEAL?

You’re ready and waiting to eat, we’ve all been there, dreaming of thai food, eating burgers in our dreams. Here’s what we do: first choose between delivery and Pick-Up to fit food ordering seamlessly into your schedule. Pick-Up is simple -- you make your order and then collect your food from the restaurant once it’s ready. No more queuing, ever (our app is magic). If you choose delivery, our couriers will bring the food you've been lusting after right to your door. Dreams really do come true.

HOW IT WORKS

First, enter your address (home/ office/ treehouse). Then, choose your favourite restaurant and place an order. They’ll prepare your food and once it’s ready, our courier bring it to you. If you need something to watch, you can track your rider in real-time. Then you eat. Food goals.

WHAT MAKES US SPECIAL

foodora chooses your local favourites; the best food near you. Vietnamese or Italian, healthy salads or food to nurse your hangover -- your dinner will be cooked with love and care. Our riders come to your very doorstep with a smile while you save time to do something else you love. There's a cuisine and a dish to suit every moment, and we'll help you make the first bite last.

ANYTHING ELSE?

Of course your safety is important to us. We guarantee secure, simple mobile payment, so you can eat when you're hungry and pay however you like.

TALK TO US

If you’ve ordered with us before, we’d want to know what you think. Give us your food thoughts/ teenage confessionals. Let us be your notepad.
Email us at support@foodora.se

For further info, visit
www.foodora.com/",2011-03-09T17:00:27Z,2025-11-19T07:21:36Z
sk,Slovakia,Food & Drink,6023,10,6755386964,Program Budapest,NORA GYORFI,https://apps.apple.com/sk/app/program-budapest/id6755386964?uo=4,0.0,0,0,Food & Drink,"Fedezd fel Budapest pezsgő világát a Programok Budapesten appal! Legyen szó spontán esti sörözésről, egy romantikus randiról vagy különleges programokról, itt mindig találsz valami izgalmasat.

Böngéssz kategóriák között, válogass kedved szerint, és találd meg a város rejtett kincseit. Az egyszerű szűrők és keresők segítenek abban, hogy pontosan azt az élményt találd meg, amit keresel.

Ráadásul partnereink rendszeresen kínálnak kedvezményeket és promóciókat, így nemcsak új helyeket próbálhatsz ki, hanem közben spórolhatsz is.

Töltsd le most, és indulj el felfedezni Budapest legjobb arcát – egyetlen koppintással.",2025-11-19T08:00:00Z,2025-11-19T21:15:05Z
sk,Slovakia,Food & Drink,6023,11,1058959277,Uber Eats: Food & Groceries,"Uber Technologies, Inc.",https://apps.apple.com/sk/app/uber-eats-food-groceries/id1058959277?uo=4,0.0,4.71929,1343,Food & Drink,"Get food delivery to your doorstep from thousands of amazing local and national restaurants. Find the meal you crave and order food from restaurants easily with the Uber Eats app. Track your order in real-time.

FIND YOUR FAVOURITE FOOD & RESTAURANTS
Order food from nearby restaurants and search by cuisine, restaurant name, dish, and meal. 
Food delivery options for you to order and enjoy such as pizza, burritos, burgers, sushi, fish and chips, doughnuts and Chinese takeout.
Prefer pickup? Skip the line and reservations and choose to pick up your order instead. Choose your favourite delivery options with the Uber Eats app now.

SUBSCRIBE TO UBER ONE
For £5.99 per month, Uber One subscribers enjoy £0 delivery fee and up to 5% off orders over £15 at participating non-grocery stores (and 5% off orders over £25 at participating grocery stores) available on Uber Eats. Members are also eligible for rewards, perks, coupons, and offers. View full Uber One Terms & Conditions in app.

ORDER ALMOST ANYTHING, ANYTIME
Order household needs from your favourite pharmacies, supermarkets, and pet shops. Baby food or nappies, pharmacy needs, beauty products and cosmetics. Grocery staples like bread and milk, bananas and produce, flowers and plants, packaged foods or frozen treats. 

You can even order alcoholic drinks including beer, wine, spirits and cocktails.*

SIMPLE DELIVERY ORDERING
Pick your food order from any menu and add it to your cart with a few taps. That’s it.
Uber Eats makes it easy to order food delivery online or through the app and have it delivered by restaurants and delivery people near you.
Or, schedule your order in advance for a delivery person to pick it up later. Your choice!

ORDER FOOD AHEAD WITH PICKUP
Now you can also order food ahead for Pickup instead of just ordering delivery. Select Pickup, add food items to your cart, and skip the lines to the restaurant to get your food.

REAL-TIME ORDER TRACKING
Track your food delivery order on a map as it heads your way.
See the estimated arrival time at your address.
Get notified when your order arrives.

FIND SOME OF YOUR FAVOURITE NATIONAL RESTAURANTS
Some of our food delivery partners include: Pizza Hut, Domino’s Pizza, Burger King, Dunkin', KFC, McDonald's, Starbucks, Subway, Taco Bell,Costa Coffee, Kaspas, Gourmet Burger Kitchen, Franco Manca, Dixy Chicken, Chipotle, Chaiiwala, Amigos Burgers Shakes, Papa John’s, Krispy Kreme.  

FIND PHARMACIES, GROCERY STORES, AND MORE
Order from grocery stores such as Asda, Sainsbury Supermarket, Waitrose, The Co-op, Iceland, M&S Food, and Londis. You can also order from pharmacies such as Boots via Uber Eats, as well as from other delivery partners in the convenience and retail spaces.

ABOUT UBER EATS
Uber Eats is the way to order the food you love through an easy delivery experience. Uber Eats is available in hundreds of cities around the world. Enter your delivery address to explore restaurant and grocery delivery options near you.

AVAILABLE INTERNATIONALLY

Join others in your city who use the Uber Eats app to order from their favourite restaurants and schedule delivery.

Uber Eats is currently available in cities and metro areas including Adelaide, Amsterdam, Atlanta, Auckland, Austin, Baltimore, Brussels, Cape Town, Chicago, Dallas, Denver, Johannesburg, Glasgow, London, Los Angeles, Madrid, Melbourne, Mexico City, Miami, Milan, Nashville, New Orleans, New York, Ottawa, Paris, Philadelphia, San Diego, San Francisco, Seattle, Stockholm, Sydney, Taipei, Tokyo, Toronto, Warsaw, and Washington DC. Uber Eats helps you find food delivery around the world. Order delivery in countries around the world. See full list of available countries on our website. Uber content/messages human- or machine-translated as per device settings; accuracy not guaranteed

*Alcohol is only available in select markets. Must be at least 18 to purchase. Item availability varies by market. See the Uber Eats app for details.",2016-06-06T21:35:56Z,2025-11-17T16:26:42Z
sk,Slovakia,Food & Drink,6023,12,1472193712,FRESH - Zdravšie potraviny,Potraviny FRESH s.r.o.,https://apps.apple.com/sk/app/fresh-zdrav%C5%A1ie-potraviny/id1472193712?uo=4,0.0,4.28571,21,Food & Drink,"Aplikácia FRESH ponúka zákazníkovi aktuálny obsah na jednom mieste. Zároveň umožňuje nakupovať priamo v aplikácií a využiť donášku potravín domov v miestach, kde donášku potravín poskytujú naše predajne FRESH a FRESH Plus.

V aplikácii nájdete:
- Digitálnu kartu FRESH
- Kupóny na produkty zadarmo
- Aktuálne aj pripravované letáky
- Prebiehajúce súťaže
- Recepty
- Články
- Eshop

Zároveň aplikácia poskytuje zákazníkovi možnosť jednoduchej spätnej väzby na naše predajne.
Sledovať si svoje nákupy a úhrady, ktoré v našich prevádzkach utratil.",2019-07-26T07:00:00Z,2025-09-24T19:35:39Z
sk,Slovakia,Food & Drink,6023,13,1533933692,Starbucks secret menu!,Chingiz Zholdaspayev,https://apps.apple.com/sk/app/starbucks-secret-menu/id1533933692?uo=4,0.0,4.85714,7,Food & Drink,"Hello, dear lovers of exotic drinks! Welcome to the ""Starbucks Secret Menu,"" also known as the ""Hidden Menu."" Dive into a world of delightful and unique beverages that you can easily recreate in your kitchen. Our app unveils eight tantalizing menu categories: ""FRAPPUCCINO,"" ""DRINKS,"" ""TEA,"" ""LATTE,"" ""FRESHERS,"" ""MACCHIATOS,"" ""HOT CHOCOLATE,"" and ""SMOOTHIES.""

Each category is packed with recipes for delicious drinks that will awaken your taste buds and ignite your creativity. Once you try one, you’ll be hooked—they’re just that irresistible! And if you fall in love with a recipe, you can save it to your favorites for quick access or share it with your friends, loved ones, or even the whole world through social media. Spread the joy, and watch as the World thanks you.

New Feature! Our app now includes an AI-powered Starbucks drink identifier. Simply snap a photo of your drink, and the AI will recognize it and provide you with a step-by-step recipe explanation, so you can easily recreate it at home.

For the ultimate Starbucks experience, we’ve added stunning wallpapers that bring a touch of Starbucks charm to your device. Plus, our app features video recipes, making it even easier to follow along and perfect your drink-making skills.

Do you have a fantastic recipe that’s missing from our app? Submit it, and let it go viral! Your contribution could become the next big hit among our community of drink enthusiasts.

Please note, we are not affiliated with Starbucks in any way. All material is sourced from open sources on the Internet and from amazing people like you. Join us on this delicious journey and explore the magic of the Starbucks Secret Menu!

Terms of use: https://gizehquality.wixsite.com/termsofuse

Privacy policy: https://gizehquality.wixsite.com/privatypolicy",2020-09-30T07:00:00Z,2025-10-06T11:13:47Z
sk,Slovakia,Food & Drink,6023,14,1552652768,KFC Slovakia Click&Collect,Stranto Business Solutions GmbH,https://apps.apple.com/sk/app/kfc-slovakia-click-collect/id1552652768?uo=4,0.0,1.55,20,Food & Drink,KFC Slovakia Click&Collect Ordering app,2021-02-08T08:00:00Z,2024-04-18T16:31:53Z
sk,Slovakia,Food & Drink,6023,15,1363182258,Qerko,Qerko s.r.o.,https://apps.apple.com/sk/app/qerko/id1363182258?uo=4,0.0,4.89286,980,Food & Drink,"Qerko was born from our desire to make paying in restaurants, bistros and cafés easier. We didn’t want to spend any more time waiting in the queue at the bar or complicatedly separate the bill with our friends at one table.

And we pursued this smart payment system beyond gastronomy borders! Download the app, scan the QR code and easily pay with just a swipe. You will get your receipt right after payment in your e-mail and in the profile in app, too.

Registration and adding the payment method can be done in less than a minute. Qerko app represents revolution in payment, so let yourself be part of it and decide on your own, when and how you are going to pay. 

What is more, with Qerko, you can get rewards in the loyalty program too.

Benefits of the app:
• Easy pay your bill or its part in a restaurant.
• No more wasting time waiting till the waiter comes.
• Comfy payment via QR code in a restaurant or at your TV screen.
• You need only your mobile phone to pay.
• You get rewards in the loyalty program just for paying.
• Many payment methods so everyone can choose - Visa, Mastercard, meal voucher cards Edenred, Sodexo or Benefit Plus or Apple Pay",2018-12-23T22:23:04Z,2025-11-14T09:35:52Z
