country,country_name,category,genre_id,rank,app_id,app_name,developer,url,price,averageUserRating,userRatingCount,primaryGenreName,description,launch_date,update_date
sk,Slovakia,Food & Drink,6023,16,6472887485,Strava.cz Meal Ordering,VIS Plzen. s.r.o.,https://apps.apple.com/sk/app/strava-cz-meal-ordering/id6472887485?uo=4,0.0,2.92366,131,Food & Drink,"The Strava app for iOS is used to order food on the internet portal strava.cz from a mobile device with the iOS operating system. Ordering food via the Internet is part of the catering systems supplied by the company VIS Plzeň, s.r.o. For users, it provides practically the same functionality as accessing the portal via a web browser.
Send suggestions or error reports to info@strava.cz. 

If you have problems with the application, please refer to the knowledge base available at http://bit.ly/2wklWN9.",2024-01-17T08:00:00Z,2024-08-27T08:57:47Z
sk,Slovakia,Food & Drink,6023,17,1524488773,European Coffee Trip,ECT media s.r.o.,https://apps.apple.com/sk/app/european-coffee-trip/id1524488773?uo=4,0.0,4.91667,48,Food & Drink,"Find a good coffee shop in a few clicks! European Coffee Trip is a mobile app built for coffee lovers and baristas living in or visiting Europe.

We manually curate a list of specialty coffee shops around Europe, from big cities to tiny villages, to guide you to excellent cafes nearby! Our database features over 5,000 cafes in 39 countries that we handpicked for the best coffee experience.

We build this mobile to make it even easier to drink tasty coffee wherever you are!

-- KEY FEATURES --

- Find a specialty coffee shop nearby
- Find a specialty coffee in any European city
- Search by proximity or navigate through the map
- Filter cafes based on your preferences
- Browse through rich cafe profiles with photo galleries
- Plan your coffee trip in a few clicks

Our database is stored offline, on your phone, so you can browse and navigate even without the Internet. We regularly review and update cafe profiles with new photos, opening hours and offerings. You can quickly check if the cafe is open or not!

-- PICK THE RIGHT CAFE --

- Types of coffee: espresso, filter coffee or cold brew
- Food menu: breakfast or lunch
- Plant-based and vegan alternatives
- Kids or dogs friendly
- Internet access and laptop friendly

Our goal is to make it easy for people to drink delicious coffee. Avoid bad coffee; get the app!",2021-09-30T07:00:00Z,2025-09-04T07:26:50Z
sk,Slovakia,Food & Drink,6023,18,1001501844,Deliveroo: Food & Shopping,ROOFOODS LTD,https://apps.apple.com/sk/app/deliveroo-food-shopping/id1001501844?uo=4,0.0,4.76098,1092,Food & Drink,"Hungry? Get your favourite meals, takeaways and groceries delivered to your door in minutes with Deliveroo. From local gems to big-name brands, discover thousands of restaurants and supermarkets near you.

ALL YOUR FAVOURITES, DELIVERED:

- Restaurants: Big brands and local gems
- Grocery: Always fresh with our Freshness Promise
- Convenience: Beauty essentials, flowers, gifts, DIY and more in minutes

Order from the restaurants you’re craving...

- Sushi or pizza?
- A Chinese or Indian?
- Burgers, pasta, breakfast or something sweet?

All of your favourites are just a tap away from top brands like KFC, McDonald’s, Burger King, Subway, Nando’s, Wagamama, Popeyes, Papa John’s, Wingstop, Giggling Squid, Kokoro, Pizza Express, Five Guys, Franco Manca, Dishoom, Pho, Taco Bell, Starbucks, Gail's Bakery, Joe & the Juice, GBK and more!

Or Fancy something different? Discover thousands of local gems that deliver right to your door.

£0 DELIVERY FEE WITH DELIVEROO PLUS

Become a member and you’ll also unlock:

- Exclusive offers and member-only deals
- Monthly rewards that help your money go further
- Discounted service fees*
- Earn 10% back on restaurant orders over £30*

*Plus Gold members only

It’s the simplest way to save while enjoying what you love most.

SUPERMARKETS SORTED

Get groceries delivered fast from top supermarkets, including Waitrose, ASDA, Morrisons, M&S, Sainsbury’s, Co-Op, Amazon Fresh, Whole Foods, Spar, One Stop, Iceland and Majestic Wine.

MORE THAN FOOD

We’re here for the everyday essentials and little treats too. From Boots and Healf to Not On The High Street, B&Q, Screwfix, Accessorize and The Perfume Shop, we've got you covered.

WHY CHOOSE DELIVEROO?

- Track every order live from kitchen to doorstep
- Enjoy fast, reliable delivery when it matters
- Order for right now or schedule for later
- Pick up deals you won’t find anywhere else

Download the app today and let us bring the best of your neighbourhood straight to your door.

T&Cs apply. Visit the website for full details.",2016-08-03T05:54:44Z,2025-11-17T15:05:51Z
sk,Slovakia,Food & Drink,6023,19,524943492,McDonald’s Germany,McDonald's Deutschland LLC,https://apps.apple.com/sk/app/mcdonalds-germany/id524943492?uo=4,0.0,4.75641,234,Food & Drink,"The official McDonald’s iPhone app!

Coupons, restaurants and your favorite products in a new design. Download our new app today:

- Current promotional products* and all our classics
- Coupons* for direct redemption at the restaurant, simply scan them at the counter
- Product finder with nutritional info
- Restaurant finder with opening hours, services and directions
- Mobile Order & Pay**


* Only at participating restaurants in Germany and Luxembourg.
** Mobile ordering and payment is currently only available in some restaurants. A list of participating restaurants can be found in the app. Mobile payment requires a valid VISA or Master Card credit card. The order function is only active if you are near a participating restaurant.",2012-05-15T11:45:52Z,2025-11-05T23:18:16Z
sk,Slovakia,Food & Drink,6023,20,6444029029,Mixit,Mixit s.r.o.,https://apps.apple.com/sk/app/mixit/id6444029029?uo=4,0.0,4.66667,3,Food & Drink,"V aplikaci Mixit.cz získáte nejrychlejší přístup k našim křupavým novinkám a výhodným akcím. Sbírejte speciální odměny a kredity za aktivitu přímo v aplikaci. Nyní si ještě snadněji můžete namíchat svoje müsli, kaši nebo mix ovoce, oříšků a čokolády. Vše vám v krásném tubusu pošleme až domů nebo si balíček vyzvednete na jednom z odběrných míst.

• Namixujte si vlastní mix müsli, kaše, ovoce nebo oříšků a čokolády
• Objevujte novinky a speciální výhodné akce přímo v aplikaci
• Okamžitý přístup do vašeho účtu a k vašim předchozím objednávkám
• Sbírejte speciální odměny a kredity za aktivitu přímo v aplikaci",2023-03-20T07:00:00Z,2025-11-21T07:59:26Z
sk,Slovakia,Food & Drink,6023,21,1055017986,Medusacard,"Medusa Restaurants, s.r.o.",https://apps.apple.com/sk/app/medusacard/id1055017986?uo=4,0.0,3.36957,46,Food & Drink,"Enjoy your Medusacard in your smartphone!

Details of your account, venues & benefits – now all in one place.

Medusacard is loyalty program of MEDUSA, largest middle-european culinary company.

Collect points in these venues and transfer them into tasty benefits!

We wish you a lot of culinary experience.",2016-02-12T08:18:29Z,2025-10-06T11:11:36Z
sk,Slovakia,Food & Drink,6023,22,1611372513,"My Tefal, cooking together",SEB Developpement,https://apps.apple.com/sk/app/my-tefal-cooking-together/id1611372513?uo=4,0.0,4.65079,63,Food & Drink,"... and ordering accessories for your multicooker, fryers and grills: Cook4Me, Actifry, Optigrill, Turbo Cuisine, Cake Factory, Easy Fry, Blenders, Pots and pans...


MAKE YOUR KITCHEN LIFE EASIER: Find recipes according to your needs in only two clicks (fresh seasonal vegetables, world cuisine, recipes ready in less than 30 minutes...). Review your history of last searches, use filters to save time or choose the ingredients that you do not want to use in your recipes.



ORGANIZE YOUR WAY: Easily collect all your favorite recipes in the “My Universe” tab of your My Tefal app. You have the possibility to modify these notebooks as you see fit.


UNIQUE RECIPES: Add a personal touch to your favorite Easy Fry or Blenders dishes! Edit a recipe by adding or removing ingredients. You have the possibility to save the new recipe to allow you to find it more easily next time you want to use it.


MAKE YOUR PERSONALIZED SHOPPING LIST: With the My Tefal app, make your life easier by creating shopping lists directly from recipes then add, remove or sort ingredients by category.


DISCOVER A RECIPE SUGGESTION EVERY DAY: Find inspiration with our suggestions of the day. You will look forward to making a recipe with your smart multicooker!


AN ACTIVE COMMUNITY: Create your own recipes and make them accessible to the whole community. Comment and rate the recipes to share your tips.
And because cooking rhymes with sharing, with the My Tefal app you can send your favorite recipes to your loved ones!


EMPTY YOUR FRIDGE AND AVOID WASTE: Thanks to the “in my fridge” feature, search for cooking recipes based on your tastes and the ingredients you have in your fridge. Your application will offer you a selection of suitable recipes that can be made with your multicooker.


The My Tefal app is your real kitchen companion that accompanies you every day. The ""step-by-step"" recipes help you make your favorite starters, main courses and desserts according to your preferences, the ingredients available and the number of portions you want. For each recipe you will find a detailed description of the ingredients and the cooking time for each.


The My Tefal application also offers you the possibility to buy the necessary accessories for your smart multicooker, Easy Fry or Optigrill, or even Pots and Pans and thus successfully complete the recipe.",2022-05-30T07:00:00Z,2025-10-21T09:23:28Z
sk,Slovakia,Food & Drink,6023,23,1273758728,HomeID,Versuni Netherlands B.V,https://apps.apple.com/sk/app/homeid/id1273758728?uo=4,0.0,4.82474,194,Food & Drink,"Unlock your home's full potential with HomeID.


HomeID, formerly NutriU, is your all-in-one app for meal planning and prep, with a variety of healthy and delicious recipes to explore. It's your companion for delicious Airfryer recipes and meals - from breakfast to dinner, healthy snacks, and delightful coffee breaks. Collaborating with home cooks, professional chefs, baristas, and Philips Kitchen Appliances, HomeID elevates daily routines into enjoyable experiences with:
• A vast array of easy recipes for every meal and occasion, including snacks, main courses, desserts, brunches, hot drinks, and more. Explore a world of homemade culinary delights.
• Detailed nutritional information for each recipe, empowering you to make informed choices for yourself and your loved ones.
• Diverse culinary options catering to all preferences, such as pasta, casseroles, chicken dishes, cheesecakes, and an extensive selection of vegan and vegetarian choices.
• Instructional videos, expert advice, and integrated features for Philips kitchen appliances, covering Airfryers, coffee/espresso machines, pasta makers, blenders, juicers, Air Steam Cookers, and All-in-One Cookers.
• Tips for crafting the perfect espresso or a simple caramel latte, bringing barista-level coffee into your home.
• A community dedicated to finding joy in the small things amid busy schedules.
• Plus, you can now purchase home appliances directly from your HomeID app.


HomeID - Your Comprehensive Home Appliance App.
Maximize your capabilities with HomeID. Suitable for new appliance owners and seasoned users, HomeID unveils the full potential of your home.
Embrace simplicity in your daily life. Join us at HomeID.",2022-09-29T07:00:00Z,2025-11-13T10:32:20Z
sk,Slovakia,Food & Drink,6023,24,342879434,Nespresso,Nestle Nespresso SA,https://apps.apple.com/sk/app/nespresso/id342879434?uo=4,0.0,3.225,40,Food & Drink,"Experience the world of Nespresso on your iPhone or iPad.

The Nespresso app allows you to buy coffee capsules, machines and accessories on-the-go or at home on your iOS device.
Enjoy the Nespresso shopping experience anytime, anywhere:
•	Refill your stock of capsules and explore new coffees
•	Find the right machine for you, and exclusive accessories to complete your coffee corner at home
•	Stay up to date with the latest Nespresso Limited Edition coffees
•	Discover the nearest Nespresso points of interest on the store locator (Nespresso Boutiques, retail stores selling Nespresso coffee machines, and coffee capsule recycling points)
Do even more with the app with one of our ‘connected’ machines:
•	Get notified when your capsule stock is running low to ensure you never run out 
•	Navigate through recipes to nurture your inner barista
•	Ensure the best coffee experience cup after cup through regular notifications from your machine on when descaling is needed, or the water tank is nearly empty
•	Get direct access to machine “How-to” videos

Take advantage of our extensive delivery services*, such as:
•	Free Standard or Pick Up Point delivery on purchases of coffee capsules and machines
•	Nespresso Boutique Pick-Up
•	Nespresso Express delivery 
•	Nespresso Saturday & Sunday delivery
•	Nespresso Your Time (choose the most convenient date and time of your delivery)
*Availability and conditions of each service depend on your geographical area",2017-09-05T10:17:51Z,2025-10-30T11:50:08Z
sk,Slovakia,Food & Drink,6023,25,1045591728,De'Longhi COFFEE LINK,De'Longhi Appliances S.r.l,https://apps.apple.com/sk/app/delonghi-coffee-link/id1045591728?uo=4,0.0,4.36141,368,Food & Drink,"Discover and explore the world of coffee with your De'Longhi coffee machine directly on your iPhone.

Coffee Link provides all you need to take your coffee experience to new destinations: 
with just a few taps you can fully manage your connected coffee machine, explore the world of coffee in our Coffee Lounge and discover and enjoy exclusive recipes.

Unleash the potential of your De’Longhi Coffee Machine:
•    Brew your favorite beverage remotely straight from your iPhone
•    Discover and prepare exclusive recipes
•    Monitor your machine's maintenance status

A fully personalized coffee experience, for you and your family:
•    Create and save your own recipes directly on the app
•    Personalize your beverages just the way you like them
•    Manage different user profiles and quickly add favorite beverages for each user

Get the most from your beans:
•    Let Bean Adapt technology extract the full flavor and aroma of your selected beans
•    Quickly adjust your machine’s settings to suit your specific taste preferences
•    Create and save different settings for each of your favorite beans

Enjoy and discover more about coffee with news, interviews and tips and tricks in the Coffee Lounge section.


Coffee Link works best with fully connected De’Longhi coffee machines. Check your model for available features.

Recipes available on selected coffee machines
Bean adapt available on selected coffee machines",2015-11-18T13:57:44Z,2025-11-06T08:53:32Z
