country,country_name,category,genre_id,rank,app_id,app_name,developer,url,price,averageUserRating,userRatingCount,primaryGenreName,description,launch_date,update_date
in,India,Food & Drink,6023,20,6683306445,Zepto Cafe,KIRANAKART TECHNOLOGIES PRIVATE LIMITED,https://apps.apple.com/in/app/zepto-cafe/id6683306445?uo=4,0.0,4.66127,3336,Food & Drink,"Introducing Zepto Cafe: Your 10-Minute Fresh Food Delivery App
Craving delicious, fresh food but short on time? Zepto Cafe is here to revolutionise your dining experience! Get a wide variety of mouthwatering dishes and refreshing beverages delivered to your doorstep in just 10 minutes*.
## Lightning-Fast Delivery
Experience the convenience of having your favourite meals at your fingertips. From crispy samosas to aromatic chai, and our signature Vietnamese cold coffee, Zepto Cafe offers an extensive menu to satisfy every craving.
## Unbeatable Variety
Explore our diverse selection:
- Quick Bites: Chicken Puff, Veg Tandoori Momos, Garlic Bread with Cheese Dip
- Comfort Food: Plain Maggi, Poha, Rawa Upma, Chole Kulche
- Hearty Meals: Hyderabadi Chicken Biryani, Butter Chicken & Rice, Paneer Makhani & Naan
- Beverages: Masala Chai, Spanish Coffee, Hazelnut Cold Coffee, Peach Iced Tea
- Desserts: Chocolate Mousse, Tiramisu, Layered Double Chocolate Cake Jar
Plus, find all your grocery needs right here in the Zepto Cafe app!
## Exclusive Offers
We're here to make you feel special: Enjoy up to 40% off on your first cafe order.
## Why Choose Zepto Cafe?
- Top-Quality Assurance: Orders prepared by expert chefs
- Trusted Service: Over 1 crore orders delivered with a 4.6+ rating
- User-Friendly Interface: Easy ordering process with live tracking
- Secure Payments: Multiple options including UPI, cards, and cash on delivery
Experience the convenience of Zepto Cafe today! Download now and transform the way you enjoy fresh, delicious food.
*T&C apply. Check the ETA before placing your order.",2024-12-13T08:00:00Z,2025-11-20T17:52:43Z
in,India,Food & Drink,6023,21,1058959277,Uber Eats: Food & Groceries,"Uber Technologies, Inc.",https://apps.apple.com/in/app/uber-eats-food-groceries/id1058959277?uo=4,0.0,4.6058,231112,Food & Drink,"Get food delivery to your doorstep from thousands of amazing local and national restaurants. Find the meal you crave and order food from restaurants easily with the Uber Eats app. Track your order in real-time.

FIND YOUR FAVOURITE FOOD & RESTAURANTS
Order food from nearby restaurants and search by cuisine, restaurant name, dish, and meal. 
Food delivery options for you to order and enjoy such as pizza, burritos, burgers, sushi, fish and chips, doughnuts and Chinese takeout.
Prefer pickup? Skip the line and reservations and choose to pick up your order instead. Choose your favourite delivery options with the Uber Eats app now.

SUBSCRIBE TO UBER ONE
For £5.99 per month, Uber One subscribers enjoy £0 delivery fee and up to 5% off orders over £15 at participating non-grocery stores (and 5% off orders over £25 at participating grocery stores) available on Uber Eats. Members are also eligible for rewards, perks, coupons, and offers. View full Uber One Terms & Conditions in app.

ORDER ALMOST ANYTHING, ANYTIME
Order household needs from your favourite pharmacies, supermarkets, and pet shops. Baby food or nappies, pharmacy needs, beauty products and cosmetics. Grocery staples like bread and milk, bananas and produce, flowers and plants, packaged foods or frozen treats. 

You can even order alcoholic drinks including beer, wine, spirits and cocktails.*

SIMPLE DELIVERY ORDERING
Pick your food order from any menu and add it to your cart with a few taps. That’s it.
Uber Eats makes it easy to order food delivery online or through the app and have it delivered by restaurants and delivery people near you.
Or, schedule your order in advance for a delivery person to pick it up later. Your choice!

ORDER FOOD AHEAD WITH PICKUP
Now you can also order food ahead for Pickup instead of just ordering delivery. Select Pickup, add food items to your cart, and skip the lines to the restaurant to get your food.

REAL-TIME ORDER TRACKING
Track your food delivery order on a map as it heads your way.
See the estimated arrival time at your address.
Get notified when your order arrives.

FIND SOME OF YOUR FAVOURITE NATIONAL RESTAURANTS
Some of our food delivery partners include: Pizza Hut, Domino’s Pizza, Burger King, Dunkin', KFC, McDonald's, Starbucks, Subway, Taco Bell,Costa Coffee, Kaspas, Gourmet Burger Kitchen, Franco Manca, Dixy Chicken, Chipotle, Chaiiwala, Amigos Burgers Shakes, Papa John’s, Krispy Kreme.  

FIND PHARMACIES, GROCERY STORES, AND MORE
Order from grocery stores such as Asda, Sainsbury Supermarket, Waitrose, The Co-op, Iceland, M&S Food, and Londis. You can also order from pharmacies such as Boots via Uber Eats, as well as from other delivery partners in the convenience and retail spaces.

ABOUT UBER EATS
Uber Eats is the way to order the food you love through an easy delivery experience. Uber Eats is available in hundreds of cities around the world. Enter your delivery address to explore restaurant and grocery delivery options near you.

AVAILABLE INTERNATIONALLY

Join others in your city who use the Uber Eats app to order from their favourite restaurants and schedule delivery.

Uber Eats is currently available in cities and metro areas including Adelaide, Amsterdam, Atlanta, Auckland, Austin, Baltimore, Brussels, Cape Town, Chicago, Dallas, Denver, Johannesburg, Glasgow, London, Los Angeles, Madrid, Melbourne, Mexico City, Miami, Milan, Nashville, New Orleans, New York, Ottawa, Paris, Philadelphia, San Diego, San Francisco, Seattle, Stockholm, Sydney, Taipei, Tokyo, Toronto, Warsaw, and Washington DC. Uber Eats helps you find food delivery around the world. Order delivery in countries around the world. See full list of available countries on our website. Uber content/messages human- or machine-translated as per device settings; accuracy not guaranteed

*Alcohol is only available in select markets. Must be at least 18 to purchase. Item availability varies by market. See the Uber Eats app for details.",2016-06-06T21:35:56Z,2025-11-17T16:26:42Z
in,India,Food & Drink,6023,22,1390247370,La Pino'z - Order Pizza Online,uengage services private limited,https://apps.apple.com/in/app/la-pinoz-order-pizza-online/id1390247370?uo=4,0.0,3.5931,12121,Food & Drink,"Order Pizza online From La Pino'z:  Every celebration deserves Monster pizza!

Whenever a pizza craving strikes, do you head to a Nearby Pizza Store?
No need to visit the nearest pizza store, you can use our Online pizza Delivery service Through the La Pino'z pizza delivery app. Our Online Pizza Delivery service is available across India with 600+ Pizza stores.
Save Time by online pizza ordering and enjoy the tastes and toppings of pizza hassle-free
Order your favorite vegetarian or non-vegetarian pizzas directly from the La Pino’z app to fulfill your pizza cravings. With India's top food delivery app, you can order pizza from nearby pizza stores 600+ Outlets across India.
Our kitchen and pizza online delivery team ensures that you enjoy cheese loaded with exciting toppings with the safety checks and measures in place at all times when ordering food online. Along with exceptional pizza, La Pino’z ensures exceptional safety measures.
La Pino’z has a contactless pizza online delivery service that allows you to enjoy your Pizza with complete safety.
We Measure the temperatures of the staff who’s handling your food, from the kitchen to the delivery rider with temperature tracking for the pizza delivery app, you can enjoy your favorite pizza with no ambiguity.
La Pino’z Pizza delivery app brings you standout options with premium toppings like olives, jalapenos, exotic vegetables, mutton keema, and more.
 
To get started, download the La Pino’z Online Pizza Delivery app from the App Store
Indulge in delightful La Pino’z Pizzas
Explore the extensive menu options and discover innovative and tantalizing dishes. Whether you're seeking something new or classic, you'll find a variety of veg pizzas and non-veg Pizzas to choose from. These include the Margherita pizza with customizable crust and toppings. From chicken wings to Monster pizza, tangy dips to stuffed garlic bread, all these tempting treats are just a click away.
When you're looking for a pizza restaurant to experience mouth-watering Italian cuisine, look no further! Don't forget to explore the diverse menu for delectable side dishes and irresistible desserts. Whether it's a solo treat or a gathering, order the irresistible Chocó Lava Cake!
Convenient Online Food Delivery Services
As people increasingly prefer home comforts, food delivery apps have surged. The Zero Contact Delivery policy provides peace of mind, eliminating concerns about contracting germs or illnesses since you don't have to come into direct contact with the delivery agent.
 
La Pion'z Online Pizza Delivery App Features:
Personalize your orders by choosing different toppings on a variety of pizza options. From Cheese Burst Pizza to Chicken Wings, English Cheddar to Cheese, a world of flavors awaits!
Order in Advance: Plan ahead for parties or gatherings by placing advance orders using coupons.
Late-night Orders: Satisfy your hunger pangs at any hour of the night.
One-Click Reorder: Loved your previous order? Simply click a button to place the same order again.
Exciting Offers: Enjoy amazing offers available at all times, ensuring affordable meals throughout the week.
Order Tracking: Keep track of your orders effortlessly once they are placed.
Hassle-Free Payments: Convenient online payment options make the checkout process easier.
How to Place an Order:
Search for ""pizza near me"" or La Pino’z pizza on the App Store.
Download the official La Pino’z Pizza Delivery app.
Log in to your account.
Locate the nearest La Pino’z Pizza Store.
Explore the menu and check for offers.
Keep an eye out for exclusive app-only La Pino’z offers.
Proceed to checkout and provide your address.
Complete the payment process.
Sit back and await the arrival of your delightful box of flavors",2018-06-27T12:29:47Z,2025-11-09T06:37:59Z
in,India,Food & Drink,6023,23,6739342823,SNACC: 10-Min Food Delivery,BUNDL TECHNOLOGIES PRIVATE LIMITED,https://apps.apple.com/in/app/snacc-10-min-food-delivery/id6739342823?uo=4,0.0,4.29419,1533,Food & Drink,"Introducing SNACC by Swiggy: Your Go-To for Quick Bites, Beverages and Home-Style Meals Delivered in 10 Minutes!

Craving comforting home-style food or a quick snack? This app brings a delightful array of freshly prepared dishes and beverages straight to your doorstep in just 10 minutes.

Why Choose SNACC?

- Speedy Delivery: Enjoy your favorite meals delivered hot and fresh in just 10 minutes.

- Diverse Menu: From aromatic coffees and teas to quick snacks and healthy homemade meals, we have something to satisfy every craving.

- Quality Assurance: Our dishes are prepared by expert chefs using the freshest ingredients to ensure top-notch taste and quality.

Explore Our Menu

- Beverages: Pick from our array of beverages to the start of your day – Filter coffee, Cappuccino, Cold Coffee, Hot chocolate, Adrak Chai and many more.

- Quick Snacks: Savor favorites like Maggi, puffs, samosas, rolls, and sandwiches, perfect for any time of the day.

- Hearty Bowls: Indulge in satisfying rice or pasta bowls, crafted to provide a wholesome meal experience.

- Home Style Meals: No more binging on knick-knacks. Order home-made lunches, tiffin and soups.

- Healthy Choices: Opt for a nourishing selection with protein shakes, protein bars, crisp salads, and freshly pressed juices to fuel your day.

- Extras: Enjoy a variety of options including eggs, nuggets, momos, and refreshing iced teas.

Exclusive Offers

New to SNACC? Enjoy Rs 50 OFF + Free Delivery on your first three orders.

User-Friendly Experience

- Easy Ordering: Our intuitive app design ensures a seamless ordering process.

- Live Tracking: Stay updated with real-time tracking of your order from preparation to delivery.

- Secure Payments: Choose from multiple payment options, including UPI, cards, and cash on delivery.

Download SNACC by Swiggy Today!

Experience the convenience of having food delivered to you in just 10 minutes. Download the SNACC app now and redefine your dining experience!

Note: Delivery times may vary based on location and traffic conditions. Please check the estimated delivery time before placing your order.",2025-01-06T08:00:00Z,2025-11-14T05:00:54Z
in,India,Food & Drink,6023,24,1603809688,Popeyes India: Food Delivery,Jubilant Foodworks Limited,https://apps.apple.com/in/app/popeyes-india-food-delivery/id1603809688?uo=4,0.0,4.69108,2062,Food & Drink,"Get ₹1000 worth of coupons & FREE DELIVERY with Popeyes app. Download now!

Online Food Ordering & Delivery with Popeyes App in India – Download the Popeyes app and order your favorite food online. 
Popeyes India: The Iconic global brand is now in India. Welcome to the Popeyes Family. Loved by Millions, it's now in India! 
Order Your Favourite Chicken Sandwich, Popeyes Signature Chicken, Chicken Wings, Cajun Veg Burger, Rice Bowls,  Combos, Wraps, Chicken Popcorns, Chicken Wings, Desserts and more online.  
Order from the Popeyes App to get exclusive offers and deals and for quick delivery of your favorite food from your nearest Popeyes store. 
Popeyes Menu: 
•	Popeyes Iconic Chicken Sandwich – Classic Chicken Sandwich & Spicy Chicken Sandwich 
•	Chicken – Lemon Chilli Grilled Chicken, Popeyes Signature Chicken – Classic, Cajun Chicken Tenders, Popeyes Signature Chicken – Spicy, Cajun Chicken Popcorn & Sweet Chilli Chicken Wings 
•	Sides – Cajun Chicken Tenders, Cajun Chicken Popcorn, Cajun Fries, Cajun Onion Rings & Cajun Veg Popcorn 
•	Rice Bowls & Wraps – Spicy Veg Rice with Cajun Veg Popcorn, Classic Chicken Wrap, Spicy Chicken Rice with Cajun Chicken Popcorn, Spicy Chicken Rice with Grilled Chicken, Spicy Chicken Rice with Popeyes Signature Chicken & Classic Veg Wrap. 
•	Vegetarian – Cajun Onion Rings, Cajun Veg Popcorn, Cajun Fries, Classic Veg Burger, Cajun Veg Burger, Classic Veg Wrap & Spicy Veg Rice with Cajun Veg Popcorn. 
5 Reasons to Order from the Popeyes App: 
•	Exclusive offers, deals & discounts for Popeyes app users
•	Multiple Options: Order online for home delivery or takeaway or Dine-in. 
•	Quick Delivery: Get your Popeyes favorites home delivered in no time. 
•	Avoid the queue! 
Payment Methods:
Hassle-free online payment with Popeyes App when you order your food online – go for any of the following payment methods: 
•	Easy payment using MasterCard or Visa Debit or Credit Card, Net Banking, Paytm and more. 
•	UPI is available as well. 
Download & Install the Popeyes iOS App now on your iPhone and Order Your Favorite Popeyes Dishes Online, Anytime. 
How to Place Order?
•	Download & Install the Popeyes App. 
•	Sign Up and log in to your account
•	Set your location to find the nearest Popeyes store. 
•	Browse through the Popeyes menu and checkout the offers and deals as well. 
•	Choose the dishes you want to order and place your food order online. 
•	Make the payment by choosing your convenient payment method. 
•	Sit back and relax while we ensure that the ordered food is delivered in no time. 
Track Your Order
With Popeyes iOS App, you can track your order and the ETA (Estimated time of arrival). 

Offer
A treat for your mouth and your wallet. Enjoy great benefits with the Popeyes app. 

Popeyes – Our Story
•	Serving since 1972 
•	25+ Countries
•	3300+ Stores 
•	250 Million+ sandwiches served
The year was 1972. A man named Al Copeland dreamed of serving the crunchiest and juiciest fried chicken out there. He crafted the perfect recipe with authentic culinary roots - roots that trace back centuries to New Orleans, Louisiana, United States. What started as one small restaurant and one big idea has now become a global fast-food phenomenon.
Popeyes in India
Jubilant Foodworks brought the joy to India with the launch of Popeyes® in Bengaluru, paving the way for Indian guests to enjoy Popeyes® world-famous menu items, including the brand's Iconic Chicken Sandwich.",2022-01-15T08:00:00Z,2025-07-10T12:07:13Z
in,India,Food & Drink,6023,25,1210203958,Starbucks India,Starbucks Coffee Company,https://apps.apple.com/in/app/starbucks-india/id1210203958?uo=4,0.0,3.86484,2708,Food & Drink,"Introducing the all-new Starbucks IN app, a world of rewards with a faster, more personalized and refreshing interface.
Enjoy a more seamless experience that brings the well-loved Starbucks experience to your app.
With our new app, you can discover more than 100+ handcrafted beverages and 60+ food choices. There is something for everyone. 

About this app:

It’s the quickest way to Join the My Starbucks Rewards™ Program and be a part of the Starbucks family.
It’s the fastest and most seamless way to pay, track your Stars, earned rewards, preloaded offers and reload your Starbucks card in a few simple steps.

What’s New?

# Faster & seamless user experience 
#  More Personalised experience 
#  Face and Fingerprint recognition
#  A refreshing user interface

Features:

Register In-App for My Starbucks Rewards™
Join My Starbucks Rewards™ with an E-Card or physical card design of your choice.

Pay In-Store
Leave your wallet where it is. Simply scan, Pay or redeem Rewards using the app at any Starbucks store in India.

Earn Rewards
Track your Stars and redeem Rewards for a free drink of your choice. Receive exclusive offers as a My Starbucks Rewards™ member.

Manage account
Easily manage Card balances, add or transfer funds, and view your account history.
 
Send a gift
Give thanks, express gratitude and let others know you care by giving a Starbucks E-Gift.

Discover What's New
Be the first to learn about what's new at Starbucks.

Find a store
See stores near you, view opening hours, and get directions by using the store locator.",2017-03-07T18:42:45Z,2025-08-13T16:00:51Z
