country,country_name,category,genre_id,rank,app_id,app_name,developer,url,price,averageUserRating,userRatingCount,primaryGenreName,description,launch_date,update_date
in,India,Food & Drink,6023,10,915824379,KFC India online ordering app,YUM RESTAURANTS (INDIA) PRIVATE LIMITED,https://apps.apple.com/in/app/kfc-india-online-ordering-app/id915824379?uo=4,0.0,4.5911,146250,Food & Drink,"KFC India – Your Chicken, Your Rules
Craving crispy? The KFC App’s got you covered with deals, speed, and a free Zinger Burger to kick things off. It’s not just food—it’s a vibe.


Why download? Because you’re smart (and hungry):
•	Order for delivery, dine-in or takeaway – your chicken, your way.
•	First order? You get a FREE Zinger Burger. Yes, really.
•	Get a fresh offer every time you order. No kidding.
•	Access App-only legends like the Double Down Burger that you won’t find anywhere else.
•	Best prices across all channels. Your wallet will thank you.
•	Skip the queue when you order dine-in or takeaway. Be the boss of the line.
•	Schedule orders, save your favorites, and store your address for lightning-fast reorders.


Download now and turn your cravings into crispy celebrations. Don’t just eat. Feast like a legend—with the KFC App.",2014-09-17T00:48:31Z,2025-09-09T05:09:46Z
in,India,Food & Drink,6023,11,1018594093,EazyDiner : Eat Out & Save,EAZYDINER PRIVATE LIMITED,https://apps.apple.com/in/app/eazydiner-eat-out-save/id1018594093?uo=4,0.0,4.61649,39686,Food & Drink,"Get best deals at top restaurants. Reserve a table now.

EazyDiner is the best app you’ll ever need to discover restaurants, make table reservations to avail great deals every time you eat out.  If you love to explore new & exotic dishes in your vicinity, EazyDiner helps you to choose from 10,000+ restaurants across India & Dubai.

Created by a team of industry experts who are hoteliers and chefs from around the globe, you can choose from handpicked and curated restaurant selection for your next dining out experience. EazyDiner members get best deals and discounts ranging from free drinks to 50% off on total bill. Our Prime membership ensures guaranteed 25% to 50 % discounts. All our members enjoy deal on every meal.

Discover Restaurants & Reserve a Table

Reserve a table at best restaurants in all top cities such as Delhi-NCR, Pune, Mumbai, Bangalore, Kolkata, Chennai, Ahmedabad, Hyderabad and 150 other cities in India & Dubai. The EazyDiner app helps you find top restaurants in your city depending on your choice of cuisine, restaurant, and location. Keep a track of your current and past bookings and also share the booking details with friends and family. Reserve a table at trendy restaurants in just a few clicks and save time & money!

Earn and Splurge EazyPoints

EazyPoints are loyalty points that you earn by making table reservations with EazyDiner, eating out, writing a review and even by referring a friend. You’ll be amazed to explore the variety of redemption offers we have in store for you. You can redeem EazyPoints for FREE 1-night stays at 5-star hotel properties across the country. Keep on uploading the bill and pay via the app to earn more and more EazyPoints. The more the merrier!

Dine like a VIP with EazyDiner Prime

EazyDiner Prime gives guaranteed 25% and upto 50% discounts for members. Dine like a VIP every time you go out. The membership provides higher discounts, access to dining events, F&B experiences along with give 2X extra EazyPoints on every booking.

EazyDiner Savings – Big, Bigger, Biggest!

Go cashless and pay your food bill through the EazyDiner app with additional bank offers. Make big on savings at over 2500 restaurants with our PayEazy feature that lets you make 100% safe online food bill payments (cashless), provides EXTRA PayEazy exclusive discounts every time you pay your dining bill and also lets you earn additional EazyPoints.

Stay Abreast of Latest Food Trends, New Dining Spots & Restaurant Reviews:

As and when a new restaurant opens up in your vicinity, we’ll get on a mission to make you gorge its signature delights with the top deals there. With exclusive expert reviews by top food critics helmed by our co-founder, the iconic Vir Sanghvi, EazyDiner doubles up as your personal guide to an extensive range of dining options in your city. Install the EazyDiner app, read quality restaurant reviews, which will help you plan the next meal at your choice of restaurant with best deals & discounts.

24x7 Culinary Concierge to Delight your Dining Experience

To make sure you have a swift and smooth dining experience, EazyDiner offers a 24x7 concierge facility. Ping for any assistance & eat out without any worry!

Deli-very very Safe

If you don’t feel like going out and wish to eat your favourite dishes in the comforts of your home, bring EazyDiner to your rescue and get exciting deals on delivery as well. EazyDiner provides safe food deliveries and takeaway services from selected restaurants in your city those which are following strict guidelines and safety measures like frequent temperature checks, sanitization process and time-to-time visits to monitor the safety standards. EazyDiner makes sure that a stronger end-to-end control on hygiene and quality of the food is being done that reaches the diners, because your safety is our utmost priority. 

Experience dining the Eazy way !",2015-07-30T09:10:35Z,2025-10-28T20:37:58Z
in,India,Food & Drink,6023,12,1052440342,"Licious - Chicken, Fish & Meat",Delightful Gourmet Private Limited,https://apps.apple.com/in/app/licious-chicken-fish-meat/id1052440342?uo=4,0.0,4.78195,69859,Food & Drink,"Order premium, delicious, fresh meats and seafood online at Licious. An online meat shop by meat lovers and for meat lovers, which delivers fresh poultry, meat, seafood, meat masalas and vegetarian plant-based protein.
 
Explore our wide range of fresh meats & seafood online:
 
Chicken: Licious Chicken has an ideal weight which ensures that the meat is just perfect and juicy. Our cold-chain system locks moisture within the chicken, ensuring a juicy bite every time. Licious chickens have no antibiotic residue or hormones. Pick from a wide range of tender juicy chicken cuts for any chicken recipe. Order fresh Chicken online from Licious.
 
Mutton: Licious Mutton comes only from government-approved partners. Our Mutton is pasture-raised & allowed to rest for maximum tenderness. Get perfect tender cuts of Mutton with the right amounts of fat along with a mix of bone-in & boneless pieces. Order Mutton online from Licious.
 
Fish & Seafood: Enjoy a variety of cuts of freshwater and seawater fish which are delivered descaled and degutted for convenient cooking. Our fish is caught daily & delivered straight to your doorstep, fresh within 24 hours of being caught. Licious fish has no added chemicals or antibiotics. Order Fish online from Licious.
 
Prawns: Licious Prawns are caught fresh from bio-secure aquaculture or coastal farms. They do not have any added chemicals or antibiotics & are available in a variety of sizes - all cleaned, deveined & delivered fresh. Order Prawns online at Licious.
 
Eggs: Our range of fresh eggs are naturally laid, cleaned & delivered fresh in breakage-free packs. These eggs are hormone & antibiotic residue-free. We have a wide range of eggs including classic, brown, quail & kadaknath eggs. Get fresh eggs online at Licious.
 
Ready-to-cook Snacks & Starters: Be it crispy snacks, Burger Patties, Chicken Wings or meaty Kebabs and marinades; make your day with our range of Ready-to-Cook Snacks & Starters that get cooked in a matter of minutes. These are freshly marinated using fresh meats & seafood and have no artificial preservatives. Order Snacks & Starters online at Licious.
 
Meat Masalas: The perfect match for our meats, Licious Meat Masalas are chef-crafted masalas made for the meat dishes you love! Our Meat Masalas offer a complete spice mix that requires no additional masalas and is Aroma-Locked (Cryogenically Ground). They contain no artificial preservatives and are made with natural tenderisers for effortless cooking. Order Meat Masala online at Licious.
 
 
UnCrave Plant-Based Protein: Our vegetarian plant-based meats look, cook, taste, and feel just like meat, but are made from plants! They are 100% vegetarian, packed with protein, low on calories and are cholesterol-free! Enjoy vegetarian Seekh Kebab, Galouti Kebab and Keema Fry. Order Plant-Based Meat online.",2015-11-01T23:38:56Z,2025-11-19T06:02:34Z
in,India,Food & Drink,6023,13,1662451643,Keeta - Food Delivery,Kangaroo Limited,https://apps.apple.com/in/app/keeta-food-delivery/id1662451643?uo=4,0.0,4.52691,1820,Food & Drink,"Keeta – The World’s Leading Food Delivery Service
Craving pizza, fried chicken, sushi, or something new? We’ve got you covered! Whether you’re in the mood for indulgent treats or healthy choices like fresh salads and light meals, Keeta delivers your favourites straight to your door. 

Why Choose Keeta?
1.Easy to Use – Order in seconds!
2.Daily Deals – Free delivery and discounts on every order!
3.Global Cuisines – Explore various tasty options.
4.On-time Promise – Your food arrives fresh and fast. 

How It Works:
1.Download Keeta and pick a restaurant.
2.Select your dishes and checkout.
3.Sit back and enjoy!",2024-09-14T07:00:00Z,2025-11-21T08:51:35Z
in,India,Food & Drink,6023,14,1090309756,Country Delight Milk & Grocery,Beejapuri Dairy Private Limited,https://apps.apple.com/in/app/country-delight-milk-grocery/id1090309756?uo=4,0.0,4.51121,214932,Food & Drink,"Delivering Grocery, Fruits & Vegetables, Milk every day morning at your doorstep by 7AM.

Trusted by 10mn+ people across Mumbai, Delhi, NCR, Hyderabad, Bengaluru, Chennai, and now delivering to all the major cities, our products are an integral part of families looking to cut out preservatives and adulterants from their every day grocery.

Our Preservatives-Free Cow and Buffalo Milk continue to be the most ordered and most recommended products since we started in 2015. Loved for their purity, consistency, and delightful aroma, our milk products are enjoyed by even kids and grandparents! 

Another one of our most ordered products, Country Coconut Water, is a trimmed-top tender coconut sourced from Pollachi. These Pollachi sourced ‘nuts bring you approximately 300ml water every time, and assured sweet, nutty flavour.

We also offer other delightful grocery items like Taaza Paneer, Ghar Jaisa Dahi, Mishti Doi, Taaza Pudina Chaach. Added to that, we are now delivering Fresh Fruits and Vegetables in selected cities. 

Like our flagship Milk and Desi Danedar Ghee, these products too are free of any middlemen intervention, chemical washing, and are delivered through an extensively monitored, advanced cold-chain system.

How does Country Delight deliver direct from the farm?
We engage directly with dairy farmers within 100kms radius of your city to procure fresh Cow and Buffalo milk twice every day. We don’t recombine or overprocess our milk or any other grocery items in our range. After checking its quality over 72 parameters, including synthetic hormones, antibiotics, and naturally occuring toxins, we pasteurise all Milk for safety, and we are delivering it to your homes within just 18-24 hours of collection. Our direct-from-farm and in-house delivery partners help us make your life easier.  

How to receive my order daily?
You can place or modify your order till 12 midnight for Milk and other dairy items. For Grocery fresh fruits and vegetables delivery, the daily cut-off ranges from 10pm to 12pm depending on your location. Our excellent delivery team will place your order at your doorstep. Just open your door to Fresh Milk, Milk Products, Fruits and vegetables anytime after 7 AM. 
It is also easy to get our Milk or fruits and vegetables every day by creating a subscription plan for these essential groceries. Our customizable subscription plan makes life easier in more ways than one. It empowers you to get fresh milk every day while also giving you a transparent view of your monthly spends on groceries. This regular flow of farm-sourced essentials, combined with the flexibility to modify or add more products till midnight, will make consuming clean, healthy, tasty products every day very easy. 

How much time does Country Delight take to deliver?
We take less than 12 hours to deliver fresh, adulteration-tested, FSSAI certified products to your doorstep. To receive Country Delight Milk, place your order anytime till 12 midnight and get assured doorstep delivery by 7AM next morning.  We also deliver our newly launched fruits and vegetables range early morning before you start your day. 
Experience the goodness of farm-fresh, chemical-free grocery delivered every day. 
To know more about our products, download our app. Claim your Rs. 100 Cashback and give our products a try.

Feel free to reach out to us at:
Email: info@countrydelight.in
Facebook: https://www.facebook.com/CountryDelightNatural/
Website: https://countrydelight.in
Privacy Policy: https://countrydelight.in/privacy-policy
Terms and conditions: https://countrydelight.in/terms-conditions",2016-04-19T08:31:15Z,2025-11-21T07:17:25Z
in,India,Food & Drink,6023,15,1535583068,EatClub: Food Delivery App,Poncho Hospitality Private Limited,https://apps.apple.com/in/app/eatclub-food-delivery-app/id1535583068?uo=4,0.0,4.73923,113493,Food & Drink,"Order on EatClub. FLAT 30% OFF Everytime. NO T&C. Get Free EATCLUB trial membership @ ₹0.

Explore a variety of cuisines - from Pizzas with 2X toppings to Desi Meals, Matka Biryani, Protein Bowls, Sub-Style Sandwiches, Rolls, Pasta, Ice Creams, Thin Crust Pizzas, Rice Bowls, Ghee Khichdi - we’ve got it all to fulfill your cravings.

Here's a look at our superloved & trustworthy brands:

BOX8 - India’s Largest Desi Meals Brand – 2CR+ Meals served. Delivering Irresistible All-in-one Meals, Dum Biryani, Curries, Desserts & more.

MOJO Pizza - Pioneers of Pizzas with 2X Toppings. Order from India’s Highest Rated Pizza Delivery Chain (4.5+ Star Rated App). 

Itminaan Matka Biryani - Slow-cooked in the authentic Dum-Pukht style & served in an Earthen Matka. 

Mealful Rolls - Full meals in big 9 inch rolls. Flavourful & filling, just like a full meal. 

LeanCrust Pizza - Meet the Thin Crust Experts! Hot & fresh thin crust pizza that stays perfect, even on delivery. 

ZAZA Mughal Biryani - The authentic, age-old Mughal flavours in India’s most flavourful biryani.

NH1 Bowls - Highway to North! Relish authentic North Indian flavors in an easy-to-eat bowl.

WeFit Bowls - High-Protein bowls, with upto 74 gm protein to fuel your fitness goals. Delicious way to eat protein!

Daily Kitchen - Homestyle meals that feel like a warm, comforting hug. 

Meet our other popular brands if you haven't already– Bhatti Chicken - Grilled, not fried, BOOM Sub Style Sandwiches, Hola - Fresh Gourmet Pasta, The Ghee Khichdi Project.

All these awesome brands & awesome deals like Meal Of The Day - Starts @ 99, Happy Hours @ 99 (Everyday 4-6 PM), BOGO Offers & more!

What’s more? Late-night delivery till 2 AM for midnight hunger pangs.

Live order tracking & customer support - Track your food orders, right from payment confirmation to delivery time to refunds. For help, chat with our customer support executives.

One membership, many benefits!

Ready to move on? Download the app now.",2021-01-27T08:00:00Z,2025-09-24T06:03:19Z
in,India,Food & Drink,6023,16,1451570624,Chicking - Online Delivery,New Albayan Foods LLC,https://apps.apple.com/in/app/chicking-online-delivery/id1451570624?uo=4,0.0,2.37778,45,Food & Drink,"Chicking is world’s first fully Halal Compliant Quick Service Restaurant (QSR) originated from Dubai, UAE.Started as a single eatery store in Dubai in the year 2000 and today Chicking have presence in 20 Countries with more than 150 Stores. Chicking is committed to provide Complete Halal Products to it’s customers and to meet halal standards in it’s global operations.",2019-06-03T09:43:29Z,2025-10-14T05:01:12Z
in,India,Food & Drink,6023,17,1597873835,Pizza Hut India - Delivery App,PH Digital Ventures UK Limited,https://apps.apple.com/in/app/pizza-hut-india-delivery-app/id1597873835?uo=4,0.0,4.46954,61786,Food & Drink,"Pizza home delivery made easy!  

Welcome to Pizza Hut India, your go-to pizza place that has a dil-satisfying menu at dil-satisfying prices! Now you can order pizza online or at the nearest Pizza Hut outlet. Pizza Hut India has got a wide range of delicious pizzas, sides, beverages, desserts & more which you can find on our online delivery app. Try our new pizzas like Mazedar Makhni Paneer, Awesome American Cheesy, Mexican Fiesta & more! 

Pizza Hut App Features:

·       Exclusive offers & discounts: Enjoy amazing deals, offers and discounts on our pizza delivery app, such as 1plus1 offer, up to Rs. 300* off & many more. Feast on affordable & delicious meals anytime you want.

·       Scheduling delivery feature: Don’t wait anymore to order at the last moment to enjoy piping-hot pizzas. Now you can order pizza online well in advance with the scheduling feature whether it is for a party or a family gathering. 

·       Takeaway: We also have pizza takeaway option. Just order from the app all that you love and pick it up from your nearest outlet.  Schedule a ‘pizza takeaway’, visit your nearest store & enjoy Dil Khol Ke!

·       Finding nearest Pizza Hut stores: Now, you can easily find the nearest Pizza Hut outlet with our App, where you can enjoy yummy pizzas in a great ambiance. You can also search pizza delivery near me options from our App. 

·       Tracking order option: Once you have placed the order with the pizza online delivery App, get updates on your order along the way. 

·       Speedy order & delivery: Order seamlessly using the pizza delivery App, and your warm & delicious order will reach you quickly.

Pizza Hut India believes in always delivering Dil Khol Ke! We create food we’re proud to serve and deliver it fast, with a smile. Your satisfaction is our utmost priority! Now download the Pizza Hut online delivery app & and satisfy your cravings while relaxing on your couch. Think Pizza, Think Pizza Hut!",2022-04-24T07:00:00Z,2025-11-18T03:11:55Z
in,India,Food & Drink,6023,18,6504881715,Swish: 10-Min Food Delivery,Munchmart Technologies Private Limited,https://apps.apple.com/in/app/swish-10-min-food-delivery/id6504881715?uo=4,0.0,4.68258,1676,Food & Drink,"Swish is a rapid food delivery platform that redefines convenience and speed. Imagine having a craving for your favourite snack or needing a refreshing beverage during a hectic workday. With Swish, you can have delightful, fast, and fresh food delivered to your doorstep in just 10 minutes.

Swish is designed to cater to the fast-paced lifestyle of modern urban dwellers. Our service is perfect for those moments when you’re in the middle of a meeting, and your stomach starts to grumble. With just a few taps on your phone, you can order a delicious snack and continue your work without missing a beat.

Picture this: You’re hosting a movie night with friends, and you realise you’ve run out of popcorn. No worries! Swish has got you covered. In 10 minutes, a friendly delivery person will arrive with a fresh batch of popcorn, ensuring your movie night is saved without any interruption.

Swish is also your go-to solution for unexpected guests. Imagine a scenario where friends drop by unexpectedly, and you have nothing to offer them. Simply open the Swish app, browse through our extensive menu of snacks and beverages, and place an order. In no time, you’ll have a variety of delicious treats to share with your guests, impressing them with your hospitality and Swish’s lightning-fast service.

In the hustle and bustle of daily life, Swish is the ultimate convenience. Our platform is designed to be user-friendly, with an intuitive interface that makes ordering a breeze. Simply browse our menu, select your items, and watch as your order is swiftly processed and delivered.

With Swish, you’re not just getting fast food; you’re getting an experience tailored to your needs. Whether you’re at home, at the office, or on the go, Swish is your reliable partner for delicious, quick, and fresh food. Experience the future of food delivery with Swish – where delightful, fast, and fresh food is just a few taps away.

A convenience you deserve. Experience Swish now!",2024-07-05T07:00:00Z,2025-11-20T05:53:28Z
in,India,Food & Drink,6023,19,920750178,McDelivery India west & south,HARDCASTLE RESTAURANTS PRIVATE LIMITED,https://apps.apple.com/in/app/mcdelivery-india-west-south/id920750178?uo=4,0.0,4.09963,33021,Food & Drink,"Whether you are craving your favourite gourmet burger or delectable, hot & gooey soft serve, the McDelivery app has got your back. The app brings the complete McDonald’s menu right on your palm. Enjoy the ease and simplicity of placing orders online and get them delivered to your doorstep in no time.
McDonald's cares for its customers and employees. So, be rest assured of the safety of your food when you place orders via the McDelivery app, one of the best apps to deliver food. Every single order is prepared & dispatched with the utmost care and with the least amount of human touch.
Frequent sanitisation, routine health check-ups of employees, and strict adherence to the safety protocols across our outlets help us deliver food in the safest manner. We call it the 'GOLDEN GUARANTEE' as it ensures our customers of extra safety without compromising on the quality & taste of food. So, go ahead and order your favourite McDonald's food online without any worry.

Why Should You Use the McDelivery App?
Placing orders from the McDelivery app is simple, safe, and convenient. Now your favourite McDonald’s items are just a few taps away. Be it McAloo Tikki, McChicken, Cappuccino, Fries, McNuggets, or anything else that is there on the menu list, just tap on the item, customise & add it to your cart, make the payment, and there you go. Indulge in your favourite McDonald’s food on any day you wish. 

Set up Your McDelivery App in a Few Easy Steps
Download the McDelivery app to use McDonald’s online delivery services. Set up your account in a few easy steps:
	•	Register – Just enter your mobile number and tap on ‘Get OTP’ for an OTP-based registration.

	•	Enable Location – Simply turn on the location services on your device to access the McDonald’s menu from the nearest McDonald’s restaurants.

	•	Check Out Best Offers – Get access to the best offers where you can get free delivery with ‘Gofree’ promo code and free favourites as well.
Now you don’t have to search online for McDonald’s food to deliver near me. Use the McDelivery app to effortlessly place your order and experience fast, safe, and contactless online food delivery to your location.

Features of the McDelivery App
The McDelivery app has made things easier for McDonald’s lovers.
	•	Order Customization, Made Easy 
You can quickly customise your order as per your personal preferences. Whether it's an option of bun for any of the listed McDonald's burgers, add-ons such as cheese, veggies, or a choice of beverage, sides, and desserts, you will be able to customise effortlessly.

	•	Order Tracking, Made Easy 
Once you've placed your order, just sit back and relax. Our delivery man will arrive at your house as soon as your order is ready.  

	•	Saving, Made Easy 
McDonald's India provides amazing offers to its customers. You can save money on your McDonald's orders daily by using exclusive McDonald's coupons. Check out the latest deals now.

	•	Finding Nearby Restaurants, Made Easy 
Enable GPS on your device to find nearby restaurants. You can also collect your order from a nearby restaurant in your area while you're on the go.

	•	Indulgence, Made Easy
Invite family and friends using your unique code to download and use the McDelivery app to receive free McDonald's burgers as rewards.

	•	Payments, Made Easy
Making payments online for your orders is now simpler than ever. You can pay for McDonald's items via credit/debit cards, CoD, wallets, net banking, and UPIs.

	•	Checking 'Payment History', Made Easy 
This feature on the app allows you to view your past payments, including details such as the amount and payment method.
Now, you don’t need to search ‘McDonald’s home delivery of food near me.’ No matter where you live, McDonald's food delivery app is always at your service. 
Please provide our app with the best rating. We curiously read your feedback & reviews and work on them to further enhance your experience.",2014-10-17T21:24:55Z,2025-10-09T05:48:59Z
