country,country_name,category,genre_id,rank,app_id,app_name,developer,url,price,averageUserRating,userRatingCount,primaryGenreName,description,launch_date,update_date
in,India,Food & Drink,6023,1,960335206,Blinkit: Grocery in 10 minutes,BLINK COMMERCE PRIVATE LIMITED,https://apps.apple.com/in/app/blinkit-grocery-in-10-minutes/id960335206?uo=4,0.0,4.66826,2312859,Food & Drink,"Blinkit is India’s last minute app. Trusted by millions, it is your everyday online grocery shopping app that home-delivers 10,000+ daily groceries in just a blink. Buy milk products, fresh fruits & vegetables, daily grocery, kitchen, home & office items by shopping for them online on Blinkit. Enjoy easy and smooth app experience with quick delivery.

- Best price and quality fresh fruits & vegetables
- Milk, curd, bread, butter, eggs, cheese, paneer & other daily grocery
- Snacks, biscuits, chips, ice cream, chocolates
- Cold drinks, ice, bottle opener
- Atta, rice, dal, oil, masalas, noodles
- Personal care, detergent, cleaning supplies
- Diapers & baby care
- Pet food
- Bulbs, batteries, mobile chargers
- Emergency medicines, thermometer
- Kitchen tools like chopper, blender, grinder
- Puja needs
- Stationery
- Smart watches, LED lights, Headphones



Beauty & skincare store
Makeup, luxury beauty brands & everyday skincare – now on Blinkit! Shop a huge range of authentic makeup, bath & body, hair care products, beauty accessories & much more!

Electronics store
Wireless or bluetooth earphones? Check. Smart watches? Yes. LED lights? Absolutely! Shop affordable and latest electronics online at best prices, only on Blinkit.

Safe and quick grocery delivery app
The average driving speed for Blinkit (formerly Grofers) delivery agents is 20kmph, since we have a grocery delivery store located every 2 km to instantly serve you.

Many safe payment options
Do your grocery shopping online on Blinkit & pay safely and securely for your groceries with UPI, COD or cards / wallets / netbanking / buy now pay later. We accept Sodexo meal pass and Paytm food wallet too.

Authentic phone accessories
We don’t want you to wait for the most premium and authentic phone accessories out there – which is why you can get them in minutes on Blinkit.

Printouts delivered in minutes
With Blinkit, you can get a printout of anything delivered in just minutes. With convenient options of both black & white and coloured prints, get all your documents sorted instantly!

Low prices, amazing offers
Blinkit (formerly Grofers) offers you big discounts and savings on daily grocery, bundles and bank offers. We give the best prices on online groceries with our monthly House Full Sale!

Live order tracking & helpful customer support
Track your grocery order online, right from your payment being confirmed to the delivery of your groceries. In case you need help, simply tap & chat with our customer support executives who are always ready to assist you.

Delivering groceries in 20+ cities
Instantly do your grocery shopping online! Get delivery of milk, vegetables, bread, snacks & more on the Blinkit app in Ahmedabad, Bengaluru, Chandigarh, Chennai, Delhi, Faridabad, Gurgaon, Hyderabad, Jaipur, Jalandhar, Kanpur, Kolkata, Lucknow, Ludhiana, Meerut, Mohali, Mumbai, Panchkula, Pune, Noida, Ghaziabad, Vadodara & Zirakpur.

Huge variety of local & international brands
Blinkit (formerly Grofers) grocery delivery app has a huge variety of shopping brands available online, including local specialities. In fact, Blinkit has brands you won’t find anywhere else. You can get delivery of daily grocery, festival special products, and even gourmet and international foods! Get the latest products from leading brands like boAt, The Wishing Chair, Ekam, MasterChow, The Body Shop, Farmley, Engage, The Whole Truth, The Moms Co, SuperBottoms, Tropicana, Nestle, Coca Cola, Lay’s, Harvest, Ferrero, Toblerone, Oreo, Nutella, Starbucks, Clinique, Kama Ayurveda, L'Occitane, Innisfree, Davidoff, Rage Coffee, Lindt, Starbucks, Blue Tokai, Sleepy Owl, Wingreens Farms, Bagrry's, Gunsberg, Jade Forest, Jimmy's Cocktails, Eveready, Nivea, Garnier, Lakmé, Haldiram's, Bikano, Heinz, Vahdam, Dettol, Cadbury, ITC, Colgate Palmolive, PepsiCo, Durex, Licious, Aashirvaad, Saffola, Patanjali, Fortune, 24 Mantra, TGL Co., Nestle, Amul, Dabur, & many more.",2015-03-04T05:39:34Z,2025-11-18T11:03:18Z
in,India,Food & Drink,6023,2,434613896,Zomato: Food Delivery & Dining,Zomato Media Pvt. Ltd.,https://apps.apple.com/in/app/zomato-food-delivery-dining/id434613896?uo=4,0.0,4.66693,5347834,Food & Drink,"Whether you’re chasing dreams, running meetings, or taking a break — Zomato is built for the ones who don’t slow down. Craving biryani between brainstorms? A cheesy burger after a long day? Or just a salad and chai to keep things steady? With lightning-fast delivery from over 3 lakh restaurants, your fuel is never far. Order in seconds, track every bite, and keep going. Hustle harder – we’ve got the food.

▪ Search and Discover Top Restaurants and Dishes
From butter chicken to sushi, dal makhani to dimsums – and legends like Domino’s, Pizza Hut, McDonald’s, Starbucks, and more – Zomato puts your cravings on speed dial. Just decisions, made easy.

▪ Access Restaurant Details
 Menus, ratings, reviews, photos – everything you need to decide fast and eat faster. Rate your meal to guide the next hungry hustler.

▪ Try Veg Mode
Veg Mode curates top vegetarian dishes, veg-only restaurants, and even veg-only delivery fleets. Clean eating with no compromise.

▪ Schedule Your Orders
 Time is currency. Lock in your lunch or dinner before the hunger hits. The scheduling feature lets you plan ahead and stay on track.

▪ Food on Train
 Even when you’re on the move, Zomato keeps up. Enter your PNR, pick your dish, and get your meal delivered to your seat at 130+ stations. No chaos, no compromises –  just food (and your schedule) right on track.",2011-05-24T18:02:45Z,2025-11-20T17:26:18Z
in,India,Food & Drink,6023,3,989540920,Swiggy: Food Instamart Dineout,BUNDL TECHNOLOGIES PRIVATE LIMITED,https://apps.apple.com/in/app/swiggy-food-instamart-dineout/id989540920?uo=4,0.0,4.4851,1681347,Food & Drink,"Hungry or Need Groceries in 10 minutes?

Welcome to Swiggy, your one-stop shop for online food ordering, groceries, dining, and convenient pickup & delivery!

Here's why India LOVES Swiggy:

• Order food & order groceries to get 10 min grocery delivery, & other essential services online
• Swiggy One users get unlimited Free Delivery on all orders including instant grocery
• Find top local restaurants like Mcdonald's & Burger King in your city
• Order Groceries like Maggi, Chocolate, and Amul fresh cream & enjoy lightening delivery in 10 Mins with Instamart
• Get discounts by paying dining out bills via our Dineout section
• Real-time updates on your food & instant grocery order status & an ETA 
• Make payments via VISA/MasterCard Credit or Debit Cards, Net Banking, Paytm, cash on delivery, credit services like LazyPay, & more

Food Delivery: Order Delicious Food With A Tap
Get Up To 60% Off + Free Delivery with Pocket Hero's picks

• No Minimum Order conditions, so you can order even a single item on Swiggy.
• Order chicken shawarma, Margherita pizza, masala dosa, burgers, pasta, coffee, chicken momos, desserts, & more.
• Explore our endless range of cuisines, including North Indian, Chinese food, South Indian, Thai, Healthy, Street Food, Breakfast, Late-Night Cravings, & more.
• Get North Indian food, Punjabi cuisine, South Indian cuisine, Italian and Bengali cuisine with top chains like Domino's Pizza, Wow Momo, KFC, Burger King, Pizza Hut, FreshMenu, McDonald's, Subway, Faasos, Starbucks coffee, and more.
• Find local restaurants, breakfast places, brunch spots, cafes & bars

INSTAMART - Get Anything In 10 Minutes

Instamart delivers groceries and more to your doorstep within 10 Minutes. Order groceries, emergency supplies, midnight cravings, cake deliveries, and more.

• From Knorr soup , fruit delivery, country delight ghee and diet coke, vegetables, Amul ice cream, Bisleri, dairy, Cadbury chocolate, cleaning essentials, personal care products like Santoor soap and Sunsilk shampoo, and baby care, you can find everything here.
• Present in 120+ cities, open from 6 a.m. to late at night* for 10 min grocery delivery like Maggi, Pringles Chips, Nescafe Coffee, and more.
*Opening & closing times might vary across cities owing to Govt. regulations.
• Grab 30,000+ products across groceries & other items like toys, stationery, home & kitchen appliances, electronics, beauty & more.

DINEOUT - deals on dining out at top restaurants

• Use Swiggy Dine out app to get up to 50% FLAT discounts with no upper limit on your dining-out bills.
• Over 40,000+ restaurants across 40+ cities 
• Up to 15% off on your bills with HDFC Bank Credit Cards
• Pre-book your table for hassle-free dining
• Find Cafes, bars, pubs, breweries, luxury dining, kid-friendly, rooftop dining, brunch buffets, and much more!

With Swiggy One, you'll experience savings like never before. 

• Order food online and get Unlimited free delivery + extra 30% discount from top restaurants
• Unlimited free delivery on all Instamart orders
• 0 surge fee

Order Food Delivery In Train IRCTC Delivery

Now, you can enjoy Swiggy's online food delivery even while traveling! With Swiggy's IRCTC delivery service, order food on train from top-rated restaurants at major railway stations and have it delivered directly to your train seat. Enter your train number, and let Swiggy handle the rest.",2015-05-12T01:37:09Z,2025-11-19T14:28:29Z
in,India,Food & Drink,6023,4,523106486,Dominos Pizza,Jubilant Foodworks Limited,https://apps.apple.com/in/app/dominos-pizza/id523106486?uo=4,0.0,4.71952,864943,Food & Drink,"This is an official mobile ordering app of Domino’s Pizza India. Now get your cheesy meals with incredible deals, only in 30 minutes!

Looking to order food online? Well, it better be Domino’s Pizza!
If you’re ordering Domino’s pizza online in India, Sri Lanka, or Bangladesh, get treated with delicious piping-hot pizzas, thanks to our extensive pizza delivery network available across the countries.

App Features:
* Easy Order Customization- Cheese Burst Pizza, Pepsi, Garlic Bread, Chicken Wings or Choco Lava Cake. Choose from our wide range of offerings and customize them the way you like! Also, we got some new offerings for you- African Peri Peri, English Cheddar & Cheese, Aussie Barbeque, Jamaican Jerk Spice and Indi Tandoori. Order them now!  
* Advance Ordering- Got a party coming up? Order your favorite pizzas in advance with domino’s pizza coupons!
* Late-Night ordering- Next time your hunger pangs strike 12 midnight, just open Domino’s App and order away
* One-Click Reorder- You can reorder your previous orders with just one click. So get, set, clickin’!
* Save your favorites- Liked our treats? You can save them in your favorites and order whenever, and wherever you like!
* IRCTC Train Ordering- Now get your cheesy meals on the go! Introducing our new ‘Deliver on Train’ feature in collaboration with IRCTC that helps you order while you travel. *T&C apply.
* Exclusive offers- Be it weekend or the middle of the week, pizza cravings can strike anytime. No stress, we got you covered with exclusive Domino’s coupons and offer deals for every day of the week. So now check out Domino’s offer today and apply Domino’s coupon codes with just one click!
* Easy order tracking- 30-minutes too long to pass? Log into our tracking feature and see our home delivery expert deliver to your doorstep. 
* Hassle-free payments- With multiple payment options on your fingertips, it’s now easier than ever to pay for your order.

How to Order?
1. Download the Domino’s app
2. Log into your account
3. Set your location for the nearest Domino’s store
4. Explore through Domino’s pizza menu with that gives you best offers for the price you pay. Do checkout app-exclusive Domino’s Pizza offer 
5. Checkout and fill your address
6. Select the payment options
7. Now sit back and relax! Your pizza will arrive in 30 minutes!

Have any feedback or queries? 
Domino’s customer care is happy to help! Write to us at guestcaredominos@jublfood.com
For more details, log into dominos.co.in",2012-05-10T00:34:44Z,2025-11-22T16:37:08Z
in,India,Food & Drink,6023,5,1516627543,Burger King India,Burger King India Private Limited,https://apps.apple.com/in/app/burger-king-india/id1516627543?uo=4,0.0,4.80372,67919,Food & Drink,"The official Burger King India app is now available for you to place your order, be it for safe and contactless dine-in, takeaway or food delivery. With the App, you can Have It Your Way in a few simple steps, and earn yourself some Crown rewards while you’re at it.

 

Taste, Your Way

We take your Trust in Taste very seriously, which is why with the Burger King App you have access to the freshest additions to the menu.

Want something big, juicy and flame grilled? Want it made Your Way with double patties extra cheese? We got a Whopper for you.

Craving those munchies? We got fries of more than one kind.

Feeling like going back to the classics? We got that irreplaceable taste for you.

Need to shake off those blues? We got some thick shakes to cheer you up.

Order through the App to let the King adapt to your taste, and recommend food items according to your preferences. 

 

Offers, Your Way

The Burger King app is Home to all the exclusive deals on your favourite dishes from the Burger King Menu. Download the app for meal prices like you’ve never seen before!

Use your crown points to redeem further discounts and offers.

 

BK Loyalty Program

The King always rewards loyalty. Earn crowns points on the Burger King app with each order. The more you collect, the greater the reward for you!

Pro tip: Shake your phone once you’ve downloaded the app to earn your crowns before you start filling up your cart.

 

Order Your Way

Wanna eat your Whopper at home in your pyjamas? The App’s got you covered with BK Delivery. Enjoy your freshly flame grilled Whopper brought to you at your doorstep through safe deliveries.

 

Wish to enjoy your meal on-the-go? Have it your way with zero contact ordering and safe takeaways by placing your order on the App. P.S- Do not blame us if you finish most of your Hi-Fries on your way back home.

 

Looking for the full Burger King experience with safe dine-ins while wearing the crown? Use this opportunity to earn some crowns as well on the Burger King app while going contactless in Your Way of ordering at the stores.

 

Finally, the King

Find out more about the Home of the Whopper on Brand Wall and you’ll learn the BK lingo in no time. At Burger King, we like to keep things real & authentic, just like the flavours in our food. Get a sneak peek into the King’s journey and how the Flame Grill came about. Learn what makes the Whopper so Imperfectly Perfect. After all, we take our food (not ourselves) very seriously.",2020-06-11T07:00:00Z,2025-10-13T18:00:05Z
in,India,Food & Drink,6023,6,6670203019,Bistro: Food in minutes,BLINK COMMERCE PRIVATE LIMITED,https://apps.apple.com/in/app/bistro-food-in-minutes/id6670203019?uo=4,0.0,4.73884,24387,Food & Drink,"Bistro: by Blinkit - Food in Minutes
Craving something delicious but short on time? Bistro is your ultimate food delivery companion, bringing a world of flavors to your doorstep in just 10 minutes! Whether it’s a quick snack, a hearty meal, or a refreshing beverage, we’ve got you covered with an extensive menu to suit every craving and occasion.

Why choose Bistro?

- Diverse Menu Selection: From crispy snacks to filling meals, desserts to hot and cold beverages, Bistro offers something for everyone.
- Lightning-Fast Delivery: Delivered to your doorstep in just 10 minutes—perfect for your busy lifestyle.
- Unparalleled Convenience: Whether it’s breakfast, lunch, dinner, or a quick bite, order anytime and satisfy your hunger in minutes.

Explore our menu

- Classic samosas, cheesy burgers, crispy fries, sandwiches, and more.
- Flavorsome thalis, rice bowls, pastas, biryanis, and hearty curries crafted to perfection.
- From freshly brewed aromatic coffees and energizing teas to smoothies, iced beverages, and refreshing juices.
- Decadent cakes, gooey brownies, ice creams, and a variety of sweet treats to end your meal on a high note.

An effortless experience

- Live order tracking: Know exactly when your food is prepared, packed, and on its way to you.
- Multiple payment options: Pay securely through UPI, credit/debit cards, wallets, or cash on delivery.
- Customer support: Our friendly customer care team is available to assist you with any queries or concerns.

How do we do it?
With strategically located kitchens and highly optimized processes, Bistro ensures your food reaches you piping hot (or refreshingly cold) in record time.

Serving happiness, anytime, anywhere
Whether you’re at home, at work, or on the go, Bistro is always ready to serve. No matter the occasion—quick office lunches, late-night cravings, or relaxed evenings—Bistro is just a tap away.

Download Bistro today!
Transform the way you eat with Bistro, the 10-minute food delivery app that redefines convenience. Explore a world of flavors, discover new favorites, and enjoy the joy of delicious food delivered faster than ever before.",2024-12-07T08:00:00Z,2025-11-19T04:50:21Z
in,India,Food & Drink,6023,7,1217507712,McDonald's,McDonald's Global Markets LLC,https://apps.apple.com/in/app/mcdonalds/id1217507712?uo=4,0.0,2.87665,2659,Food & Drink,"Welcome to the new official McDonald’s app.

The app is filled with great offers specially tailored to you. Deals and discounts appear regularly so check back often to see what’s new.

The news section keeps you up to date with everything that’s going on in McDonald’s near you. Look here for new games and competitions.

The nutrition section provides information on our entire menu. We provide allergy advice and nutritional information on everything from the Big Mac to a single dip!

Use our restaurant finder to find your nearest McDonald’s. Filter your search based on opening hours, facilities and get directions from wherever you are.",2018-12-11T18:07:01Z,2025-11-21T13:12:09Z
in,India,Food & Drink,6023,8,1171775851,magicpin:Food|Fashion|Delivery,Samast Technologies Private Limited,https://apps.apple.com/in/app/magicpin-food-fashion-delivery/id1171775851?uo=4,0.0,3.78197,8976,Food & Drink,"Welcome to India's 3rd largest food delivery app :)

Sign up now to enjoy a variety of deals and offers. Lucky new users can get up to 70% OFF (up to INR 150) and free delivery on food order. Order from McDonald's, Faasos, Behrouz Biryani, WOW! Momo and 10,000+ more restaurants near you. Offer valid for new users in Bangalore, Pune, Ahmedabad, Chennai, Jaipur, Lucknow, Kolkata, Mumbai, Hyderabad, Navi Mumbai, Thane, Howrah, Hooghly, Kalyan, New Delhi, Gurgaon, Noida, Ghaziabad and Faridabad. Free delivery applicable on orders above the minimum order value at select restaurants.

magicpin brings alive the best of shopping and savings from stores near you. Earn points on every purchase – whenever and wherever you shop. Use those points to get cashback, vouchers, pay at stores and order from your favourite local shops. Just upload pictures of your receipts or transaction SMS on magicpin and watch the savings and rewards roll in. Discover, shop and save with the best offers from your favourite brands across food, fashion, grocery, beauty, pharmacy, electronics, entertainment, travel, technology and more. 

How The Magic Happens 
1. Pin your location for amazing discounts, offers, cashback and vouchers from your favourite stores and brands
2. Discover and shop from nearby restaurants, grocery stores, fashion stores, electronics stores, pharmacies and beauty stores 
3. Upload your bills or share transaction SMS wherever you go shopping to earn magicPoints
4. Use magicPoints to buy super-saver vouchers for all your favourite retail stores and use the points in-store or for home deliveries from restaurants, grocery stores and pharmacies
5. Use magicPay to pay at shops and for delivery orders to earn instant rewards and magicPoints
6. The more you shop, the more magicPoints you earn, which you can use to shop even more 



Where The Magic Happens 
Get the best offers and earn savings and rewards at all stores near you. These include:
• Fashion and brand stores
• Grocery stores and supermarkets
• Restaurants
• Electronics stores
• Pharmacy orders delivered home in 45 minutes
• Spas, salons and beauty parlours
• Home delivery of orders from nearby restaurants, grocery stores and pharmacies
• Mobile recharges
• Gyms
• Travel vouchers
• Hotels
• Movies, concerts and events
• Online stores like Flipkart, Amazon, Myntra, AJIO and Nykaa

. . .and many more places near you!

Daily Deal Alerts 
• Get daily discounts with coupon codes and vouchers for leading brands and stores near you
• Mega offers on brands like Pantaloons, Big Bazaar, Superdry, Armani Exchange, Croma and many more
• Refer your friends to get free gift vouchers, rewards and magicPoints
• Use GroupBuy to buy vouchers with your friends and earn more magicPoints
• 4 PM Big Friday Sales: Save up to 90% on everything

Brands On Board 
With over 900,000 local and online stores across 40 cities, magicpin is your gateway to a brand new world. From the biggest brands to your local favourites, get savings, discounts, vouchers and the best deals for all your shopping.  

Some of the top brands on magicpin are:
• Titan
• Fastrack 
• Pepe Jeans
• Shoppers Stop 
• Pantaloons 
• Spykar
• Calvin Klein
• Lifestyle 
• Starbucks 
• Café Coffee Day 
• McDonald’s 
• Pizza Hut 
• Domino's 
• Biryani By Kilo
• Faasos 
• Behrouz Biryani 
• Wow! Momos 
• Bikanervala 
• BTW 
• A2B 
• Bahar Biryani
• Uber
• BookMyShow



The magicpin Feed 
Discover the best of shopping, lifestyle and entertainment in your city. 
• Follow your friends and top magicpin users (called magicians)
• Find the best places to shop, dine, party and hang out in your neighbourhood
• Discover places and brands trending among your friends 
• Engage with your friends and magicians and save their recommendations and reviews
• Apply to become a magician and share your discoveries with the magicpin community",2016-11-03T23:03:52Z,2025-11-23T19:15:48Z
in,India,Food & Drink,6023,9,808796222,EatSure Food Delivery,Rebel Marketplace India Private Limited,https://apps.apple.com/in/app/eatsure-food-delivery/id808796222?uo=4,0.0,4.58131,37543,Food & Drink,"Welcome to EatSure – The Food Court App
EatSure is your ultimate solution for ordering food online! Discover a wide range of delicious dishes from your favorite restaurants and get them delivered right to your doorstep. Satisfy your cravings with just a few taps!

Features:
Extensive Restaurant Selection
Browse through a wide range of restaurants offering multiple cuisines – Indian, Chinese, Italian, Mexican, and more!
We are home to some of India's most loved restaurants – Faasos, Oven Story Pizza, Behrouz Biryani, Wendy's, Kwality Walls, Mad Over Donuts, SLAY Coffee, Sweet Truth, Firangi Bake, Lunchbox, The Good Bowl, The Biryani Life, Baskin Robbins, Go Zero, Prasuma Momos, Zomoz, Naturals Ice Cream, Marrakesh, Anand Sweets & Savouries, and many more.
Seamless Ordering Experience
Enjoy a simple and hassle-free ordering process. Browse menus, customize dishes to your liking, and checkout easily — it's that simple!
Real-Time Order Tracking
Track your food from the kitchen to your doorstep with live order updates. Know exactly when your meal will arrive.
EatSure Elite Loyalty Program
Step into the world of EatSure Elite, where it's more than just perks — it's a status!
Enjoy free delivery on orders above ₹199, get a free dish on orders above ₹499, and use SurePoints to upgrade your dish.
Why settle for ordinary when you can be an Elite?
Best Price Guarantee
Unlike other platforms, our restaurant partners don't pay hefty commissions — the savings come directly to you!
Order from Behrouz, Oven Story, Faasos, LunchBox, and other trusted brands at the best prices — guaranteed!
Secure Payment Options
Pay easily and safely through credit/debit cards, UPI, and mobile wallets. Your personal information is always secure.
Buy 1 Get 1 Free Across Restaurants
Our revolutionary Buy 1 Get 1 Free lets you choose any two dishes from two cuisines and get one absolutely free!
Customer Reviews & Ratings
Make informed decisions by checking genuine reviews and ratings from real users about food quality and delivery service.
We Deliver Across 80+ Cities in India
Order your favorite meals from trusted restaurants across major cities and towns.

Download EatSure today!
Experience the convenience of online food delivery with the EatSure Food Court App.
Savor the flavors, indulge in culinary delights, and make every meal memorable.",2014-02-15T00:11:09Z,2025-10-15T12:37:08Z
