country,country_name,category,genre_id,rank,app_id,app_name,developer,url,price,averageUserRating,userRatingCount,primaryGenreName,description,launch_date,update_date
gb,United Kingdom,News,6009,9,388947468,The Telegraph: UK & World News,TELEGRAPH MEDIA GROUP HOLDINGS LIMITED,https://apps.apple.com/gb/app/the-telegraph-uk-world-news/id388947468?uo=4,0.0,4.46551,35116,News,"Stay ahead of breaking news in politics, sport and culture. Explore a range of tools and advice, from building your wealth to looking after your health. Keep your ear to the ground with Telegraph Podcasts, including the latest news from Ukraine, gripping investigations and the inside scoop on today’s biggest talking points. And train your brain with Telegraph Puzzles, like Sudoku, PlusWord, Panagram, Sorted and the Cryptic Crossword. 

Not yet a Telegraph Subscriber? Download the app now to try 14 days free – no payment details required. 

Follow the latest breaking news

Stay ahead of the stories shaping our world, from News and Business to Politics and Sport. Visit the Latest section for breaking news headlines, as they unfold in the UK, US and around the world. Or tap Home to scroll through the day’s biggest stories, with live blogs, videos and photo galleries, plus free-thinking comment and in-depth analysis.

Expert advice

Make the best decisions for you and your family. Whether you’re managing your money, looking after your health, planning your next holiday or searching for the perfect school or university, you’ll find a range of practical, valuable advice from names you can trust.
See how the latest news affects your plans – and learn how to turn it to your advantage. You’ll also find a wide range of useful tools and guides, to help you plan your next step with confidence.

Read the daily digital newspaper

Enjoy the digital editions of The Daily Telegraph and Sunday Telegraph anytime, anywhere. They're just like the printed editions of the newspaper, including all your favourite sections, supplements and magazines, like Telegraph Magazine.

Every day’s edition of the newspaper is available from 5am. What's more, once you've downloaded your newspaper, you can browse it online or offline. So whether you’re travelling to work, need some food for thought over lunch, or you’re just relaxing at home, you’ll be able to read the full range of our unrivalled insight, expert tips and in-depth long reads.

Stay ahead

Set up notifications and never miss a moment, whether it’s a breaking news story, a major sporting event, the latest updates in business and finance, a must-read interview or opinion from your favourite journalists.

Listen to podcasts

Visit our Podcast Centre for a widely acclaimed range of audio-journalism. Listen to Ukraine: The Latest, get the inside track on the news in The Daily T, tune in to Planet Normal or listen to a gripping investigation, like Bed of Lies.

Read subscriber-only newsletters

Enjoy more from your favourite Telegraph journalists. Read a selection of their subscriber-only newsletters.

Newsletters in the app include Matt’s weekly newsletter, Your Royal Appointment, Investor and Beyond Brexit Bulletin.

Play Telegraph Puzzles

Boost your mood and your brain power, wherever life takes you. Play games like the Mini Crossword, PlusWord, Panagram, Killer Sudoku and the Cryptic Crossword.

Don’t have a Puzzles Subscription? Worry not, upgrading your access is quick and simple.

N.B.
- Payment will be charged to your iTunes Account at confirmation of purchase
- Your subscription automatically renews unless auto-renew is turned off at least 24 hours before the end of the current period
- Your account will be charged for renewal within 24 hours prior to the end of the current period
- You can manage your subscription and switch off the auto-renewal by accessing your Apple ID after purchase

If you're a Telegraph Print Subscriber, you can use the app by validating your subscriber number and postcode within the app.

Privacy Policy: http://www.telegraph.co.uk/topics/about-us/3691972/Privacy-and-Cookie-Policy.html

Terms and conditions: http://www.telegraph.co.uk/topics/about-us/3692012/Terms-and-Conditions.html

You know where we are if you need us. For support or feedback, please contact us via product_app@telegraph.co.uk.",2010-09-20T16:06:20Z,2025-11-05T10:22:49Z
gb,United Kingdom,News,6009,10,316391924,"Sky News: Breaking, UK & World",Sky UK Limited,https://apps.apple.com/gb/app/sky-news-breaking-uk-world/id316391924?uo=4,0.0,4.57638,276613,News,"Get the full story, first. Free, wherever you get your news.


Download our app for award-winning journalism and breaking news stories from the UK and around the world.


At Sky News, our mission is to give you the ​full story, first, wherever you get your news. Because when you’ve got the full story, you can make up your own mind. We believe this has never mattered more.


We give you the full story, first:
- Taking you there, 24:7. So you can see what’s really happening.
- Asking the big questions. So you can find out what matters.
- Through bold and independent reporting. Giving you a fresh perspective.

Key features:
- Breaking news notifications - be the first to find out about major developing stories
- Watch Sky News live
- Listen to our podcasts including Sky News Daily, Electoral Dysfunction and Politics at Jack and Sam’s
- Easy navigation to see headlines on multiple topics from politics to entertainment
- Read articles while you’re offline
- Dark mode - change your preferences any time from the settings cog

Please note: Watching video may incur additional mobile network and/or WiFi charges.",2009-05-24T07:00:00Z,2025-10-23T09:49:22Z
gb,United Kingdom,News,6009,11,436792321,The Times: UK & World News,Times Media Limited (Apps),https://apps.apple.com/gb/app/the-times-uk-world-news/id436792321?uo=4,0.0,4.05928,9093,News,"Breaking UK and world news and expert analysis at your fingertips with The Times news app. Download now to access award-winning journalism anytime, anywhere.

A LIVE NEWS APP FOR THE STORIES THAT MATTER
Read the stories that matter most, curated by Britain’s leading journalists. From politics and business news to lifestyle and sport.

READ FROM YOUR FAVOURITE WRITERS AND TOPICS
Use the Find menu to dive deeper into the topics that interest you and read articles from your favourite writers, including Caitlin Moran, Hugo Rifkind, Giles Coren, Dolly Alderton, Jeremy Clarkson, and so many more. 

EXCLUSIVE CONTENT & BENEFITS
Read The Rich List, Best Places to Live, Good University Guide and our exclusive interviews.
Enjoy Times+ rewards, including two-for-one cinema tickets, events with our writers, and exclusive competitions.

CROSSWORDS & PUZZLES
Take a break from the news and challenge your mind with your favourite crosswords, sudoku, and more. Explore the Puzzles tab to find the perfect game and difficulty level for you. Plus, catch up on the games you’ve missed from the past 7 days.

30 DAYS OF PRINT EDITIONS IN YOUR POCKET
Prefer the feel of a traditional newspaper? Access the day’s print edition and browse past editions from the last 30 days.

SAVE ARTICLES & READ OFFLINE
Save articles to read offline, whenever it suits you.

JOIN THE CONVERSATION
Share your thoughts with other readers and our journalists by commenting on articles.

AVAILABLE ACROSS DEVICES
Access The Times news app on iPhone and iPad with iOS 13 or later. Your subscription also includes access via the web.

DARK MODE
Switch to dark mode for a reading experience that reduces eye strain and adapts to your environment.

IN A NUTSHELL
Download The Times news app today. Get instant access to breaking news, expert opinions and analysis, puzzles, and exclusive subscriber benefits. Stay informed, entertained, and connected—all in one app.

ACCESSING THE TIMES AND SUNDAY TIMES NEWS APP
The news app is free to download. You can read the news in one of the following ways:
Get an in-app subscription to The Times and Sunday Times. A digital subscription will give you access both through the app and web.
Log in with your username and password if you have an existing digital subscription.

PLEASE NOTE
Payment will be charged to your Apple account when you confirm your purchase.
Your subscription renews automatically unless you turn off auto-renew at least 24 hours before the current period ends
Your account will be charged for renewal within 24 hours before the current period ends
You can manage your subscription and turn off auto-renew by going to your Subscription Manager after purchase
If you start a free trial and then buy a subscription, any unused trial time will be lost

You can find full terms and conditions at http://www.thetimes.com/static/terms-and-conditions/

We value your opinion and feedback. Your views are essential to ongoing improvements. You can send feedback to us directly by emailing us at care@thetimes.com or by visiting https://www.thetimes.com/static/contact-us/

Follow Us:
https://www.facebook.com/timesandsundaytimes
https://twitter.com/thetimes",2011-06-27T20:24:29Z,2025-11-19T12:29:17Z
gb,United Kingdom,News,6009,12,485672520,The Sun Mobile - Daily News,News UK & Ireland Limited,https://apps.apple.com/gb/app/the-sun-mobile-daily-news/id485672520?uo=4,0.0,4.67366,14206,News,"The Sun Mobile app is the home of the latest breaking news, the biggest scoops and exclusives, and latest TV, showbiz news, and football news with live updates, videos and so much more.

Main features include:

Personalise your own feed on the ‘My News’ tab, choosing the subjects you want to read about – and removing the ones you don't. It's easy to edit so you can get the stories you want, the way you want them.


- Get breaking news notifications with videos and images straight to the lock screen on your device.

- Customise your alerts with the stories you want to hear and read about.

- Easy-to-navigate home screen displays all the top stories, from news and showbiz to TV and sport.

- All the latest videos from across news, sport, showbiz and money, with an ‘Editor’s Top Picks’ tab showing the very best.

- A ‘most-read’ feature for every section to highlight the most popular Sun stories of the day so you don't miss out.

- Special ‘swipe’ option to help you move easily from story to story, rather than having to navigate back through the app.

- Share stories and content with your friends and followers on social media platforms, including Facebook, X and WhatsApp.

- Huge Sport section featuring all the latest news, analysis, fixtures and insight from all our columnists, especially the Premier League and news about Manchester United, Manchester City, Chelsea, Arsenal, Liverpool and Tottenham. You can personalise your feed to get your team's news first, including clubs from the Football League and Scotland.

- All the latest football transfer news and gossip in a constantly-updated live blog.

- It's not just football, within the Sport section you will also find the latest from the worlds of boxing, rugby, cricket, tennis, NFL and much more.

- All your favourite and most outspoken columnists in one place, including the unique outlooks of Karren Brady and Jeremy Clarkson 

- The home of Bizarre, The Sun’s legendary showbiz gossip column, for all the latest about your favourite celebs. Plus behind-the-scenes look at the latest reports and your TV and Soaps updates.

- All the latest lifestyle stories from Fabulous Magazine. Plus the best fashion and beauty tips, health and fitness, parenting, relationships, food, horoscopes, pictures and videos.

- Special sections on the biggest stories, keeping you up-to-date on the latest news.

- The best travel news and tips, from city breaks to beach holidays to cruises, plus regular traffic and public transport updates to help you stay on top of delays.

- The famous Dear Deidre column, from the nation’s number one agony aunt, on hand to answer readers' questions about life and love.

- Great money savers, with discounts and exclusive competitions in the new Offers section.

- New features added all the time - we'll let you know when they're ready to use.


You can choose to unsubscribe from The Sun news push notifications in your device’s ‘Notifications’ screen.

Full Terms & Conditions can be found at: https://www.thesun.co.uk/terms-and-conditions/

For more information, visit us at https://www.the-sun.co.uk/
For additional support, contact us at https://www.the-sun.co.uk/contact-us/

Follow our social media:
https://www.facebook.com/thesun/
https://twitter.com/TheSun
https://www.instagram.com/thesun/",2012-01-31T23:48:44Z,2025-11-03T09:05:38Z
gb,United Kingdom,News,6009,13,409128287,The Guardian - UK & World News,Guardian News & Media Ltd,https://apps.apple.com/gb/app/the-guardian-uk-world-news/id409128287?uo=4,0.0,4.80345,252211,News,"Get fearless, independent journalism with the Guardian app. Never miss breaking news, dive into diverse opinion pieces, and follow stories minute-by-minute with our dynamic live blogs - from world news and politics to business and sport. Get the following app exclusive features:

My Guardian - Your own custom feed of your favourite topics and writers, so you can follow the stories you care most about. 

Puzzles - Whether you're looking for classics like Soduku and Crosswords, or fun word games like Wordiply and Word wheel, we have the puzzle for you. 

Podcasts - Listen to our award-winning podcasts directly in the Guardian app. 
 
Listen to Articles - Can't read our articles? Listen to them instead. You can get realistic audio transcription of every article we publish - excluding live blogs. 

The Guardian news app is free to download and offers you a beautiful, intuitive mobile experience – so you can read, watch and listen to our independent reporting whenever and wherever it suits you. Readers have a limited number of articles, which refreshes on a regular basis. If you’re a regular reader, you might consider subscribing. Subscribing gives you full access to Guardian articles in our app, so you can read quality, international journalism with no restrictions.

And, when you subscribe, you’ll unlock:

Unlimited reading in the app, with no subscription messages
Ad-free reading, for an uninterrupted experience
Offline reading – download articles to explore on the go

What’s more, subscribing to our news app is a great way to show your support for fearless, independent Guardian journalism. As a reader-funded news organisation, we rely on your funding to power our future. Thank you.

All content in the Guardian app is copyright Guardian News & Media 2025. All rights reserved.

Our Terms of Service and Privacy Policy apply when accessing content via the Guardian app.

Privacy Policy: http://www.theguardian.com/help/privacy-policy

Terms of Service: http://www.theguardian.com/help/terms-of-service

If you subscribe to the Guardian app, our subscription terms will also apply https://www.theguardian.com/info/2023/feb/24/the-guardian-news-app-terms-conditions. Your subscription will auto renew and you will be charged before the next renewal date unless you cancel.",2011-01-19T00:15:00Z,2025-11-17T14:14:14Z
gb,United Kingdom,News,6009,14,1239397626,"The Economist - News, Podcasts",The Economist Newspaper Group Inc.,https://apps.apple.com/gb/app/the-economist-news-podcasts/id1239397626?uo=4,0.0,4.79844,67177,News,"The world is complex, and changing fast. The Economist app unlocks independent reporting and news analysis from correspondents across the globe. With articles, podcasts, videos and more, our app is a simple way to understand big news developments and why they matter.

Now introducing The Economist Insider, a premium video offering available at launch for subscribers to The Economist. Join senior editors as they explain what's happening now—and what comes next.

What does The Economist cover?

With expert journalists around the world, The Economist reports on politics in America and around the world, as well as economics, business, science, technology and more. We connect the dots to explain the news today and implications for tomorrow.

Why choose The Economist app?

- Read global, fact-checked news reporting anywhere
- Listen to award-winning podcasts and audio articles
- Watch videos that distill big news 

Get access to independent news reporting on your terms:

- Catch up on the news quickly with The World in Brief 
- Enjoy early access to weekly edition, ahead of print
- Download articles for offline reading

Play news games to test your knowledge:

- Mini crossword: The Economist’s wordplay news puzzle
- Dateline history quiz: guess when news extracts were published 
- Pint-sized news quiz: have you been following the latest headlines?

Enjoy additional features:

- Bookmark news articles to read later
- Give news articles to friends and family
- Read news analysis easily with adjustable text size
- Toggle dark mode

See what The Economist subscribers say:

“Great app, excellent journalism! The Economist is wonderful. The content is interesting and relevant and the reporting is superlative. Equally impressive is the drive to stay relevant by presenting media in multiple formats, from print to podcasts and short videos.”

“Impeccable journalism with an app to match. The Economist doesn’t need my endorsement of the quality of their journalism. It speaks for itself. Rather, I’ll comment that their app is well-designed and refreshing to use…I love being able to easily download entire editions, listen to articles with real narrators and search for past articles.”

Full terms of use: https://www.economist.com/legal/terms-of-use
Our privacy policy: https://www.economist.com/privacy",2018-05-03T04:30:18Z,2025-11-18T07:54:42Z
gb,United Kingdom,News,6009,15,1199070742,Podcast App,"Evolve Global, Inc.",https://apps.apple.com/gb/app/podcast-app/id1199070742?uo=4,0.0,4.71363,28470,News,"Get millions of podcasts at your fingertips and any curiosity on-demand, only on Podcast App: the #1 most downloaded podcast app in The App Store. Sharpen up in your downtime with free and easy access to millions of shows. Start feeding all of your interests from news and comedy to true crime, sports and infinitely more.

Find something new to listen to in less than 10 seconds. With endless personalized recommendations,  interest categories, and our powerful search and filters, it’s easy to discover the perfect show or episode for your mood. Once you’re listening, pick up where you left off, speed it up or rewind 10 seconds and track your listening history. We provide the tools to take your time back and make the world of podcasts your own. Time to stop scrolling and just listen. 

Features

* Search any person, topic, sport, mood, and more to discover millions of the most popular and up-and-coming shows waiting for you. 


* Infinite personalized recommendations and ""Best of"" lists to help you find exactly what you want to listen to. 


* Favorite what you find, or save for later. Start building your podcast collection and settle in. 

* We won't forget about you—easily keep up with your favorite shows, pick up where you left off, and track your history and streaks in your personal profile.


— — — — — — — — — Subscription pricing and terms — — — — — — — — — — —

Our free app is ad-supported, but includes visual ads only. 

If you purchase our Premium subscription you can…

* Remove all visual ads completely
* Access our entire library of curated Deep Dive Playlists
* Unlock your full listening history
* Add your own private podcasts by URL

The payment will be charged to your iTunes account at confirmation of purchase. Your account will be charged for renewal 24 hours prior to the end of the current period and will identify the cost of the renewal. Auto-renewal may be turned off at any time by going to your settings in the iTunes Store after purchase. Subscription automatically renews unless auto-renew is turned off at least 24-hours before the end of the current period. Any unused portion of a free trial period, if offered, will be forfeited when you purchase a subscription to that publication, where applicable. Prices may vary from country to country.

Privacy Policy & Terms of Use: https://evolve.xyz/privacy/",2017-03-10T11:48:17Z,2025-10-23T00:03:20Z
gb,United Kingdom,News,6009,16,284862083,NYTimes: Breaking World News,The New York Times Company,https://apps.apple.com/gb/app/nytimes-breaking-world-news/id284862083?uo=4,0.0,4.74204,8664,News,"Discover original reporting and understand the events shaping the world in The New York Times app. Follow breaking news and get live updates. Watch news videos that provide context on top stories. Listen to news podcasts, culture podcasts, narrated articles and more. Access a range of coverage for the U.S., Australia and the world, including investigations, cultural commentary and analysis.


Download the app to enjoy all of The Times, all in one place: breaking news and in-depth reporting, plus games, recipes, audio journalism, product reviews, sports coverage and more.



BREAKING NEWS AND LIVE UPDATES
- Push notifications deliver the latest headlines and developing stories as they happen.
- Your daily news app that helps you stay informed as news breaks.
- Add widgets and custom alerts to keep up with the latest Australian and world news.

ORIGINAL REPORTING AND IN-DEPTH ANALYSIS
- Read, watch and listen to investigative reporting and insights.
- Access global news from 1,700 Times journalists reporting from 150 countries.
- Explore complex stories brought to life through data and visual journalism.

NEWS VIDEOS
- Watch videos featuring reporters, critics and other experts.
- Get closer to the story with videos across news and culture.
- Understand breaking news, top stories, culture reporting and more, in video.

INFORMED AUDIO NEWS
- Listen to a variety of audio journalism, including podcasts and narrated articles.
- Tune in to daily podcasts like “The Daily” and “The Headlines.”

ARTS, SCIENCE, TECHNOLOGY AND LIFESTYLE COVERAGE
- Discover reporting across arts, culture, fashion, travel and more.
- Stay informed on topics like technology, science and health.
- Explore culture with podcasts like “Modern Love” and “The Interview.”

SAVE, FOLLOW AND PERSONALIZE
- Easily save and access articles on topics you care about.
- See what’s new for you with personalized recommendations based on your tastes and reading history.

WORD, VISUAL AND NUMBER GAMES
- Unwind with daily games like the Crossword, Wordle, Connections, the Mini, Spelling Bee and Sudoku.

INSPIRING RECIPES
- Explore recipe ideas for easy weeknight dinners, holiday showstoppers and more.

COMMUNITY CONVERSATIONS
- Engage with Times reporters and readers in our moderated comments section. 
- Subscribers can share 10 articles per month with anyone.

DIGITAL SUBSCRIPTIONS
Enjoy everything we offer with a New York Times All Access subscription, which includes unlimited access to:
— Investigations, culture and analysis from News
— Word, visual and number puzzles from Games
— Recipes, videos, advice and inspiration from Cooking
— Independent product reviews from Wirecutter
— In-depth, personalized sports coverage from The Athletic

BY DOWNLOADING THE NEW YORK TIMES APP, you agree to:
• The automatic renewal terms stated above.
• The New York Times Privacy Policy: https://www.nytimes.com/privacy/privacy-policy
• The New York Times Cookie Policy: https://www.nytimes.com/privacy/cookie-policy
• The New York Times California Privacy Notices: http://www.nytimes.com/privacy/california-notice
• The New York Times Terms of Service: https://www.nytimes.com/content/help/rights/terms/terms-of-service.html

* Promotional offers for new subscribers only. Prices shown are in U.S. dollars. Other restrictions apply.",2019-01-31T08:00:00Z,2025-11-17T20:23:47Z
gb,United Kingdom,News,6009,17,1324203419,Ground News,Snapwise Inc.,https://apps.apple.com/gb/app/ground-news/id1324203419?uo=4,0.0,4.56649,2782,News,"Get all your news in one place on an eye-opening platform that shows you the bias, reliability and ownership of every source you read. Cut through the noise and escape media echo chambers with Ground News.

Ground News is the largest news aggregator in the world with over 50K news sources and 60K articles added daily. But we aren’t a typical news aggregator, throwing hundreds of headlines at you that barely skim the surface. Ground frees people from algorithmic restraints, illuminates blindspots and makes media bias explicit with our one-of-a-kind media analysis features.

AVOID MANIPULATIVE ALGORITHMS
SPOT MEDIA  BIAS
DISCOVER BLINDSPOTS
CHECK THE RELIABILITY OF SOURCES
SEE WHO OWNS THE NEWS YOU CONSUME

Read daily breaking stories from sources around the world, in real time. Like a modern day newspaper, we show you diverse stories instead of algorithm-driven content that can limit your worldview. News coverage is rarely unbiased, so we give you as much context as possible so you can come to your own conclusions. Compare coverage on partisan topics like politics, and elections.

Enjoy our free features, or subscribe for in-depth analysis that will transform the way you look at news.


About Your Ground News Subscription: 
Subscriptions renew monthly and can be managed through your App Store account
Payment will be charged to your App Store Account on confirmation of purchase
Renewal is automatic unless turned off at least 24-hours before the end of the current period
Subscriptions can also be managed through Ground News by going to your Account Settings after purchase 

See full terms and conditions here: https://ground.news/terms-and-conditions",2018-04-09T21:24:09Z,2025-11-18T18:51:44Z
