country,country_name,category,genre_id,rank,app_id,app_name,developer,url,price,averageUserRating,userRatingCount,primaryGenreName,description,launch_date,update_date
gb,United Kingdom,News,6009,1,333903271,X,TWITTER INTERNATIONAL UNLIMITED COMPANY,https://apps.apple.com/gb/app/x/id333903271?uo=4,0.0,4.57442,1385698,News,"Welcome to X (formerly known as Twitter), your trusted digital town square where conversations unfold in real time, and the world connects through breaking news, live events, podcasts, and everything in between.

Whether you're passionate about sports, tech, music, or politics, X is your front-row seat to what’s happening across the globe.

X isn’t just another social media app, it’s the ultimate destination for staying well informed, sharing ideas, and building communities. With X, you’re always in the loop with relevant trending topics and breaking news, delivered instantly to your screen, raw and unfiltered.

What You Can Do on X:
• Follow breaking news from around the world before it hits the headlines, and stay ahead of the curve with real-time updates on trending topics and viral conversations.

• Post your thoughts, photos, and videos with a global community. Join millions of users in shaping public dialogue across social, cultural, and political conversations.

• Discover Grok, the AI assistant powered by X’s real-time data. You can ask Grok to summarize trending news, explain videos, or give you more context about posts.

• Stream live video or go live with Spaces, our audio feature that enables you to host discussions, hold interviews, or start your next live podcast. Whether you're streaming a concert, a live game, or your thoughts on a hot topic, X keeps your audience engaged.

• Watch videos: from live breaking news and sports clips to podcasts and gaming sessions that last up to 3 hours long. Many of the world’s leading voices, in comedy, gaming, podcasting, and politics, all share their content on X.

• Connect and chat privately with friends, followers, customers, or collaborators through Direct Messages.

• Join and build communities tailored to your interests: from sports news, gaming, entertainment, crypto, entrepreneurship, tech, and more.

• Subscribe to X Premium to unlock exclusive features like a blue checkmark, boosted visibility, prioritized replies, fewer ads, longer videos, and post editing. X Premium also gives you access to creator revenue sharing and the ability to offer exclusive content to subscribers.

Why X?
In a world of constant change, X is your real-time source to stay ahead of the curve, connect with people, and explore diverse perspectives. From breaking live news and trending memes to top podcasts and live streams from your favorite creators, X brings it all together in one powerful social experience.

Privacy Policy: https://x.com/privacy
Terms and Conditions: https://x.com/tos",2009-10-09T19:50:00Z,2025-11-19T08:49:42Z
gb,United Kingdom,News,6009,2,1064216828,Reddit,"REDDIT, INC.",https://apps.apple.com/gb/app/reddit/id1064216828?uo=4,0.0,4.71849,368166,News,"Welcome to Reddit, the heart of the internet.

Reddit is a social network with something for everyone: trending topics, anonymous group discussions, and diverse communities.

Joining Reddit means immersing yourself in brutally honest and wholesome conversations that span across every topic and interest you could imagine.  Beyond exclusive content straight from the source, you'll also find gaming communities, insightful bloggers, passionate TV fandoms, sports enthusiasts, support groups, AI forums, the latest in celeb news, and creators of all types.

If you’re into gaming and sport, you can discover the best Xbox and PS5 forums, talk Zelda, Call Of Duty, or minecraft strategy while discussing the latest Football news, Cricket matches, and Rugby games.

Reddit has over 100,000 online communities (forums where members post and comment) dedicated to discussing topics. Some of the most popular global communities are:
■ r/AskReddit, where users can ask and answer questions
■ r/funny, which is full of humorous content, jokes, hilarious memes
■ r/science, for scientific talks and daily news from the scientific community
■ r/gifs, with funny animated gifs for your fun  and viewing pleasure
■ r/music, r/fredagain, r/beyonce and other music forums where music fans gather to discuss their favourite artists and genres.

On Reddit you’ll find:
■ Thousands of community groups and interesting topics, and a wealth of original content. 
Latest news, entertainment news, social media news, book clubs, TV fan theories, technology forums, open AI discussions, conspiracy theories, gaming forums,debate forums, and personalised content, there's a community for everyone.

■ Loads of laughs
Find popular memes, witty humour, jokes and gags, oddly satisfying videos, comedy clips, funny cat videos, and more to help you lose track of time.

■ Pop culture buzz
Explore the latest trends at r/popculturechat and r/fauxmoi, or join the lively discussions at TV groups like r/loveislandtv, r/bigbrotheruk, and r/MAFS_UK.

■ AMAs, or ""Ask Me Anything""
Celebrities, politicians, and experts answer questions from users.

■ The best discussions on any topic
Reddit’s discussion threads are where community members jump in with humour and insights for top conversations about anything; science discoveries, pop culture, gardening, entertainment, or financial advice.

■ Post anonymously and get answers to all of your questions
Ask communities anything you want. Ask questions on relationships, mental health, parenting, career advice, fitness plans, and more.

■ Anonymous profiles
Connect with people about any topic, join interactive community groups, and chat with other redditors, all anonymously.

Voting and Karma:

Instead of likes and hearts, Reddit’s social media network runs on upvotes or downvotes. Voting on posts and comments increase or decrease the creator’s karma, and helps popular and relevant posts rise to the top, while filtering out low-quality or irrelevant posts.

While karma doesn't directly impact your ability to use Reddit, more karma can increase posts’ visibility and help you get noticed. Some communities require karma to post or comment, which helps maintain content quality and community standards.



Reddit Premium:

Purchase Reddit Premium to enjoy an ads-free experience and access to premium avatar gear, r/lounge, custom app icons, and more.

Payment will be charged on a recurring monthly or annual basis to your Apple account. Your monthly or annual Premium subscription will automatically renew unless you cancel at least 24 hours before your subscription ends. Cancel anytime in your device’s Account Settings. No partial refunds.

Privacy Policy: https://www.redditinc.com/policies/privacy-policy
User Agreement: https://www.redditinc.com/policies/user-agreement
Reddit Rules:https://redditinc.com/policies/reddit-rules

If you have any problems with the app, get support at RedditHelp.com",2016-04-07T08:12:27Z,2025-11-18T18:02:22Z
gb,United Kingdom,News,6009,3,1581650857,Substack,Substack Inc.,https://apps.apple.com/gb/app/substack/id1581650857?uo=4,0.0,4.82531,27983,News,"Substack is a new media app that connects you with the creators, ideas, and communities you care about most.
- Support the creators you love: Subscribe for free or upgrade to view original work and connect directly with your favorite writers, artists, and podcasters.
- Enjoy ad-free videos and podcasts: Access short-form clips, video episodes, and  read-aloud articles without interruptions.
- Connect in real time: Join livestreams and live group chats, where top creators bring their biggest supporters into their world. 
- Explore independent ideas: Discover bold opinions and engaging views across food, sports, politics, fashion, comedy, finance, and more.

How it works:
1. Download the Substack app.
2. Claim your handle.
3. Explore the feed to enjoy notes, videos, and clips from creators. 
4. Subscribe to your favorites for free, tune into their livestreams and join private group chats.",2022-03-08T08:00:00Z,2025-11-17T17:28:36Z
gb,United Kingdom,News,6009,4,640360962,Nextdoor: Neighbour Network,"Nextdoor.com, Inc.",https://apps.apple.com/gb/app/nextdoor-neighbour-network/id640360962?uo=4,0.0,4.65665,244977,News,"Connect to your neighbourhood with Nextdoor. 

With trusted local news, real-time safety alerts, neighbour recommendations, free and for sale items, events, and groups – if it’s happening in your neighbourhood, it’s on Nextdoor.

Nextdoor is the essential neighbourhood network, bringing together over 10 million Brits and over 100 million neighbours around the globe.

WHAT MAKES NEXTDOOR THE #1 APP FOR NEIGHBOURS

See What's Happening Nearby

• Stay informed about local news and issues from trusted sources
• Find local events such as boot sales, farmers markets and community gatherings
• Join the conversation – from housing developments to road closures to hot new restaurant openings

Stay Safe and Prepared

• Get real-time weather, traffic and safety alerts 
• Be notified of critical power outages, severe weather and nearby fires as they happen
• Ask for or offer help in times of emergency

Find Local Favourites, Recommended By Your Neighbours

• Find a local babysitter or handyperson
• Discover hidden gems like the best place to take the kids, the most delicious tasting coffee or the new food pop-up
• Get something fixed fast with a trusted plumber, roofer or handyperson

Connect With Your Neighbours

• Find local free items, like that bike your neighbour no longer needs 
• Discover a group based on your interests, finding a local book club or tennis partner
• Keep up-to-date on all the neighbourhood happenings


HEAR WHAT NEIGHBOURS HAVE TO SAY ABOUT NEXTDOOR

“Nextdoor is an amazing app. It connects you to your immediate community. I had a lost pet and it immediately was met with concern and suggestions and support. Besides that it’s just a positive thing for communication and interaction. I’m so glad I downloaded the Nextdoor app.!!!!” - App review

“Fantastic platform for meeting neighbours, finding out local news or finding recommendations for local businesses! The ability to interact with the neighbours and being involved in the community is priceless! Highly recommend!” - App review

“I really enjoy using the Nextdoor app because it helps me stay in the know and know what’s going on in my area. Also it’s a great way to help others locally” - App review
 
“Before Nextdoor, I didn’t know there were several qualified babysitters living nearby and looking for work. It was easy to feel comfortable hiring my neighbour’s daughter to watch my son after school.” - App review

“This Spring, we decided to sell lots of old appliances, tools, clothing and electronics on Nextdoor. In no time, our neighbours stopped by to make a deal and take things off our hands. It was easier than anything else and it feels good knowing our old stuff has found a new home in the neighbourhood.” - App review


OUR MISSION

To make every neighbourhood feel like home.
Our mission is to make every neighbourhood feel like home. We do this by connecting neighbours to the local gems around them – people, places, and information. These local connections improve our lives by fostering a sense of community and belonging no matter where we live. 

YOUR PRIVACY

Nextdoor is a trusted environment where all neighbours are verified, making it safe to share online the kinds of things you'd be okay sharing with your neighbours in person.

Here's how:
• Every neighbour verifies their address when they join Nextdoor
• All members go by their real names, just like in person

Continued use of Location Services running in the background can dramatically decrease battery life. Nextdoor doesn't run Location Services in the background unless you give us permission by turning on optional features that require it.

Terms: nextdoor.com/member_agreement

Privacy: nextdoor.com/privacy_policy",2016-05-03T17:09:38Z,2025-11-19T16:50:44Z
gb,United Kingdom,News,6009,5,1566365113,GB News,GB NEWS LIMITED,https://apps.apple.com/gb/app/gb-news/id1566365113?uo=4,0.0,4.35743,3942,News,"Download the GB News App - the free news app from The People's Channel!
If you're looking for a breaking news app with the latest, breaking stories download the GB News App now. With the GB News App, not only are you plugged into the latest news and stories from GBNews.com but you can watch GB News live and catch-up on our award-winning TV shows, from Farage, Breakfast with Eamonn and Isabel to Dewbs & Co and Patrick Christys Tonight.
 
You also gain exclusive entry into our Members Area, packed with special behind-the-scenes footage, interviews and analysis for GB News subscribers. Hailed one of the best news apps in the UK, the GB News App brings you the very latest breaking news, wherever you are. 
 
Download our free news app today for the best breaking news and live TV/VoD experience. Never miss your favourite shows again, stay  informed and join our growing GB News community. Join us. Together, we are The People's Channel - Britain's News Channel. 
 
- Round-the-Clock Updates: Keep up-to-date with breaking news 24-hours-a-day 
- Live TV and catch-up: A full live stream and Video on Demand service from GB News 
- Stories that matter to you: We're not the establishment, we're The People's Channel 
- More than news: Beyond breaking news we have the top Royal, Politics, Personal Finance, Technology, Opinion and Analysis, Sport, Celebrity, Lifestyle, TV, and Lifestyle content, updated 24/7
- GBN America: Get the latest US news and politics from our correspondents in the United States 
- User-Friendly Experience: Enjoy easy navigation and an intuitive design for a smooth news browsing journey
- GB News Membership: Access a huge range of exclusive stories, videos, uncut shows, behind-the-scenes footage, access to special events and play crosswords, puzzles, games and quizzes - from sudoku to wordsearch -  in our brilliant GB News members-only area
- Free news alerts: Real-time updates and push notifications straight to your phone, so you never miss out on the latest breaking news
- Seamless Sharing: Easily share news and your favourite stories across your social networks
- Listen: Live or on demand to GB News Radio, Britain's fastest-growing news radio station

Privacy Policy: https://www.gbnews.uk/privacy
Terms of Use: https://www.gbnews.uk/terms
Membership Rules: https://www.gbnews.com/terms/membership-rules",2021-06-12T07:00:00Z,2025-04-24T10:03:47Z
gb,United Kingdom,News,6009,6,377382255,BBC News - UK & World Stories,BBC Media Applications Technologies Limited,https://apps.apple.com/gb/app/bbc-news-uk-world-stories/id377382255?uo=4,0.0,4.50605,751180,News,"The official BBC News app offers you the latest live news you can trust from our UK and global network of journalists.


Download the BBC News app, where you’ll get top stories and breaking news, live reporting, and the option to follow news topics that match your interests. Our topics range from UK News, Health, Lifestyle, Culture, Business, Technology and Science and Environment. These can all be found in the My News tab in the app.



The BBC News app offers the following:


News, Features & Analysis
Headlines, detailed analysis, and exclusive features.



Breaking news and top stories 
Get breaking news and top stories from our trusted global network of journalists.



Live news and developing stories
Follow developing stories with up-to-the-minute reporting available 24-hours a day and access the BBC News channel live stream.



Local news and weather
Using the UK postcode in your BBC account, we’ll show you local stories and weather to stay informed on your area.



Alerts for top stories
Opt-in to push alerts where you will receive notifications instantly to your device. 



Follow news that’s important to you with My News
Create a personalised My News experience that brings together the topics and stories you care about and trust the most. Access them quickly in the My News tab.

------


If you choose to receive push alerts, a unique identifier relating to your device will be stored by Airship on behalf of the BBC to provide you with the service. No other personal data relating to you (such as a username or email address) is processed.


You can choose to unsubscribe from BBC News push notifications in your device’s ‘Notifications’ screen.


For attribution and analysis purposes, our data processor AppsFlyer collects the below information about you:
- Your device information, such as device type
- Your IP address to determine your location
- Activity data, such as the time you downloaded the app
- Which sites (if any) referred you to download and use the app


We also use this data together with your BBC account data to improve the BBC News service. You can opt out from AppsFlyer tracking by filling out their ‘Forget My Device’ form: https://www.appsflyer.com/optout.



The BBC News app uses technologies similar to cookies to measure audience behaviour. The app uses information collected through these technologies for internal purposes to analyse and improve the app and help us give you a better experience. You can switch this off using the Send App Statistics toggle on the BBC News app’s Settings screen.


For more information about how and why we use information about you, please visit the BBC News App Privacy Notice: https://www.bbc.co.uk/news/help-55320181


The BBC will keep your information secure and not share it with anyone else in accordance with the BBC’s Privacy Policy which can be found here: http://www.bbc.co.uk/privacy.


For more information about how the BBC processes your personal data to provide a personalised service to you, please see the BBC’s Privacy and Cookies Policy at https://www.bbc.co.uk/usingthebbc/privacy/how-does-the-bbc-collect-data-about-me/.


If you install this app, you accept the BBC Terms of Use at http://www.bbc.co.uk/terms/",2010-07-23T11:39:53Z,2025-11-06T11:05:37Z
gb,United Kingdom,News,6009,7,1200842933,Financial Times: Business News,Financial Times Ltd.,https://apps.apple.com/gb/app/financial-times-business-news/id1200842933?uo=4,0.0,4.77085,40397,News,"Empower your ambitions with the Financial Times’ unrivalled, globally focused journalism. 

WHAT’S FREE? Download for free and access all podcasts, all videos, the FT Crossword, markets & finance blog “Alphaville” and 3 articles of your choice per month without any payment.

FINANCIAL TIMES ADVANTAGE:
• Accurate, independent, and insightful journalism since 1888.
• Unbiased reporting: Expert comment and analysis on world news, business, politics, economics, finance, companies and more
• Thought-provoking journalism: Explore the arts, real estate, fashion, food, books, technology news and more with a unique FT voice
• Market Insights: Monitor real-time stock prices, charts, equities screeners, and global market news
•Personalised news: Follow topics important to you by curating your own feed with MyFT

LISTEN, WATCH, READ: 
• Podcasts, including News Briefing and FT Weekend
• Articles read by AI
• Available with Apple CarPlay for news on the go
• Offline Reading: Save articles and editions for offline reading anywhere, anytime
• Video: Compelling insights through video journalism 

JOIN THE CONVERSATION: 
•Engage and Share: Join the conversation in the comments, or share and gift news stories

HAVE A SUBSCRIPTION?
• Go beyond free access with discounts and offers in the app 
• Choose from access levels based on your content needs
• Current subscribers log in for seamless access

IS THE FT FOR YOU?
 Whether you're an economist analysing global trends, a stockbroker navigating market shifts, a business leader staying ahead of financial news, or a curious mind exploring politics, culture, and the forces shaping our world, the Financial Times offers world-class insights to inspire, inform, and push you further in your ambitions.
From Wall Street to Hong Kong, from New York to London, FT covers not just markets and finance, but also global affairs, technology, climate policy, and industry leading social research. Whether you're unpacking the impact of elections, exploring cultural shifts, or following scientific breakthroughs, our innovative approach to news brings you deeper analysis and fresh perspectives.

With reporting from over 50 countries, opinion pieces, long-form features, and expert commentary on everything from diplomacy to digital transformation, FT is for those who think beyond the headlines. Whether you're planning your next departure to a cultural capital, exploring new culinary experiences, or seeking fresh literary insights, stay ahead of the conversation with FT.

Terms and conditions apply.  Read them at ft.com/terms
We respect your privacy.  Read our privacy policy at ft.com/privacy",2017-08-07T12:30:47Z,2025-11-18T17:42:02Z
gb,United Kingdom,News,6009,8,297700808,"LBC: UK, World & Breaking News",Global Media & Entertainment Limited,https://apps.apple.com/gb/app/lbc-uk-world-breaking-news/id297700808?uo=4,0.0,4.49246,6370,News,"Welcome to the official LBC news app
Stay on top of the latest news, breaking stories, and insightful opinions from award-winning journalists like Nick Ferrari, James O’Brien, Andrew Marr, Lewis Goodall, and more. With LBC, you can read, watch, and listen to top stories and in-depth discussions on everything from current events and politics to global affairs, business, and tech. Keep up with the headlines you care about most with LBC – Leading Britain’s Conversation.
 
Whether you're into political deep dives or curious about the latest news from Silicon Valley, stay in the know with LBC. With the LBC app, you can read breaking news, listen live, or catch up on your favourite shows – all in one place. Download LBC today and get UK & World news on your terms.
 
Why download the LBC news app:
 
Customise your news feed
With LBC, you control your news. Personalise your feed to follow the topics and opinion pieces that matter most to you, and easily add, remove, or reorder stories to match your interests.
 
An award-winning lineup
Get access to insightful commentary and expert opinions on breaking UK news from LBC's all-star lineup, including Nick Ferrari, James O’Brien, Andrew Marr, Lewis Goodall, Shelagh Fogarty, Ian Dale, Tom Swarbrick, and more.
 
Never miss a headline
Stay in the loop with push notifications delivering the latest stories, headlines, and breaking news straight to your device.
 
News, your way
Whether it’s live radio, articles, or podcasts like “The News Agents,” LBC has you covered. Discover the latest news in whatever format suits you best.
 
Additionally, with LBC you can also enjoy all of Global’s other stations, including Capital, Capital XTRA, Capital XTRA Reloaded, Capital Dance, Capital Chill, Capital Anthems, Classic FM, Classic FM Calm, Classic FM Movies, Gold, Heart, Heart 70s, Heart 80s, Heart 90s, Heart 00s, Heart 10s, Heart Dance, Heart Love, Heart Musicals, Smooth, Smooth Chill, Smooth Country, Smooth Relax, Smooth Soul, Smooth 70s, Smooth 80s, Radio X, Radio X Classic Rock, Radio X Chilled, Radio X 90s and Radio x 00s.
 
Download the LBC app to read, watch, and listen to live coverage of UK news and world affairs today.",2009-01-16T06:55:43Z,2025-11-17T11:09:44Z
