country,country_name,category,genre_id,rank,app_id,app_name,developer,url,price,averageUserRating,userRatingCount,primaryGenreName,description,launch_date,update_date
tt,Trinidad and Tobago,Entertainment,6016,1,835599320,"TikTok - Videos, Music & LIVE",TIKTOK PTE. LTD.,https://apps.apple.com/tt/app/tiktok-videos-music-live/id835599320?uo=4,0.0,4.85505,21828,Entertainment,"Discover videos from around the world and create your own with easy-to-use tools to capture your life. 

From your morning coffee to your evening commute, TikTok has the videos to make your day. Whether you’re a sports fanatic, a travel lover or simply looking for a laugh, there’s something for everyone on TikTok. Enjoy an endless stream of short videos on things you love most. Watch what you like, skip what you don’t. 
 
WATCH
A personalised video feed based on what you watch, like, and share. TikTok offers you real, interesting, and fun videos that will make your day.  You'll find a variety of videos from Food and Fashion to Sports and DIY - and everything in between.

 
CREATE
Pause and resume your video with just a tap. As many times as you need.
Millions of creators on TikTok showcase their incredible skills and every day life. Let yourself be inspired.
 
ENTERTAIN
Be entertained and inspired by a global community of creators.

Take video creation to the next level with special effects, filters, music, and more. Unlock filters, effects, and AR objects to take your videos to the next level.
 
CUSTOMISE
Our integrated editing tools allow you to easily edit your videos.
Trim, cut, merge and duplicate video clips without leaving the app.
 
ADD MUSIC
Add your favorite sound to your videos with millions of music clips and sounds. 
We curate music and sound playlists for you with the hottest tracks in every genre, including Hip Hop, EM, Pop, Rock, Rap, and Country, and the most viral original sounds.

Obtain access to LIVE benefits to better interact with hosts!
Choose between a one-month subscription or auto-renewal subscription to enjoy special LIVE benefits (currently only available in limited regions)

Note: 
If you subscribe via Apple, payment will be charged to App Store Account at confirmation of purchase. Subscription automatically renews unless auto-renew is turned off at least 24 hours before the end of the current period. Account will be charged for renewal within 24 hours prior to the end of the current period at the rate of the selected plan. Subscriptions and auto-renewal may be managed by going to Account Settings after purchase.

Terms of Service —
https://www.tiktok.com/legal/terms-of-service

Privacy Policy —
https://www.tiktok.com/legal/privacy-policy",2014-04-02T22:44:45Z,2025-11-18T22:18:20Z
tt,Trinidad and Tobago,Entertainment,6016,2,363590051,Netflix,"Netflix, Inc.",https://apps.apple.com/tt/app/netflix/id363590051?uo=4,0.0,4.76157,5683,Entertainment,"Looking for the most talked about TV programmes and films from the around the world? They’re all on Netflix.

We’ve got award-winning series, films, documentaries and stand-up specials. And with the mobile app, you get Netflix while you travel, commute or just take a break.

What you’ll love about Netflix:
• We add TV programmes and films all the time. Browse new titles or search for your favourites, and stream videos straight to your device.
• The more you watch, the better Netflix gets at recommending TV programmes and films you’ll love.
• Enjoy a safe watching experience just for children with family-friendly entertainment.
• Preview quick videos of our series and films and get notifications for new episodes and releases.

Netflix membership is a month-to-month subscription that begins at sign-up. You can easily cancel at any time, online, 24 hours a day. There are no long-term contracts or cancellation fees. We just want you to love what you watch.

Please note that the App Privacy information applies to information collected through the Netflix iOS, iPadOS and tvOS apps. See the Netflix Privacy Statement (link below) to learn more about information we collect in other contexts, including account registration.

Privacy policy: www.netflix.com/privacy
Terms of use: www.netflix.com/terms

Phone number: +18667160414
Email: iosappstore@netflix.com",2011-12-14T17:47:35Z,2025-11-18T18:49:39Z
tt,Trinidad and Tobago,Entertainment,6016,3,1636235979,ReelShort - Stream Drama & TV,"New Leaf Publishing, Inc.",https://apps.apple.com/tt/app/reelshort-stream-drama-tv/id1636235979?uo=4,0.0,4.67134,499,Entertainment,"Tired of never finishing a movie or paying for unused subscriptions? 

Watch ReelShort — Every Second is Drama

Say hello to ReelShort, a next-gen HD streaming short movie platform offering exclusive vertical TV mini series. Recognized by Times100 for our movie reels innovation in the entertainment industry, we're changing the way you watch movies with our one-minute short movie episodes that you can enjoy anytime, anywhere, all from the convenience of your phone with the ReelShort App.

Choose from our TV mini series library packed with endless addictive movie shorts added daily, from romantic encounters with billionaires and heart-wrenching tragedies to epic comeback stories and more—you won't ever be short on short movie entertainment!

Featured Shows:
[Don't Miss Me When I'm Gone] After losing my parents, I move in with my godmother, Aunt Sandra. I live under her roof with her two sons-the Miller brothers-surrounded by love and care. I think I’ll end up with one of them. But everything changes when the maid’s daughter, Lola, moves in. The Miller brother I love most breaks my heart into pieces. After I leave, they lose their minds trying to find me.

[Move Aside! I'm the Final Boss] Kingsley is the secret King of King's Corps and the richest man on Earth, but when he returns from the battlefield, his childhood sweetheart brutally dumps him, thinking he's a clown. How will the King of all men make her regret it?

Here's why you'll love ReelShort:

Bite-sized original movie shorts designed for on-the-go viewing
•Exclusive short movies with juicy vertical content that will keep you hooked
•New TV mini series added daily, with hundreds of new episodes each month
•Hollywood-quality entertainment, crafted for the big screen delivered to your small screen
•The first ever interactive live action short movies, where you decide what happens next
Experience the future of short movie entertainment, one minute at a time — download ReelShort now!

""Crazy Maple Studio is quietly changing the streaming game with its ReelShort app."" - Time100 

""The biggest player in this new genre is ReelShort."" - New York Times

""Every minute has a hook that keeps you watching."" - Wall Street Journal

""ReelShort, which has dozens of shows — similarly light on character development and packed with curveballs — made for binge-watching in minutes."" - Washington Post

Follow Us on Social Media

Instagram: https://www.instagram.com/reelshortapp
Facebook: https://www.facebook.com/reelshortapp
YouTube: https://youtube.com/@reelshortapp
TikTok: https://www.tiktok.com/@reelshortapp
ReelShort's  Website: https://www.reelshort.com 

Notice:
If you subscribe through Apple, the payment will be deducted from your App Store account upon purchase confirmation.
Subscription privileges: While your subscription is active, you can watch all tv mini series for free.
Your subscription will take effect within 24 hours after purchase, depending on the status of your order in the Apple Store. The subscription is valid for 7 days.
Auto-Renewal: Your subscription will automatically renew. You will be charged within 24 hours before the start of each subscription period until you cancel your subscription.
Cancellation: On iOS devices, you can cancel your subscription at least 24 hours before the next renewal date by going to Settings > iTunes & App Store > Apple ID > View Apple ID > Subscriptions > ReelShort.
The subscription is billed weekly. The actual price may vary by region.

Terms of Service: https://crazymaplestudios.com/v/user-agreement
Privacy Policy: https://crazymaplestudios.com/v/privacy-agreement",2022-08-07T07:00:00Z,2025-11-21T03:37:29Z
tt,Trinidad and Tobago,Entertainment,6016,4,6453889399,VenevisionPlay,Venevision Continental LLC,https://apps.apple.com/tt/app/venevisionplay/id6453889399?uo=4,0.0,0,0,Entertainment,"¡Bienvenidos a Venevision Play, la plataforma de entretenimiento hecha para los venezolanos! Disfruta de tus canales favoritos en vivo, elige entre una amplia selección de contenido bajo demanda y diviértete con un catálogo variado para todos los gustos. ¡Sumérgete en el mejor entretenimiento desde donde quieras y cuando quieras en Venevision Play!",2023-08-28T07:00:00Z,2025-08-04T16:45:06Z
tt,Trinidad and Tobago,Entertainment,6016,5,1446075923,Disney+,"Disney Electronic Content, Inc.",https://apps.apple.com/tt/app/disney/id1446075923?uo=4,0.0,4.62209,172,Entertainment,"Bring home a world of endless entertainment with Disney+, bringing you the latest releases from Disney, Pixar, Marvel, Star Wars, National Geographic and more.
 
Stream must-see Originals like The Mandalorian, Loki and The Bear, blockbusters like Encanto, Avatar and Guardians of the Galaxy as well as binge-worthy series like The Simpsons, Criminal Minds and Modern Family.
 
With Disney+, you'll enjoy:
• Brand new Originals, blockbusters and epic series added frequently
• Personalised recommendations based on your viewing preferences
• Robust parental controls for family-friendly viewing
• No hidden costs and the ability to cancel at any time*
 
For help with Disney+, please visit: http://help.disneyplus.com. 
For our Subscriber Agreement and other policies, please visit: https://disneyplus.com/legal/subscriber-agreement 
*Effective at the end of the billing period. 
The content available on Disney+ may vary by region.
Some titles shown above may not be available in your country.",2020-11-16T08:00:00Z,2025-11-13T02:13:47Z
tt,Trinidad and Tobago,Entertainment,6016,6,545519333,Amazon Prime Video,AMZN Mobile LLC,https://apps.apple.com/tt/app/amazon-prime-video/id545519333?uo=4,0.0,4.59633,545,Entertainment,"Watch movies, TV shows, live programming, and sports including Amazon MGM Studios-produced series and movies Road House, The Lord of the Rings: The Rings of Power, Fallout, Reacher, The Boys, and The Idea of You, and much more. Browse titles, search for your favorites, or enjoy movies and shows recommended just for you.

App features:
• Download videos to watch anywhere.
• Rent or buy new-release movies and popular TV shows (availability varies by marketplace).
• Cast from your phone or tablet to the big screen with Chromecast.
• Create multiple profiles so each person gets a personalized entertainment experience.
• Go behind the scenes of movies and TV shows with exclusive X-Ray access, powered by IMDb (availability varies by marketplace).

Enjoy Prime Video updates on your Apple TV or Mac by downloading the latest app from the App Store on your device. This requires an Apple TV 3rd generation or later, and for Mac, macOS Big Sur 11.4 or later.

If you subscribe to Prime Video via iTunes (where available), payment is charged to your iTunes Account at confirmation of purchase and your membership automatically renews monthly unless auto-renewal is turned off at least 24 hours before the end of the then current plan period. Your account is charged for renewal within 24 hours before the end of each plan period at the rate of your selected plan. Manage your subscription and turn off auto-renewal anytime by going to My Account or through iTunes.

For customers located within the European Union, United Kingdom or Brazil: By using this app, you agree to the Amazon Conditions of Use and the Prime Video Terms of Use at primevideo.com/ww-av-legal-home. See our Privacy Notice, Cookies Notice and Interest-Based Ads Notice at primevideo.com/ww-av-legal-home.

For all other customers: By using this app, you agree to the Amazon Conditions of Use, Privacy Notice, and and the Prime Video Terms of Use at primevideo.com/ww-av-legal-home.",2016-12-14T06:44:48Z,2025-11-14T16:34:37Z
tt,Trinidad and Tobago,Entertainment,6016,7,6445905219,DramaBox - Stream Drama Shorts,STORYMATRIX PTE. LTD,https://apps.apple.com/tt/app/dramabox-stream-drama-shorts/id6445905219?uo=4,0.0,4.7036,1083,Entertainment,"Looking for something to watch during your daily commute, lunch break, or just to unwind after a long day? Look no further than our Dramabox!
With our app, you can access a huge selection of high-quality content from some of the best creators out there. From indie films to award-winning TV series, we've got something for everyone. And with new content added regularly, you'll always have something fresh to watch.

Here are just a few of the features you'll love about our app:

- Stream your favorite shows and movies in HD quality, no matter where you are.
- Discover new content based on your viewing preferences and what's trending in the app.
- Get personalized recommendations based on your viewing history and ratings.
- Enjoy ad-free streaming and uninterrupted viewing.
- Create playlists and save your favorite titles for later.

So what are you waiting for? Download our app now and start watching the best short movies, TV series, and drama today!

Note: If you subscribe through Apple, the payment will be deducted from your App Store account when you confirm the purchase. 
Unless the user turns off automatic renewal at least 24 hours before the current subscription period ends. Otherwise, the system automatically extends the validity period. Within 24 hours of the end of the current subscription period, the system will charge the account renewal fee according to the price of the selected plan. After completing the purchase, users can manage their subscriptions and automatic renewal in account Settings.
Privacy policy: https://support.dramaboxdb.com/privacy.html
DramaBox Paid Terms of Service: https://www.apple.com/legal/internet-services/itunes/dev/stdeula
Developer site：https://www.dramabox.com",2023-04-18T07:00:00Z,2025-11-12T01:28:41Z
tt,Trinidad and Tobago,Entertainment,6016,8,6751423254,StreamBluu,Cable & Wireless Holdings Inc,https://apps.apple.com/tt/app/streambluu/id6751423254?uo=4,0.0,0,0,Entertainment,"Important: Invite-Only Access

Bluu is currently in an invite-only period for selected Flow customers.

If you’ve received an email or SMS invite, sign in with your Flow ID to start watching.



Didn’t get an invite? Join our wait-list to be notified when access expands and  enter into our Prize Giveaways! — https://forms.gle/zv6W8sZybcHiZ6Tx6

Visit our help center for more info: https://support.streambluu.com/hc/en-us


Bluu is the Caribbean’s home for premium streaming—live sports, local TV, and curated movies & shows in one app. Stream like ah boss across mobile, web, and TV devices.



Sports you get:

All RUSH Channels

Football: UEFA Champions League & UEFA Europa League; LaLiga; Bundesliga — and much more being added



Motorsport: F1, F2, and F3 (race weekends including practice, qualifying & race coverage)



Cricket: Indian Premier League (IPL); Caribbean Premier League (CPL); and select international tours



Athletics: Diamond League and World Athletics events



Regional football: CONCACAF World Cup Qualifiers



American football: National Football League (NFL) (select games & programming)



Line‑ups vary by market and season. Schedules subject to change.

Local channels & news: Stay connected with Television Jamaica (TVJ), CNC3 and CCN TV6, plus other market‑specific Caribbean channels—live news, current affairs and local favorites in one place.



Why Bluu



One simple package: premium sports + local TV + hand‑picked movies/shows



Built for the Caribbean: regional catalog and data‑friendly streaming



Watch anywhere: phone, tablet, Fire TV Stick, Apple TV, and cast to your TV (AirPlay/Chromecast)



Availability & account


Bluu is available in supported Caribbean markets. Contact your local sales office for more info. A Flow ID is required to sign in.



Billing 


After any free preview or promo, your subscription renews automatically on your usual Flow bill.




Legal
UEFA, Formula 1, LaLiga, Bundesliga, Indian Premier League, Caribbean Premier League, Diamond League, CONCACAF and National Football League and all associated marks are the property of their respective owners. Bluu is an independent streaming service; content availability is subject to rights, region, device and schedule changes.",2025-10-10T07:00:00Z,2025-11-06T16:00:49Z
tt,Trinidad and Tobago,Entertainment,6016,9,6448176203,GoodShort - Short Dramas Hub,SINGAPORE NEW READING TECHNOLOGY PTE. LTD.,https://apps.apple.com/tt/app/goodshort-short-dramas-hub/id6448176203?uo=4,0.0,4.91667,840,Entertainment,"GoodShort: a must-have app for original dramas and movies

To enjoy original short dramas and movies of a minute or so, anytime, anywhere, whether in travel, at home, or at a restaurant

We have a myriad of short dramas and movies adapted from novels with high quality, high definition, and high update frequency, guaranteeing a different screen experience for you.

[Diverse, all-inclusive content]
There are a lot of short dramas and reels adapted from novels, definitely something fascinating to you. From modern romance, urban romance, and youth romance to live-in sons-in-law, magic doctors, CEOs, billionaires, queens, and gods of war, all your favorite genres and themes can be found here!

[A personalized list of works you may like]
The excellent recommendation system will help you find the best originals, short dramas, and short movies adapted from the hottest novels, meeting the preferences of all kinds of drama and movie lovers!

[A user-friendly, elegant interface]
The simple, clear, user-friendly interface is an ergonomic fit for your eyes.

[Smooth experience]
Smooth streaming, as well as the comfortable interface design, will give you unparalleled viewing enjoyment. The high-quality content output provides a rich, high-definition, smooth, and flawless screen experience.

[Unlimited resources, super fast updates]
The selected, diversified content will satisfy your viewing needs for different content. Subscribe to your favorite works to keep up with the latest updates of your favorite dramas.

Whether you want to relax or pass the time while waiting, GoodShort is the best choice for you. Download it and start exploring!

About the Automatic Subscription Renewal:

1. Payment: After you confirm the purchase, the fee will be automatically charged to your Apple iTunes account.

2. Renewal: 24 hours before your subscription expires, the renewal fee will be automatically deducted from your Apple iTunes account. After the renewal payment is processed, your premium membership will be extended automatically.

3. If you want to unsubscribe, please open the iPhone ""Settings""-->enter ""iTunes Store and App Store""-->click ""Apple ID"", select ""View Apple ID"", go to the ""Account Settings"" page, click ""Subscribe"" choose GoodShort to unsubscribe. if you do not unsubscription at least 24 hours before the end of the subscription period, this subscription will be automatically renewed.

We are looking forward to hearing your comments and ideas. Please email us at contact@goodshort.com

Service Agreement:https://m.goodreels.com/other/static_file/term_of_use.html
Privacy Policy:https://m.goodreels.com/other/static_file/privacy_policy.html",2023-06-12T07:00:00Z,2025-11-13T09:27:47Z
tt,Trinidad and Tobago,Entertainment,6016,10,1666653815,HBO Max: Watch Movies & TV,"WarnerMedia Global Digital Services, LLC",https://apps.apple.com/tt/app/hbo-max-watch-movies-tv/id1666653815?uo=4,0.0,4.7908,1611,Entertainment,"The most talked about shows and movies featuring the worlds of HBO, the DC Universe, Discovery, and beyond.  
 
With HBO Max you'll get: 
• Access to thousands of TV shows and movies.  
• Exclusive, award-winning series that everyone's talking about — like the HBO Originals The Last of Us, Succession, The White Lotus, and House of the Dragon. 
• Stream select live sports from some of your favorite events, leagues and teams. Availability varies by country or region, plan, and by subscription provider. 
• The latest hits from HBO, Max Originals, Discovery, Cartoon Network, ID, DC, Adult Swim, and more. 
• Iconic favorite TV shows like Friends, Rick and Morty, 90 Day Fiancé, Looney Tunes, and more. 
• Family-friendly entertainment for the whole household.  
• Fascinating documentaries and unscripted series.  
 
Features: 
• Enjoy your favorite shows and movies at home or on the go. HBO Max is available on select TV, web browser, mobile, tablet, and gaming console devices. (Device availability may vary by country or region and by plan.) 
• Browse or search with ease across HBO, movies, series, genres, and brands.  
• Download shows and movies you love to watch offline with select plans. (Download limits vary by plan.)  
• Create personalized profiles for the entire household complete with customizable ratings, and profile PIN protection options.  
• Pick up episodes and movies where you left off on any of your favorite devices.  
• Find everything you love, all in one place, with My Stuff.  
• Watch on multiple devices at the same time. (Limits vary by plan.)  
• Stream high-quality video up to 4K resolution and surround sound including Dolby Atmos (where available) on select plans.
 
Content, sports and feature availability on HBO Max may vary by country or region. Sports, where available, may in some countries require a separate add-on which must be added to a base plan. Some titles and features shown above may not be available in your country or region. Language availability varies by country and region.  
 
You will be charged for your subscription on a recurring basis unless you cancel at least 24 hours before your next billing date. Your App Store account will automatically be charged within 24 hours prior to the end of the current billing period. When you cancel, you will have access until the end of your current billing period. You can manage or cancel your subscription by visiting the App Store app or Subscriptions under Settings on your Apple device after purchase. 

Purposes disclosed in the App Privacy label may vary based on features or services that may not be available in all countries or regions. HBO Max is only available in certain countries or regions.  
 
Terms of Use: https://hbomax.com/terms-of-use/",2024-02-27T08:00:00Z,2025-11-03T15:55:24Z
tt,Trinidad and Tobago,Entertainment,6016,11,6465895541,JoyReels - Enjoy Short Dramas,UREELS PTE. LTD.,https://apps.apple.com/tt/app/joyreels-enjoy-short-dramas/id6465895541?uo=4,0.0,4.5,6,Entertainment,"Find the perfect entertainment to match your mood. No matter where you are, you can watch the most popular mini-series anytime on JoyReels. Enjoy now!

We offer a wide selection of dramas and short TVs with high quality and high definition. Furthermore, fantastic plot, short episodes, frequent update, all make it easy to watch on the go. 

Why JoyReels? 
[Diverse content]
There are lots of short TVs, dramas with different themes. You can explore popular genres such as Werewolf, Advanture & Action, Billionaire and Romance with just a tap.

[Fast update]
Experience the thrill of discovering something new with JoyReels'regular content updates. Our library is constantly expanding, ensuring that every visit to the app brings fresh and exciting short videos for your viewing pleasure. Say goodbye to monotony and say hello to a constant stream of entertainment.

[User-friendly experience]
Simple, clear, easy understanding interface and Smooth streaming, high-definition playing bring you an unprecedented and incredible experience. 

Note:
If you subscribe via Apple, payment will be charged to App Store Account at confirmation of purchase. Subscription automatically renews unless auto-renew is turned off at least 24 hours before the end of the current period. Account will be charged for renewal within 24 hours prior to the end of the current period at the rate of the selected plan. Subscriptions and auto-renewal may be managed by going to Account Settings after purchase.

Terms of Service —
https://www.joyreels.com/user_agreement/index.html 
Privacy Policy —
https://www.joyreels.com/privacy_policy/index.html 
Apple Terms of Service —
https://www.apple.com/legal/internet-services/itunes/dev/stdeula/",2023-09-27T07:00:00Z,2025-11-17T22:36:52Z
