country,country_name,category,genre_id,rank,app_id,app_name,developer,url,price,averageUserRating,userRatingCount,primaryGenreName,description,launch_date,update_date
lu,Luxembourg,Graphics & Design,6027,1,6502747597,DecAI™ - AI Home Design,COOL SUMMER LIMITED,https://apps.apple.com/lu/app/decai-ai-home-design/id6502747597?uo=4,0.0,4.19608,51,Graphics & Design,"Transform your living space with DecAI™, where designing your dream home is as simple as snapping a photo by AI.

► AI Interior Design & Decor
Just upload an image of your room, choose the type of space and the style you want. Our advanced AI technology will analyze your room's dimensions and characteristics, then generate a stunning interior design plan catered to your taste. From modern chic to rustic warmth, our AI interior designer presents you with a visualization of furniture arrangements, color palettes, and decorative accents that bring your personal touch to life. 

► AI Garden Design
Upload a snapshot of your yard, patio or rooftop, and watch as our advanced AI crafts personalized garden designs in seconds—no green thumb needed. From tropical oases to cottage-core charm, our technology tailors layouts with seasonal blooms, winding pathways, and cozy seating zones, matching your style and space dimensions. Visualize drought-resistant plantings, modern hardscaping, or vibrant flower beds before breaking ground, and unlock endless possibilities for backyard makeovers, balcony retreats, or front-yard curb appeal. 

► AI Exterior Design & Renovation
Transform your home's exterior and garden with AI-powered design tools, visualize your dream space. Get rid of design constraints with a multitude of novel ideas for your home's exterior design. Simply upload a picture of your house, choose your preferred style, and the AI will provide you with a personalized design plan.

► Transform Any Item with Replace
Unlimited Creativity with Seamless Replacement – Tired of your current furniture or decorations? The Replace feature lets you erase unwanted items and input what you’d like to see instead, generating a new image to breathe new life into your home.


► Discover New Walls
Revamp your room's look with ""New Walls."" Swap textures and colors with ease, visualizing the perfect wall finish without lifting a paintbrush. Our AI ensures every suggestion aligns with your vision.

► Preview Your Flooring Choices
Why wait for the perfect flooring when you can see it instantly? Our ""Instantly Install New Flooring"" feature lets you preview a wide selection of flooring options, from hardwood to tile, right on your device.

► Explore Room Design Ideas
Looking for a little inspiration? ""AI Interior Design"" is your go-to source for a plethora of room design ideas.

◆ SUBSCRIPTION TERMS ◆
Title: One Week Subscription
Length of Subscription: 1 Week
Price: 5.99/  Week
Title: One Year Subscription
Length of Subscription: 1 Year
Price:  $39.99/ Year
Title: Lifetime Purchase
Price：$49.99
• Payment will be charged to iTunes Account at confirmation of purchase
• Subscription automatically renews unless auto-renew is turned off at least 24 hours before the end of the current period
• Account will be charged for renewal within 24 hours prior to the end of the current period, and identify the cost of the renewal
• Subscriptions may be managed by the user and auto-renewal may be turned off by going to the user's Account Settings after purchase
• Any unused portion of a free trial period, if offered, will be forfeited when the user purchases a subscription to that publication, where applicable
• You can cancel a free trial or subscription anytime by turning off auto-renewal through your iTunes account settings. This must be done 24 hours before the end of a free trial or subscription period to avoid being charged. The cancellation will take effect the day after the last day of the current subscription period, and you will be downgraded to the free service.

If got any questions, please email us to coolsummerdev@icloud.com and we'll help you figure it out！

Read more about our terms and conditions here:
Privacy Policy:https://coolsummerdev.com/artgenerator-privacy-policy
Term of Use:https://coolsummerdev.com/artgenerator-terms-of-use
Community Guidelines: https://coolsummerdev.com/community-guidelines",2024-05-23T07:00:00Z,2025-11-21T02:59:35Z
lu,Luxembourg,Graphics & Design,6027,2,6446832902,Wallpics - Live Wallpapers 4K,IgKnight Technologies Ltd,https://apps.apple.com/lu/app/wallpics-live-wallpapers-4k/id6446832902?uo=4,0.0,4.7755,49,Graphics & Design,"Transform your iPhone into a personal masterpiece with Wallpics, the ultimate destination for stunning live wallpapers, DIY wallpaper creations, charging animations, pfp icons, matching wallpaper sets, and true 4K quality backgrounds. Whether you’re looking to refresh your lockscreen or craft a cohesive home-and-lockscreen theme, Wallpics delivers everything you need to make your device truly yours.

Endless Live Wallpapers & 4K Quality Backgrounds
• Dive into a vast library of dynamic live wallpapers in breathtaking 4K quality—fluid animations that bring motion and depth to your lockscreen and home screen.
• Browse categories from abstract art and nature scenes to futuristic cityscapes, all rendered in ultra-high definition for crisp, vibrant visuals.
• Enjoy smooth playback and perfect compatibility with iOS’s Live Photo lockscreen feature—your screen has never looked this alive.

DIY Wallpaper Studio
• Unleash your creativity with Wallpics’s intuitive wallpaper maker. Mix and match patterns, colors, and textures to design your own custom backgrounds in minutes.
• Add text, overlays, and stickers—or start with our premium templates to craft a signature look.
• Export your creations in both standard and 4K resolutions, ready to set as your lockscreen, home screen, or share with friends.

Charging Animations & Dynamic Effects
• Impress every time you plug in: choose from a gallery of charging animations that light up around your battery icon—so fun, you’ll look forward to low battery!
• From neon pulses and sparkles to liquid fills and energy ripples, our power-on effects are fully customizable and optimized for iOS.

Premium PFP Icons & Matching Wallpaper Sets
• Personalize your social profiles with a curated collection of pfp icons—stylized avatars, minimalist logos, and neon glyphs that pop on any background.
• Coordinate your entire device aesthetic with matching wallpaper bundles—lockscreen and home screen designs that complement each other perfectly.
• Keep your theme cohesive across apps by exporting both backgrounds and pfp icons at once.

Features at a Glance

Live Wallpapers: Animated lockscreen backgrounds & home screen motion

DIY Wallpaper: Custom background studio with templates, text & stickers

Charging Animations: Dynamic power-on effects for every charge

PFP Icons: Profile picture avatars in multiple styles and resolutions

Matching Wallpaper Sets: Coordinated lockscreen + home screen bundles

4K Quality: Ultra-HD backgrounds and exports

Ready to elevate your iPhone experience? Download Wallpics now and unlock a universe of live wallpapers, DIY creations, charging animations, pfp icons, matching wallpaper, and 4K quality backgrounds—tailored just for you!

Payment will be charged to the credit card connected to your iTunes Account when you confirm the initial subscription purchase. Subscriptions automatically renew unless auto-renew is turned off at least 24-hours before the end of the current subscription period. Your account will be charged for renewal within 24-hours prior to the end of the current period, and the cost of the renewal will be identified. You may manage your subscription and auto-renewal may be turned off by going to your Account Settings after the purchase. Any unused portion of a free trial period, if offered, will be forfeited when you purchase a subscription, where applicable.

Read more about our terms and conditions here:

Privacy Policy: https://imageconverter.io/privacy-policy
Terms of Use: https://imageconverter.io/terms-of-use
Contact us: j.leisis.mba@gmail.com",2023-03-28T07:00:00Z,2025-11-19T02:57:43Z
lu,Luxembourg,Graphics & Design,6027,3,6749894179,ReRoom AI: Home Design Planner,GM UniverseApps Limited,https://apps.apple.com/lu/app/reroom-ai-home-design-planner/id6749894179?uo=4,0.0,5,2,Graphics & Design,"Bring your dream design to life with just one photo!

Our app helps you instantly transform any space — whether it’s your room, garden, or house exterior. Just upload a photo, choose a style and color palette, and get a ready-to-use design idea in seconds.

Key features:

- Interior Design – upload your room photo, select the type of space, style, and colors to see how it could look.
- Exterior Design – redesign your house facade with one tap.
- Landscape Design – visualize your garden or yard in different styles.
- Virtual Furnishing – decorate your room with furniture and décor items to see how everything fits together.

Perfect for:
- Homeowners planning renovations
- Designers looking for inspiration
- Anyone dreaming of refreshing their space easily

Turn imagination into reality — start designing today! 


Information about subscription auto-renewal: 

Subscriptions automatically renew unless auto-renew is turned off at least 24 hours before the end of the current period. Subscriptions may be managed by the user. 

Auto-renewal may be turned off by navigating to iTunes Account Settings after purchase. 

After canceling a subscription, it will stay active until the end of the period. Auto-renewal will be disabled. 

Any unused portion of a free trial period will be discarded when the user purchases a subscription. Payment will be charged to your iTunes Account upon purchase confirmation. 

An account will be charged for renewal 24 hours before the end of the current period. The cost depends on the selected plan. 

Terms of Service: https://reroomai.app/documents/terms-of-use
Privacy Policy: https://reroomai.app/documents/privacy
Billing terms: https://reroomai.app/documents/subscription-terms",2025-08-30T07:00:00Z,2025-11-18T08:36:40Z
lu,Luxembourg,Graphics & Design,6027,4,6448484908,AR Drawing: Sketch & Paint,Digital Solutions Technologies Limited,https://apps.apple.com/lu/app/ar-drawing-sketch-paint/id6448484908?uo=4,0.0,4.74286,35,Graphics & Design,"Just trace a projected picture on paper and color it!

- Use your phone camera to draw
- Lots of templates: Animals, Cars, Nature, Food etc.
- Built-in flashlight
- Share the result with your friends

AR Drawing is an innovative mobile app that allows to create stunning drawings and paintings using augmented reality technology. You can draw anything you want on any surface.

Whether you are an experienced artist or just starting out, this app is perfect for unleashing your creativity and exploring new possibilities in art. So why wait? Download AR Drawing: Sketch & Paint today and start creating your own masterpiece!

Privacy Policy: https://ar-drawing.com/privacy/
Terms of Use: https://ar-drawing.com/terms/",2023-05-02T07:00:00Z,2025-11-11T17:51:04Z
lu,Luxembourg,Graphics & Design,6027,5,1534785237,Pixelcut AI Photo Editor,Pixelcut Inc.,https://apps.apple.com/lu/app/pixelcut-ai-photo-editor/id1534785237?uo=4,0.0,4.67082,240,Graphics & Design,"Join more than 70 million Pixelcut creators! Pixelcut’s background remover, AI background generator, and Magic Eraser helps you create amazing photos in seconds. Pixelcut is an AI photo editor that helps you edit images with ease.

HERE’S WHAT YOU GET:
Background Eraser - Instantly remove background from any photo to get a transparent background, and then change background to an AI background or color. Pixelcut’s background remover is the most precise background remover in the world. After you remove background, you can add a white background or AI generated background to make your photos look pro. Pixelcut’s background eraser works on every type of image (even hair!) and is super accurate. Our background eraser is perfect for product photos, YouTube thumbnails or any other reason you’d like to remove background of your photo.  
Magic Eraser - Remove objects with the swipe of a finger. Erase objects and cleanup pictures in seconds. No blurry mess like other apps, with Pixelcut you can remove objects from photos like they were never there!
AI Backgrounds - Generate AI backgrounds for your photo. If you want to do more than remove background, our AI background generator will help you change background of any photo to an amazing AI generated background. Put your product on a beautiful kitchen counter or change background of a selfie to the beach!
White Background - Quickly replace background with a white background or change background to any color. You can also choose from over 2 million backgrounds.
AI Shadows - After you change background to a white background or replace background with our AI background generator, you can easily add a beatiful AI shadow to give your product a professional look!
Templates - Choose from thousands of templates designed to help you sell more!

Pixelcut’s mission is to help your photos stand out whereever you post online. You now have all of the power of a photo studio on your iPhone! 

Download Pixelcut and grow your business today!

Have questions, problems, or feedback? Reach out to us at support@pixelcut.app.

The Pixelcut Pro Membership Experience
Pixelcut Pro is a monthly or yearly subscription that provides access to tools to help you sell more and grow your business. The Pixelcut Pro membership gives you unlimited and instant background removals, hundreds of templates, hundreds of fonts, overlays and backdrops, all updated monthly. Subscription auto-renews at the end of each term (month or year depending on subscription), unless cancelled 24-hours in advance. The subscription fee is charged to your iTunes account at confirmation of purchase. You may manage your subscription and turn off auto-renewal by going to your Settings after purchase. No cancellation of the current subscription is allowed during active period. Payment will be charged to iTunes Account at confirmation of purchase. Account will be charged for renewal within 24-hours prior to the end of the current period, and identify the cost of the renewal. Any unused portion of a free trial period, if offered, will be forfeited when the user purchases a subscription to that publication, where applicable.

Terms and conditions: https://pixelcut.ai/terms
Privacy policy: https://pixelcut.ai/privacy",2020-11-03T08:00:00Z,2025-11-19T17:03:52Z
lu,Luxembourg,Graphics & Design,6027,6,6464476667,Home AI - AI Interior Design,HUBX YAZILIM HIZMETLERI ANONIM SIRKETI,https://apps.apple.com/lu/app/home-ai-ai-interior-design/id6464476667?uo=4,0.0,4.21666,120,Graphics & Design,"Easily redesign your home in a variety of stunning styles using advanced AI technology.​​ Home AI brings the expertise of an interior designer right into your pocket!

Simply take or upload a photo of the room and space you wish to redesign, choose a style, and receive instant interior design alternatives with unparalleled detail and accuracy. 

Whether you aim to modernize your living room, add a touch of elegance to your bedroom, or completely revamp your kitchen, Home AI has got you covered.
Whether you're an existing homeowner looking for a fresh new look, or a real estate agent staging the perfect property, our app is your ideal design partner. Home AI is here to serve as your personal AI interior design assistant, transforming your space in real time and providing personalized interior designs tailored specifically for your space.

【Effortless Interior Design at Your Fingertips】

Instant Room Makeover: Take a picture of any room in your house, and Home AI's advanced AI technology will instantly generate stunning interior design concepts tailored to your space. Witness the magic unfold as your vision comes to life before your eyes, with every detail thoughtfully optimized.

A World of Interior Design Styles: Unleash your inner decorator with our extensive library of over 10 diverse interior design styles. From the sleek minimalism of modern interior design to the calming serenity of a zen aesthetic, Home AI caters to every taste. Experiment with various styles, mix and match elements, and discover the perfect look that reflects your unique personality.

AI-Powered Recommendations that Go Beyond Style: Home AI doesn't just suggest a new look; it provides insightful recommendations on furniture, decor, and color schemes that perfectly complement your chosen style. Create a harmonious and cohesive space that feels truly lived-in.

【More Than Just Visualization:】

Save and Share Your Concepts: Capture and store your favorite interior design concepts for future reference. Share your transformed spaces with friends, family, or even professional interior designers to gather valuable feedback and refine your vision. Collaborate effortlessly and bring your design dreams to life.

Find Inspiration from Endless Possibilities: Home AI acts as your personal interior design muse, offering endless inspiration to spark your creativity. Explore different concepts and experiment with various styles to find the perfect balance that reflects your unique taste and elevates your space.

【Home AI is the ultimate tool for anyone who wants to:】

Effortlessly visualize interior design ideas and see their dream home come to life
Explore a vast library of interior design styles and discover their perfect aesthetic
Refresh a single room or plan a complete home makeover with ease
Collaborate with friends, family, and professionals to create a personalized space
Spark their creativity and find endless interior design inspiration

Download Home AI today and unlock a world of interior design possibilities! Reimagine your space, redefine your style, and create the home of your dreams with the power of cutting-edge AI technology.

By using the app, you confirm that you acknowledge and accept our Privacy Policy and Terms of Use:
Privacy Policy: https://homeinterior.ai/privacy
Terms of Service: https://homeinterior.ai/terms

Do you have a question for us?
info@homeinterior.ai",2024-04-05T07:00:00Z,2025-11-24T10:56:15Z
lu,Luxembourg,Graphics & Design,6027,7,1076159017,Home Planner: AI Room Design,Room Planner Ltd,https://apps.apple.com/lu/app/home-planner-ai-room-design/id1076159017?uo=4,0.0,4.66355,214,Graphics & Design,"HOME PLANNER: THE ULTIMATE HOUSE DESIGN AND RENOVATION APP

Bring your dream space to life with Home Planner, the ultimate app for design and renovation enthusiasts. Featuring advanced tools like 3D modeling with home design AI, a built-in 3D scanner, and precise measure functionality, this house design app is perfect for both professionals and DIY enthusiasts. Whether you’re reimagining a single room or planning a complete overhaul, Home Planner offers everything you need to design, customize, and visualize your space effortlessly.

Transform Your Vision with Home Design AI and 3D Modeling
Craft stunning designs using Home Planner’s intuitive 3D modeling tools. Create detailed layouts in both 2D and 3D, allowing you to visualize every aspect of your project. The app’s advanced 3D modeling capabilities and top-notch home design AI enable you to experiment with different furniture arrangements and decor styles. Let your vision come to life with accuracy and ease.

Scan Your Space with the 3D Scanner
Home Planner’s built-in 3D scanner lets you capture your space in seconds. By scanning any room, you can instantly generate accurate dimensions and layouts. The 3D scanner ensures every detail of your space is accounted for, eliminating guesswork and saving you time. 

Measure with Unmatched Precision
Avoid costly design errors with Home Planner’s precise measure tools. The integrated digital tape measure captures exact dimensions of walls, furniture, and spaces, ensuring every element fits perfectly. Whether you’re measuring for a new sofa or planning a full renovation, Home Planner ensures functional and aesthetic designs.

Seamlessly Combine 3D Modeling and Scanning
Combine 3D modeling with the 3D scanner to create highly detailed and accurate designs with our home design AI. Scan your space, then use the house design app’s 3D modeling tools to explore various layouts and decor styles. Home Planner ensures your projects are as precise as they are creative.

House Design App that Customizes Every Detail of Your Space
Personalize your designs with unparalleled flexibility. Experiment with materials, colors, and finishes to craft a space that reflects your style. With 3D modeling and home design AI, you can visualize every change in real-time, while the 3D scanner and measure tools provide the accuracy of your floor plans.

Immersive Visuals with Realistic Renders
Showcase your designs with lifelike renders and detailed visualizations. Home Planner’s 3D modeling features produce stunning results, complete with realistic lighting and textures. Share your designs with clients, collaborators, or friends to get feedback and refine your concepts.

House Design App that Streamlines Your Workflow with Powerful Tools
Home Planner’s comprehensive toolset - including 3D modeling, top-notch home design AI, a 3D scanner, and precise digital measure tape - makes it easy to plan and execute projects efficiently. From scanning a room to generating layouts and creating detailed designs.

Collaborate and Share Your Designs
Share your projects with ease using Home Planner’s collaborative features. Gather feedback and refine your ideas effortlessly. With Home Planner and our home design AI, turning your vision into reality is a collaborative and enjoyable experience.

Unlock Premium Features of Advanced House Design App
Upgrade to premium and explore the full potential of Home Planner:

— Access pre-designed layouts for quick inspiration
— Create unlimited projects for large-scale designs
— Unlock an extensive catalog of decor and furniture items
— Generate high-quality renders and immersive visuals
— Utilize advanced 3D modeling AI for home design, 3D scanner, and measure tools

Home Planner combines cutting-edge technology with user-friendly design. With advanced 3D modeling AI for home design, an integrated 3D scanner, and precise digital measure tape, this house design app has everything you need to create stunning spaces.",2016-04-08T17:25:28Z,2025-11-21T01:16:20Z
lu,Luxembourg,Graphics & Design,6027,8,1472157401,Layout - Photo Collage Maker,Fitness Labs SRL,https://apps.apple.com/lu/app/layout-photo-collage-maker/id1472157401?uo=4,0.0,4.51136,176,Graphics & Design,"Do you have some cool memories from your last holiday?
 Use Photo Collage Maker to combine the best of your experiences! Bring your ideas to life with this super fun and easy to use the app.
Equipped with a wide array of layouts, shapes, and styles, you can rotate, resize or rearrange freely the photos in the collage.
The great number of filters will help to enhance the aspect of your creation.
Be ready to share with the world a unique story!

No unnecessary features or complicated UI
Very flexible, quick, and simple workflow
Extensive collection of beautifully designed layouts
Mix your photos and choose the size and style that fits you best
Add a personalized touch by picking the right filter

----
Subscribe to take advantage of the features described above. Subscription length: weekly, monthly, yearly
By subscribing you get unlimited edits and access to our tools.Payment will be charged to iTunes Account at confirmation of purchase. Your subscription will automatically renews unless auto-renew is turned off at least 24-hours before the end of the current period. Your account will be charged for renewal within 24-hours prior to the end of the current period. Subscriptions may be managed and auto-renewal may be turned off by going to the Account Settings after purchase. No cancellation of the current subscription is allowed during active subscription period.
Any unused portion of a free trial period, if offered, will be forfeited when the user purchases a subscription to that publication, where applicable

For the Terms of service and privacy policy, please check: 
http://braincake.net/collage_privacy.html
http://braincake.net/collage_terms.html",2019-12-11T08:00:00Z,2025-11-23T08:30:43Z
