country,country_name,category,genre_id,rank,app_id,app_name,developer,url,price,averageUserRating,userRatingCount,primaryGenreName,description,launch_date,update_date
lu,Luxembourg,News,6009,1,333903271,X,TWITTER INTERNATIONAL UNLIMITED COMPANY,https://apps.apple.com/lu/app/x/id333903271?uo=4,0.0,4.4732,6940,News,"Welcome to X (formerly known as Twitter), your trusted digital town square where conversations unfold in real time, and the world connects through breaking news, live events, podcasts, and everything in between.

Whether you're passionate about sports, tech, music, or politics, X is your front-row seat to what’s happening across the globe.

X isn’t just another social media app, it’s the ultimate destination for staying well informed, sharing ideas, and building communities. With X, you’re always in the loop with relevant trending topics and breaking news, delivered instantly to your screen, raw and unfiltered.

What You Can Do on X:
• Follow breaking news from around the world before it hits the headlines, and stay ahead of the curve with real-time updates on trending topics and viral conversations.

• Post your thoughts, photos, and videos with a global community. Join millions of users in shaping public dialogue across social, cultural, and political conversations.

• Discover Grok, the AI assistant powered by X’s real-time data. You can ask Grok to summarize trending news, explain videos, or give you more context about posts.

• Stream live video or go live with Spaces, our audio feature that enables you to host discussions, hold interviews, or start your next live podcast. Whether you're streaming a concert, a live game, or your thoughts on a hot topic, X keeps your audience engaged.

• Watch videos: from live breaking news and sports clips to podcasts and gaming sessions that last up to 3 hours long. Many of the world’s leading voices, in comedy, gaming, podcasting, and politics, all share their content on X.

• Connect and chat privately with friends, followers, customers, or collaborators through Direct Messages.

• Join and build communities tailored to your interests: from sports news, gaming, entertainment, crypto, entrepreneurship, tech, and more.

• Subscribe to X Premium to unlock exclusive features like a blue checkmark, boosted visibility, prioritized replies, fewer ads, longer videos, and post editing. X Premium also gives you access to creator revenue sharing and the ability to offer exclusive content to subscribers.

Why X?
In a world of constant change, X is your real-time source to stay ahead of the curve, connect with people, and explore diverse perspectives. From breaking live news and trending memes to top podcasts and live streams from your favorite creators, X brings it all together in one powerful social experience.

Privacy Policy: https://x.com/privacy
Terms and Conditions: https://x.com/tos",2009-10-09T19:50:00Z,2025-11-24T03:35:31Z
lu,Luxembourg,News,6009,2,1581650857,Substack,Substack Inc.,https://apps.apple.com/lu/app/substack/id1581650857?uo=4,0.0,4.73034,178,News,"Substack is a new media app that connects you with the creators, ideas, and communities you care about most.
- Support the creators you love: Subscribe for free or upgrade to view original work and connect directly with your favorite writers, artists, and podcasters.
- Enjoy ad-free videos and podcasts: Access short-form clips, video episodes, and  read-aloud articles without interruptions.
- Connect in real time: Join livestreams and live group chats, where top creators bring their biggest supporters into their world. 
- Explore independent ideas: Discover bold opinions and engaging views across food, sports, politics, fashion, comedy, finance, and more.

How it works:
1. Download the Substack app.
2. Claim your handle.
3. Explore the feed to enjoy notes, videos, and clips from creators. 
4. Subscribe to your favorites for free, tune into their livestreams and join private group chats.",2022-03-08T08:00:00Z,2025-11-17T17:28:36Z
lu,Luxembourg,News,6009,3,1558991881,Biscuit,OAKLUX Sarl,https://apps.apple.com/lu/app/biscuit/id1558991881?uo=4,0.0,4.49333,75,News,"The app that was missing in Luxembourg!  

With Biscuit, find current offers and prepare your shopping with all the good deals from stores near you while participating in eco-responsible projects.


If you no longer want to receive paper catalogs or you do not receive catalogs from your favorite stores in Luxembourg and its surroundings, this application is for you!


Thanks to Biscuit, find the best offers in the catalogs of your favorite stores with just one click! Be aware of all current discounts and sales, discover reductions for maximum savings!


Whether it is to consult the catalogs of brands around you, add stores to favorites, spot promotions and good deals before a shopping trip during sales or Black Friday, save on your food shopping, Biscuit is there for you.


Using Biscuit also means making a gesture for the environment by eliminating paper leaflets but also by contributing directly to eco-responsible projects just by consulting catalogs.


The icing on the cookie? 

An eco-responsible application!


Through the Biscuit application, each user is an actor in preserving the environment. Changing our habits by using Biscuit will be part of everyday good practices. We are committed to implementing projects that will be financed by Biscuit thanks to your consultations.


We have several missions along two major axes:


- Reforestation and sustainable forest management
- Local programs to raise awareness among the younger generation in favor of the environment in Luxembourg.


We collaborate with reference organizations with maximum transparency in the management of the projects implemented. The choice of our partners depends on the scale of the projects and the geographical area. Our wish is to give you as much information as possible about the investment and the impact of these investments.


You can consult these projects directly from the application by clicking from the menu on “Our ecological commitments” then “Our projects”. We regularly publish content on our social networks on the progress of our projects and their results.

Do you have suggestions ? Ideas ? Tell us by email (contact@biscuit-app.lu) or via our contact form on the application.

We appreciate all suggestions and we treat every request very seriously.


Contact us ?

Are you looking for a brand but you can't find it among those currently listed? We are currently in negotiations with various brands and we will be able to add them to Biscuit as soon as possible.


If you would like to see a particular store, do not hesitate to send us all your suggestions via the “Contact Us” section from the drop-down menu of the application or by email to “contact@biscuit-app.lu”


Do you just want to contact us to share your love? We also accept little hearts and kitten photos.


We talk about us  !
Orange Telecom: “One more step in Orange’s ecological transition”
PaperJam: “An Eco-Responsible App - Biscuit, holy bread against advertising leaflets”
PFAC: “ “Each Biscuit App user becomes an actor in preserving the environment simply by consulting catalogs.”
FAL: “In addition to preserving the environment by saving paper, the user will participate in the development of other projects.”

Follow us on social networks?

Find us on our various social networks to follow all our news!

Facebook: Biscuit App
Instagram: Biscuit_app
LinkedIn: Biscuit_app

The more of us there are, the further our projects will go!

Did you really read the whole description? Our colleague sells a Renault Megane III

The Biscuit App team",2021-08-06T07:00:00Z,2025-05-27T17:23:43Z
lu,Luxembourg,News,6009,4,1064216828,Reddit,"REDDIT, INC.",https://apps.apple.com/lu/app/reddit/id1064216828?uo=4,0.0,4.74465,1966,News,"Welcome to Reddit, the heart of the internet.

Reddit is a social network with something for everyone: trending topics, anonymous group discussions, and diverse communities.

Joining Reddit means immersing yourself in brutally honest and wholesome conversations that span across every topic and interest you could imagine.  Beyond exclusive content straight from the source, you'll also find gaming communities, insightful bloggers, passionate TV fandoms, sports enthusiasts, support groups, AI forums, the latest in celeb news, and creators of all types.

If you’re into gaming and sport, you can discover the best Xbox and PS5 forums, talk Zelda, Call Of Duty, or minecraft strategy while discussing the latest Football news, Cricket matches, and Rugby games.

Reddit has over 100,000 online communities (forums where members post and comment) dedicated to discussing topics. Some of the most popular global communities are:
■ r/AskReddit, where users can ask and answer questions
■ r/funny, which is full of humorous content, jokes, hilarious memes
■ r/science, for scientific talks and daily news from the scientific community
■ r/gifs, with funny animated gifs for your fun  and viewing pleasure
■ r/music, r/fredagain, r/beyonce and other music forums where music fans gather to discuss their favourite artists and genres.

On Reddit you’ll find:
■ Thousands of community groups and interesting topics, and a wealth of original content. 
Latest news, entertainment news, social media news, book clubs, TV fan theories, technology forums, open AI discussions, conspiracy theories, gaming forums,debate forums, and personalised content, there's a community for everyone.

■ Loads of laughs
Find popular memes, witty humour, jokes and gags, oddly satisfying videos, comedy clips, funny cat videos, and more to help you lose track of time.

■ Pop culture buzz
Explore the latest trends at r/popculturechat and r/fauxmoi, or join the lively discussions at TV groups like r/loveislandtv, r/bigbrotheruk, and r/MAFS_UK.

■ AMAs, or ""Ask Me Anything""
Celebrities, politicians, and experts answer questions from users.

■ The best discussions on any topic
Reddit’s discussion threads are where community members jump in with humour and insights for top conversations about anything; science discoveries, pop culture, gardening, entertainment, or financial advice.

■ Post anonymously and get answers to all of your questions
Ask communities anything you want. Ask questions on relationships, mental health, parenting, career advice, fitness plans, and more.

■ Anonymous profiles
Connect with people about any topic, join interactive community groups, and chat with other redditors, all anonymously.

Voting and Karma:

Instead of likes and hearts, Reddit’s social media network runs on upvotes or downvotes. Voting on posts and comments increase or decrease the creator’s karma, and helps popular and relevant posts rise to the top, while filtering out low-quality or irrelevant posts.

While karma doesn't directly impact your ability to use Reddit, more karma can increase posts’ visibility and help you get noticed. Some communities require karma to post or comment, which helps maintain content quality and community standards.



Reddit Premium:

Purchase Reddit Premium to enjoy an ads-free experience and access to premium avatar gear, r/lounge, custom app icons, and more.

Payment will be charged on a recurring monthly or annual basis to your Apple account. Your monthly or annual Premium subscription will automatically renew unless you cancel at least 24 hours before your subscription ends. Cancel anytime in your device’s Account Settings. No partial refunds.

Privacy Policy: https://www.redditinc.com/policies/privacy-policy
User Agreement: https://www.redditinc.com/policies/user-agreement
Reddit Rules:https://redditinc.com/policies/reddit-rules

If you have any problems with the app, get support at RedditHelp.com",2016-05-18T06:01:47Z,2025-11-21T01:07:14Z
lu,Luxembourg,News,6009,5,360077592,RTL.lu,CLT-UFA,https://apps.apple.com/lu/app/rtl-lu/id360077592?uo=4,0.0,2.57212,208,News,"Mat der RTL App fir iPhone an iPad sidd Dir iwwerall an zu all Moment informéiert. Ob liesen, Radio lauschteren oder Video kucken, RTL proposéiert Iech déi verschiddenst Contenue vun nationalen an internationalen News, Sport, Kultur bis zu den Tëlee- a Radiosemissiounen am Livestream an am Replay.

Dat Wichtegst vum Dag op ee Bléck

- Direkt op der Home:
- Newsfeed 
- 3 Haaptkategorien : RTL.lu, Tëlee a Radio
- Déi aktuellst Artikelen
- Trafic 
- Meteo

Push-Message :  Info op d’Mooss

Verpasst näischt méi mat eise Push-Messagen. Wielt u wat Iech interesséiert a sidd direkt informéiert :
- Breaking News (national an international)
- Sport-News
- Trafic-Info  
- Kultur & Lifestyle
- RTL Service
- RTL-Aktiounen 

RTL App fir iPhone an iPad : Iwwerall an zu all Moment informéiert

All Moment RTL",2010-03-17T20:11:58Z,2025-02-19T08:54:41Z
lu,Luxembourg,News,6009,6,6446636745,LU-Alert,Centre des technologies de l'information de l'Etat,https://apps.apple.com/lu/app/lu-alert/id6446636745?uo=4,0.0,3.16667,24,News,"The Government of the Grand Duchy of Luxembourg has developed a mobile app, called ' LU-Alert ', to alert the population in case of an emergency and share information about risks by smartphone. The app supplements the alert system operated by the Government and forms part of a general approach for increasing public awareness and understanding of risks and protective measures.

The app enables the Government to broadcast alerts about major incidents, natural hazards or imminent danger. It allows users to be alerted by a notification on their smartphone in the event of a situation that affects public safety. It is possible to choose types of risks / proximity / places of interest settings to display personalized alerts.

As a preventive measure, information on appropriate behavior to adopt and the various emergency response plans are also available via the app.",2024-10-14T07:00:00Z,2025-10-29T06:42:12Z
lu,Luxembourg,News,6009,7,1239397626,"The Economist - News, Podcasts",The Economist Newspaper Group Inc.,https://apps.apple.com/lu/app/the-economist-news-podcasts/id1239397626?uo=4,0.0,4.79621,898,News,"The world is complex, and changing fast. The Economist app unlocks independent reporting and news analysis from correspondents across the globe. With articles, podcasts, videos and more, our app is a simple way to understand big news developments and why they matter.

Now introducing The Economist Insider, a premium video offering available at launch for subscribers to The Economist. Join senior editors as they explain what's happening now—and what comes next.

What does The Economist cover?

With expert journalists around the world, The Economist reports on politics in America and around the world, as well as economics, business, science, technology and more. We connect the dots to explain the news today and implications for tomorrow.

Why choose The Economist app?

- Read global, fact-checked news reporting anywhere
- Listen to award-winning podcasts and audio articles
- Watch videos that distill big news 

Get access to independent news reporting on your terms:

- Catch up on the news quickly with The World in Brief 
- Enjoy early access to weekly edition, ahead of print
- Download articles for offline reading

Play news games to test your knowledge:

- Mini crossword: The Economist’s wordplay news puzzle
- Dateline history quiz: guess when news extracts were published 
- Pint-sized news quiz: have you been following the latest headlines?

Enjoy additional features:

- Bookmark news articles to read later
- Give news articles to friends and family
- Read news analysis easily with adjustable text size
- Toggle dark mode

See what The Economist subscribers say:

“Great app, excellent journalism! The Economist is wonderful. The content is interesting and relevant and the reporting is superlative. Equally impressive is the drive to stay relevant by presenting media in multiple formats, from print to podcasts and short videos.”

“Impeccable journalism with an app to match. The Economist doesn’t need my endorsement of the quality of their journalism. It speaks for itself. Rather, I’ll comment that their app is well-designed and refreshing to use…I love being able to easily download entire editions, listen to articles with real narrators and search for past articles.”

Full terms of use: https://www.economist.com/legal/terms-of-use
Our privacy policy: https://www.economist.com/privacy",2018-05-03T04:30:18Z,2025-11-24T08:56:21Z
lu,Luxembourg,News,6009,8,507415273,L'essentiel Mobile,Edita S.A.,https://apps.apple.com/lu/app/lessentiel-mobile/id507415273?uo=4,0.0,2.88119,101,News,"L'application de «L'essentiel» vous permet de suivre l'intégralité de l'actualité. Luxembourg, Grande Région, Monde, Économie, Sport, People et Divertissements: retrouvez toutes vos rubriques préférées ainsi que des vidéos et des diaporamas sur votre iPhone et votre iPod Touch.",2012-03-20T10:24:36Z,2025-08-25T12:18:39Z
lu,Luxembourg,News,6009,9,509464046,police.lu,Police Grand-Ducale,https://apps.apple.com/lu/app/police-lu/id509464046?uo=4,0.0,3.44444,36,News,"L’application est gratuite et permet aux utilisateurs de profiter d’un certain nombre de services.

Au-delà de la mise à disposition d’informations policières (actualités, appels à témoins, messages de prévention, postes vacants, etc.), l’application mobile permet à la Police d’informer directement et rapidement les utilisateurs en cas de crise grâce aux notifications, et de solliciter en outre l’appui de la population en cas de disparition d’une personne ou de recherche d’un auteur présumé par exemple.

La fonction « My Safe » permet aux utilisateurs de stocker les principales données (photos, factures, etc.) de leurs objets de valeur à un même endroit. Dans le cas inopiné d’un vol, l’utilisateur a toutes les données sous la main qui pourront être transmises facilement via mail à l’agent de police lors du dépôt de plainte. Il n’y aura pas de perte de temps inutile et le travail des agents de police sera facilité grâce à un dossier plus complet. Toutes les données ainsi enregistrées dans l’application mobile ne sont disponibles pour la Police qu’à partir du moment où l’utilisateur les aura transférées à la Police. Pour le reste, elles ne sont visibles que pour le propriétaire du smartphone qui a évidemment la possibilité d’éditer ou de supprimer les entrées.

La fonction « E-Call » permet aux utilisateurs de contacter le centre d’intervention national 113. L’avantage en est que l’appelant est géolocalisable pour l’opérateur au 113.

La fonction « Chat » permet aux utilisateurs d’envoyer un message texte au 113, lorsque l’appelant n’est pas en mesure de parler au téléphone.

L’application mobile permet en outre de trouver le commissariat de police le plus proche, reprend les informations trafic et fournit un accès à l’e-commissariat.",2012-09-15T18:24:51Z,2024-02-07T08:30:51Z
lu,Luxembourg,News,6009,10,1200842933,Financial Times: Business News,Financial Times Ltd.,https://apps.apple.com/lu/app/financial-times-business-news/id1200842933?uo=4,0.0,4.74615,520,News,"Empower your ambitions with the Financial Times’ unrivalled, globally focused journalism. 

WHAT’S FREE? Download for free and access all podcasts, all videos, the FT Crossword, markets & finance blog “Alphaville” and 3 articles of your choice per month without any payment.

FINANCIAL TIMES ADVANTAGE:
• Accurate, independent, and insightful journalism since 1888.
• Unbiased reporting: Expert comment and analysis on world news, business, politics, economics, finance, companies and more
• Thought-provoking journalism: Explore the arts, real estate, fashion, food, books, technology news and more with a unique FT voice
• Market Insights: Monitor real-time stock prices, charts, equities screeners, and global market news
•Personalised news: Follow topics important to you by curating your own feed with MyFT

LISTEN, WATCH, READ: 
• Podcasts, including News Briefing and FT Weekend
• Articles read by AI
• Available with Apple CarPlay for news on the go
• Offline Reading: Save articles and editions for offline reading anywhere, anytime
• Video: Compelling insights through video journalism 

JOIN THE CONVERSATION: 
•Engage and Share: Join the conversation in the comments, or share and gift news stories

HAVE A SUBSCRIPTION?
• Go beyond free access with discounts and offers in the app 
• Choose from access levels based on your content needs
• Current subscribers log in for seamless access

IS THE FT FOR YOU?
 Whether you're an economist analysing global trends, a stockbroker navigating market shifts, a business leader staying ahead of financial news, or a curious mind exploring politics, culture, and the forces shaping our world, the Financial Times offers world-class insights to inspire, inform, and push you further in your ambitions.
From Wall Street to Hong Kong, from New York to London, FT covers not just markets and finance, but also global affairs, technology, climate policy, and industry leading social research. Whether you're unpacking the impact of elections, exploring cultural shifts, or following scientific breakthroughs, our innovative approach to news brings you deeper analysis and fresh perspectives.

With reporting from over 50 countries, opinion pieces, long-form features, and expert commentary on everything from diplomacy to digital transformation, FT is for those who think beyond the headlines. Whether you're planning your next departure to a cultural capital, exploring new culinary experiences, or seeking fresh literary insights, stay ahead of the conversation with FT.

Terms and conditions apply.  Read them at ft.com/terms
We respect your privacy.  Read our privacy policy at ft.com/privacy",2017-06-27T15:08:02Z,2025-11-18T17:42:02Z
lu,Luxembourg,News,6009,11,1143507069,PanneauPocket,CWA Enterprise,https://apps.apple.com/lu/app/panneaupocket/id1143507069?uo=4,0.0,4.77778,9,News,"Above all, our dedication to the citizens. Thanks to the free app PanneauPocket,get notified of all alerts and information from your town. Do not miss any news from your town, wherever you are! Receive notifications in real-time on your phone as soon as your city hall publishes new information.
Thanks to PanneauPocket, you can also be informed of the upcoming events around you from the cities using the app. Bookmark your favorite cities by hitting the heart.
Wherever you are, at home, work, on vacations, receive all the useful information and alerts about your town on your mobile phone.
Be informed of every-day life events about your place of residence even if you are away.
PanneauPocket is so easy to use, you do not need to set up the app, and it is suitable for all audiences.
PanneauPocket is a municipal communication system that particulary works well for towns with inhabitants spread through a wide geographical aera. You no longer need to walk in front of the city hall to have access to the informational displays.
Our advice : Invite all of your family, friends, coworkers to download the app for free. Local information is precious.",2016-09-07T17:12:10Z,2025-10-06T07:14:05Z
lu,Luxembourg,News,6009,12,556668009,RTL,M6 Distribution Digital,https://apps.apple.com/lu/app/rtl/id556668009?uo=4,0.0,4.48062,129,News,"Avec l'application RTL, 1ère radio privée de France, plongez dans l’univers de votre station de radio préférée : le direct, les replays, les podcasts et les playlists de nos programmes phares !

LE MEILLEUR DE RTL

• Accédez en un clic au direct audio ou vidéo, et revenez au début de l’émission si vous avez manqué le début.
• Retrouvez facilement le replay audio ou vidéo de toutes les émissions de l'antenne : Les Grosses Têtes, L'œil de Philippe Caverivière, Héros, L'Heure du Crime, RTL Matin...
• Suivez en temps réel toutes les infos RTL de la Rédaction (actualités, sport, culture, économie, santé…) et abonnez-vous aux notifications pour ne rien manquer.

PERSONNALISEZ VOTRE APPLICATION
Créez-vous un compte pour profiter de fonctionnalités personnalisées !

• Suivez vos émissions et podcasts favoris.
• Téléchargez des épisodes via votre compte utilisateur RTL, pour les écouter où et quand vous le voulez.
• Reprenez la lecture de vos podcasts là où vous l'avez laissée.
• Choisissez les notifications et newsletters que vous souhaitez recevoir pour rester informé des actualités et nouveautés.
• Programmez votre alarme personnalisée pour commencer la journée avec RTL ou l’une de nos radios digitales.

PROFITEZ A 100% DE NOS CONTENUS EXCLUSIFS

• Découvrez nos radios digitales RTL : 100% Grosses Têtes, RTL 100% France, RTL 100% Hits, RTL 100% 80…
• Laissez-vous tenter par nos podcasts originaux, entièrement crées par nos équipes : Une lettre d'Amérique, Les Voix du Crime, Lis-moi une histoire, Symptômes...

RTL PARTOUT AVEC VOUS

• Embarquez-nous dans vos trajets du quotidien ! En voiture, écoutez RTL partout grâce à la compatibilité CarPlay.

UNE REMARQUE, UNE SUGGESTION, UNE QUESTION ?
Contactez-nous à l’adresse mail suivante : mobile.radio@m6.fr

Retrouvez également votre radio RTL sur les réseaux sociaux : Facebook, Youtube, Instagram, X, BlueSky et TikTok !",2012-09-04T19:45:56Z,2025-10-30T06:57:10Z
