country,country_name,category,genre_id,rank,app_id,app_name,developer,url,price,averageUserRating,userRatingCount,primaryGenreName,description,launch_date,update_date
co,Colombia,Graphics & Design,6027,1,6479689893,Tattoo AI - Diseño de tatuajes,HUBX YAZILIM HIZMETLERI ANONIM SIRKETI,https://apps.apple.com/co/app/tattoo-ai-dise%C3%B1o-de-tatuajes/id6479689893?uo=4,0.0,4.75207,3860,Graphics & Design,"Tattoo AI: ¡Tu app ideal para crear tatuajes únicos sin esfuerzo!
Ya seas un amante de los tatuajes, estés pensando en hacerte el primero o seas un artista del tatuaje en busca de inspiración, Tattoo AI tiene todo lo que necesitas. Con su generador de tatuajes con IA de última generación y una amplia gama de estilos —desde blanco y negro hasta japonés y tribal— puedes crear diseños increíbles para cualquier parte del cuerpo con solo unos toques.

Características principales:

Generador de tatuajes con IA:
El generador de tatuajes con inteligencia artificial es el corazón de Tattoo AI. Solo escribe tus ideas o temas, y nuestra IA avanzada creará diseños únicos adaptados a tus gustos. ¡Es como tener a un tatuador personal en tu bolsillo!

Variedad de estilos:
Tattoo AI ofrece una gran variedad de estilos para todos los gustos. Ya sea que prefieras la elegancia del blanco y negro, los detalles intrincados del arte japonés o la creatividad audaz de los personajes de videojuegos, aquí encontrarás el diseño perfecto.

Tatuajes con texto:
¿Buscas una frase o cita significativa para tatuarte? Tattoo AI te permite crear tatuajes con texto personalizados, eligiendo tipografías y estilos únicos. Solo escribe tus palabras favoritas y nuestra IA las convertirá en diseños hermosos que reflejan tu personalidad.

Personalización total del cuerpo:
Diseña tatuajes para cualquier parte del cuerpo de forma sencilla. Nuestra app te ayuda a visualizar cómo se verán los diseños en diferentes zonas, para que tomes decisiones seguras antes de tatuarte.

Plantillas de tatuaje de alta calidad:
Convierte tus diseños en plantillas listas para usar. Perfecto para tatuadores o para quien quiera llevar sus diseños digitales a la realidad.

Guardar y compartir:
Guarda tus diseños favoritos y compártelos con amigos o con tu tatuador. Recibe retroalimentación, haz ajustes y perfecciona tu tatuaje ideal.

Por qué amarás Tattoo AI:

Inspírate:
Nuestro generador con IA te da ideas ilimitadas para tatuajes. Ya no tienes que buscar imágenes genéricas: obtén diseños personalizados que reflejan tu estilo y esencia.

Diseños únicos:
Cada tatuaje es especial. Tattoo AI crea diseños personalizados según tus ideas, asegurando que el resultado sea totalmente único.

Ahorra tiempo:
Olvídate de pasar horas pensando y dibujando. Deja que la IA se encargue de eso, para que tú solo elijas y disfrutes tu nuevo tatuaje.

Visualización sencilla:
¿No estás seguro de en qué parte del cuerpo tatuarte? Usa la app para ver cómo se verían los diseños en diferentes zonas y elige con confianza.

Libertad creativa:
Ya seas un artista del tatuaje o solo alguien que ama los tatuajes, Tattoo AI te ofrece herramientas que estimulan tu creatividad y te permiten explorar infinitas posibilidades.

Resuelve tus dudas sobre tatuajes:
Encontrar el diseño perfecto puede ser complicado. Tattoo AI facilita el proceso generando ideas que coinciden con tu estilo y preferencias.

Descubre tu potencial para tatuajes:
Tattoo AI no es solo una app para crear tatuajes, es un centro creativo para los verdaderos fanáticos. Nuestro generador con IA y la variedad de estilos te permiten crear tatuajes que realmente son tuyos. Ya sea algo pequeño o una manga completa, Tattoo AI es el compañero ideal en tu camino tatuador.

Para usar esta app, debes aceptar nuestro Acuerdo de Licencia de Usuario Final (EULA): https://tattoo.ai/terms
Y nuestra Política de Privacidad: https://tattoo.ai/privacy",2024-06-15T07:00:00Z,2025-11-18T06:01:43Z
co,Colombia,Graphics & Design,6027,2,6448484908,AR Drawing: Sketch & Paint,Digital Solutions Technologies Limited,https://apps.apple.com/co/app/ar-drawing-sketch-paint/id6448484908?uo=4,0.0,4.53627,1833,Graphics & Design,"Solo calca la imagen proyectada en papel y coloréala

Usa la cámara de tu teléfono para dibujar
Muchas plantillas: Animales, Autos, Naturaleza, Comida y más
Linterna integrada
Comparte el resultado con tus amigos

AR Drawing es una aplicación innovadora que te permite crear dibujos y pinturas increíbles usando tecnología de realidad aumentada Puedes dibujar lo que quieras sobre cualquier superficie

Ya seas un artista con experiencia o estés comenzando esta app es perfecta para liberar tu creatividad y explorar nuevas posibilidades en el arte Descarga AR Drawing: Sketch & Paint y comienza a crear tu propia obra maestra

Política de Privacidad: https://ar-drawing.com/privacy/
Términos de Uso: https://ar-drawing.com/terms/",2023-05-02T07:00:00Z,2025-11-11T17:51:04Z
co,Colombia,Graphics & Design,6027,3,1534126062,"Themify: Iconos, Temas, Widget",AIBY Incorporated,https://apps.apple.com/co/app/themify-iconos-temas-widget/id1534126062?uo=4,0.0,4.60391,3070,Graphics & Design,"Explora nuestra amplia colección de atractivos íconos, temas, fondos de pantalla y widgets para que personalices y animes las pantallas de bloqueo y de inicio de tu teléfono. Sin duda encontrarás algo que se adapte a tus gustos.


Y no se trata solo del aspecto. Con los widgets de Themify para las pantallas de bloqueo y de inicio y StandBy, puedes tener acceso rápido a la información que necesites, convertir tu teléfono en una pantalla inteligente e incluso tener una mascota digital en tu pantalla.

Funciones clave:


■ Temas 3 en 1


Independientemente de que te gusten los tonos oscuros o te apasionen los colores pastel, puedes decorar tu pantalla para crear un espacio armonioso con unos pocos toques. Solo tienes que instalar un tema que se adapte a tus gustos y disfrutar de una perfecta combinación de íconos de aplicaciones, widgets y fondos de pantalla.


■ Gran colección de widgets
Widgets interactivos para llevar un seguimiento de tus actividades más importantes, como el sueño o la distancia recorrida.
Widgets con hora y calendario, clima, frases motivadoras o simplemente imágenes atractivas: agrega cualquier información directamente a tus pantallas de inicio y de bloqueo
Simpáticas mascotas digitales (¡recuerda alimentarlas y bañarlas!)
Widgets para StandBy con la hora, el día o el clima en tiempo real siempre activos
Widgets informativos creados especialmente para iPad

■ Creador de temas

Si quieres personalizar el tema de tu pantalla de inicio, utiliza nuestro Creador de temas. Cambia su diseño y crea uno único para tu dispositivo.


■ Más de 2000 paquetes de íconos


Para quienes ya no quieran seguir usando los mismos íconos estándar, tenemos una gran variedad de paquetes de íconos personalizados. ¡Seguro encontrarás contenido único para tu gusto!


■ Fondos fijos y animados

Anime, Urbano, Animales, Naturaleza, Automóviles, por mencionar algunos. ¡Tenemos fondos de pantalla fijos y animados para todos los gustos y estados de ánimo! 


■ Integración con Salud de Apple 


Sincroniza Themify con la aplicación Salud y haz un seguimiento sin esfuerzo de tu sueño diario, la cantidad de pasos realizados y la ingesta de agua mediante el uso de widgets prácticos y atractivos. 

SUSCRIPCIÓN DE ACCESO ILIMITADO
• Puedes suscribirte a todas las funciones de Themify para acceder a ellas de forma ilimitada.
• Las suscripciones se facturan semanalmente o anualmente a la tasa seleccionada según tu plan de suscripción.

Todos los datos personales están protegidos según los Términos de uso y la Política de privacidad:
https://aiby.mobi/widget/terms/ 
https://aiby.mobi/widget/privacy/",2020-10-02T07:00:00Z,2025-11-06T06:29:00Z
co,Colombia,Graphics & Design,6027,4,6748313878,AI Home Decor-Diseño Interior,Wildsmyth Interactive Limited,https://apps.apple.com/co/app/ai-home-decor-dise%C3%B1o-interior/id6748313878?uo=4,0.0,4.88598,307,Graphics & Design,"AI Home Decor te ayuda a rediseñar interiores y exteriores en segundos. Sube una foto, elige un estilo y obtén transformaciones sorprendentes para habitaciones, jardines y más – todo impulsado por IA.

[ Domina tu estilo: Transformación total del hogar ]
  ⌂ Diseño interior inteligente: Sube una foto de tu habitación, elige un estilo y recibe un diseño personalizado generado por IA con colores, muebles y detalles que se adaptan a tu gusto, todo visualizado con claridad impresionante.
 ⌂ Nuevos estilos para el jardín: Descubre nuevas posibilidades para tu jardín. Captura el espacio, elige tu estilo favorito y deja que la IA lo reimagine con ideas creativas y frescas.
 ⌂ Transferencia de estilo sencilla: Explora diseños de interiores y jardines de otros usuarios, o sube tu propia imagen de referencia, y aplica instantáneamente ese look a tu espacio interior o exterior con la transferencia de estilo de IA.
⌂ Transformaciones exteriores inspiradoras: Rediseña la fachada de tu casa con precisión sin esfuerzo. Solo toma una foto, selecciona tu estilo arquitectónico preferido y observa cómo la IA genera planes visuales de alta calidad que muestran nuevos colores, materiales y detalles únicos.

[ Perfecciona los detalles: Estilo preciso ]
 ⌂ Descubre nuevas paredes: Rediseña tu espacio fácilmente – cambia colores y texturas con un toque. La IA muestra acabados perfectos sin ensuciar.
 ⌂ Suelos al instante: Visualiza madera, baldosas y más en pantalla. Observa al momento el cambio en tu habitación y elige con seguridad.
 ⌂ Reemplazo inteligente: ¿Cansado de tu mobiliario o decoración? Borra lo que no quieres, describe tu idea y la IA generará un nuevo estilo.
 ⌂ Diseña tu pintura mural: Escribe lo que imaginas y la IA creará una obra única que encaje perfectamente con tu espacio.

[ Asesor del hogar IA: Tu aliado inteligente ]
 ⌂ Impulsado por IA avanzada, este servicio ofrece orientación personalizada según tus necesidades. Desde la distribución hasta la comodidad diaria, el asistente se adapta a tu estilo – ya sea optimizando espacios pequeños, mejorando el descanso o creando ambientes para mascotas. Recibe asesoría profesional en cada paso, integrada con tus elecciones de diseño.

[ Pásate a Premium para acceso total ]
- Disfruta limpieza avanzada, organización inteligente y funciones exclusivas de IA
- Elige el plan que más te convenga: semanal, mensual o anual
- La suscripción se renueva automáticamente salvo cancelación al menos 24h antes del fin del período. Puedes gestionarla en los ajustes de Apple ID.
 
Empieza hoy y descubre una nueva manera de diseñar tu hogar. Con IA avanzada, transforma tu espacio, eleva tu estilo y haz realidad tu visión.

Política de privacidad: https://www.wildsmythinteractive.com/privacy-policy-homeai
Términos de servicio:https://www.wildsmythinteractive.com/terms-of-service-homeai",2025-07-09T07:00:00Z,2025-11-18T04:01:26Z
co,Colombia,Graphics & Design,6027,5,6464476667,Home AI - diseño de interiores,HUBX YAZILIM HIZMETLERI ANONIM SIRKETI,https://apps.apple.com/co/app/home-ai-dise%C3%B1o-de-interiores/id6464476667?uo=4,0.0,4.79772,14481,Graphics & Design,"Remodela tu casa utilizando Home AI, la herramienta más potente de Diseño de Interiores con IA ideal para quienes desean construir casas o renovarlas..

¿Cansado de mirar las mismas paredes de siempre? ¿Quieres hacer un cambio de decoración de interiores? ¿Sueñas con una remodelación completa de tu casa, un planificador de habitaciones o incluso con construir casas desde cero pero te agobian las opciones? Home AI está aquí para ser tu asistente personal para Diseñar Interiores y diseño de casas, transformando tu hogar en una obra maestra con el poder de la inteligencia artificial.

【Diseño de interiores y decoración de interiores al alcance de tu mano】 

●Modelación instantánea de habitaciones: Toma una foto de cualquier habitación de tu casa, y los avanzados algoritmos de IA de Home AI generarán al instante asombrosos conceptos de diseño de interiores, arquitectura, propuestas para construir casas adaptadas a tu espacio y diseño de casas adaptados a tus necesidades. Sé testigo de cómo se despliega la magia a medida que tu visión va cobrando vida ante tus ojos para diseñar casas, con cada detalle cuidadosamente optimizado.

●Un mundo de estilos de diseño de interiores y de arquitectura: Libera al decorador que llevas dentro para diseñar casas con nuestra amplia biblioteca de más de 10 estilos para diseñadores de interiores  y quienes desean construir casas y quieren hacer decoración de interiores. Desde el elegante minimalismo del diseño de interiores moderno hasta la relajante serenidad de la estética zen en el diseño de casas, Home Al satisface todos los gustos. Experimenta con varios estilos, mezcla y combina elementos, y descubre el aspecto perfecto que refleje tu personalidad única.

●Recomendaciones basadas en IA que van más allá del estilo: Home Al no sólo te sugiere un nuevo look, sino que también te da recomendaciones sobre muebles, decoración y combinaciones de colores, arquitectura del espacio que complementan a la perfección el estilo que has elegido para volverte un profesional al diseñar casas. Crea un espacio armonioso y coherente que se sienta verdaderamente como si estuvieras viviendo en él.

【Más que una simple visualización:】

●Guarda y comparte tus obras maestras: Captura y guarda tus conceptos favoritos de diseño de interiores para consultarlos en el futuro, así como del diseño de casas y la decoración de interiores. Comparte tus espacios transformados con amigos, familiares o incluso diseñadores de interiores profesionales para obtener valiosos comentarios y perfeccionar tu visión. Colabora sin esfuerzo y trae a la vida tus sueños de diseño.

●Encuentra inspiración en un sinfín de posibilidades: Home AI actúa como tu musa personal para diseñar tus interiores, diseñar casas, así como la arquitectura de tu espacio, ofreciéndote un sinfín de fuentes de inspiración para despertar tu creatividad. Explora diferentes conceptos y experimenta con varios estilos para encontrar el equilibrio perfecto que refleje tu gusto único y eleve tu espacio.

【Home IA es la herramienta definitiva para cualquiera que quiera:】

●Visualizar sin esfuerzo ideas de para diseñar interiores y ver cómo la casa de sus sueños cobra vida
●Explorar una amplia biblioteca de estilos de diseño de interiores y descubrir su estética perfecta, así como su arquitectura
●Refrescar una habitación o planificar un cambio de imagen completo con facilidad
●Colaborar con amigos, familiares y profesionales para crear un espacio personalizado
●Despertar tu creatividad y descubrir la casa de tus sueños


¡Descarga Home AI hoy mismo y descubre un mundo de posibilidades para diseñar los interiores de tu hogar!

Al utilizar la aplicación, confirmas que conoces y aceptas nuestra Política de Privacidad y Términos de Uso:
Política de Privacidad: https://homeinterior.ai/privacy
Términos del servicio: https://homeinterior.ai/terms

¿Tienes alguna pregunta para nosotros?
info@homeinterior.ai",2024-04-05T07:00:00Z,2025-11-20T17:07:05Z
co,Colombia,Graphics & Design,6027,6,1534704608,"iScreen:Icono,Widget,Tema","Xiamen iScreen Information Technology Co., Ltd.",https://apps.apple.com/co/app/iscreen-icono-widget-tema/id1534704608?uo=4,0.0,4.7187,4241,Graphics & Design,"＊ ¡Estiliza tu móvil, ¡iScreen it!​​ ＊

iScreen - Pantalla de inicio personalizada con diversos Widgets, Temas y Fondos de pantalla para que la pantalla de tu teléfono destaque.

¡iOS 26 Desbloqueado!, con efectos de vidrio líquido y más de 1000+ fondos de pantalla y temas espaciales en 3D. Se añadió personalización dinámica del Centro de Control para 
una experiencia más práctica y divertida.

No solo puedes criar mascotas y cultivar plantas en la Dynamic Island, personalizar tu Pantalla de Bloqueo con widgets Interactivos, Clima, Batería, Lanzador, Panel-X, Texto e Ícono, Animación, Reloj de Trabajo, Contador de Pasos, sino también añadir widgets de Pantalla de Inicio como Panel Dinámico, Fotos, Álbum de Desplazamiento, Lista de Tareas, Cuenta Regresiva, Reloj Digital, Calendario, Notas de Emoji, Ventilador, Aire Acondicionado, y más para mayor diversión. Además de los widgets, iScreen también ofrece varios Temas, Fondos de Pantalla, obras de arte generadas por IA, Animaciones de Carga y otras funciones para hacer que la pantalla de tu teléfono sea más hermosa y única.

Característica especial:
  【iOS 26】  
Divertidas funciones de iOS 26, personalizadas con más de 1000+ fondos de pantalla y temas espaciales en 3D. Efectos dinámicos añadidos en el Centro de Control para que tu teléfono sea verdaderamente único.

  【Centro de Control】  
Personaliza el estilo de tu Centro de Control con iconos coloridos. Las características incluyen un Contador, Recordatorio de Agua, Libro de Respuestas, Lanzamiento de Dados e Inicio Rápido, combinando belleza y practicidad.

  【Fondos de Pantalla DIY】  
Crea fondos de pantalla estáticos o dinámicos con plantillas ricas como Polaroid, Rompecabezas de Corazón, Tarjeta Intercambiable y Luces de Marquee Animadas para hacer que tu pantalla de inicio sea única.

  【Widgets】  
Incluye widgets populares como Panel Dinámico, Muro de Fotos, Clima, Batería, Cuenta Regresiva, Calendario, Panel-X, Notas de Emoji, Reloj Digital, Rueda de la Fortuna, Molino de Viento y Aire Acondicionado. También ofrece estilos creativos de pantalla de bloqueo como Emojis, Animaciones e Iconos, con soporte para efectos transparentes, haciendo que tu teléfono sea divertido y práctico.

  【Animación de Carga】  
Animaciones de carga geniales e interesantes con efectos personalizados para una experiencia de carga personalizada.

  【Widgets de Pareja】  
Dulces widgets diseñados para parejas y amigos. Envíen mensajes y fotos a las pantallas del otro, y verifiquen la distancia en tiempo real, el clima y los estados de ánimo.

  【Widgets Interactivos】  
Completa rápidamente registros de tareas pendientes o juega juegos como ""Golpear Topo"" y ""Arcade"" sin abrir la aplicación, añadiendo diversión a tu rutina diaria.

  【Temas y Fondos de Pantalla】  
Una vasta colección de temas y fondos de pantalla actualizados diariamente, incluyendo estilos de tendencia como Ins, minimalista, rosa y negro, arte de IA y diseños de papel cortado. Eleva fácilmente el estilo de tu pantalla de inicio y personaliza tu teléfono!

  【Dynamic Island】  
Ofrece una variedad de funciones divertidas, como Isla de Mascotas, Isla de Plantas, Isla de Animación, Isla del Clima, Isla de Panel, Isla de Calendario, Isla de Firma, Isla de Lanzador, Isla de Temporizador y más. Viene con múltiples animaciones creativas integradas, y también puedes cargar imágenes o avatares personalizados a tu Dynamic Island y establecer citas exclusivas

Use Of Terms: https://www.xmzerone.com/about/deskagreement.html
Privacy Policy: http://www.xmzerone.com/about/deskprivacy.html",2020-11-25T08:00:00Z,2025-11-13T01:54:41Z
co,Colombia,Graphics & Design,6027,7,6502747597,Diseño de casa IA - DecAI™,COOL SUMMER LIMITED,https://apps.apple.com/co/app/dise%C3%B1o-de-casa-ia-decai/id6502747597?uo=4,0.0,4.74315,876,Graphics & Design,"Con DecAI™ diseñar los interiores y exteriores de la casa de tus sueños es tan sencillo como hacer una foto con nuestra potente AI.

► Decoración y Diseño de Interiores AI
Tan solo tienes que subir una foto de tu habitación, elegir el tipo de espacio y el estilo que deseas. Nuestra avanzada tecnología AI analizará las dimensiones de la sala para generar un plan de diseño de interiores personalizado que se adapte a tus gustos. Desde estilo moderno hasta rústico, nuestro diseñador de interiores AI pondrá a tu disposición la visualización de todo tipo de disposiciones de mobiliario, paletas de colores y detalles decorativos.

► Diseño de Jardines AI
Enseña a la AI una foto de tu jardín, patio o azotea y recibe al instante diseños personalizados de magníficos jardines. Desde oasis tropicales hasta lugares rústicos, nuestra tecnología te mostrará flores de temporada, senderos y acogedoras zonas de descanso, ajustándose al estilo y dimensiones de tu espacio. Antes de empezar a remodelar, visualiza plantas resistentes a la sequía, paisajes modernos o macetas con vibrantes flores, y descubre un sinfín de posibilidades para renovar tu patio trasero, balcón o jardín.

► Remodelacion y Diseño de Exteriores AI.
Transforma el exterior y diseña tu casa con nuestras herramientas de remodelación AI. Elimina las limitaciones de diseño con una amplia gama de ideas novedosas para el exterior de tu hogar. Sube una foto, elege un estilo y la inteligencia artificial te proporcionará un plan de diseño personalizado.

► Reemplaza Cualquier Elemento
Creatividad ilimitada con reemplazos sin esfuerzo. ¿Cansado de tus muebles actuales? La función Reemplazar te permite borrar elementos que no te gustan e introducir los que te gustaría ver en su lugar, generando una nueva imagen para remodelar tu casa.

► Descubre Nuevas Paredes
Diseña interiores con ""Nuevas Paredes"". Cambia texturas y colores con facilidad y visualiza el acabado perfecto sin necesidad de pintar. Nuestra AI garantizará que todas tus sugerencias se ajustarán a tu visión.

► Previsualiza Opciones de Suelos
¿Por qué esperar al suelo perfecto cuando puedes verlo instantanemente? Nuestra función «Instalar Suelos Nuevos al Instante» te permite previsualizar directamente en su dispositivo una amplia selección de suelos, desde madera hasta baldosas.

► Explora Ideas de Diseño de Interiores
¿Buscas inspiración? DecAI puede ser tu fuente de referencia para una amplia variedad de ideas de diseño de habitaciones.

◆ TÉRMINOS DE SUSCRIPCIÓN ◆

Suscripción Semanal: $5.99/semana
Suscripción Anual: $39.99/año
Compra de por Vida: $49.99

El pago se cobrará en tu cuenta iTunes tras confirmar la compra.
• La suscripción se renovará automáticamente, a menos que se desactive la renovación automática 24 horas antes del final del período actual.
• El importe de la renovación se cargará a tu cuenta en las 24 horas anteriores a la fecha de vencimiento de la suscripción. Podrás ver el precio de la renovación.
• Puedes gestionar tu suscripción y desactivar la renovación automática en cualquier momento en la configuración de iTunes.
• Cualquier porción no utilizada de un período de prueba gratuito (si se ofrece), se perderá al comprar una suscripción.
• Para evitar cargos por renovación, cancela tu suscripción o prueba gratuita al menos 24 horas antes de que finalice desactivando la renovación automática en la configuración de iTunes. La cancelación entrará en vigor el día después de que finalice tu período actual y pasarás a la versión gratuita.

Si tienes alguna pregunta, por favor envíanos un correo a coolsummerdev@icloud.com y te ayudaremos a resolverlo.

Para más información, lea nuestros términos y condiciones:
Política de privacidad: https://coolsummerdev.com/artgenerator-privacy-policy
Términos de uso: https://coolsummerdev.com/artgenerator-terms-of-use
Normas de la comunidad: https://coolsummerdev.com/community-guidelines",2024-05-23T07:00:00Z,2025-11-21T02:59:35Z
