country,country_name,category,genre_id,rank,app_id,app_name,developer,url,price,averageUserRating,userRatingCount,primaryGenreName,description,launch_date,update_date
ai,Anguilla,Education,6017,1,570060128,Duolingo - Language Lessons,"Duolingo, Inc",https://apps.apple.com/ai/app/duolingo-language-lessons/id570060128?uo=4,0.0,4.82093,497,Education,"Learn a new language with the world’s most-downloaded education app! Duolingo is the fun, free app for learning 40+ languages through quick, bite-sized lessons. Practice speaking, reading, listening, and writing to build your vocabulary and grammar skills.

Designed by language experts and loved by hundreds of millions of learners worldwide, Duolingo helps you prepare for real conversations in Spanish, French, Chinese, Italian, German, English, and more.

And now, you can learn Math and Music the Duolingo way!  

Build real-world math skills – from calculating tips to identifying patterns – and sharpen your mental math in our Math course.

Learn how to read music and play familiar songs on your device in our Music course – no instrument required.

Whether you’re learning for travel, school, career, family and friends, or your brain health, you’ll love learning with Duolingo.

Why Duolingo?
• Duolingo is fun and effective. Game-like lessons and fun characters keep you motivated to build solid skills across language, math and music.

• Duolingo works. Designed by learning experts, Duolingo has a science-based teaching methodology proven to foster long-term knowledge retention.

• Track your progress. Work toward your learning goals with playful rewards and achievements when you make practicing a daily habit!

• Join 300+ million learners. Stay motivated with competitive Leaderboards as you learn alongside our global community.

• Every course is free. Learn Spanish, French, German, Italian, Russian, Portuguese, Turkish, Dutch, Irish, Danish, Swedish, Ukrainian, Esperanto, Polish, Greek, Hungarian, Norwegian, Hebrew, Welsh, Arabic, Latin, Hawaiian, Scottish Gaelic, Vietnamese, Korean, Japanese, English, and even High Valyrian. And now, learn Math and Music with our newest courses!

What the world is saying about Duolingo:

“Far and away the best language-learning app.” –The Wall Street Journal

“This free app and website is among the most effective language-learning methods I’ve tried… lessons come in the form of brief challenges – speaking, translating, answering multiple-choice questions – that keep me coming back for more.” –The New York Times

“Duolingo may hold the secret to the future of education.” – TIME Magazine

“…Duolingo is cheerful, lighthearted and fun…” - Forbes

“Our favorite language app…” - CNET

If you like Duolingo, try Super Duolingo for 14 days free! Learn a language fast with no ads, and get fun perks like Unlimited Hearts and Monthly Streak Repair.

If you choose to purchase Super Duolingo, payment will be charged to your Apple account, and your account will be charged for renewal within 24-hours prior to the end of the current period. Auto-renewal may be turned off at any time by going to your settings in the App Store after purchase. Any unused portion of a free trial period, if offered, will be forfeited when the user purchases a subscription to that publication, where applicable.

Privacy Policy: https://www.duolingo.com/privacy
Terms of Service: https://www.duolingo.com/terms",2012-11-13T08:00:00Z,2025-11-18T14:12:41Z
ai,Anguilla,Education,6017,2,1581979387,Госуслуги Культура,"MINKOMSVYAZ ROSSII, FKU",https://apps.apple.com/ai/app/%D0%B3%D0%BE%D1%81%D1%83%D1%81%D0%BB%D1%83%D0%B3%D0%B8-%D0%BA%D1%83%D0%BB%D1%8C%D1%82%D1%83%D1%80%D0%B0/id1581979387?uo=4,0.0,4.68605,86,Education,"Выпустите бесплатно «Пушкинскую карту» с балансом 5000 ₽ и посещайте кино, музеи, театры и концертные залы за счёт государства. Карта действует для молодых людей от 14 до 22 лет



Получите доступ в Госуслуги Культура 
Зарегистрируйтесь или войдите под подтвержденной учётной записью портала Госуслуг. Для выпуска ""Пушкинской карты"" дайте согласие в мобильном приложении. Когда карта будет готова, придёт уведомление. Выпуск и обслуживание бесплатны. Воспользуйтесь афишей мероприятий, если не подходите под условия программы ""Пушкинская карта""



Лимит карты — 5000 ₽
На мероприятия «Пушкинской программы» можно потратить 5000 ₽, из которых до 2000 ₽ - на билеты в кино.
Карту нельзя обналичить или пополнить самостоятельно



Билеты в кино
«Пушкинской картой» можно оплатить билеты на российские фильмы, созданные при поддержке Минкультуры России, Фонда кино, региональных органов власти в сфере культуры. Также доступна покупка билетов на отечественные фильмы из «золотой коллекции»


Баланс и реквизиты всегда под рукой

Узнавайте баланс карты и копируйте реквизиты для покупки билетов в пару кликов


Культурные события — рядом с вами
Вы не пропустите интересный фильм, концерт или выставку, где бы не находились. Выберите нужный регион и узнавайте о предстоящих событиях. Приложение покажет, какие из них проходят рядом


Быстрый поиск мест и подробная информация
Находите кино, музеи, театры, культурные центры на карте или в списке и получайте информацию о месте: описание, адрес, график работы, фото, расписание мероприятий и цену билетов


Покупка билетов
Для покупки достаточно нажать «Посмотреть цены» и ввести реквизиты «Пушкинской карты» на сайте продавца. Реквизиты не придётся вписывать вручную — скопируйте их из приложения. Билет придёт на электронную почту


Ответы на вопросы о карте
Узнайте больше об использовании «Пушкинской карты» в специальном разделе или позвоните на единый контактный номер телефона 8 800 100-06-45
Подробную информацию о «Пушкинской карте» можно узнать на сайте https://culture.gosuslugi.ru/",2021-08-31T07:00:00Z,2025-10-31T13:39:16Z
ai,Anguilla,Education,6017,3,6478287397,Speak & Learn English: Learna,DEEP FLOW SOFTWARE SERVICES - FZCO,https://apps.apple.com/ai/app/speak-learn-english-learna/id6478287397?uo=4,0.0,4.63333,30,Education,"Ready to Speak English Confidently? 

Welcome to Learna AI English Tutor App, your all-in-one solution for mastering the English language! Learn English with grammar, speaking, reading, pronunciation, and vocabulary practices designed to enhance your proficiency in every aspect of the language.

With Learna AI, you can speak English confidently and effectively through interactive conversations. Our app takes your language learning journey beyond traditional methods. Whether you're a beginner or an advanced learner, Learna AI is here to help you learn & speak English in a fun, engaging, and personalized way.

English practices and lessons are guided by our Learna AI Virtual Chat Character, offering tailored support as you learn. You can speak with the AI character to improve both your speaking and listening skills. The app provides real-time feedback, helping you speak correctly and refine your vocabulary as you go. This makes learning English more dynamic, interactive, and efficient, as you can practice speaking at your own pace.

Learna AI also focuses on improving your grammar skills. You’ll learn essential grammar rules and practice them through a variety of exercises that help reinforce your understanding. The grammar practices are designed to gradually improve your proficiency, allowing you to speak with accuracy and clarity. As you learn grammar, you will build a stronger foundation for your speaking and writing skills.

Vocabulary plays a critical role in speaking English fluently. With Learna AI, you can improve your vocabulary by learning new words and phrases that are practical and useful in daily conversations. Each lesson focuses on building your vocabulary, ensuring you have a broad range of words at your disposal. The app features vocabulary practice that adapts to your level, helping you speak more naturally and confidently.

Your pronunciation also gets a boost with Learna AI. As you speak, you’ll receive valuable feedback to improve your pronunciation. The app includes exercises specifically designed to help you master English pronunciation and speak clearly. Pronunciation practices allow you to correct mistakes and sound more authentic when speaking English.

Track your progress with detailed performance metrics and milestones. Set learning goals to monitor your achievements and celebrate your successes. With continuous practice, you’ll see your speaking skills improve, and your vocabulary will expand. By setting specific goals, you ensure that each practice session is focused and effective.

Learna AI Language Tutor Features:

English Conversation Practice with Learna AI Virtual Chat Character
Get feedback from Learna AI for your mistakes
Learn English Grammar with tailored lessons
Improve your English Reading Skills
Enrich your English Vocabulary with daily vocabulary practices & Learn new words 
Spelling Check and vocabulary reinforcement
Perfect your English Pronunciation through interactive exercises
Enhance your English Speaking Skills through practical speaking practice
Track your progress and set goals to continually improve
Speak, practice, and learn today with Learna AI, your partner in mastering the English language!
Terms of Use: https://www.apple.com/legal/internet-services/itunes/dev/stdeula/",2024-09-25T07:00:00Z,2025-11-20T05:59:35Z
ai,Anguilla,Education,6017,4,557130558,HelloTalk - Language Learning,HELLOTALK FOREIGN LANGUAGE EXCHANGE LEARNING TALK CHAT APP,https://apps.apple.com/ai/app/hellotalk-language-learning/id557130558?uo=4,0.0,4.5,4,Education,"Practice languages with native speakers on HelloTalk! We recently introduced HelloTalk Live and Voiceroom - interactive language and culture events to help you master languages through the content you love! 

HelloTalk, the original language exchange app, connects you with native speakers to practice languages (English, Japanese, Korean, Spanish, French, Mandarin Chinese, Portuguese, German, Italian, Russian, Arabic, Turkish, Hindi, Indonesian, Thai, Vietnamese and 160+ more) for FREE! 

HelloTalk equips you with learning tools such as translation and instant captions so you can learn by chatting with native speakers. Learn languages from locals around the world through livestreams and Voicerooms. Connect with expert hosts to discuss interesting topics with language partners in the learning community! 

Why HelloTalk? 

► Real language learning atmosphere 
Whether you're focused on a widely spoken language or a less common one, HelloTalk caters to your needs. The system smartly matches you based on your native language and proficiency, while allowing you to filter ideal language partners according to various criteria such as age, location, and gender. Plus, with built-in translation and transliteration tools, you can communicate confidently without any language barriers.

► A powerful tool for sharpening your language skills
Acquiring new words through conversations with native speakers is more effective than rigid memorization. Whether you're a student preparing for exams like the CET, GRE, TOEFL, IELTS, planning to study abroad, or a professional seeking career advancement through language skills, HelloTalk offers native speakers who match your proficiency level for engaging interactions and valuable learning experiences.

► Immersive multi-person language chat rooms
If you choose to learn Spanish, for example, every Voiceroom you enter on HelloTalk gathers Spanish learners and Spanish native speakers from around the world to discuss interesting topics. Here, only your voice needs to be heard, creating a comfortable, introvert-friendly atmosphere. Here, sharing mutual interests allows everyone to freely express themselves and share personal experiences, fostering both language intuition and authentic expression skills. It's incredibly addictive!

► Diverse global Livestreams
HelloTalk features handpicked foreign language hosts who offer online video lessons, share language insights, and provide glimpses into their lives abroad. You can even join them on stage for one-on-one video conversations with fellow language learners. Whether you're grappling with pronunciation, speaking speed, or shyness, these hosts will assist you in refining your language skills and guiding the conversation. For rapid improvement in spoken language, there's no substitute for direct communication with native speakers!

► International Moments
HelloTalk's Moments offers real-time posts covering learning, lifestyle, and cultural insights from around the world. It's your ticket to discovering fresh perspectives and gaining deeper insights into diverse cultural customs, all from the comfort of your home. Don't forget to engage with posts that catch your interest!

What the world is saying about HelloTalk
“One of the best apps to help you learn a new language.” - 9to5Mac 
""When you're ready to experiment with a foreign language, HelloTalk provides an excellent opportunity for interaction with other speakers."" –PCMag 
""HelloTalk, which connects native speakers with an apprentice, also offers language exchanges to its 20 million users in more than 150 languages."" -Forbes 

START PRACTICING LANGUAGES RIGHT AWAY!!!

Learn more about the HelloTalk app: 
- Facebook: https://www.facebook.com/Hellotalk/ 
- Twitter: https://twitter.com/hellotalkapp 

Send any feedback to support@hellotalk.com 
- Privacy Policy: https://www.hellotalk.com/privacy-policy 
- Terms of Use: https://www.hellotalk.com/terms-of-service",2012-12-15T23:10:56Z,2025-11-19T02:08:59Z
ai,Anguilla,Education,6017,5,6670786037,Госуслуги Моя школа,"MINKOMSVYAZ ROSSII, FKU",https://apps.apple.com/ai/app/%D0%B3%D0%BE%D1%81%D1%83%D1%81%D0%BB%D1%83%D0%B3%D0%B8-%D0%BC%D0%BE%D1%8F-%D1%88%D0%BA%D0%BE%D0%BB%D0%B0/id6670786037?uo=4,0.0,4.125,8,Education,"«Госуслуги Моя школа» — приложение для школьников и родителей. Следите за расписанием, оценками, домашними заданиями


Единое расписание
Создавайте собственные события и добавляйте к школьному расписанию — уроки, репетиторы и кружки на одном экране


Похвала и поддержка
Ставьте лайки и хвалите ребёнка за хорошие оценки и выполненные задания


Учёба под контролем
Проверяйте результаты контрольных, динамику среднего балла и итоговые оценки. Следите за прогрессом выполнения домашнего задания


Конфиденциальность
Вся информация о ребёнке защищена и доступна только родителям. Для использования приложения нужна подтверждённая учётная запись на Госуслугах


Доступность функций может различаться в зависимости от региона",2025-02-19T08:00:00Z,2025-11-06T07:26:06Z
ai,Anguilla,Education,6017,6,1196524622,Minecraft Education,Mojang AB,https://apps.apple.com/ai/app/minecraft-education/id1196524622?uo=4,0.0,4,11,Education,"THIS APP IS FOR SCHOOL AND ORGANISATIONAL USE. 

Minecraft Education is a game-based platform that inspires creative, inclusive learning through play. Explore blocky worlds that unlock new ways to tackle any subject or challenge. 

Dive into subjects like reading, maths, history and coding with lessons and standardised curriculum designed for all types of learners. Or explore and build together in creative open worlds.

USE IT YOUR WAY
With hundreds of ready-to-teach lessons, creative challenges and blank canvas worlds, there are lots of ways to make Minecraft Education work for your students. It’s easy to get started, no gaming experience necessary.

PREPARE STUDENTS FOR THE FUTURE
Help learners develop key key skills like problem solving, collaboration, digital citizenship and critical thinking to help students them thrive now and in the future workplace. Spark a  passion for STEM.

GAME-BASED LEARNING
Unlock creativity and deep learning with immersive content created with partners including BBC Earth, NASA and the Nobel Peace Centre. Inspire students to engage in real-world topics with culturally relevant lessons and build challenges.

KEY FEATURES 
 - Multiplayer mode enables collaboration in-game across platforms, devices and hybrid environments 
 - Code Builder supports block-based coding, JavaScript and Python with intuitive interface and in-game execution
 - Immersive Reader helps players read and translate text 
 - Camera and Book & Quill items allow documentation and export of in-game creations
 - Integration with Microsoft Teams and Flipgrid supports assessment and teacher controls

Minecraft Education licences can be purchased with Admin access to a Microsoft 365 Admin Centre account. Talk to your Tech Lead for information on academic licensing. 

Terms of use: The terms that apply to this download are the terms that were presented when you purchased your Minecraft Education subscription.

If you subscribe to Minecraft Education via iTunes:

Each Minecraft Education subscription lasts one year from date of purchase. The payment will be charged to your iTunes account at confirmation of purchase. Your subscription will automatically renew unless auto-renew is turned off at least 24 hours before the end of the current period. If your subscription is set to auto-renew, your account will be charged within 24 hours prior to the end of the current period at the subscription price option you previously selected.

Turn off auto-renewal by going to the user's Account Settings after purchase. If you cancel after your subscription has activated, your account will not be refunded for the remaining active period of the subscription.

Privacy policy: https://aka.ms/privacy",2018-09-06T14:45:07Z,2025-10-30T18:02:49Z
ai,Anguilla,Education,6017,7,919087726,Photomath,Google LLC,https://apps.apple.com/ai/app/photomath/id919087726?uo=4,0.0,4.86747,83,Education,"Photomath is known worldwide for helping millions of learners to learn, practice, and understand maths – one step at a time. 

Scan any maths problem with the Photomath app to get step-by-step explanations with accurate solutions and a variety of teacher-approved methods. Maths is about the process, so Photomath breaks your problem into bite-sized steps to help you understand the “what” and “why” along with the “how.” Whether you’re learning basic arithmetic or advanced geometry, we’ll tackle it together, step by step. 

Why Photomath? 

Billions of maths problems: From primary school maths to advanced calculus and everything in between, Photomath can solve billions of maths problems—including word problems! Whether handwritten, in a textbook, or on a screen, Photomath is here to help you untangle your trickiest problem.

Step-by-step explanations: Maths isn’t just about an answer. It’s about every step along the way. That’s why Photomath breaks down each step, so you can *really* learn. Less guesswork = less stress, especially with our new Animated Steps, which show you the exact progression of a particular step. 

Expert-developed methods: Photomath’s educational content is centered around the learner’s experience, driven by the expertise of our own team of mathematicians and former maths teachers. 

Self-paced learning: Photomath’s instant support is like having a 24/7 virtual tutor. Checking your homework before dinner? Stuck on a problem at 2am? We can help. Follow our detailed steps, taking whatever time you need to review definitions, rationale, and more – all within the explanation.

Want to dive deeper and explore more ways to learn? Photomath Plus can get you there with custom Animated Tutorials, detailed Textbook Solutions, and more! 

KEY FEATURES
• Step-by-step explanations included in our basic version (free of charge)
• Word problem instructions
• Interactive graphs
• Video learning
• Multiple solution methods
• Advanced scientific calculator

Photomath is for learners of all levels, including those studying:
Numbers & Quantity
Algebra
Functions
Trigonometry & Angles
Sequences
Geometry
Calculus

“The step-by-step guide is beneficial to students that do not have access to a tutor and struggle with solving math problems.” — Forbes

“A viral video about a new app looks like a dream come true for anyone who struggles with math.” — Time
___________________________________________

• Payment will be charged to your Apple ID account at the confirmation of purchase. 
• A subscription automatically renews unless it’s canceled at least 24 hours before the end of the current billing period. 
• Your account will be charged for renewal within 24 hours prior to the end of the current period. 
• Manage or cancel your subscription in your account settings on the App Store after purchase. 
• Offers and pricing are subject to change without notice. 

Suggestions or questions? Email us at support@photomath.com 

Website: www.photomath.com
TikTok: @photomath
Instagram: @photomath 
Facebook: @Photomathapp 
Twitter: @Photomath 

Terms of Use: https://photomath.app/en/termsofuse 
Privacy Policy: https://photomath.app/en/privacypolicy",2014-10-17T13:56:43Z,2025-09-25T07:26:07Z
