country,country_name,category,genre_id,rank,app_id,app_name,developer,url,price,averageUserRating,userRatingCount,primaryGenreName,description,launch_date,update_date
ch,Switzerland,Lifestyle,6012,9,6741062364,Deepsearch AI Search Assistant,XSTUDIOS BILISIM TEKNOLOJILERI REKLAMCILIK ANONIM SIRKETI,https://apps.apple.com/ch/app/deepsearch-ai-search-assistant/id6741062364?uo=4,0.0,4.02996,367,Lifestyle,"Finde jede Person online mit Leichtigkeit – Die ultimative KI-gestützte App zur Personensuche & zum Aufspüren von Social-Media-Profilen!

Du fragst dich, wie du die Social-Media-Profile von jemandem findest, den du gerade erst kennengelernt hast? Möchtest du den Kontakt zu einem alten Freund wiederherstellen oder die Online-Präsenz einer neuen Bekanntschaft überprüfen?
Unsere leistungsstarke DeepSearch AI-App hilft dir dabei, öffentlich verfügbare Informationen über Personen einfach und an einem Ort zu entdecken!

Mit nur einem Namen durchsucht unser KI-Suchassistent mehrere Plattformen gleichzeitig – so findest du Menschen schnell, einfach und ohne Mühe. Kein ständiges Durchforsten mehrerer Websites – unser Social-Media-Finder bündelt alles in einer benutzerfreundlichen Oberfläche.

• Warum unsere App zur Personensuche und Social-Media-Recherche wählen?

Soziale Profile leicht finden – Suche nach Name, Telefonnummer, E-Mail-Adresse oder Benutzername, um Profile auf verschiedenen Plattformen zu finden.

Umfassende Hintergrundsuche – Greife auf öffentlich verfügbare Aufzeichnungen, Bilder, Videos und relevante Informationen zu.

Freunde online wiederfinden – Stelle mit wenigen Klicks den Kontakt zu alten Bekannten, Klassenkameraden oder früheren Kollegen wieder her.

Social-Media-Entdeckung – Erhalte Einblicke in die Online-Präsenz einer Person, inklusive öffentlich zugänglicher beruflicher und privater Daten.

Bleib informiert – Sieh sofort, was im Trend liegt und wer am meisten gesucht wird.

Schnelle & einfache Suche – Unser intuitives Design ermöglicht eine schnelle, effiziente und unkomplizierte Personensuche.

• Leistungsstarke Funktionen – jederzeit verfügbar!

Erweiterter Social-Media-Finder – Finde Social-Media-Konten einer Person auf verschiedenen Plattformen.

Plattformübergreifende Suche – Spare Zeit, indem du mehrere Quellen gleichzeitig durchsuchst.

Öffentlich verfügbare Hintergrundinformationen – Sieh dir berufliche Details, Online-Erwähnungen und andere Daten an.

Finde Personen in Sekunden – Gib einfach einen Namen oder Benutzernamen ein, und wir erledigen den Rest.

Suchverlauf & beliebte Suchanfragen – Behalte deine früheren Suchen im Blick und entdecke, wer gerade im Trend liegt.

Datenschutz & Transparenz – Wir stellen nur öffentlich zugängliche Informationen zur Verfügung und achten auf ethische Nutzung.

• Wer kann von dieser App profitieren?

Networking-Fans – Ob auf geschäftlichen Veranstaltungen oder bei neuen Begegnungen: Finde Online-Profile sofort.

Personalverantwortliche & Arbeitgeber – Überprüfe berufliche Hintergründe für fundierte Einstellungsentscheidungen.

Journalisten & Forscher – Sammle öffentlich verfügbare Daten für Artikel, Berichte und Recherchen.

Neugierige Personen – Erfahre mehr über Freunde, Kollegen oder auch Prominente – ohne mühsame Einzelsuche.

Online-Dater – Überprüfe die öffentliche Online-Präsenz einer Person, bevor du den nächsten Schritt machst.

Keine endlosen Suchanfragen mehr!
Egal ob du Social-Media-Profile finden, Freunde wiedersehen oder einen Hintergrundcheck machen willst – unsere App liefert schnelle und präzise Ergebnisse basierend auf öffentlich zugänglichen Daten.

UNBEGRENZTER ZUGRIFF AUF ALLE FUNKTIONEN

Du kannst ein Abo abschließen, um uneingeschränkten Zugang zu allen Funktionen der App zu erhalten.

Die Abrechnung erfolgt automatisch gemäß dem gewählten Abonnementplan.

Durch die Nutzung der App bestätigst du, dass du unsere Datenschutzrichtlinie und Nutzungsbedingungen zur Kenntnis genommen und akzeptiert hast:
Datenschutzrichtlinie: https://deepsearchai.app/privacy
Nutzungsbedingungen: https://deepsearchai.app/terms",2025-03-13T07:00:00Z,2025-11-16T07:38:57Z
ch,Switzerland,Lifestyle,6012,10,1045985566,Flatfox,flatfox AG,https://apps.apple.com/ch/app/flatfox/id1045985566?uo=4,0.0,4.6815,3573,Lifestyle,"Willkommen bei Flatfox! Die Plattform, die dir Tür zu tausenden von Wohnungen, Häusern und WG-Zimmern in der Schweiz öffnet. 
Finde einzigartige Inserate und kommuniziere ganz einfach per Chat direkt mit den Inserenten. 
Behalte den Überblick und organisiere deine Wohnungs- oder Nachmietersuche entspannt und kostenlos in unserer App.

Deine drei Erfolgsfaktoren für einen bequemen Wohnungswechsel:

Timing: 
Attraktives Inserat schon weg? Erstelle dein persönliches Suchabo und verpasse keine Wohnung mehr, die deinen Kriterien entspricht. 

Überblick: 
Erste Kontaktanfrage? Dank unserem Chat und Besichtigungsplaner geht Organisieren ganz einfach. Dabei behältst du immer und überall den Überblick, ohne deine persönlichen Daten zu teilen. 

Reichweite:
Du suchst einen Nachmieter? Veröffentliche und verwalte dein Inserat kostenlos auf Flatfox. Für noch mehr Sichtbarkeit besteht die Möglichkeit, dein Inserat auch direkt auf zusätzlichen Marktplätzen zu publizieren.

Flatfox macht die Wohnungssuche schlau, bequem und effizient – probiere es jetzt aus!",2015-11-17T12:22:42Z,2025-11-18T07:46:22Z
ch,Switzerland,Lifestyle,6012,11,482401785,Chicorée,Chicoree Mode AG,https://apps.apple.com/ch/app/chicor%C3%A9e/id482401785?uo=4,0.0,4.75027,38333,Lifestyle,"Die Chicorée App für iOS: Jetzt die neusten Modetrends und Neuigkeiten rund um Chicorée entdecken, VIP-Punkte sammeln und von exklusiven Einkaufsgutscheinen und Geschenken profitieren.

Das Chicorée Mobile Erlebnis bietet Dir folgende Inhalte:

+ Sammle VIP Punkte und erhalte dafür exklusive Einkaufsgutscheine und Geschenke
+ Die neuesten Modetrends, Produkte, News und Lookbooks bei Chicorée
+ Sofortige Informationen per Push-Nachrichten zu aktuellen Aktionen und Angeboten
+ Umfassender Storefinder mit allen Öffnungszeiten
+ Lokalisierungsfunktion per GPS um die nächste Chicorée Filiale zu finden

Ausserdem kannst Du Dich jederzeit über die Push-Notifications benachrichtigen lassen, sobald neue Gutscheine und Geschenke verfügbar sind, die Du an der Kasse in jeder Chicorée Filiale direkt einlösen kannst.

Wir freuen uns auf Dein Feedback, Deine Kritik oder Deine Verbesserungsvorschläge. Sende uns einfach eine Mail an public@chicoree.ch. So können wir die Chicorée App gemeinsam weiter verbessern und Dir ein noch besseres Mobile Mode Erlebnis bieten.",2011-12-18T08:00:00Z,2025-11-14T08:46:54Z
ch,Switzerland,Lifestyle,6012,12,6457317054,KnowS,KnowS IT GmbH,https://apps.apple.com/ch/app/knows/id6457317054?uo=4,0.0,4.80227,263,Lifestyle,"Hast du Unterstützung nötig oder möchtest zusätzliches Einkommen verdienen?
Mit KnowS hast du beides in der Hand. Finde schnell Hilfe oder biete deine Fähigkeiten an - lokal, versichert und fair.

WARUM KNOWS
- Einfach: Inserate kostenlos erstellen oder Angebote entdecken
- Sicher: Verifizierte Nutzer und Schutz im Schadensfall mit Zurich Versicherung
- Vielfältig: Über 100’000 Mitglieder und zahlreiche Dienstleistungen

DEINE VORTEILE
- Faire Preise und transparente Buchung
- Orts- und zeitunabhängig arbeiten
- Reparieren statt wegwerfen und somit nachhaltig handeln
- Kostenloses Suchabo für neue Aufträge
- Versicherte Aufträge für mehr Sicherheit
- Echte Bewertungen aus der Community
- Hilfe direkt aus deiner Nähe

--> Alles in einer App, von Handwerk bis Nachhilfe

LOSLEGEN
App laden und Teil der Community werden. Hilfe finden oder Geld verdienen - KnowS macht es möglich.

FRAGEN ODER FEEDBACK
Gemeinsam werden wir besser. Schreib an info@knows.com oder nutze in der App den Bereich Hilfe bzw. knows.com/hilfe.

DU FINDEST UNS AUCH HIER
https://www.instagram.com/knows_app/
https://www.facebook.com/KnowledgeSkillsNow/
https://www.linkedin.com/company/knows
https://www.threads.com/@knows_app",2023-09-30T07:00:00Z,2025-11-03T20:58:14Z
ch,Switzerland,Lifestyle,6012,13,1451072799,Coca-Cola: Spielen & Gewinnen,The Coca-Cola Company,https://apps.apple.com/ch/app/coca-cola-spielen-gewinnen/id1451072799?uo=4,0.0,4.54084,2424,Lifestyle,"Willkommen in der aufregenden Welt der Coca-Cola App!

Lösche deinen Durst mit unseren erfrischenden Getränken und entdecke eine Welt voller Möglichkeiten. Sammle Codes von unseren Coca-Cola Aktionsprodukten oder Spiele in der App, um Punkte zu sammeln und Preise zu gewinnen. Tritt unserer Coca-Cola-Community bei, indem du unsere Treue-App nutzt, und verbinde dich mit anderen Enthusiasten, die deine Leidenschaft teilen. Egal, ob du ein Fan von Coke, Coke Zero Sugar, Fanta, Sprite oder anderen bist – in der App gibt es immer etwas Besonderes zu entdecken. Gönn dir dein Lieblingsgetränk von Coca-Cola und entdecke eine Vielzahl von Belohnungen und Spielen, die auf dich zugeschnitten sind.

Hier sind drei überzeugende Gründe, warum du die Coca-Cola Treue-App heute herunterladen und nutzen solltest:


- Der Spiele-Bereich: Tauche ein in eine Welt der Unterhaltung in unserem Bereich """"Spiele"""", wo dich fesselnde und interaktive Spielerlebnisse erwarten. Hier findest du einzigartige Abwechslung, bei immer wieder neuen spannenden Aktionen.

- Sammle Punkte: Durch das Eingeben der Codes von unseren Coca-Cola Aktionsprodukten oder beim Spielen in der App sammelst du Punkte, die du für Sofortgewinne oder Teilnahmen an wöchentlichen oder monatlichen Gewinnspielen einlösen kannst.

Coca-Cola Nachrichten – Immer auf dem Laufenden: Schau dir die aktuellen Kampagnen-News an, um zu sehen, was deine Lieblingsmarke für dich bereithält. Verpasse keine unserer Aktionen und Neuigkeiten – werde heute Teil der Coca-Cola Fanfamilie.

Freu dich auf kommende Features, die dein Erlebnis in der App weiter verbessern werden. Wir schätzen dein Feedback, also zögere nicht, den Kommentarbereich zu besuchen und uns mitzuteilen, was du sehen möchtest oder welche Verbesserungsvorschläge für zukünftige Updates hast. Deine Meinung ist uns wichtig!

Haftungsausschluss: Bitte beachte, dass bestimmte App-Funktionen und Wettbewerbe je nach Land variieren können. Genieße unsere Coca-Cola Angebote, erlebe die Coca-Cola Welt und entdecke unsere Coca-Cola Belohnungen und unsere spannenden Coca-Cola Veranstaltungen. Hol dir die Coca-Cola App für mehr Spaß beim Punkte sammeln und gewinnen!",2019-02-28T17:12:32Z,2025-11-18T11:30:51Z
ch,Switzerland,Lifestyle,6012,14,6741855114,empfohlen.de Umfragen & Tests,Unium GmbH,https://apps.apple.com/ch/app/empfohlen-de-umfragen-tests/id6741855114?uo=4,0.0,3.93902,328,Lifestyle,"Geld verdienen mit Umfragen und Tests? So oft und wann Sie wollen? Jetzt bei empfohlen.de anmelden und durchstarten!

Werde Mitglied auf Deutschlands größter Plattform für bezahlte Online-Umfragen & Tests und schließe dich über 5.000.000 Online-Testern an.

Nach der kostenlosen Anmeldung hast du sofort Zugang zu unzähligen Online-Umfragen.

- Verdiene über € 850 mit verfügbaren Aufträgen direkt nach der Anmeldung, ob von unterwegs oder von zu Hause aus, maximale Flexibilität garantiert.
- Wähle aus dem größten Sortiment im deutschsprachigen Raum, Aufträge, die genau zu dir passen.
- Du wirst regelmäßig zu den neuesten Umfragen eingeladen.
- Aufträge mit mehreren Zielen ermöglichen es dir, durch kontinuierliches Testen höhere Gewinne zu erzielen.
- Schnelle und sichere Auszahlung: Werde innerhalb von 48 Stunden ausgezahlt.
- Getestet, verifiziert, empfohlen! Wir legen Wert auf Authentizität und Vertrauenswürdigkeit. Nicht umsonst werden wir von Verbraucherschutz.de empfohlen. 

Außerdem hat empfohlen.de eine Bewertung von 4.2 Sternen bei Trustpilot bei über 120.000 Bewertungen!",2025-02-26T08:00:00Z,2025-11-15T13:03:49Z
ch,Switzerland,Lifestyle,6012,15,6478527868,MIA DAY: Reiseplaner & Karten,COMPLETE FUN LTD,https://apps.apple.com/ch/app/mia-day-reiseplaner-karten/id6478527868?uo=4,0.0,4,3,Lifestyle,"Entdecke Orte, Aktivitäten, Routen & Karten in der Schweiz mit KI-gestütztem Guide.

Ob beim Wandern, Skifahren, Biken oder einfach beim Erkunden – MIA DAY nutzt KI, um dir Aktivitäten vorzuschlagen, die zu deiner Stimmung, deinem Standort und deinen Vorlieben passen.

Finde versteckte Schätze und entdecke mehr als 50.000 ausgewählte Orte in den Alpen, an Seen und auf Wanderwegen – alles für dich gemacht.

DARUM WIRST DU ES LIEBEN:

INTELLIGENTE KI-EMPFEHLUNGEN
Erzähl MIA, wie dein Tag aussehen soll – relaxt, abenteuerlich, mit Freunden oder solo – und bekomme personalisierte Ideen in Sekunden.
 
500+ AKTIVITÄTEN ZUM ERLEBEN
Von adrenalingeladenen Klettersteigen bis zu Familienpicknicks und Alpentermen – finde Ideen für jede Stimmung, Jahreszeit und jedes Niveau.

50.000+ AUSGEWÄHLTE ORTE
Entdecke eine handverlesene Auswahl der Top-Wanderrouten, Seen, Berggipfel, Viewpoints, Klettertouren, Skigebiete und mehr in der Schweiz.

PLANE & ORGANISIERE DEINE ERLEBNISSE
Füge Aktivitäten deinem Kalender hinzu, organisiere Meetups und erhalte Erinnerungen oder Wetter-Updates mit Terminvorschlägen.

LIVE-MAP & DISTANZMESSUNG
Sieh in Echtzeit, was um dich herum ist, und wähle Routen nach Entfernung, Höhenmeter oder Schwierigkeitsgrad.

Ob Einheimischer oder Tourist – mit MIA DAY wird die Schweiz zu deinem persönlichen Abenteuerspielplatz.

Tiefer erkunden. Cleverer planen. Die Schweiz mit KI entdecken. Hol dir MIA DAY – deinen persönlichen Outdoor-Planer.",2025-05-29T07:00:00Z,2025-11-15T10:29:56Z
ch,Switzerland,Lifestyle,6012,16,1487652920,Mercedes-Benz,Mercedes-Benz AG,https://apps.apple.com/ch/app/mercedes-benz/id1487652920?uo=4,0.0,4.7378,22697,Lifestyle,"Ihr Smartphone wird zur digitalen Verbindung zu Ihrem Mercedes. Sie haben einen Überblick über alle Informationen und steuern Ihr Fahrzeug über die App.

MERCEDES-BENZ: ALLE FUNKTIONEN AUF EINEN BLICK

IMMER INFORMIERT: Der Fahrzeugstatus informiert Sie über den Kilometerstand, die Reichweite, den aktuellen Kraftstoffstand oder die Daten Ihrer letzten Fahrt. Mit der App können Sie bequem den Reifendruck, den Zustand von Türen, Fenstern, Schiebedach und Kofferraum oder den aktuellen Verriegelungszustand überprüfen. Sie können auch den Standort Ihres Fahrzeugs lokalisieren und erhalten Warnmeldungen, z. B. bei unverschlossenen Türen.

KOMFORTABLE FAHRZEUGSTEUERUNG: Mit der Mercedes-Benz App können Sie die Türen, Fenster und das Schiebedach aus der Ferne ver- und entriegeln oder öffnen und schließen. Starten Sie die Standheizung/-belüftung oder programmieren Sie sie in Abhängigkeit von Ihrer Abfahrtszeit. In Elektrofahrzeugen können Sie auch die Vorklimatisierung aktivieren und die gewünschte Innenraumtemperatur sofort oder für eine bestimmte Abfahrtszeit einstellen.

KOMFORTABLE ROUTENPLANUNG: Planen Sie Ihre Route in aller Ruhe und senden Sie Adressen bequem über die App an Ihren Mercedes. Dann können Sie einsteigen und sofort losfahren.

SICHERHEIT IN NOTFÄLLEN: Die Mercedes-Benz App benachrichtigt Sie bei Diebstahlversuchen, Abschleppversuchen und Parkschäden. Wenn ein Fahrzeugalarm ausgelöst wurde, können Sie ihn über die App ausschalten. Der Geofencing-Dienst sendet Ihnen eine Benachrichtigung, sobald das Fahrzeug einen von Ihnen festgelegten Bereich erreicht oder verlässt.

KRAFTSTOFFEFFIZIENTES FAHREN: Die Mercedes-Benz App zeigt Ihnen den individuellen Kraftstoffverbrauch Ihres Fahrzeugs. Sie vergleicht auch Ihren Kraftstoffverbrauch mit dem anderer Fahrer desselben Fahrzeugmodells. Die ECO Anzeige informiert Sie über die Nachhaltigkeit Ihrer Fahrweise.

EINFACHES BUCHEN: Die Mercedes-Benz App erinnert Sie rechtzeitig an Ihren nächsten Werkstatttermin. Wenn Sie einen Service bei Ihrem Mercedes-Benz Vertragshändler buchen möchten, erledigt die App dies in wenigen Schritten.

IMMER IN KONTAKT MIT IHREM SERVICEPARTNER: Finden Sie schnell und einfach einen Mercedes-Benz Partner in Ihrer Nähe und speichern Sie Ihren Wunschpartner in der App.

INDIVIDUELLE ANGEBOTE: Für die bestmögliche Wartung Ihres Mercedes bietet Ihnen die Mercedes-Benz App ein auf Ihr Fahrzeug zugeschnittenes Angebot.

Mit einer Mercedes me ID können Sie auf Dienste in der Mercedes-Benz App zugreifen, auch wenn Ihr Fahrzeug nicht verbunden ist.

Bitte beachten Sie: Mercedes-Benz Dienste und On-Demand-Funktionen funktionieren nur mit Mercedes-Benz Fahrzeugen, die mit dem Mercedes-Benz Kommunikationsmodul ausgestattet sind. Der Funktionsumfang ist abhängig von der jeweiligen Fahrzeugausstattung und den von Ihnen gebuchten Diensten. Ihr Mercedes-Benz Vertragshändler berät Sie gerne. Die Nutzung erfordert ein aktives, kostenloses Mercedes me Konto. Die Nutzung der Funktionen kann vorübergehend eingeschränkt sein, wenn die Bandbreite der Datenübertragung nicht ausreicht. Die kontinuierliche Nutzung der GPS-Funktion im Hintergrund kann die Lebensdauer der Batterie verkürzen.",2020-06-22T07:00:00Z,2025-11-03T06:54:31Z
ch,Switzerland,Lifestyle,6012,17,1472718009,TP-Link Tapo,TP-Link Systems Inc.,https://apps.apple.com/ch/app/tp-link-tapo/id1472718009?uo=4,0.0,4.82068,1238,Lifestyle,"Set up, manage, and control Tapo home security cameras, smart plugs, smart lighting, and more – all from the Tapo app. Tapo aims to help you live a smarter, easier, and more secure life.

- Control from Afar
Quickly and easily connect and control all your devices from a single tap, no matter where you are! Organize your devices across Homes and Rooms with ease. Group your devices for batch control. You can also share devices to your friends or family members to control together.

- Know what’s going on
Get the status of your devices in real time. Understand what’s going on at home at a glance, and get instant notifications.
Intelligent features in the Tapo home security cameras let you tune into the action live, record important moments, talk to your pets, and scare away intruders.
*Get up to 30 days of cloud video history and enjoy AI detections with Tapo Care (subscription service) for Tapo home security cameras.

- Automate your home with Smart Actions
Make your Tapo devices work around your daily routine. Have your lights gently wake you up in the morning or turn off all your home devices when you leave home. Custom Smart Actions give your home that level of intelligence in a snap.

- Hands-free Voice Control
Use your voice to control your Tapo devices via Amazon Alexa, Google Assistant, Siri or your favorite smart assistant. Simple voice commands let you turn on/off devices, or adjust the brightness/temperature/color. You can even cast your security cameras to display on your TV – without opening the app.

Stay tuned for updates as we add new features and products to the Tapo family!
For more information about your Tapo, visit www.tapo.com

Terms of Use
https://www.tapo.com/app/privacy/#terms-of-use
Privacy Policy
https://www.tapo.com/app/privacy/#privacy-policy",2019-09-16T07:00:00Z,2025-11-17T04:03:48Z
ch,Switzerland,Lifestyle,6012,18,1462875428,Roborock,"Beijing Rockrobo Technology Co., Ltd.",https://apps.apple.com/ch/app/roborock/id1462875428?uo=4,0.0,4.75548,8625,Lifestyle,"Die Roborock App ist eine spezielle Anwendung, die für die Steuerung der intelligenten Hardware-Geräte von Roborock konzipiert wurde. 
Sie unterstützt netzwerkfähige Produkte unter den Staubsaugerrobotern, Nass- und Trockenstaubsaugern und Molekularsieb-basierten Waschtrocknern von Roborock.
Du kannst die intelligenten Geräte fernbedienen und ihren Status und Reinigungsfortschritt durch diese App prüfen – jederzeit und überall.
Entfessle fortschrittlichere Merkmale durch die Roborock App.
【Roborock Staubsaugerroboter】
· Prüfe Reinigungskarte und -pfad ganz nach Wunsch jederzeit und überall und kontrolliere den Reinigungsfortschritt in Echtzeit. 
· Wähle aus verschiedenen personalisierten Reinigungsmethoden aus, einchließlich Routinen für Raumreinigung, Zonenreinigung, planmäßige Reinigung und Punktreinigung.
· Lege häufig verwendete Reinigungsaufgaben als Routinen fest, die durch Fingertipp gestartet werden können. 
· Wähle mehrere Reinigungspräferenzen aus, einschließlich Staubsaugen, Wischen, Saugen & Wischen, SmartPlan (nur auf bestimmte Modelle anwendbar) und benutzerdefinierter Modus. 
· Lege einen personalisierten Reinigungsplan fest, indem du Saugkraft, Wasserdurchfluss, Reinigungshäufigkeit und Route einstellst (nur auf bestimmte Modelle anwendbar).
· Ermöglicht dir das Bearbeiten einer Karte basierend auf deinem Zuhause und das Festlegen von Namen für Schwellen, Teppiche, Bodentypen, Möbel und Räume. 
· Richte unsichtbare Wände und Sperrzonen ein, damit dein Roborock diese während der Reinigung nicht überquert oder betritt.
· Genieße eine Reihe von Funktionen, die Spaß machen, einschließlich Remote-Sicht, Hindernisfotos, Schnappschüsse vom Haustier, Modus zum Umherfahren, Suche nach dem Haustier und benutzerdefinierte Artikulierungen (nur auf bestimmte Modelle anwendbar).
【Roborock Nass- und Trockenstaubsauger】
· Passe Wasserdurchfluss, Saugkraft, Rollendrehzahl und Reinigungsmittelstand (nur auf bestimmte Modelle anwendbar) basierend auf Boden und Schmutzgrad an.
· Smarte geplante Selbstreinigung & Trocknung: Beginnt automatisch Selbstreinigung und Trocknung anhand von Datensätzen zur historischen Nutzung.
【Roborock Waschtrockner】
· Prüfe den Fortschritt beim Waschen und den Betriebsstatus ganz nach Wunsch überall und jederzeit.
· Wähle aus über 20 intelligenten Wasch- und Trocknungsprogrammen aus, um die Anforderungen verschiedener Arten von Textilien und Kleidung professionell zu erfüllen und somit optimale Waschleistung zu gewährleisten.
Lege ein Programm als APP Programm für schnellen Zugriff über das Bedienfeld fest.",2019-06-18T06:57:57Z,2025-11-19T09:35:50Z
ch,Switzerland,Lifestyle,6012,19,957323480,Xiaomi Home,"Beijing Xiaomi Co., Ltd",https://apps.apple.com/ch/app/xiaomi-home/id957323480?uo=4,0.0,3.802,1101,Lifestyle,"Eine Profi-App, die Ihnen hilft, Ihre intelligenten Geräte zu verwalten. 
•  Neue Geräte mit wenigen einfachen Schritten hinzufügen
•  Ihr Gerät steuern, wo immer Sie sich gerade befinden 
•  In Echtzeit den Status Ihrer Geräte abfragen
•  Ihre Geräte mit Freunden und Familienmitgliedern teilen
•  Intelligente Aufgaben einrichten und ausführen
•  Die fortwährende Nutzung von GPS im Hintergrund kann die Lebensdauer des Akkus stark verringern

[Xiaomi Home Cloud Storage Automatische Verlängerung Dienstbeschreibung]
- Verlängerungsservice:7-Tage-Überschreibung Verlängerungs-Storageplan, 30-Tage-Überschreibung Verlängerungs-Storageplan
- Verlängerungszeitraum: ein Monat
- Verlängerungspreis: 7-Tage-Überschreibung Verlängerungs-Storageplan für 10 Yuan/Monat, 30-Tage-Überschreibung Verlängerungs-Storageplan für 24 Yuan/Monat
- Zahlung: nach Bestätigung des Abonnements wird Ihr Apple ID Konto belastet;
- Verlängerung stornieren: Wenn Sie die Verlängerung stornieren möchten, schalten Sie bitte die automatische Verlängerungsfunktion in der iTunes/Apple ID-Einstellungsverwaltung 24 Stunden vor Ablauf des aktuellen Abonnementzeitraums manuell aus. Spezifischer Pfad: Bitte öffnen Sie die „Einstellungen“ des Apple-Handys --> geben Sie „iTunes Store und App Store“ ein --> klicken Sie auf „Apple ID“, wählen Sie „Apple ID anzeigen“, gehen Sie auf die Seite „Kontoeinstellungen“, klicken Sie auf „abonnieren“, wählen Sie Xiaomi Home Cloud Storage abbestellen. Wenn Sie innerhalb von 24 Stunden vor Ablauf kündigen, wird die Abonnementgebühr berechnet;
- Verlängerung: Das Apple ID Konto wird innerhalb von 24 Stunden vor Ablauf belastet. Nach erfolgreicher Belastung wird der Abonnementszeitraum um einen Abonnementzeitraum verlängert;
- Xiaomi Home Cloud Storage Automatische Verlängerung Dienstvereinbarung: https://camera.api.io.mi.com/cloud-service/app/doc/auto_renew-en.html,
Xiaomi Home Cloud Storage Nutzungsvereinbarung: https://camera.api.io.mi.com/cloud-service/app/doc/user_licence-en.html
- Nutzungsbedingungen und Nutzungsvereinbarung: https://g.home.mi.com/views/user-terms.html?locale=en&type=userLicense
- Datenschutzerklärung: https://g.home.mi.com/views/user-terms.html?locale=en&type=userPrivacy

【HealthKit】
- Your record after each weighing: BMI (body mass index), body fat percentage, weight, lean body mass will be shared to Apple Health.",2015-01-27T18:32:39Z,2025-11-20T14:37:49Z
