country,country_name,category,genre_id,rank,app_id,app_name,developer,url,price,averageUserRating,userRatingCount,primaryGenreName,description,launch_date,update_date
ch,Switzerland,Lifestyle,6012,1,429047995,Pinterest,"Pinterest, Inc.",https://apps.apple.com/ch/app/pinterest/id429047995?uo=4,0.0,4.63476,87721,Lifestyle,"Pinterest ist ein Ort endloser Möglichkeiten. Du kannst:
- Inspiration sammeln
- Die neuesten Trends shoppen
- Neue Hobbys ausprobieren

Erstelle Pinnwände, merke dir Pins und kreiere Collagen mit allem, was dich inspiriert. Entdecke zahllose Ideen, von Fashion-Tipps und einfachen Rezepten bis DIY-Projekten und kreativen Ideen, mit denen du deinem Zuhause einen neuen Anstrich verpassen kannst. Gestalte ein Leben, das du liebst? 

It's Possible.",2011-04-28T15:51:13Z,2025-11-19T16:28:23Z
ch,Switzerland,Lifestyle,6012,2,595287172,Hinge Dating App: Match & Date,"Hinge, Inc.",https://apps.apple.com/ch/app/hinge-dating-app-match-date/id595287172?uo=4,0.0,4.2462,4354,Lifestyle,"HINGE IST DIE DATING-APP, DIE ENTWICKELT WURDE, UM GELÖSCHT ZU WERDEN
Hinge ist für alle, die von Dating-Apps loskommen wollen. Mit einem Profil, das deine Persönlichkeit durch Text, Fotos, Video und Stimme zeigt, entstehen einzigartige Unterhaltungen, die zu tollen Dates führen. Und es funktioniert. Alle drei Sekunden verabreden sich Menschen auf Hinge zu einem Date. Darüber hinaus waren wir 2022, die am schnellsten wachsende Dating-App in den USA, Großbritannien und Kanada.



SO WIRST DU HINGE WIEDER LOS
Beim Online-Dating sind die Leute so sehr mit Matching beschäftigt, dass sie sich gar nicht erst persönlich treffen.  Hinge will das ändern. Also haben wir eine Dating-App entwickelt, die gelöscht werden soll. So geht's:



* Wir lernen schnell deinen Typ kennen. Du wirst nur den für dich besten Personen vorgestellt.



* Wir zeigen dir die Persönlichkeit einer Person. Du lernst potenzielle Dates durch ihre individuellen Antworten auf Fragen kennen und erfährst auch etwas über ihre religiösen Überzeugungen, ihre Größe, ihre politische Einstellung, ihre Dating-Absichten, ihren Beziehungstyp und vieles mehr.



* Wir machen es dir leicht, miteinander ins Gespräch zu kommen. Jedes Match beginnt damit, dass jemand einen bestimmten Teil deines Profils mag oder kommentiert.



* Wir wollen, dass du dich sicher fühlst, wenn du jemanden persönlich triffst, und auf tolle Dates gehst. Die Selfie-Verifizierung macht es Datern auf Hinge einfacher, sicherzustellen, dass sie die sind, die sie vorgeben zu sein.



* Wir fragen, wie deine Dates laufen. Nachdem du mit einem Match Telefonnummern ausgetauscht hast, melden wir uns bei dir, um zu erfahren, wie dein Date gelaufen ist. So können wir dir in Zukunft bessere Empfehlungen geben.



PRESSE
""Die App ist für nach Liebe suchende Personen die erste Adresse."" - The Daily Mail
""Der CEO von Hinge sagt, eine gute Dating-App beruhe auf Verletzlichkeit und nicht auf Algorithmen."" - Washington Post
""Hinge ist die erste Dating-App, die tatsächlich den Erfolg in der realen Welt misst"" - TechCrunch



Die Nutzung der App ist kostenlos. Mitglieder, die alle sehen wollen, die sie mögen oder unbegrenzte Likes senden möchten, können auf Hinge+ upgraden. Für den Zugriff auf zusätzliche Funktionen, einschließlich erweiterter Empfehlungen und bevorzugter Likes, bieten wir HingeX an.



ABO-INFOS
Bei der Kaufbestätigung wird das Apple-Konto mit dem Betrag belastet.
Das Abonnement verlängert sich automatisch, wenn die automatische Verlängerung nicht mindestens 24- Stunden vor Ablauf des aktuellen Zeitraums deaktiviert wird.
Das Konto wird innerhalb von 24- Stunden vor Ablauf des aktuellen Zeitraums für die Erneuerung belastet.
Nach dem Kauf können in den Kontoeinstellungen die Abonnements verwaltet und die automatische Erneuerung deaktiviert werden.



Support: hello@hinge.co
Nutzungsbedingungen: https://hinge.co/terms.html
Datenschutzerklärung: https://hinge.co/privacy.html



Alle Fotos sind von Modellen und dienen nur zur Veranschaulichung.",2013-02-06T06:50:22Z,2025-11-17T15:23:55Z
ch,Switzerland,Lifestyle,6012,3,1222822904,SmartThings,"Samsung Electronics Co., Ltd.",https://apps.apple.com/ch/app/smartthings/id1222822904?uo=4,0.0,4.32876,8395,Lifestyle,"Verbinden und steuern Sie Ihre Smart-Home-Geräte schnell und einfach mit SmartThings.
SmartThings ist kompatibel mit hunderten Smart-Home-Marken. Sie können also alle Ihre Smart-Home-Gadgets von einer zentralen Stelle aus steuern, einschließlich Ihres Samsung Smart TV und Smart-Home-Anwendungen.
Mit SmartThings können Sie mehrere Smart-Home-Geräte schneller und einfacher verbinden, kontrollieren und steuern. Verbinden Sie Ihre Samsung Smart TVs, intelligente Anwendungen, intelligente Lautsprecher und Marken wie Ring, Nest und Philips Hue – über nur eine App.
Steuern Sie anschließend Ihre intelligenten Geräte über Voice Assistants wie Google Assistant

[Hauptmerkmale]
- Steuern und kontrollieren Sie Ihr Haus von überall aus
- Verbinden Sie Ihre intelligenten Geräte verschiedenster Marken und schließen Sie sie zusammen, indem Sie „Szenarien“ erstellen
- Erstellen Sie Routinen, die je nach Zeit, Wetter und Geräte-Status eingestellt sind, damit Ihr Zuhause reibungslos im Hintergrund läuft
- Erlauben Sie eine gemeinsame Kontrolle, indem Sie anderen Nutzern Zugriff gewähren
- Erhalten Sie über automatisierte Benachrichtigungen Status-Meldungen über Ihre Geräte
- Reden Sie mit Ihren Geräten über Google Assistant
- Überwachen und kontrollieren Sie den Stromverbrauch und sparen Sie Geld mit SmartThings Energy. Überprüfen Sie, wie hoch die Betriebskosten für Ihr Zuhause und kompatible Samsung-Geräte sind, und probieren Sie verschiedene Energiesparfunktionen aus, wie zum Beispiel den KI-Sparmodus, oder stellen Sie die Geräte so ein, dass sie in den Nebenlastzeiten in Betrieb gehen.
- Erhalten Sie Rezeptempfehlungen, indem Sie Speisen, Wein und Fleisch scannen. Planen Sie den Einkauf und die Mahlzeiten sowie die Vorbereitung mit SmartThings Cooking

※ Manche Funktionen sind möglicherweise nicht in allen Ländern verfügbar.

[App-Voraussetzungen]
Einige Mobilgeräte werden möglicherweise nicht unterstützt.
- iOS 16.0 oder höher. / iPhone 6s oder höher / iPad mini 4 oder neuer

※ App-Berechtigungen
Die folgenden Genehmigungen für den App-Dienst sind erforderlich. Für optionale Berechtigungen wird die Standardfunktion des Diensts eingeschaltet aber nicht zugelassen. 

[Erforderliche Zugriffsberechtigungen]
-

[Optionale Zugriffsberechtigungen]
• Bluetooth: Zum Suchen von Geräten in der Nähe über Bluetooth oder BLE.
• Mikrofon: Wird verwendet, um mit Ultraschallsensor ausgestattete Geräte einzurichten
• Kamera: Zum Scannen von QR-Codes.
• Standort: Für automatisierte Aktionen über GPS. (Die Verwendung von GPS ist optional.)
                    Suchen Sie WLAN-Informationen, um ein Gerät in iOS 13 oder höher hinzuzufügen
• Kontakte: Bestätigen Sie Benutzerinformationen, die beim Senden von SMS bereitgestellt werden",2017-06-20T04:18:53Z,2025-10-02T10:00:06Z
ch,Switzerland,Lifestyle,6012,4,547702041,Tinder Dating App: Chat & Date,Tinder LLC,https://apps.apple.com/ch/app/tinder-dating-app-chat-date/id547702041?uo=4,0.0,3.99694,45683,Lifestyle,"MATCHEN. CHATTEN. DATEN. ES BEGINNT MIT EINEM SWIPE™.
Über 97 Milliarden Matches sprechen für sich: Tinder® ist die beliebteste kostenlose Dating-App und bietet Sicherheitsfunktionen, mit denen du entspannter neue Leute kennenlernst. Du suchst die große Liebe? Eine offene Beziehung? Ein Date oder neue Freunde? Lerne mit Tinder überall Leute vor Ort kennen und mach das Beste aus deinem Datingerlebnis!

Mehr als nur Fotos: Gib deine Interessen an und erfahre mehr über deine Matches, um leichter ins Gespräch zu kommen.
Finde, was du suchst: Leg deine Beziehungsziele fest und lerne passende Leute kennen.

SO FUNKTIONIERT TINDER
Auf Tinder® neue Leute kennenlernen ist einfach und macht Spaß – zeig deine Persönlichkeit in deinem Profil, um potenzielle Matches auf dich aufmerksam zu machen. Beantworte Fragen, erzähl etwas über dich und zeig dein Gesicht in Fotos, um deine Chancen auf ein Match zu erhöhen. Ein Swipe nach rechts ist ein Like, ein Swipe nach links ein Nope. Bei Tinder müssen beide Interesse zeigen, denn erst wenn zwei Personen sich gegenseitig liken, heißt es: It's a Match!

SICHERHEIT GEHT VOR
Probiere unsere Sicherheitsfeatures aus, um entspannter neue Leute kennenzulernen:

- Mein Date teilen: Teile deine Pläne mit Freunden und Familie, damit sie wissen, wo du dich mit wem triffst.
- Lass dich fotoverifizieren: Verifiziere deine Fotos, damit andere wissen, dass du authentisch bist & erhöhe so deine Chancen auf Matches.
- Bist du dir sicher/Stört dich das: Tinder entdeckt unangemessene Nachrichten, um dich vor ihnen zu schützen.
- Ein Profil melden: Wenn sich jemand verdächtig oder unangemessen verhält, kannst du das Profil schnell und einfach blockieren und melden.
- Kontakte blockieren: Du hast die Kontrolle und kannst alle (z. B. Expartner) blockieren, die du nicht auf der App sehen willst.
- Videochat: Du hast Spaß beim Chatten? Dann probiere aus, ob eure Chemie auch beim Videochat stimmt und triff neue Leute ganz einfach von zu Hause aus!

LERNE TINDER PLUS KENNEN
- Unbegrenzte Like: Swipe so oft nach rechts, wie du willst.
- Passport-Modus™: Lerne auf der ganzen Welt schon vor deiner Anreise Leute kennen.
- Swipes zurücknehmen: Ändere jederzeit deine Meinung.
- Inkognito-Modus: Werde nur von den Profilen gesehen, die du gelikt hast.

ERLEBE TINDER GOLD
- Erhalte alles, was in Tinder Plus™ enthalten ist und probiere es eine Woche aus, bevor du dich für ein Monatsabo entscheidest.
- Sieh, wer dich gelikt hat, und matche sofort, um schneller Leute kennenzulernen.
- Ein Boost pro Monat bedeutet 30 Minuten lang mehr Aufrufe für dein Profil.
- Wöchentliche Super-Likes, damit du bei Leuten auffällst, die dir wirklich, wirklich gut gefallen.

UPGRADE AUF TINDER PLATINUM
Mit Tinder Platinum™ holst du das Beste aus den Premiumfunktionen von Tinder heraus: Deine Likes für potenzielle Matches werden priorisiert, du kannst vor dem Matchen Komplimente versenden und vieles mehr.

Worauf wartest du also noch? Millionen Menschen weltweit nutzen Tinder bereits! Tinder bietet die meisten Leute fürs Dating und erhöht deine Chancen darauf, genau das zu finden, wonach du suchst. Lade dir noch heute die beste kostenlose Dating-App herunter!
-----------------------------------

Beim Kauf von Tinder Plus®, Tinder Gold™ oder Tinder Platinum™ wird der Betrag von deinem Apple Konto abgebucht; 24 Stunden vor Ablauf der aktuellen Laufzeit wird das Konto für eine Verlängerung belastet. Nach einem Kauf kannst du die automatische Verlängerung über die Einstellungen im App Store jederzeit abbestellen. Während der aktiven Abo-Laufzeit kannst du das aktuelle Abo nicht abbestellen. Wenn du Tinder Plus®, Tinder Gold™ oder Tinder Platinum™ nicht kaufen möchtest, kannst du Tinder ganz einfach gratis weiter nutzen.

Die auf den Fotos abgebildeten Personen sind Models und nur zur Veranschaulichung gedacht.

Datenschutzrichtlinie: https://www.gotinder.com/privacy
Nutzungsbedingungen: https://www.gotinder.com/terms
Besuche: https://www.tinderlove.com/",2012-08-03T01:43:39Z,2025-11-20T18:10:28Z
ch,Switzerland,Lifestyle,6012,5,6477195354,Stoody,STOODY SARL,https://apps.apple.com/ch/app/stoody/id6477195354?uo=4,0.0,4.53846,13,Lifestyle,"STOODY est une carte 100% digitale qui se bat pour le pouvoir d'achat des étudiants de 16 à 29 ans en leur offrant des offres et des tarifs préférentiels dans des domaines essentiels tels que la santé, la téléphonie, l'assurance, le transport et, surtout, les loisirs.",2024-02-22T08:00:00Z,2025-10-07T07:17:20Z
ch,Switzerland,Lifestyle,6012,6,993135524,MyDyson™,Dyson Inc.,https://apps.apple.com/ch/app/mydyson/id993135524?uo=4,0.0,4.49904,5713,Lifestyle,"Bodenreinigung
Reinige dein Zuhause mühelos mit einem Dyson Saugroboter oder kabellosen Staubsauger.

-	Plane und überwache die Reinigung, wähle passende Modi für jeden Raum und lege Bereiche fest, die dein Saugroboter meiden soll.
-	Erhalte Infos zur Staubmenge sowie den wissenschaftlichen Nachweis einer gründlichen Reinigung.
-	Entdecke Anleitungen zur Einrichtung, Problembehebung und Wartung, damit dein Gerät immer einwandfrei funktioniert.

Kompatibel mit einer Vielzahl von Staubsaugern, einschließlich dem Dyson 360 Vis Nav™ Saugroboter, den V15™, V8™, V12™ und Gen5detect™ Staubsaugern sowie dem Dyson WashG1™ Nassreiniger.

Raumklima
Steuere deinen Luftreiniger, -befeuchter und Ventilator und übernimm die Kontrolle über die Luftqualität in deiner Umgebung.

-	Steuere die Luftstromgeschwindigkeit, Drehbewegung, den Auto-Modus, Sleep-Timer, die Temperatur und Luftfeuchtigkeit von überall aus.
-	Überwache die Luftqualität, um herauszufinden, welchen Schadstoffen du ausgesetzt bist.
-	Erhalte monatliche Berichte zur Luftqualität.
-	Überwache die Filterlebensdauer und erhalte Benachrichtigungen, um einfach Ersatzfilter zu bestellen.

Kompatibel mit einer Vielzahl von Dyson Luftreinigern mit und ohne Heiz- bzw. Ventilatorfunktion sowie mit Dyson Luftbefeuchtern.

Haarpflege
Verbinde dein Dyson Haarpflegegerät mit der MyDyson™ App für optimale Stylingergebnisse.

-	Entdecke unsere Stylinganleitungen, um mit deinem Haartrockner, Multi-Haarstyler und Haarglätter deinen gewünschten Look zu kreieren.
-	Erstelle dein Haarprofil, um mit i.d. curl™ optimale Ergebnisse zu erzielen und maßgeschneiderte Inhalte zu erhalten.
-	Richte mit dem Dyson Airwrap i.d.™ deine personalisierte Stylingsequenz zum Kreieren perfekter Locken ein.
-	Verbessere deine Styling-Skills mit Insider-Tipps von Promi-Haarstylist*innen und Beauty-Expert*innen.

App-kompatible Funktionen wie i.d. curl™ sind für den Dyson Airwrap i.d.™ verfügbar. Die App bietet ebenfalls Stylinganleitungen, individuelle Inhalte sowie persönliche Haarprofile für den Dyson Airwrap i.d™ sowie den Dyson Airwrap™, Supersonic™, Airstrait™ und Corrale™.

Audio
Hole mit der App das Beste aus deinen Dyson Kopfhörern heraus und optimiere dein Audioerlebnis.

-	Wechsle zwischen dem Isolations- und Transparenzmodus oder schalte ANC aus.
-	Wähle zwischen drei Equalizer-Voreinstellungen für deinen perfekten Sound.
-	Überwache die Lärmbelastung oder aktiviere die Lautstärkebegrenzung.
-	Entdecke das gesamte Sortiment an Ohrpolstern und Endkappen für deinen Dyson OnTrac™ Kopfhörer.

Kompatibel mit dem Dyson OnTrac™ und Dyson Zone™.

Beleuchtung
Transformiere deine Umgebung mit intelligenter Beleuchtungstechnologie, die sich deinem Alltag anpasst.

-	Stelle die Helligkeit und Farbtemperatur ein, um dir deine ideale Umgebung zu schaffen.
-	Wähle zwischen dem voreingestellten Entspannungs-, Arbeits- und Präzisionsmodus – je nach Aufgabe, Stimmung oder Tageszeit.
-	Richte Timer und Zeitpläne ein, um deine Leuchten automatisch ein- oder auszuschalten.

Kompatibel mit der Dyson Solarcycle Morph™ Tisch- und Stehleuchte.

Zusätzliche Funktionen
Mache dein Zuhause smarter
Verbinde dein Dyson Produkt nahtlos mit Siri, Alexa und Google Home.*

Erhalte Support
Sprich mit Dyson Experts, entdecke die Bedienungsanleitungen und löse Probleme mit unserem Tool zur Fehlerbehebung.

Erfahre als Erste*r alle Neuigkeiten
Erhalte Benachrichtigungen zu Sonderangeboten, Launches und Events ­– vor allen anderen.  

Bitte beachte, dass manche Dyson Geräte eine 2,4-GHz-WLAN-Verbindung benötigen. Die spezifischen Anforderungen findest du auf der Website von Dyson. Bei Anmerkungen zur neuesten Version kannst du uns direkt unter help@dyson.de kontaktieren.

*Die Funktionalität von Alexa, Siri und Google Home kann je nach Land und Produkt abweichen.",2016-03-30T16:25:28Z,2025-11-21T07:58:42Z
ch,Switzerland,Lifestyle,6012,7,930441707,Bumble: Dating & Freunde Chat,Bumble Holding Limited,https://apps.apple.com/ch/app/bumble-dating-freunde-chat/id930441707?uo=4,0.0,4.26557,22408,Lifestyle,"Der Liebe ein Stück näher – mit unserer Dating-App

Bumble ist die Dating-App, um Leute kennenzulernen, echte Beziehungen aufzubauen und der Liebe etwas näher zu kommen. Wir glauben, dass tiefe Verbindungen der Grundstein eines glücklichen Lebens sind. Und jetzt möchten wir dir helfen, deines zu finden – indem wir uns für die Sicherheit der Community einsetzen und Features für selbstbewusstes Dating entwickeln.

Triff neue Leute und finde beim Dating echte Verbindungen

Bumble ist eine kostenlose Dating-App für die Partnersuche und Beziehungen, die auf gegenseitigem Respekt und Vertrauen aufbauen. Egal, ob du bereit bist, diese eine Person zu finden, oder einfach Spaß am Dating hast, mit Bumble kannst du als Single neue Leute kennenlernen und echte Bindungen schaffen.

Die Liebe ist unser Spezialgebiet. Deshalb achten wir besonders darauf, einen Safe Space zu schaffen, in dem unsere Mitglieder sich wohlfühlen und selbstbewusst und respektvoll chatten können.

- Unsere Mitglieder stehen bei uns immer an erster Stelle.
- Sicherheit ist unsere Priorität. Damit du dir sicher sein kannst, dass all deine Matches verifiziert sind.
- Respekt, Entschlossenheit und Freude leiten uns und wir laden alle ein, auch für diese Werte einzustehen.

Teste unsere kostenlosen Features für noch einfacheres Dating
- Personalisiere dein Profil mit Interessen und Profilfragen für bessere Connections, Gespräche und Dates. So wissen andere direkt, wer du bist, was du magst und wonach du suchst.
- Vertraue dank der Ausweisverifizierung darauf, dass du mit echten Menschen schreibst.
- Date selbstsicher mit Dating-Tipps von Experten, die dich bei deiner Suche unterstützen.
- Verlinke deinen Spotify-Account und finde heraus, welche Songs euch verbinden.
- Mache Videocalls mit deinen Matches und schicke ihnen deine Lieblingsbilder, um euch näher zu kommen.
- Chatte sorglos mit neuen Leuten, denn alle Nachrichten müssen unsere Community-Richtlinien einhalten.
- Fühl dich noch sicherer und teile alle Details zu deinen Treffen mit Freunden, denen du vertraust.
- Dating-Pause gefällig? Kein Problem! Mit dem Snooze-Modus kannst du dein Profil verbergen (und deine Matches trotzdem behalten!).

Du möchtest noch mehr Möglichkeiten fürs Kennenlernen? Bumble Premium bietet dir zusätzliche Features für ein noch tolleres Dating-Erlebnis
- Lass dir anzeigen, wem du gefällst.
- Nutze erweiterte Filter wie „Auf der Suche nach...“, um Leute zu treffen, die die gleichen Werte, Hobbys und Ziele haben wie du.
- Gib abgelaufenen Matches eine zweite Chance und lass dir keine fantastischen Dates entgehen.
- Nutze den Inkognito-Modus und bestimme selbst, wann dein Profil sichtbar ist.
- Verlängere Matches um 24 Stunden.
- Swipe so viel du willst und lerne noch mehr Leute kennen.
- Flirte auf der ganzen Welt mit dem Reise-Modus.
- Mache noch mehr Eindruck mit SuperSwipes und Spotlights mit wöchentlichen Updates.

Inklusivität ist das A und O
Bumble macht keine Unterschiede in Sachen Liebe: ob hetero, schwul, lesbisch, queer … wir sind LGBTQ-freundlich und möchten, dass sich in unserer Community alle willkommen und sicher fühlen. Also egal, wie du dich definierst und ob du chatten, daten oder deinen Lieblingsmenschen finden willst, bei uns bist du richtig.

---
Bumble ist eine kostenlose Dating-App für die Nutzung nach dem Download. Wir bieten optionale Abonnements (Bumble Boost & Bumble Premium) und kostenpflichtige Features an, die nicht an Abos gekoppelt sind, sondern auf einmaliger oder mehrfacher Nutzung basieren (Bumble Spotlight & Bumble SuperSwipe). Deine persönlichen Daten werden gemäß unserer Datenschutzrichtlinie und den geltenden Gesetzen sicher verarbeitet. Bitte lies dir unsere Datenschutzrichtlinie und die AGB durch.
https://bumble.com/privacy-policy/de
https://bumble.com/de/terms
Bumble Inc. ist die Muttergesellschaft von Bumble, Badoo und BumbleBFF (fürs Freunde finden) – soziale Netzwerke und Dating-Apps zum Download und zur freien Nutzung.",2015-02-06T09:17:07Z,2025-11-17T09:23:19Z
ch,Switzerland,Lifestyle,6012,8,1055281310,Philips Hue,Signify Netherlands B.V.,https://apps.apple.com/ch/app/philips-hue/id1055281310?uo=4,0.0,4.67709,17206,Lifestyle,"Es gibt keine umfangreichere Methode, Deine smarten Philips Hue Lampen und das Zubehör zu organisieren, zu steuern und anzupassen, als mit der offiziellen Philips Hue App. 

Organisiere Deine smarten Lampen
Deine smarte Beleuchtung zu organisieren ist ganz einfach. Gruppiere Lampen in Räume oder Zonen - zum Beispiel die gesamte untere Etage oder alle Lampen im Wohnzimmer-, die die physischen Räume in Deinem Zuhause widerspiegeln.

Steuere Deine Lampen bequem von jedem Ort aus
Steuere Deine Lampen mit der App von jedem Ort aus, an dem Du eine Internetverbindung hast. 

Entdecke die Hue Galerie mit Lichtszenen
Mit den, von professionellen Lichtdesignern erstellten, Szenen erzeugst Du die für jeden Anlass passende Stimmung. Anhand eines Fotos oder Deiner Lieblingsfarben kannst Du sogar Deine eigenen Lichtszenen erstellen. 
 
Bright Home Security
Schütze Dein Zuhause mit Licht, Kameras und Sensoren für ein besonders sicheres Gefühl, egal ob Du zu Hause oder unterwegs bist. Mit Philips Hue erhältst Du nicht nur Smart Home Security für Dein Zuhause - sondern Bright Home Security. Im Security Center kannst Du die Hue Secure Kameras, Hue Secure Kontaktsensoren und Raum-Bewegungsmelder programmieren, so dass Du Benachrichtigungen erhältst, wenn eine Aktivität erkannt wird. Löse Licht- oder Tonalarme aus, rufe bei Notfallnummern oder einen vorgegebenem Kontakt an und überwache Dein Heim in Echtzeit.

Das optimale Licht für jeden Augenblick des Tages
Mit der Szene „Natürliches Licht“ ändert sich die Beleuchtung im Laufe des Tages automatisch so, dass Du zur richtigen Zeit Energie tanken, Dich besser konzentrieren oder entspannter und ausgeruhter fühlen kannst. Stelle die Szene ein und erlebe, wie sich das Licht mit dem Sonnenstand am Himmel verändert: von kühlen Blautönen am Morgen hin zu wärmeren, entspannenden Farbtönen bei Sonnenuntergang. 

Automatische Funktionen für Deine Lampen
Stimme Deine smarten Lampen auf Deinen Tagesablauf ab. Mit der Philips Hue App kannst Du ganz einfach persönliche automatische Funktionen einrichten und Dich zum Beispiel morgens sanft vom Licht aufwecken lassen oder Dich beim Nachhausekommen am Abend vom Licht begrüßen lassen. 

Synchronisiere Deine Lampen mit dem Fernseher oder mit Musik und Games
Deine Lampen können synchron mit dem Bildschirm oder mit Sound blinken, tanzen, dunkler oder heller werden. Mit der Philips Hue Play HDMI Sync Box, Philips Hue Sync for TV, mit der Desktop App oder Spotify kannst Du Dir ein völlig neues Erlebnis schaffen.

Sprachsteuerung einrichten
Verwende das Apple HomeKit, Amazon Alexa oder den Google Assistant, um Deine smarte Beleuchtung nur mit Deiner Stimme zu steuern. Mit einfachen Sprachbefehlen kannst Du das Licht ein- und ausschalten, dimmen und aufhellen oder sogar die Farbe ändern, ohne dass Du einen Finger rühren musst.

Nutze Siri Shortcuts zur schnellen Steuerung
Nutze die Shortcuts App, um Kurzbefehle zu erstellen, die Du auf Deinem Bildschirm in Widgets platzieren kannst und steuere so Deine Beleuchtung noch schneller. Ohne die App zu öffnen kannst Du Lampen ein- oder ausschalten, ihre Helligkeit oder Farbtemperatur ändern, oder auch Lichtszenen einstellen.

Weitere Informationen zur Philips Hue App: www.philips-hue.com/app. 
Lese die Datenschutzerklärung für Philips Hue unter www.philips-hue.com/privacy.

Hinweis: Für einige Funktionen in dieser App ist eine Philips Hue Bridge erforderlich.",2016-04-28T09:36:39Z,2025-11-11T15:18:30Z
