country,country_name,category,genre_id,rank,app_id,app_name,developer,url,price,averageUserRating,userRatingCount,primaryGenreName,description,launch_date,update_date
be,Belgium,News,6009,1,333903271,X,TWITTER INTERNATIONAL UNLIMITED COMPANY,https://apps.apple.com/be/app/x/id333903271?uo=4,0.0,4.51851,95989,News,"Welcome to X (formerly known as Twitter), your trusted digital town square where conversations unfold in real time, and the world connects through breaking news, live events, podcasts, and everything in between.

Whether you're passionate about sports, tech, music, or politics, X is your front-row seat to what’s happening across the globe.

X isn’t just another social media app, it’s the ultimate destination for staying well informed, sharing ideas, and building communities. With X, you’re always in the loop with relevant trending topics and breaking news, delivered instantly to your screen, raw and unfiltered.

What You Can Do on X:
• Follow breaking news from around the world before it hits the headlines, and stay ahead of the curve with real-time updates on trending topics and viral conversations.

• Post your thoughts, photos, and videos with a global community. Join millions of users in shaping public dialogue across social, cultural, and political conversations.

• Discover Grok, the AI assistant powered by X’s real-time data. You can ask Grok to summarize trending news, explain videos, or give you more context about posts.

• Stream live video or go live with Spaces, our audio feature that enables you to host discussions, hold interviews, or start your next live podcast. Whether you're streaming a concert, a live game, or your thoughts on a hot topic, X keeps your audience engaged.

• Watch videos: from live breaking news and sports clips to podcasts and gaming sessions that last up to 3 hours long. Many of the world’s leading voices, in comedy, gaming, podcasting, and politics, all share their content on X.

• Connect and chat privately with friends, followers, customers, or collaborators through Direct Messages.

• Join and build communities tailored to your interests: from sports news, gaming, entertainment, crypto, entrepreneurship, tech, and more.

• Subscribe to X Premium to unlock exclusive features like a blue checkmark, boosted visibility, prioritized replies, fewer ads, longer videos, and post editing. X Premium also gives you access to creator revenue sharing and the ability to offer exclusive content to subscribers.

Why X?
In a world of constant change, X is your real-time source to stay ahead of the curve, connect with people, and explore diverse perspectives. From breaking live news and trending memes to top podcasts and live streams from your favorite creators, X brings it all together in one powerful social experience.

Privacy Policy: https://x.com/privacy
Terms and Conditions: https://x.com/tos",2009-10-09T19:50:00Z,2025-11-19T08:49:42Z
be,Belgium,News,6009,2,1064216828,Reddit,"REDDIT, INC.",https://apps.apple.com/be/app/reddit/id1064216828?uo=4,0.0,4.70498,19803,News,"Welcome to Reddit, the heart of the internet.

Reddit is a social network with something for everyone: trending topics, anonymous group discussions, and diverse communities.

Joining Reddit means immersing yourself in brutally honest and wholesome conversations that span across every topic and interest you could imagine.  Beyond exclusive content straight from the source, you'll also find gaming communities, insightful bloggers, passionate TV fandoms, sports enthusiasts, support groups, AI forums, the latest in celeb news, and creators of all types.

If you’re into gaming and sport, you can discover the best Xbox and PS5 forums, talk Zelda, Call Of Duty, or minecraft strategy while discussing the latest Football news, Cricket matches, and Rugby games.

Reddit has over 100,000 online communities (forums where members post and comment) dedicated to discussing topics. Some of the most popular global communities are:
■ r/AskReddit, where users can ask and answer questions
■ r/funny, which is full of humorous content, jokes, hilarious memes
■ r/science, for scientific talks and daily news from the scientific community
■ r/gifs, with funny animated gifs for your fun  and viewing pleasure
■ r/music, r/fredagain, r/beyonce and other music forums where music fans gather to discuss their favourite artists and genres.

On Reddit you’ll find:
■ Thousands of community groups and interesting topics, and a wealth of original content. 
Latest news, entertainment news, social media news, book clubs, TV fan theories, technology forums, open AI discussions, conspiracy theories, gaming forums,debate forums, and personalised content, there's a community for everyone.

■ Loads of laughs
Find popular memes, witty humour, jokes and gags, oddly satisfying videos, comedy clips, funny cat videos, and more to help you lose track of time.

■ Pop culture buzz
Explore the latest trends at r/popculturechat and r/fauxmoi, or join the lively discussions at TV groups like r/loveislandtv, r/bigbrotheruk, and r/MAFS_UK.

■ AMAs, or ""Ask Me Anything""
Celebrities, politicians, and experts answer questions from users.

■ The best discussions on any topic
Reddit’s discussion threads are where community members jump in with humour and insights for top conversations about anything; science discoveries, pop culture, gardening, entertainment, or financial advice.

■ Post anonymously and get answers to all of your questions
Ask communities anything you want. Ask questions on relationships, mental health, parenting, career advice, fitness plans, and more.

■ Anonymous profiles
Connect with people about any topic, join interactive community groups, and chat with other redditors, all anonymously.

Voting and Karma:

Instead of likes and hearts, Reddit’s social media network runs on upvotes or downvotes. Voting on posts and comments increase or decrease the creator’s karma, and helps popular and relevant posts rise to the top, while filtering out low-quality or irrelevant posts.

While karma doesn't directly impact your ability to use Reddit, more karma can increase posts’ visibility and help you get noticed. Some communities require karma to post or comment, which helps maintain content quality and community standards.



Reddit Premium:

Purchase Reddit Premium to enjoy an ads-free experience and access to premium avatar gear, r/lounge, custom app icons, and more.

Payment will be charged on a recurring monthly or annual basis to your Apple account. Your monthly or annual Premium subscription will automatically renew unless you cancel at least 24 hours before your subscription ends. Cancel anytime in your device’s Account Settings. No partial refunds.

Privacy Policy: https://www.redditinc.com/policies/privacy-policy
User Agreement: https://www.redditinc.com/policies/user-agreement
Reddit Rules:https://redditinc.com/policies/reddit-rules

If you have any problems with the app, get support at RedditHelp.com",2016-05-18T06:01:47Z,2025-11-21T01:07:14Z
be,Belgium,News,6009,3,1533426234,Mijn Magazines,Roularta Media Group,https://apps.apple.com/be/app/mijn-magazines/id1533426234?uo=4,0.0,4.23519,3274,News,"Met de Mijn Magazines-app heb je met één app toegang tot de digitale artikels, video’s, columns en nog veel meer van al deze merken. Zowel de Nederlandstalige als Franstalige edities. Je digitale leeservaring is beter dan ooit. Heb je bovendien een Family abonnement (voor nu enkel beschikbaar in België), dan kun je via de Mijn Magazines-app je leesplezier gratis delen met familie en vrienden.
Knack, EW, Beleggers Belangen, Trends, Landleven, Happinez, Flow, Libelle, Libelle Lekker, Flair, Psychologie Magazine, Feeling, Formule 1, Helden, Plus Magazine, delicious., Vorsten, KW, Seasons, Roots, Truckstar, De Zondag, Columbus Travel, Fiets, KIJK, Fiets Actief, Yoga by Happinez, Zin Magazine…. allemaal in 1 app.
 
Hier lees je de gebruiksvoorwaarden:
BE: https://www.roularta.be/nl/disclaimer - NL: https://roularta.nl/disclaimer/ (Terms of use)


Hier lees je over ons privacybeleid:
BE: https://www.roularta.be/nl/privacy-policy-clean - NL: https://roularta.nl/voorwaarden/privacy-policy/",2021-07-06T07:00:00Z,2025-11-17T09:17:30Z
be,Belgium,News,6009,4,1581650857,Substack,Substack Inc.,https://apps.apple.com/be/app/substack/id1581650857?uo=4,0.0,4.77816,1163,News,"Substack is a new media app that connects you with the creators, ideas, and communities you care about most.
- Support the creators you love: Subscribe for free or upgrade to view original work and connect directly with your favorite writers, artists, and podcasters.
- Enjoy ad-free videos and podcasts: Access short-form clips, video episodes, and  read-aloud articles without interruptions.
- Connect in real time: Join livestreams and live group chats, where top creators bring their biggest supporters into their world. 
- Explore independent ideas: Discover bold opinions and engaging views across food, sports, politics, fashion, comedy, finance, and more.

How it works:
1. Download the Substack app.
2. Claim your handle.
3. Explore the feed to enjoy notes, videos, and clips from creators. 
4. Subscribe to your favorites for free, tune into their livestreams and join private group chats.",2022-03-08T08:00:00Z,2025-11-17T17:28:36Z
be,Belgium,News,6009,5,377388077,De Tijd,Mediafin,https://apps.apple.com/be/app/de-tijd/id377388077?uo=4,0.0,3.64244,688,News,"De Tijd is dé referentie voor betrouwbaar politiek, economisch en zakelijk nieuws. Zorg dat u altijd als eerste op de hoogte bent van het belangrijkste nieuws dankzij onze app.

Lezers die zich voor het eerst registreren, krijgen nu 1 maand gratis toegang tot de volledige app van De Tijd. Bent u al abonnee? Dan kunt u zich eenvoudig aanmelden met uw inloggegevens, en meteen van start gaan met het lezen van onze bekroonde journalistiek en diepgaande analyses over politiek, economie, business, technologie en financiën.

Belangrijkste functionaliteiten van de app:
- Meldingen: altijd als eerste op de hoogte van belangrijk nieuws
- Nieuws: recent nieuws en hoofdpunten overzichtelijk weergegeven
- Markten Live: realtime beurskoersen
- Mijn Nieuws: uw persoonlijk nieuwsoverzicht
- Podcasts: elke weekdag nieuwe afleveringen
- Printeditie: de krant in papieren weergave
- Portefeuille: de stand van uw portefeuille
- Puzzels: elke dag nieuwe uitdagingen
- Sabato: het weekendmagazine van De Tijd
- Netto: het antwoord op al uw geldvragen",2010-06-19T23:20:51Z,2025-11-17T21:13:55Z
be,Belgium,News,6009,6,403025567,HLN,DPG Media (Apps),https://apps.apple.com/be/app/hln/id403025567?uo=4,0.0,4.51685,20470,News,"Als eerste mee met de actualiteit, het nieuws uit je buurt, de strafste video’s en de leukste spelletjes? Jij kiest. Via het vernieuwde menu van de HLN app navigeer je heel eenvoudig tussen ‘Nieuws’, ‘In de buurt’, ‘Video’ en ‘Puzzel’.

Bovenaan de app ben je in één klik mee met de meest recente artikels en video’s, Sport, Showbizz, Nina, Bizar, Geld, Eten, Tech, Mobiliteit, Wonen, Reizen of Wetenschapsnieuws. En bij belangrijk nieuws ben jij als eerste op de hoogte via gratis pushberichten.

Het beste van de HLN app
• In de buurt: selecteer je favoriete gemeenten en blijf op de hoogte van regionaal nieuws, toffe adresjes en evenementen bij jou in de buurt.
• Video: alle straffe beelden die je gezien moet hebben, bekijk je hier. De interessantste fragmenten uit populaire tv-programma’s en trending video’s van over de hele wereld. Laat je entertainen en zoek inspiratie in de dagelijkse selectie van onze redactie.
• Puzzel: daag jezelf uit met meer dan 50 gratis puzzels, spelletjes en quizzen. Neem het op tegen andere lezers via highscores.

Haal meer uit de app met deze handige functies
• Snel een artikel opzoeken? Via het nieuwe snelmenu in de HLN app heb je directe toegang tot de zoekfunctie. 
• Een artikel opslaan of makkelijk terugvinden? Bewaar ze met één klik in ‘Jouw leeslijst’. Lees deze artikels in de app wanneer het jou het best uitkomt. 
• Zin in een podcast? We verzamelen HLN’s beste podcasts nu via de geïntegreerde podcastspeler in de HLN app.
 
Handig om te weten
De HLN-app is gratis te downloaden. Je hebt een abonnement om HLN+ artikels te lezen. Om onbeperkt te kunnen lezen, kun je in de app een HLN Mobiel maandabonnement afsluiten. Dit abonnement kost € 7,99 per maand. Bij het bevestigen van de aankoop wordt het bedrag van je iTunes account afgeschreven.

Een abonnement via de App Store wordt automatisch verlengd. Deze automatische verlenging kan tot 24 uur voor het aflopen van de abonnementsperiode worden stopgezet via de instellingen van je Apple ID. Ga daarvoor op je iPhone naar Instellingen > iTunes en App Store > klik op je Apple ID > Toon Apple ID > Beheer abonnementen

Enkele apparaten worden niet ondersteund door de HLN app. Heb je problemen met het downloaden van de app? Lees dan verder bij ‘additional information’.

Volg HLN op social media
Altijd op de hoogte blijven? Volg HLN.be op Facebook, Instagram of Twitter:
Facebook: https://www.facebook.com/HLN.be
Instagram: https://www.instagram.com/hln_be/
Twitter: https://twitter.com/hln_be",2010-11-29T12:01:25Z,2025-11-12T21:18:46Z
be,Belgium,News,6009,7,952769219,VRT NWS,VRT,https://apps.apple.com/be/app/vrt-nws/id952769219?uo=4,0.0,4.37395,14256,News,"VRT NWS brengt je het meest recentste, betrouwbaarste en belangrijkste nieuws uit binnen- en buitenland. We zoomen ook dieper in met achtergrondverhalen, analyses van experten en opiniestukken. Altijd uitgelegd in heldere taal om te lezen, te beluisteren en te bekijken.

Breaking nieuws krijg je meteen op je hoofdscherm dankzij onze push-berichten. Met meer dan een miljoen downloads is VRT NWS dan ook de meest gebruikte nieuwsapp onder de kwaliteitssites.",2015-03-26T12:48:26Z,2025-11-18T01:24:58Z
be,Belgium,News,6009,8,539988296,Nieuwsblad Nieuws,Corelio Publishing,https://apps.apple.com/be/app/nieuwsblad-nieuws/id539988296?uo=4,0.0,3.88527,2702,News,"Blijf op de hoogte van het belangrijkste (sport)nieuws, de strafste verhalen uit je buurt en krijg tips die je leven makkelijker maken. 

• Alles van het Nieuwsblad vind je in één handige app: 
Lees artikels, beluister podcasts of bekijk video’s. Bovendien vind je ook de digitale krant in onze nieuwsapp.

• Als eerste op de hoogte van het nieuws:
Groot nieuws of een belangrijke sportwedstrijd? We houden je live op de hoogte. 

• Meldingen op jouw maat:
Meldingen bij belangrijk nieuws, sportupdates of nieuws uit je buurt? Kies zelf welke meldingen je ontvangt. Je kan je voorkeuren makkelijk aanpassen.

• De strafste podcasts:
De Stemmen van Assisen, Sjotcast, Het Punt van Van Impe, Vrolijke Vrekken … Je vindt ze allemaal in onze app. Ideaal voor in de wagen of tijdens het koken.

• Even pauze? 
In onze app vind je iedere dag nieuwe puzzels. En voor onze app-gebruikers gaan we graag een stapje verder. Ontdek exclusieve wedstrijden, dossiers en acties in onze app.

Heb je feedback voor ons? Stuur een e-mail naar newsapps@mediahuis.be.
Ben je tevreden over onze app? Vergeet dan zeker niet de app een waardering te geven.",2012-08-01T10:09:43Z,2025-10-28T09:00:04Z
be,Belgium,News,6009,9,506601384,DS Nieuws,Corelio Publishing,https://apps.apple.com/be/app/ds-nieuws/id506601384?uo=4,0.0,3.61046,1702,News,"Je leest het beste van De Standaard in de gratis nieuwsapp, jouw essentiële nieuwsbron om de wereld beter te begrijpen. Vol duiding, handige tips, inspiratie en inzicht. Snelle updates doorheen de dag en betrouwbare, grondige journalistiek. Elke ochtend de digitale krant en om 17 uur DS Avond. Alles verrijkt met podcast, video, en een optimale leeservaring. 

- Betrouwbaar live nieuws
- Toonaangevende opinie
- Onafhankelijke journalistiek, reportages, interviews en analyses
- Lees eenvoudig de digitale krant en alle bijlagen
- Elke werkdag om 17 uur krijg je een round-up van de dag met de meest essentiële nieuwsfeiten in de digitale avondeditie DS Avond
- DS Vandaag: onze dagelijkse nieuwspodcast
- Het weekmenu van De Standaard: inspiratie en recepten voor elke dag
- Handige tips en inspirerende verhalen
- Elke dag een nieuwe actuapuzzel: de Woordslang
- Elk weekend Karels Crypto: het uitdagendste cryptogram om te kraken


Eén vernieuwde app, alle perspectieven.
Opmerkingen of feedback- over de nieuwe nieuwsapp? We horen het graag op newsapps@mediahuis.be

Ben je tevreden over deze app? Aarzel dan niet om een review te plaatsen.",2012-05-15T04:42:39Z,2025-10-28T08:59:44Z
be,Belgium,News,6009,10,416079343,De Morgen - Nieuws,DPG Media (Apps),https://apps.apple.com/be/app/de-morgen-nieuws/id416079343?uo=4,0.0,4.51487,3261,News,"Download de app van De Morgen: blijf op de hoogte van het laatste nieuws en krijg meteen inzicht. Op uw iPhone altijd urgent en actueel. Of op uw iPad, interactief en liefdevol vormgegeven.

Ontdek nu de vernieuwde De Morgen app op uw mobiel! Naast de Live-feed, waarmee u de actualiteit 24/7 kunt volgen, brengt de redactie u in de app van De Morgen nu ook het nieuws van de dag via de digitaal doorbladerbare Print Editie én de gloednieuwe Digitale Editie, die u extra beeld- en geluidsmateriaal biedt.

OP UW SMARTPHONE
• Scroll door onze verschillende secties: lees het laatste nieuws, interviews, politieke ontwikkelingen, wetenschap, technologie en onze beste columns en opinies
• Ontdek het nieuws van de dag via de digitaal doorbladerbare Print Editie én de gloednieuwe Digitale Editie, die u extra beeld- en geluidsmateriaal biedt. 
• Mis geen enkel belangrijk nieuws of verhaal: bepaal zelf welke meldingen u wilt ontvangen
• Bekijk de tv-gids en krijg handige kijk- en streamingtips van de redactie

Privacy
De Morgen is een uitgave van DPG Media
Onze gebruiksvoorwaarden vindt u op https://www.dpgmedia.be/nl/gebruiksvoorwaarden
Ons privacy statement vindt u op https://www.dpgmedia.be/nl/privacy",2011-03-13T04:11:53Z,2025-11-11T20:08:22Z
be,Belgium,News,6009,11,927696928,RTL info. Actualités en direct,RTL Belgium,https://apps.apple.com/be/app/rtl-info-actualit%C3%A9s-en-direct/id927696928?uo=4,0.0,4.13033,1289,News,"L’info en temps réel, où vous voulez et quand vous voulez.

RTL info vous accompagne tout au long de la journée pour vous donner une information claire, sérieuse et décryptée de l’actualité belge et étrangère. Des faits d’actualité du jour en passant par la politique, l’économie, le sport ou encore les news people, ne manquez rien grâce à nos nombreux articles et vidéos. Suivez également en direct nos éditions télévisées de 13 et 19h.

RTL info et ses journalistes s’engagent à aborder pour vous tous les sujets avec pertinence, crédibilité et empathie.

L’application fait peau neuve pour être encore plus lisible et intuitive.

En téléchargeant l’application, nous vous invitons à créer un compte personnel et à y choisir les thématiques qui vous intéressent le plus. L’application vous proposera automatiquement des articles et des vidéos en phase avec vos centres d’intérêts. Vous aurez également la possibilité de créer votre propre Une personnalisée.

L’info qui vous concerne, en temps réel, c’est sur RTL info.",2014-12-09T08:00:38Z,2025-11-18T14:24:29Z
be,Belgium,News,6009,12,412453498,RTBF Actus,RTBF,https://apps.apple.com/be/app/rtbf-actus/id412453498?uo=4,0.0,3.07103,2351,News,"Accédez rapidement à tout ce qui fait l’actualité : ce qui anime la Belgique et le monde, les infos de votre région, les résultats de vos sports favoris, les sorties culturelles à ne pas manquer ou encore les dernières tendances. 

Découvrez-y notamment : 
    - Toute l’actualité politique belge et internationale, des dossiers approfondis de la rédaction INFO sur les élections 2024, l'actu économique, les dernières infos climat, etc. ; 
    - L’actualité locale et internationale ;
    - Les infos trafic et prévisions météo en Belgique ;
    - L’actualité sport en Belgique et dans le monde : football, cyclisme, tennis, NBA, Formule 1 et Formule E, Moto GP, WRC, JO, sport féminin, ... ; 
    - Les derniers podcasts info, histoire, cinéma, musique, pop-culture, humour, société, etc. ;
    - De nombreux conseils conso et bien-être ;
    - Vos radios RTBF favorites : Vivacité, Classic21, La Première, Tipik, Musiq3, Jam et Tarmac ;
    - Les programmes et contenus des marques RTBF : La Une, Tipik, La Trois, Ixpé, Auvio et Auvio Kids ;

En 2024, l’application a été améliorée pour vous offrir une meilleure expérience : 
    - Un accès intuitif et un confort de lecture optimal ; 
    - Des contenus trouvés plus facilement grâce à la nouvelle fonctionnalité de recherche ; 
    - Une vue plus complète des infos du jour depuis la page d’accueil ; 
    - Recevez des alertes en temps réel grâce aux notifications sur votre smartphone ou tablette​ ;",2011-01-27T08:04:41Z,2025-09-25T08:23:55Z
be,Belgium,News,6009,13,504299905,Le Soir – Actu et info,Rossel & Cie,https://apps.apple.com/be/app/le-soir-actu-et-info/id504299905?uo=4,0.0,3.70408,686,News,"Le Soir est le journal de référence en Belgique francophone.
Suivez l’info en direct, retrouvez toute l'actualité en Belgique et à l'international, mais aussi l'actu économique et politique avec l’application Le Soir !
 
Accédez aux analyses, entretiens, et reportages de la rédaction et plongez dans nos dossiers thématiques et grands formats, avec un confort de lecture optimal.
 
Découvrez toutes les fonctionnalités:
- Accédez à toute l’actualité décryptée en direct par la rédaction
- Téléchargez le journal et tous ses suppléments en version numérique pour y accéder où que vous soyez, même hors ligne
- Recevez des alertes infos en temps réel grâce aux notifications
- Sauvegardez vos articles préférés pour les retrouver facilement
- Recherchez un article sur un sujet spécifique rapidement et facilement
- Accédez à 30 années d’archives
- Profitez d’une facilité d’utilisation et d’un confort de lecture optimal sur votre smartphone et tablette
- Partagez facilement les articles qui vous intéressent avec votre entourage

Profitez pleinement de cette application, de toutes ses fonctionnalités et de l’intégralité du contenu en vous abonnant sans aucun engagement.
----------------------------------------------------------------------------
Abonnement via l’application :
 
Choisissez votre formule d’abonnement :
 
L'abonnement Start mensuel revient à 11,99€ par mois ou 119,99€ en annuel.
L'abonnement Premium mensuel revient à 17,99€ par mois ou 189,99€ en annuel

Le paiement est pris en charge par votre compte iTunes au moment de la confirmation de l’achat. Si vous choisissez l’abonnement Premium mensuel (annuel), il sera automatiquement renouvelé chaque mois (années) par un prélèvement de 17,99€ (189,99€) via votre compte iTunes.

Si vous choisissez l’abonnement Start mensuel (annuel), il sera automatiquement renouvelé chaque mois (années) par un prélèvement de 11,99€ (119,99€) via votre compte iTunes.
 
Gérez votre abonnement et stoppez quand vous le désirez le renouvellement automatique, après votre achat, via la gestion de votre compte iTunes. L’abonnement sera automatiquement renouvelé s’il n’est pas annulé au minimum 24 heures avant la fin de la période en cours. Le compte iTunes sera débité pour le renouvellement 24h avant la fin de la période en cours.
 
Accédez à nos conditions générales de vente à cet endroit : http://www.rossel.be/mentions-legales/rossel-cie-2/cgv-3/",2012-09-26T14:04:41Z,2025-10-31T10:57:43Z
be,Belgium,News,6009,14,582293404,HBVL Nieuws,Icotel,https://apps.apple.com/be/app/hbvl-nieuws/id582293404?uo=4,0.0,4.01556,900,News,"Wat er in Limburg gebeurt, lees en zie je als eerste in de nieuwsapp van Het Belang van Limburg.
Of het nu gaat om nieuws uit jouw gemeente, boeiende sportverslagen, scherpe analyses of wereldwijde actualiteit, je vindt het allemaal in één handige app.

Waarom kiezen voor de HBVL-nieuwsapp?

• Gemeentenieuws: In één klik naar het nieuws uit jouw gemeente via ‘Mijn gemeente’.

• Meteen op de hoogte: Het meest recente nieuws en de meest recente video’s vind je overzichtelijk bij ‘Net binnen’.

• De digitale krant: Vanaf 5 uur 's morgens staat jouw vertrouwde krant klaar in de app.

• Sportliefhebber? Altijd het laatste sportnieuws binnen handbereik.

• Voor u opgelost: Journalist Gunter Willekens lost problemen van onze lezers op.

• Limburgse onderzoeksjournalistiek: Voor nieuws van belang graven wij dieper.

• Goesting-tips: Leuke tips voor eten en drinken, ontspanning en uitjes in Limburg.

• Podcast: In de HBVL-app vind je de beste actua- en crimi-podcasts, eenvoudig te beluisteren via de ingebouwde podcastspeler.

• Ontspanning: Geniet dagelijks van nieuwe puzzels en wedstrijden.

Handig om te weten:
De app van Het Belang van Limburg is gratis te downloaden. Voor toegang tot +plusartikels heb je een abonnement nodig. Wil je onbeperkt lezen? Sluit eenvoudig een abonnement af in de app.

Heb je vragen of feedback? Laat het ons weten via https://help.hbvl.be/contactformulier. Tevreden? Laat een review achter!

Download nu en blijf altijd op de hoogte!",2012-12-14T08:00:00Z,2025-10-28T08:58:11Z
