country,country_name,category,genre_id,rank,app_id,app_name,developer,url,price,averageUserRating,userRatingCount,primaryGenreName,description,launch_date,update_date
cy,Cyprus,Social Networking,6005,20,443904275,LINE,LY Corporation,https://apps.apple.com/cy/app/line/id443904275?uo=4,0.0,3.18182,11,Social Networking,"LINE is transforming the way people communicate, closing the distance between family, friends, and loved ones—for free. With voice and video calls, messages, and a limitless variety of exciting stickers, you’ll be able to express yourself in ways that you never thought possible. Available all around the world on mobile, desktop, and Apple Watch, the LINE platform continues to grow, always offering new services and features that make your life more fun and convenient.

◆ Messages, Voice calls, Video calls.
Enjoy voice and video calls and exchanging messages with your LINE friends.

◆ LINE stickers, emojis, and themes
Express yourself just the way you want with stickers and emojis. Also, find your favorite themes to customize your LINE app.

◆ Home
Gives you easy access to your friends list, birthdays, the sticker shop and various services and contents offered by LINE.

◆ LINE VOOM
Available in Japan, Taiwan, and Thailand, you can explore even more content that you may like in the ""For you"" tab.

◆ Seamless connection on mobile, Apple Watch, and desktop

Chat anytime and anywhere. Whether you’re on the go or working at the office or remotely, use LINE via your iPhone, Apple Watch, or desktop.

◆ Store your personal information with Keep Memo

My own chatroom to temporarily store messages, photos, and videos.

◆ Messages protected with Letter Sealing

Letter Sealing encrypts your messages, call history and location information. Always be assured of your privacy when using LINE.

*We recommend using a data plan or connecting to Wi-Fi as you may incur data usage fees otherwise. 

*Please check the recommended specifications from LINE settings > “Help center” > “LINE usage environment/Settings” > ""System requirements for LINE” when installing/updating the LINE app. In addition, if you're using an old version of iOS, we recommend updating it to the latest version.

▼Click here to see how to update your iOS version.
https://support.apple.com/en-us/HT204204

**********
If your network speed is too slow or you don't have enough device storage, LINE may not install properly.

If this happens, please check your connection and try again.
**********",2011-07-08T09:28:14Z,2025-11-20T03:03:51Z
cy,Cyprus,Social Networking,6005,21,6476268135,INSAVIOR,INSAVIOR LTD,https://apps.apple.com/cy/app/insavior/id6476268135?uo=4,0.0,4.75,4,Social Networking,"INSAVIOR | Safety in Action for Women 

Enough with words they don’t save lives. INSAVIOR is a women-only app that turns empathy into real-time action. Built by women, for women, it combines innovation, technology, and a verified community to protect and empower women 18+.

How it works:

Instant SOS Alerts – Notify nearby women and/or emergency contacts discreetly.

Medium Alerts – Request a safe escort or company from verified INSAVIOR women nearby when you feel unsafe.

Live Group Chat – Connect instantly with nearby women when an SOS is activated; see how many are alerted and your distance from the closest member.

Anonymous Story Sharing & Expert Chat – Share safely or get guidance from trusted professionals.

Self-Defense Tutorials & Resources – Learn skills to protect yourself anytime.

INSAVIOR bridges the gap between awareness and action, eliminating the bystander effect through technology, solidarity, and real-time support.

Download now and be part of a community where empathy turns into action, instantly.",2024-11-11T08:00:00Z,2025-10-09T14:25:25Z
cy,Cyprus,Social Networking,6005,22,836634305,novoville,NOVOVILLE LIMITED,https://apps.apple.com/cy/app/novoville/id836634305?uo=4,0.0,4.59504,242,Social Networking,"Novoville is a Civic Engagement Platform that transforms the way citizens access local services. Thousands of citizens are already using Novoville to improve the places they live in.

Depending on where you live, you can use the brand new Shared Repairs or GetVolunteering services, or simply report an issue you come across in your neighbourhood. These features allow you to improve your home and help your community straight from your mobile device. Download the free Novoville app to get involved!

With Novoville Shared Repairs, you can:

- Create your virtual tenement and contact other owners
- Report your issue & get quotes from Trusted Traders
- Pay into a dedicated digital account   

With the GetVolunteering feature, you can:

- Help people in need who live in your area and match your interests
- Submit call logs to your organisation 
- See all your submitted call logs and upcoming appointments

With the incident management feature, you can:

- Report issues you come across in your neighbourhood
- Get notified about emergencies, important announcements and events
- Give your opinion on important local matters

Novoville: Powerful cities, Empowered citizens.",2022-06-06T07:00:00Z,2025-10-17T07:25:04Z
cy,Cyprus,Social Networking,6005,23,1312424138,Messenger Duo for WhatsApp,BEST SOCIAL APPS DEVELOPMENT LTD,https://apps.apple.com/cy/app/messenger-duo-for-whatsapp/id1312424138?uo=4,0.0,4.32157,1020,Social Networking,"Introducing Messenger Duo, the ultimate iOS app that takes your experience to the next level. With a wide array of additional features and powerful tools, this app enhances your capabilities and allows you to do so much more with the world's most popular messaging platform. Messenger Duo is here to revolutionize your WA experience.

◉ Dual Chat: Say goodbye to the hassle of switching between devices or accounts. With Messenger Duo, you can effortlessly manage two accounts on one device, doubling your communication power. Keep personal and business conversations separate and organized, all within a single app.

► Second Phone Number: Expand your communication options by adding extra phone number to your Messenger Duo account. Whether you need a dedicated number for business purposes or simply want to separate your personal and professional contacts, Messenger Duo has got you covered.

◉ Lock Chat: Protect your privacy and secure your personal data with the powerful chat lock feature. Messenger Duo allows you to set up an additional layer of security, ensuring that only you have access to your conversations. Rest assured, your private chats remain truly private and secure.

► AI ChatBot: Use ChatGPT. It can answer questions and assist you with tasks, such as composing messages, text, story, emails & more.

◉ Send Messages with Beautiful Fonts: Enhance your text messages with a variety of stylish and beautiful fonts to stand out and express yourself uniquely.

► Voice Message Transcription: Convert voice messages into text with ease, making them accessible and easy to reference.

◉ Message Scheduler: Take control of your messaging routine with the built-in message scheduler. Plan ahead and schedule messages to be sent at a specific time, ensuring important messages are delivered on time and you never miss an important appointment or deadline.

► News and Updates: Stay informed and up to date with the latest news and updates through the dedicated news section in Messenger Duo. Get notified about new features, tips, and tricks to make the most out of your Messenger experience.

◉ Quickly Send Messages to People Not in Your Contacts: Save time and hassle by sending messages to non-contacts directly without adding them first.

► Voice Changer: Spice up your conversations and have fun with the voice changer feature. With a variety of voice effects to choose from, you can transform your voice into something unique and surprise your friends during calls or voice messages.

◉ Translate Messages: Break down language barriers and connect with friends from around the world. Messenger Duo features a built-in translation tool that allows you to translate messages in real-time, facilitating seamless communication regardless of the language you or your contacts speak.

► Status Quotes: Express yourself and share your thoughts with captivating status updates. Messenger Duo provides a variety of customizable status options, including text, allowing you to showcase your creativity and engage with your contacts in a unique way.

◉ Messenger on Apple Watch: Stay updated and reply to messages directly from your Apple Watch with the Messenger Duo app. Receive notifications, view chats, and send quick replies right from your wrist, ensuring you never miss an important conversation.

Disclaimer:
This is an UNOFFICIAL tool for WhatsApp Messenger.
We are NOT affiliated, associated, authorized, endorsed by, or in any way officially connected with WhatsApp LLC, or any of its subsidiaries or affiliates. Usage falls within guidelines of ""fair use"".

EULA:
https://www.freeprivacypolicy.com/live/0520f9a1-d8b4-47e5-ba82-43a7f1dc68e8",2017-11-28T03:41:10Z,2025-06-16T06:49:11Z
cy,Cyprus,Social Networking,6005,24,564177498,"VK: social network, messenger",V Kontakte OOO,https://apps.apple.com/cy/app/vk-social-network-messenger/id564177498?uo=4,0.0,3.72967,492,Social Networking,"VK unites tens of millions of people by offering unlimited features for communication, dating, entertainment, business and sharing news from anywhere around the world. On the app, you can listen to music, watch videos and clips, keep track of your health, play games, and shop.

Stay in touch with friends and family. In the messenger, you can chat in group chats and private messages with both friends on VK and people from your phone’s contacts. Bring together an unlimited number of people in video calls, all for free with no time limits.

VK has social media solutions for a wide variety everyday situations:

- Discover everything one of the largest social networks in the world has to offer. Meet new friends and join online communities. Stay close with faraway friends using the messenger and VK Calls.
- Listen to the music you love and easily find your new favorite songs thanks to personalized recommendations.
- Watch and create VK Clips, short vertical videos covering a wide range of themes.
- Enjoy live streams, share pictures, play games, and read interesting news in thematic feeds.
- Learn something new in podcasts and upload your own.
- Keep track of your health and stay in shape. Use VK Health to compete with your friends and see who can walk the most. Your steps are counted thanks to Apple Health. So take a nice long walk, and try to get to the top of the leaderboard!

Terms of Service: vk.com/terms
Privacy Policy: vk.com/privacy",2012-10-04T00:12:14Z,2025-11-19T16:32:06Z
cy,Cyprus,Social Networking,6005,25,1459645446,BeReal: Photos & Friends Daily,BeReal,https://apps.apple.com/cy/app/bereal-photos-friends-daily/id1459645446?uo=4,0.0,4.78066,4582,Social Networking,"BeReal is the simplest photo-sharing app where you and your friends post once a day to show what you’re really up to.

Every day at a random time, everyone gets the same two-minute window to take and share a photo. The camera snaps both the front and back simultaneously, capturing the real moment. No filters — just real life, as it happens.

You won’t find influencers here. You’ll find your friends making coffee, walking to class, lying on the floor, laughing at nothing, or stuck in traffic. It’s not about looking perfect. It’s about being present and staying connected in a way that’s honest, unfiltered, and sometimes unintentionally hilarious.

Post on time or post late—it still counts. Comment, react with your face using RealMojis, or just scroll through your circle’s day. Your BeReal feed is private by default, unless you choose to go public and see what others are up to around the world.

If you’re tired of chasing clout and scrolling endless edits, BeReal is your once-a-day reset. One daily notification. Two minutes. Real friends, real moments.

Download BeReal and join the social network that’s not trying to be one.",2020-02-27T08:00:00Z,2025-11-18T11:05:09Z
