country,country_name,category,genre_id,rank,app_id,app_name,developer,url,price,averageUserRating,userRatingCount,primaryGenreName,description,launch_date,update_date
pa,Panama,Sports,6004,19,382002079,OneFootball: Resultados Fútbol,Onefootball GmbH,https://apps.apple.com/pa/app/onefootball-resultados-f%C3%BAtbol/id382002079?uo=4,0.0,4.86723,4941,Sports,"TODA LA ACCIÓN DEL FUTBOL MUNDIAL
Sigue todas las noticias, resultados, calendarios, alineaciones, minuto a minuto, estadísticas, substituciones de todos los partidos a nivel mundial

EL MUNDO DEL FUTBOL EN UNA APP
Todo lo que necesitas saber: resultados, calendarios, tablas, noticias, estadísticas, videos y transferencias

TODOS LOS EQUIPOS Y COMPETENCIONES
- Futbol mexicano: Liga MX, Copa MX, Liga Premier, Liga Ascenso, Liga MX Femenil, Selección Mexicana, el Tri
- Futbol europeo: Serie A, La Liga, Premier League, Bundesliga, Eredivisie, Champions League, Europa League 
- Futbol internacional: CONCACAF Nations League,, CONCACAF Champions League, MLS, Copa Libertadores, Copa Sudamericana, Mundial de Clubes

PARTIDOS EN VIVO Y LAS MEJORES JUGADAS
Si vives en España o América Latina, puedes ver partidos en vivo y compilados con las mejores jugadas de ciertas competiciones europeas y globales, como la Bundesliga Austríaca, la Liga Polaca, la Super Liga India y muchas otras más. ¡No te lo pierdas!

RESULTADOS Y PARTIDOS EN DIRECTO DEL FUTBOL MUNDIAL
Sigue todos los resultados y partidos en directo de tus equipos favoritos y fútbol mundial

NOTICIAS DE FUTBOL,
Mantente actualizado de todas las noticias del futbol mundial con la plataforma mas completa
- Newsroom de OneFootball: un equipo de periodistas y editores especializados en fútbol trabajando 24 horas al día porque el fútbol nunca descansa
- Blog Network de OneFootball: accede a los contenidos creados por un selecto grupo de bloggers y creadores seleccionados alrededor del mundo
- Club Network de OneFootball: recibe las noticias al momento y directamente de la fuente oficial gracias a las cuentas de clubes como las Chivas, Real Madrid, Manchester City, Mónaco y muchos más

VIDEOS DE FUTBOL
Mira entrevistas, resultados, resumen de partidos, goles, clips de futbol y mucho más.

TODO EL MERCADO DE FICHAJES
Todas las noticias y rumores del mercado de fichajes. Entérate de los estatus de los traspasos incluyendo los valores y resultados de cada negociación.

GUIA DE TV
Descubre dónde se transmitirán partidos seleccionados de tus ligas y competencias favoritas*
* Disponible solo para usuarios en los siguientes países: Alemania, Brasil, Francia, España, Estados Unidos, Italia, México y Reino Unido.

VENTANA DEL MERCADO DE FICHAJES
Mantente siempre un paso adelante con todas las noticias de fichajes de este verano.
- Recibe actualizaciones instantáneas sobre rumores, fichajes confirmados y análisis detallados de cada movimiento importante.
- La cobertura exclusiva de OneFootball te garantiza no perderte ninguna historia de fichajes, desde los primeros rumores hasta los anuncios oficiales.
- No te pierdas ni un solo fichaje: OneFootball es tu fuente de referencia para una cobertura completa esta temporada.

Para consultas y recomendaciones, escríbenos a feedback@onefootball.com
Facebook: Facebook.com/OneFootball
Twitter: @OneFootball
Instagram: OneFootball
Política de privacidad: https://static.onefootball.com/legal/app-privacy-policy/es
Términos de uso: https://static.onefootball.com/legal/terms-of-use/es
Términos de uso de Apple: https://www.apple.com/legal/internet-services/itunes/dev/stdeula/",2010-07-16T22:34:08Z,2025-11-21T11:25:43Z
pa,Panama,Sports,6004,20,1633729778,Cubitt Jr + Teens,Kenex Trading SA,https://apps.apple.com/pa/app/cubitt-jr-teens/id1633729778?uo=4,0.0,4.11111,9,Sports,"Cubitt Jr + Teens your daily health and sport partner

Why use Cubitt Jr + Teens app?
1. Pedometer: Count your steps, calories, active time, distance.
2. Sleep Tracker: Record and analysis your sleeping.
3. Notification reminder: Never miss notification on your phone.
4. Heart Rate support: Measure you Heart Rate and save your log.
5. Sport Tracker: Track your sport performance with the activity modes
6. Apple health: Supports syncing your data to Apple Health (HealthKit).
7. Daily tracker: Record your daily exercise, and share to your friends.
8. Sport Plan: Develop your own sports plan.
9. Games: choose your favorite and play to win. 
10. Good habit alarm: make you schedule to remember good habits.",2022-08-17T07:00:00Z,2025-10-01T00:49:13Z
pa,Panama,Sports,6004,21,484672289,NBA App: basketball y noticias,"NBA MEDIA VENTURES, LLC",https://apps.apple.com/pa/app/nba-app-basketball-y-noticias/id484672289?uo=4,0.0,4.80328,183,Sports,"Toda la NBA. A un toque de distancia.

Accede gratis y al instante a las últimas noticias, puntuaciones, historias detrás de escena y momentos destacados de los partidos.

No hay una manera más fácil de estar al día de la NBA.

Con la aplicación gratis de la NBA, los aficionados tienen acceso a los siguientes recursos:
- Puntuaciones, estadísticas y clasificaciones de todos los partidos que se actualizan en tiempo real
- Las últimas noticias del básquetbol, momentos destacados, avances y resúmenes de los partidos
- Historias de toda la NBA para seguir de cerca la acción
- Series originales para vivir la liga desde adentro, como “Pass the Rock”, “Chasing History” y muchas otras más
- Novedades en vivo personalizadas sobre tus equipos y jugadores favoritos
- Acceso gratuito en vivo a las conferencias de prensa posteriores a los partidos
- Juegos gratuitos para poner a prueba tus conocimientos de básquetbol con NBA Play

¿Quieres más? Mira partidos en vivo con NBA League Pass y disfruta de tus equipos y jugadores de la NBA favoritos.

Los suscriptores de NBA League Pass tienen acceso a los siguientes recursos:
- Transmisiones de partidos de la NBA en vivo y bajo demanda*
- Transmisiones alternativas, incluidas Strategy Stream y Hoopervision
- Presentadores en idioma local
- Datos con estadísticas de jugadores, puntuaciones de otros partidos y probabilidades en vivo, sin dejar el partido
- Transmisiones de partidos optimizadas para ver en teléfonos y tabletas
- Acceso a transmisiones disponibles 24/7 de NBA TV y contenido de estudio**
- Acceso a los archivos de la NBA para ver los partidos y los momentos más memorables

Los suscriptores de League Pass Premium tienen acceso a los siguientes recursos:
- Acceso a la NBA en todo momento, con la posibilidad de descargar los partidos para verlos luego, sobre la marcha o sin conexión
- Transmisiones libres de anuncios en hasta 3 dispositivos
- Espectáculos desde el estadio durante los descansos del partido, para que te sientas como si estuvieras allí

* Se aplican suspensiones y restricciones en EE. UU. y Canadá.
** NBA TV no está disponible en algunos mercados: Bielorrusia, China, Italia, Myanmar, Rusia, España.

¿Hay beneficios gratis para los aficionados? Con NBA ID, claro que sí. Regístrate y obtén acceso a los siguientes recursos:
- Beneficios exclusivos para miembros, como sorteos gratis de entradas y ofertas de productos
- Noches de partidos en vivo y contenido exclusivo gratuitos
- Beneficios diarios durante NBA ID Member Days
- Experiencias mejoradas en eventos de la NBA 
- Votaciones sobre los mejores momentos de la liga e influencia sobre los partidos
- Insignias que puedes ganar y mostrar a los demás aficionados

Juega gratis con NBA Play y pon a prueba tus conocimientos sobre básquetbol. Entre los juegos, se incluyen:
Full Court Guess
Hoop Connect
NBA IQ
NBA Rank
Player Path
NBA Blast
Juegos de preguntas

Los suscriptores actuales de NBA League Pass y NBA TV pueden acceder a su suscripción iniciando sesión en la aplicación.

Con la compra NBA League Pass o NBA TV, se te facturará automáticamente a través de Apple cada 30 días (paquetes mensuales) o cada 365 días (paquetes anuales), hasta que canceles tu suscripción. Los reembolsos no están disponibles una vez que se activan las suscripciones.

Visita support.watch.nba.com para comunicarte con el equipo de asistencia si tienes algún problema.

Condiciones de uso: http://www.nba.com/news/termsofuse
Política de privacidad: http://www.nba.com/news/privacy_policy.html",2011-12-21T05:03:51Z,2025-11-18T22:10:59Z
pa,Panama,Sports,6004,22,545609647,LALIGA App Oficial - 2025/26,Liga Nacional de Futbol Profesional,https://apps.apple.com/pa/app/laliga-app-oficial-2025-26/id545609647?uo=4,0.0,4.83547,699,Sports,"¡ARRANCA LA TEMPORADA DE LALIGA 2025/2026!

Sigue el fútbol en vivo minuto a minuto y las noticias del inicio de la liga española. La ilusión de los nuevos fichajes y los objetivos de cada equipo marcan cada jornada desde el primer momento. ¡Toda la emoción del arranque de la temporada y el mercado de fichajes más caliente en la app de fútbol y marcadores!

LALIGA APP Oficial te ofrece lo que buscas en las mejores aplicaciones de fútbol, pero en una sola: marcadores de fútbol, noticias, vídeos de goles y las alineaciones. ¡Ahora puedes entérate de los últimos fichajes de LALIGA 2025/2026 antes que nadie!

◉ Consulta al instante todos los resultados de fútbol, alineaciones y goles.

Disfruta de los partidos de fútbol como nunca hasta ahora y disfruta aún más de tu equipo favorito: FC Barcelona, Real Madrid, Atlético de Madrid, Real Betis, Sevilla FC… ¡Todos están en LALIGA App Oficial! Sigue en directo los resultados de ElClásico o el derbi del momento.

◉ Permanece siempre actualizado e infórmate en la aplicación de las noticias de LALIGA EA Sports en un solo sitio y accede a todos los resúmenes, jugadas y goles de tu equipo favorito y jugadores como Mbappé, Lamine Yamal o Nico Willliams. Además, recibe las últimas novedades del mercado de fichajes.

¡Vive toda la fuerza de nuestro fútbol! A diferencia de otras aplicaciones de fútbol, también podrás encontrar resultados de otras competiciones: Copa del Rey, UEFA Champions League, UEFA Europa League, Premier League, Bundesliga, Seria A y otras competiciones. Últimas noticias de fútbol español e internacional, con todos los movimientos del mercado de fichajes, horarios y resultados de fútbol.

◉ Funcionalidades de LALIGA App Oficial:

▶ ¡Mercado de fichajes! Desde el 1 de julio al 31 de agosto. Consulta las altas y bajas de LALIGA EA SPORTS y LALIGA HYPERMOTION. Puedes ver los últimos fichajes del fútbol español en tiempo real y la evolución del mercado.

▶ Horarios y estadísticas: Toda la información que buscas de LALIGA 2025/2026, Copa del Rey, UEFA Champions League, UEFA Europa League, Liga F, Premier League, Bundesliga, etc.

▶ Resultados de fútbol y marcadores: La aplicación para ver partidos de fútbol minuto a minuto y seguir cada detalle de los partidos de la liga española.

▶ ​​Resúmenes de fútbol: mejores momentos y resultados de fútbol del FC Barcelona, Real Madrid, Real Betis, Sevilla FC y de todos los equipos de la liga española.

▶ Vídeos en vertical: Comparte con tus amigos todos los momentos del partido en un instante y crea comunidad alrededor de tu equipo.

▶ Zona MILIGA: Entra en MILIGA y consigue grandes ventajas exclusivas de los patrocinadores oficiales de LALIGA. Participa en encuestas y sorteos exclusivos para fans, haz tus pronósticos de la temporada y consigue premios únicos.

▶Sección “Mi equipo favorito”: Personaliza la app con los colores y contenidos de tu equipo de la liga española para acceder de forma rápida y sencilla a los próximos partidos y los partidos jugados, marcadores de fútbol, datos del club, plantilla, alineaciones, goles y estadísticas, resúmenes, previas y todas las noticias de tus equipos favoritos.

▶ Sección “Equipos”: También podrás dar seguimiento al contenido actualizado con fotografías y vídeos, resultados de fútbol y los horarios de los clubes que elijas.

▶ Noticias: Recibe las últimas noticias, resultados de fútbol en directo, jugadores, pichichi, ligas nacionales, competiciones europeas y comunicados oficiales de LALIGA 24-25. Disfruta de los mejores goles, resúmenes y noticias de la liga.

▶ Notificaciones: Configura y personaliza las alertas de LALIGA App Oficial para estar al tanto de los partidos en directo de tus equipos favoritos y mantenerte al día sobre los fichajes, los resultados de fútbol y las noticias.

¡Descárgate la aplicación para ver partidos en vivo minuto a minuto y seguir los resultados de fútbol, fichajes, goles y noticias de tus equipos favoritos!",2012-08-01T18:08:31Z,2025-10-06T05:52:41Z
pa,Panama,Sports,6004,23,1243599288,Fanatiz,Fanatiz SpA,https://apps.apple.com/pa/app/fanatiz/id1243599288?uo=4,0.0,5,1,Sports,"Fanatiz te permite mirar el deporte que amas, donde sea que viajes, te mudes o vivas. 100% legal, oficial y seguro.

Instala la app Fanatiz y comienza a ver de inmediato y en HD el mejor fútbol y deporte de Sudamerica y el mundo. Mira en vivo o a demanda, en idioma original y otros, partidos, resumenes, estadísticas, entrevistas y documentales de ligas como la Liga Profesional de fútbol de Argentina o el Brasileirão de Brasil, entre tantas. Accede a través de múltiples dispositivos, sin cortes ni interrupciones.

FÚTBOL DE SUDAMERICA Y EUROPA, CANALES EN VIVO, DEPORTES DE TODO EL MUNDO Y MÁS VIVEN EN FANATIZ

• Copa Libertadores, Sudamericana y Recopa Sudamericana (ES, EN)
• Liga Profesional de Fútbol de Argentina y Copa de Argentina completos; previas, resumenes, estadísticas, entrevistas y documentales de AFA Play; la transmisión completa 24/7 de TyC Sports Internacional (ES, EN)
• Brasileirāo A y B completos, Copa do Brasil, Estaduales; previas, resumenes, estadísticas, entrevistas y documentales de Brasileirāo Play (PT-BR, EN)
• Ligue 1 y Ligue 2 de Francia completos, Primeira Liga de Portugal y Superlig de Turquia con partidos seleccionados (EN, ES, FR)
• Liga BetPlay Colombia, LigaPro Ecuador, Liga 1 Peru y Primera Division Uruguay con partidos seleccionados (ES)
• +10 canales de deportes en vivo como TyC Sports Internacional, beIN Sports, GolTV, etc.
• +2000 horas de contenidos a demanda (VOD) como partidos, resumenes, entrevistas y más.
• 100% legal y oficial. En idiomas originales. Pruebalo gratis y cancela cuando quieras.

** Este contenido solo está disponible en algunos países. Consulta la aplicación o el sitio web para conocer la disponibilidad en tu país de residencia o al que viajes. **

PERSONALIZA TU EXPERIENCIA FANATIZ, DISFRUTANDO CUÁNDO Y CÓMO QUIERAS

• Selecciona los equipos de tu interés para acceder más rápido a todas las estadísticas, consultar resultados anteriores y recibir alertas personalizadas.
• Fanatiz está disponible en iPhone, iPad, Apple TV, Roku, Amazon Fire TV; míralo con Chromecast, Airplay y a través del sitio web.
• Para disfrutar los partidos y deportes que te apasionan con Fanatiz, sólo debes contar con una conexión estable a internter. Todo se transmite en la mejor calidad que tu dispositivo soporte, hasta HD.
• Mira el contenido en vivo o a demanda (VOD), para revivirlos cuando quieras.

** La disponibilidad y duración de los contenidos en el servicio VOD varía. **

El pago se cargará a la cuenta de iTunes en la confirmación de la compra y tu suscripción se renovará automáticamente a menos que la renovación automática se desactive al menos 24 horas antes del final del período actual.

Se cobrará a la cuenta la renovación dentro de las 24 horas anteriores al final del período actual e identificará el costo de la renovación. Las suscripciones pueden ser administradas por el usuario y la renovación automática puede desactivarse yendo a la configuración de la cuenta del usuario después de la compra.

Términos y condiciones: https://www.fanatiz.com/terms-and-conditions/
Política de privacidad: https://www.fanatiz.com/privacy-policy-2/",2017-06-27T22:15:55Z,2025-08-19T17:34:07Z
pa,Panama,Sports,6004,24,1567932355,DUPR,DUPR LLC,https://apps.apple.com/pa/app/dupr/id1567932355?uo=4,0.0,4,1,Sports,"DUPR uses an innovative rating algorithm engineered to grow the sport of pickleball with a commitment to accuracy, transparency, and adaptability.


LOG MATCHES

Start increasing your rating today by registering and recording all your matches!
Log your recent matches. Once you’re done, your opponent will be prompted to verify scores via email.


GET YOUR DUPR
 
Your rating will be updated immediately once your scores are verified by your opponent 
You may review your match history at any time.
 

FIND PLAYERS NEARBY 

Browse DUPR user profiles - see the match history, ratings, and approximate location of potential opponents and teammates.


Subscription Information

DUPR offers in-app subscriptions that provide exclusive features, an ad-free experience, and other benefits.


EULA

https://www.apple.com/legal/internet-services/itunes/dev/stdeula/",2023-06-22T07:00:00Z,2025-11-17T15:15:41Z
pa,Panama,Sports,6004,25,835022598,Formula 1®,Formula One Digital Media Limited,https://apps.apple.com/pa/app/formula-1/id835022598?uo=4,0.0,4.9095,674,Sports,"Experience Formula 1 like never before with our official app!

Your one-stop hub keeps you updated with the latest F1 news, thrilling highlights, race results, action-packed videos, real-time results and detailed schedules.

Stay ahead of the curve with:
•	The latest F1 news and expert technical analysis
•	Race weekend schedules and real-time results
•	Manage your F1 Fantasy team 
•	Free Leaderboard with live timings
•	Driver and conductor standings 

For F1 TV Access® subscribers, unlock a world of exclusive content including:
•	Live telemetry data and session insights, including comprehensive tyre Information, lap times, speed and DRS.
•	Real-time interactive Driver Tracker Maps
•	Live English audio commentary
•	Listen to the drama unfold with the best of Team Radio

Download now for your ultimate companion into the world of Formula 1.

How to subscribe to F1® TV

F1® TV puts you in the driving seat – with race highlights, live timing and live streaming (available only in certain countries). You can subscribe to F1® TV with an annual or monthly subscription. 

Subscriptions renew automatically, unless you turn off auto-renew at least 24 hours beforehand. You can turn off auto-renew at any time through your iTunes account.

Terms of use: https://account.formula1.com/#/en/terms-of-use
Subscription terms and conditions: https://account.formula1.com/#/en/subscription-terms
Privacy policy: https://account.formula1.com/#/en/privacy-policy",2014-03-07T20:28:58Z,2025-11-17T11:16:55Z
