country,country_name,category,genre_id,rank,app_id,app_name,developer,url,price,averageUserRating,userRatingCount,primaryGenreName,description,launch_date,update_date
pw,Palau,Food & Drink,6023,19,758103884,foodpanda: Food & Groceries,Internet Services Polen Sp. z o.o.,https://apps.apple.com/pw/app/foodpanda-food-groceries/id758103884?uo=4,0.0,4.8,15,Food & Drink,"Discover the local choice for meals, groceries, and food delivery with foodpanda!

Life can get overwhelming, but we’re here to help! Whether you need daily meals, groceries, or shopping essentials, foodpanda has got you covered with convenient food delivery.

Order Your Favourite Food with Just 3 Simple Taps!

With foodpanda, you can easily choose the food you love, and we’ll deliver it right to your door. Serving millions across over 400 cities in 11 Asian markets — Singapore, Hong Kong, Thailand, Malaysia, Pakistan, Taiwan, the Philippines, Bangladesh, Laos, Cambodia, and Myanmar — foodpanda is your go-to for everyday food delivery.

Endless Food and Grocery Delivery Choices at Your Fingertips!
Hungry for wood-fired pizza, a classic burger or fried chicken? We know the best restaurants near you – big famous brands and tiny local faves. Best part? We've got exclusive discounts and promos waiting for all new foodies. With a simple click, your food and groceries are on their way with fast delivery!

Need Groceries? We’ve Got You Covered!
Want to cook but short on time? Imagine having fresh produce, pantry staples, frozen goods, personal care items, your cute pets' needs, and much more, delivered in a flash — everything you need for a hassle-free home-cooked meal, all available through our speedy groceries delivery service from foodpanda shops and pandamarts.

Best Food and Grocery Delivery Deals Just for You!
Looking for the best savings on groceries and food? We regularly update our daily deals, personalised just for you! Here’s a tip: skip the queue and choose self pick-up for extra savings on your grocery orders, or enjoy the convenience of our food delivery options.

Save on tasty takeaways.
On the go? Try pick-up! Skip the queue and save up when you self-collect your order.

Worry-free package delivery.
Need to send or receive a parcel? Go with pandago. Our reliable fleet and on-demand delivery service will safely deliver it for you in no time.

Our tech is shaped by you.
Explore personalised offers and delicious picks just for you. Dish out what you feel about your order and let foodies know what’s yum. 

Want More? Join pandapro!
Unlock even greater savings on food delivery and grocery options with our pandapro membership today!

Live like a panda and let us take care of the rest — let’s do it the panda way with seamless food delivery!

For more info, please visit our website.",2013-11-25T18:13:11Z,2025-11-22T08:33:03Z
pw,Palau,Food & Drink,6023,20,596011949,HungerStation - Food Delivery,HungerStation LLC,https://apps.apple.com/pw/app/hungerstation-food-delivery/id596011949?uo=4,0.0,4.59999,15,Food & Drink,"HungerStation – The First and Biggest Delivery App in Saudi Arabia

Whatever you need, HungerStation delivers it to you before anyone else. From your favorite restaurants, groceries, and pharmacies, to gifts and flowers. Our coverage reaches over 102 cities and regions across the Kingdom, with more than 55,000 restaurants and stores ready to serve you anytime.

Why HungerStation?
Because we’re the largest in Saudi Arabia: more than 55,000 restaurants and stores at your fingertips.

Variety that matches your cravings: whether it’s Pizza, Shawarma, Sushi, Sandwiches, Fresh Salad, Fast Food, Ice Cream, Coffee, Bakery treats, Japanese dishes, or authentic Arabic meals, you’ll always find what you’re looking for. Plus, you can enjoy international cuisines, traditional favorites, healthy options, organic products, and more.

Not just restaurants!

HungerStation Market: groceries, fresh fruits and vegetables, and cleaning products.

Pharmacies: from medicine to daily personal care.

Flowers & Gifts: want to surprise someone? Order now and we’ll deliver their gift wherever they are.

Payment your way: cash, card, or Apple Pay.

Daily deals & discounts tailored for you.

HungerStation Plus: unlimited free delivery from over 35,000 restaurants, stores, and pharmacies.

How to order? Just 4 easy steps:
1- Download the HungerStation app and set your location.
2- Choose a restaurant or store you like.
3- Browse the menu and add your favorites to the cart.
4- Order and relax, your order is on the way.

What makes us stand out?
Track your order step by step until it arrives.
Smart filters and search help you find the best restaurants and deals.
Real customer reviews to guide your choice.
24/7 customer support.
Schedule your order and get it delivered at the time that suits you.

New to HungerStation?
Enjoy a full year of unlimited free delivery from over 35,000 restaurants and stores as soon as you sign up.

HungerStation is more than just an app! It’s your shortcut to saving time and effort. Order in a few taps and rest assured, everything will arrive quickly and with quality.

Download HungerStation now.


HungerStation Before Everyone.",2013-02-02T19:29:38Z,2025-11-19T07:29:35Z
pw,Palau,Food & Drink,6023,21,6444784506,Chicken Inn,SIMBISA INTERNATIONAL FRANCHISING LIMITED,https://apps.apple.com/pw/app/chicken-inn/id6444784506?uo=4,0.0,0,0,Food & Drink,"Order food delivery from Chicken Inn.

Download the app from the App Store, choose your location and we'll present you with personalised location-based Chicken Inn restaurant offerings.

We offer the ability of ordering food for delivery from Chicken Inn restaurants.",2023-08-01T07:00:00Z,2025-11-20T09:11:59Z
pw,Palau,Food & Drink,6023,22,1481818660,CibouScan - You Scan,henri gil,https://apps.apple.com/pw/app/cibouscan-you-scan/id1481818660?uo=4,0.0,5,15,Food & Drink,"CIBOUSCAN: Scan Your BEAUTY & FOOD Products – Health Score, Nutri-Score, NOVA and Recipes

CIBOUSCAN is the must-have app to take care of your health, your skin and the planet.
Scan your beauty products and groceries in seconds to see their full ingredients, health score, Nutri-Score, NOVA, additives, and find better alternatives that suit you.

Beauty: your bathroom under control
	•	Scan your cosmetics (skincare, body care, hair care, makeup, perfume).
	•	Get a complete health score for each product: ingredients list, controversial additives, potential impact on your health.
	•	Check the compatibility with your skin type, specific needs or allergies.
	•	Read real user reviews to choose wisely before buying.
	•	Create your personalized beauty routine and get a routine score to track and improve your habits every day.

Food: scan, decode, cook
	•	Scan your food products to see their Nutri-Score, NOVA, and any additives.
	•	Discover personalized recipes based on your food preferences, favorite or blacklisted products, allergies, diet and the season.
	•	Easily view your scan history to track your consumption over time.
	•	Get smart flexitarian recommendations designed to reduce your environmental impact while eating deliciously.

Practical, complete and privacy-friendly
	•	No account required: use all features completely anonymously.
	•	Works with and syncs automatically to the CIBOULETTE app if you already have it.
	•	One smart assistant for your beauty choices, grocery shopping, Nutri-Score and NOVA – all in one app.

Why choose CIBOUSCAN?
	•	One app to scan both BEAUTY and FOOD products.
	•	Access to health scores, Nutri-Score, NOVA, additives, skin compatibility.
	•	Real user reviews to help you compare and decide.
	•	Personalized recipes for healthy eating without frustration.
	•	A flexible and kind approach: better choices without forbidding what you love.
	•	Everything is anonymous, practical and made for you.

Download CIBOUSCAN now and join the CIBOULETTE team to shop smarter, eat better and take care of yourself and the planet.

** CibouScan is not affiliated with any other apps

Try Premium:

Upgrade to Premium for an ad-free experience. Subscriptions are billed to your Apple account and auto-renew unless turned off in App Store settings. Any unused portion of the free trial is forfeited upon purchase of a subscription.

- PREMIUM SUBSCRIPTION -

Premium gives access to all the features of the application!

The subscription will be billed in a single payment. Payment is made through iTunes account at confirmation of purchase.
The subscription will renew automatically within 24 hours before the end of the subscription. Your account will be debited 24 hours before your existing subscription ends, at the same price you paid the first time.
You can manage your subscription and auto-renewal by receiving you in your account settings after purchase.
If you pay for your subscription before the trial period expires, the remaining free trial period will be forfeited.

CGU / CGV: https://weblogit.co.uk/cgu.html
Privacy: https://weblogit.co.uk/privacy.html



We keep in touch ?
- Instagram : https://www.instagram.com/ciboulette.app/
- Site : https://ciboulette.app/
- Mail : henri@ciboulette.app - lisa@ciboulette.app",2019-10-02T07:00:00Z,2025-11-17T11:29:05Z
pw,Palau,Food & Drink,6023,23,960335206,Blinkit: Grocery in 10 minutes,BLINK COMMERCE PRIVATE LIMITED,https://apps.apple.com/pw/app/blinkit-grocery-in-10-minutes/id960335206?uo=4,0.0,4.83333,36,Food & Drink,"Blinkit is India’s last minute app. Trusted by millions, it is your everyday online grocery shopping app that home-delivers 10,000+ daily groceries in just a blink. Buy milk products, fresh fruits & vegetables, daily grocery, kitchen, home & office items by shopping for them online on Blinkit. Enjoy easy and smooth app experience with quick delivery.

- Best price and quality fresh fruits & vegetables
- Milk, curd, bread, butter, eggs, cheese, paneer & other daily grocery
- Snacks, biscuits, chips, ice cream, chocolates
- Cold drinks, ice, bottle opener
- Atta, rice, dal, oil, masalas, noodles
- Personal care, detergent, cleaning supplies
- Diapers & baby care
- Pet food
- Bulbs, batteries, mobile chargers
- Emergency medicines, thermometer
- Kitchen tools like chopper, blender, grinder
- Puja needs
- Stationery
- Smart watches, LED lights, Headphones



Beauty & skincare store
Makeup, luxury beauty brands & everyday skincare – now on Blinkit! Shop a huge range of authentic makeup, bath & body, hair care products, beauty accessories & much more!

Electronics store
Wireless or bluetooth earphones? Check. Smart watches? Yes. LED lights? Absolutely! Shop affordable and latest electronics online at best prices, only on Blinkit.

Safe and quick grocery delivery app
The average driving speed for Blinkit (formerly Grofers) delivery agents is 20kmph, since we have a grocery delivery store located every 2 km to instantly serve you.

Many safe payment options
Do your grocery shopping online on Blinkit & pay safely and securely for your groceries with UPI, COD or cards / wallets / netbanking / buy now pay later. We accept Sodexo meal pass and Paytm food wallet too.

Authentic phone accessories
We don’t want you to wait for the most premium and authentic phone accessories out there – which is why you can get them in minutes on Blinkit.

Printouts delivered in minutes
With Blinkit, you can get a printout of anything delivered in just minutes. With convenient options of both black & white and coloured prints, get all your documents sorted instantly!

Low prices, amazing offers
Blinkit (formerly Grofers) offers you big discounts and savings on daily grocery, bundles and bank offers. We give the best prices on online groceries with our monthly House Full Sale!

Live order tracking & helpful customer support
Track your grocery order online, right from your payment being confirmed to the delivery of your groceries. In case you need help, simply tap & chat with our customer support executives who are always ready to assist you.

Delivering groceries in 20+ cities
Instantly do your grocery shopping online! Get delivery of milk, vegetables, bread, snacks & more on the Blinkit app in Ahmedabad, Bengaluru, Chandigarh, Chennai, Delhi, Faridabad, Gurgaon, Hyderabad, Jaipur, Jalandhar, Kanpur, Kolkata, Lucknow, Ludhiana, Meerut, Mohali, Mumbai, Panchkula, Pune, Noida, Ghaziabad, Vadodara & Zirakpur.

Huge variety of local & international brands
Blinkit (formerly Grofers) grocery delivery app has a huge variety of shopping brands available online, including local specialities. In fact, Blinkit has brands you won’t find anywhere else. You can get delivery of daily grocery, festival special products, and even gourmet and international foods! Get the latest products from leading brands like boAt, The Wishing Chair, Ekam, MasterChow, The Body Shop, Farmley, Engage, The Whole Truth, The Moms Co, SuperBottoms, Tropicana, Nestle, Coca Cola, Lay’s, Harvest, Ferrero, Toblerone, Oreo, Nutella, Starbucks, Clinique, Kama Ayurveda, L'Occitane, Innisfree, Davidoff, Rage Coffee, Lindt, Starbucks, Blue Tokai, Sleepy Owl, Wingreens Farms, Bagrry's, Gunsberg, Jade Forest, Jimmy's Cocktails, Eveready, Nivea, Garnier, Lakmé, Haldiram's, Bikano, Heinz, Vahdam, Dettol, Cadbury, ITC, Colgate Palmolive, PepsiCo, Durex, Licious, Aashirvaad, Saffola, Patanjali, Fortune, 24 Mantra, TGL Co., Nestle, Amul, Dabur, & many more.",2015-03-04T05:39:34Z,2025-11-18T11:03:18Z
pw,Palau,Food & Drink,6023,24,312101965,Epicurious,Advance Magazine Publishers Inc.,https://apps.apple.com/pw/app/epicurious/id312101965?uo=4,0.0,0,0,Food & Drink,"The ultimate recipe resource for curious home cooks.

Discover more than 50,000 recipes from the biggest names in cooking — including Epicurious, Bon Appétit, Gourmet, HarperCollins, and more — with the new Epicurious app. Reimagined, redesigned, and ready to help you find recipes that you’ll love to cook and share, the new Epicurious app is the sidekick you need to be a hero in the kitchen. 

ENDLESS CHOICES
Discover 50,000+ test-kitchen perfected recipes from cooking’s biggest names, including Epicurious, Bon Appetit, Gourmet, and HarperCollins. 

VIDEO
You can now find recipes through fun and engaging videos. Watch along to help you cook delicious dishes at home.

ROBUST SEARCH AND SAVE OPTIONS
What Do You Want to Cook? Advanced search functions make it easy to find exactly what you’re looking for. Search our entire catalog by meal, diet, occasion, ingredients and more. Save your favorites so they are always close at hand. 

RECOMMENDATIONS TO YOUR TASTE
Personalized settings and recommendations mean you can adjust your Epicurious app experience at any time for customized recipes tailored to you.

iPAD COMPATIBILITY
Enjoy the entire Epicurious app experience on a larger screen, with high-resolution photos and more.

ADDED BENEFITS
If you’re already an epicurious.com or bonappetit.com subscriber, log in for unlimited access to the Epicurious app now. 

Or, subscribe in the app, and start enjoying full access on both epicurious.com and bonappetit.com and all 50,000+ recipes, plus instructional videos, expert advice, kitchen product reviews and cooking technique tutorials.
 
Choose from two subscription options: 

- Monthly subscription to the new Epicurious app: $4.99. Cancel anytime.
- Annual subscription to the new Epicurious app: $39.99 (save 33% off the monthly price). Non-refundable. Cancel anytime.

The app is free to download. Subscribers receive unlimited access to recipes. Users need to be subscribed and logged in to access recipes in the app. Non-subscribers may access the recipes by starting a free trial.  If you used an earlier version of the Epicurious app, you can access your library of saved recipes in the new app by signing in with the same email address associated with your previous account. Users who have trouble accessing recipes can e-mail us at apps@epicurious.com for assistance.

The subscription includes a 1 month free trial, after which it will automatically renew unless auto-renew is turned off at least 24 hours before the end of the current period. Account will be charged for renewal within 24 hours prior to the end of the current period and will state the cost of renewal. Subscriptions may be managed by the user, and auto-renewal may be turned off by updating the user’s App Store Subscription settings after purchase. Any unused portion of a free trial period, if offered, will be forfeited when the user purchases a subscription to that publication, where applicable. Payment will be charged to iTunes account at confirmation of purchase.

Please Note: Users can cancel their subscription anytime from App Store settings.

The Epicurious app requires iOS 14 or above.

Information about our Terms of Use & Privacy Policy can be found at
- Privacy policy: https://www.condenast.com/privacy-policy
- Terms of Use: https://www.condenast.com/user-agreement",2012-06-02T11:31:13Z,2025-11-24T06:27:48Z
pw,Palau,Food & Drink,6023,25,1615641660,Seoudi Supermarket,Seoudi Supermarket,https://apps.apple.com/pw/app/seoudi-supermarket/id1615641660?uo=4,0.0,0,0,Food & Drink,"It’s now easier with Seoudi! Shop all your favorite groceries and household needs online smoothly with one click of a button. 

A Wide Assortment of Egyptian & International Brands 

More than 15,000 assorted products are available online, starting from fresh vegetables, fruits, dairy products, deli, butchery, bakery, kitchen and household essentials, as well as small appliances. 

Innovative Solutions for Premium Quality 

Freshness is guaranteed within all our products because we strive to maintain high food quality & good taste. In addition, all products are delivered right to your doorstep in the fastest way possible. 

An Exceptional & Unique Shopping Experience 

Because Seoudi is your favorite place to shop, we are keen on offering you the best online shopping experience for a higher satisfaction level and all day round service. We take your orders 24/7.   

Fresh Food Experts Since 1938 
 
Quality is in the core of our work. Therefore, Seoudi’s team of chefs, bakers, and food handlers are keen on maintaining the quality and safety of our special products, and preparing them with love and perfection. And with our customization feature, you can pick your favorite cuts, marination, and specific weights from the application the same way you do at the branch. 

Fast Delivery & Order Tracking Feature 

As soon as you place your order on Seoudi’s application, you can easily start tracking it starting from the preparation phase, any changes you make within the order, and the delivery until the order finally arrives at your doorstep in the fastest way possible. 

Discover Top Deals & Multiple Payments Methods 

A world of unbeatable offers and discounts is waiting for you to discover on Seoudi’s application. Order and choose your preferred and safe payment method, whether through online credit or debit card payments or through cash or card upon delivery.",2022-08-24T07:00:00Z,2025-11-23T13:38:49Z
