country,country_name,category,genre_id,rank,app_id,app_name,developer,url,price,averageUserRating,userRatingCount,primaryGenreName,description,launch_date,update_date
pw,Palau,Food & Drink,6023,1,1543717933,Bazooka Fried Chicken,Mario Sadra,https://apps.apple.com/pw/app/bazooka-fried-chicken/id1543717933?uo=4,0.0,0,0,Food & Drink,Bazooka is an app that receive food orders from client to deliver it,2020-12-17T08:00:00Z,2025-11-14T12:14:05Z
pw,Palau,Food & Drink,6023,2,1543654711,Суши Селл,"MNE BY V KOSMOS, OOO,",https://apps.apple.com/pw/app/%D1%81%D1%83%D1%88%D0%B8-%D1%81%D0%B5%D0%BB%D0%BB/id1543654711?uo=4,0.0,0,0,Food & Drink,"Скидка 20% от 1299 рублей для новых клиентов по промокоду ""аппстор""

- Быстрая бесплатная доставка 
- Актуальное время доставки и курьер на карте
- Предварительный заказ - возможность выбрать дату и время
- Всё актуальные акции под рукой
- Подарок за первый заказ в приложении",2021-02-10T08:00:00Z,2025-11-12T00:26:44Z
pw,Palau,Food & Drink,6023,3,6447102735,Juusto Pizzeria,Fiveteq Limited,https://apps.apple.com/pw/app/juusto-pizzeria/id6447102735?uo=4,0.0,5,1,Food & Drink,"- Ui improvement
- system speed improvements",2023-04-23T07:00:00Z,2023-07-10T12:03:56Z
pw,Palau,Food & Drink,6023,4,6755383983,Criticify,Gaetano Giuseppe Domenico Russo,https://apps.apple.com/pw/app/criticify/id6755383983?uo=4,0.0,0,0,Food & Drink,"This app is designed for culinary critics who evaluate restaurants, cafés, and gastronomic experiences. It offers tools for creating detailed ratings, keeping tasting journals, and using checklists and timers to measure cooking precision. Users gain access to chef insights, expert articles, and professional tasting techniques. The app also helps track upcoming tastings and culinary events, making evaluations more organized and insightful.",2025-11-18T08:00:00Z,2025-11-18T19:53:45Z
pw,Palau,Food & Drink,6023,5,1595938390,Zest: Meal Planner & Helper,"Culi, Inc.",https://apps.apple.com/pw/app/zest-meal-planner-helper/id1595938390?uo=4,0.0,5,1,Food & Drink,"Tired of cooking the same 3 meals on repeat? Zest integrates a mind-blowing cooking education into your routine. Learn to cook with us through step-by-step explanations of foundational cooking concepts in fewer than 10 minutes and dishes that bring the concept to life. Our recipes are created by two former Michelin star chefs, distilled by a home chef, and cooked by you, the superstar home cook that you are (or will be). We don't assume any prior culinary knowledge. We meet you where you are and help you improve.
 
Stop copying traditional recipes - start learning from Zest. We've cooked those delicious Bon Appetit dinners. But when we took away the recipes we felt like lost puppies. Zest is designed to teach you the how's and why's of cooking. So when the recipe is gone you can confidently navigate the kitchen. The promise: Taste improvement after one dinner with Zest.

FEATURES:

STEP-BY-STEP INSTRUCTIONS
We've all tried cooking a TikTok recipe. You rewatch the video 13 times to figure out what the hell is going on. Zest embeds videos throughout recipes so you can click into content when you need it. No more pausing and restarting. Learn at your own pace.
 
CONCEPT VIDEOS
Watch a short video on a new concept at your own pace and then cook recipes that reinforce what you've learned. We dive into topics like the science of tasting and the basics of seasoning, sautéing, roasting and more!

SKILL VIDEOS
Don't know how to dice an onion? Don't be embarrassed, we got you covered. Skill videos are linked in each recipe to guide you along, so you don't have to watch Gordon Ramsey on YouTube (we love his accent too).

CURATED MENU
Choose a menu to fit your preferences. Tired of wasting produce? Search for dishes including what’s already in your fridge. Got allergies? Compile safe recipes in your menu to find them when you’re ready to get cooking. 

GROCERY LIST
Shop your menu with our automated grocery list. Plus, utilize our helpful tips while you shop. Don't know what a neutral oil is? We got you covered.

PERSONALIZED RECOMMENDATIONS
Rate the recipes you cook, so we can recommend similar ones.

Feedback? Technical Issues? Killer ideas you want to contribute to make our app better? Email us at support@zestapp.co. We're always here to help and would love to chef up new ideas together!

End User Licensing Agreement: https://www.apple.com/legal/internet-services/itunes/dev/stdeula/",2021-12-24T08:00:00Z,2025-11-19T15:34:09Z
pw,Palau,Food & Drink,6023,6,1451492388,Bolt Food,BOLT TECHNOLOGY OU,https://apps.apple.com/pw/app/bolt-food/id1451492388?uo=4,0.0,4.5,10,Food & Drink,"Craving something delicious? Whether it's pizza, tacos, or your favourite fast food from Burger King and KFC, Bolt Food delivers straight to your door.

WHY CHOOSE BOLT FOOD?
- Real-time tracking: track your order and courier’s location from the restaurant to your doorstep.
- Convenient scheduling: plan ahead and order food or groceries in advance.
- Pickup options: prefer to grab your meal yourself? Use our pickup feature for easy collections.
- Takeaway deals and discounts: save on your favourite meals and snacks.
- Seamless payments: pay effortlessly using Google Pay, Apple Pay, or credit/debit cards.

HOW TO GET STARTED:
1. Set your delivery address.
2. Browse and pick meals, groceries, or snacks from your favourite local restaurants or stores.
3. Place your food order and pay securely.
4. Track your order in real-time.
5. Sit back and enjoy!

DISCOVER LOCAL AND GLOBAL FAVOURITES:
Explore a culinary world at your fingertips with Bolt Food. From beloved local restaurants to renowned fast food chains like McDonald's, get meals from your favourite restaurants delivered to your door.

*BOLT MARKET - QUICK GROCERY DELIVERY:
Need groceries or essentials delivered? Bolt Market brings everyday items like milk, bread, and coffee, as well as speciality products like pet supplies, cosmetics, or alcohol, right to your doorstep. Forget the long supermarket queues and shop smarter with Bolt Market.

*BOLT PLUS
With Bolt Plus, you can access exclusive benefits that save you time and money. For example, you can enjoy priority delivery for your orders, even during the busiest hours.

*GO OUT AND SAVE WITH DINEOUT
As convenient as it is to get food delivered to your door, some moments are worth making the trip out for. Find tables at nearby DineOut restaurants and get a discount off your meal. Just open the app, search for what you crave, and switch to the DineOut tab for in-restaurant offers. 

Bolt Food was created by the European super-app Bolt. It’s challenging the efficiency of the food and grocery delivery industry while helping restaurants and stores get more orders and enabling couriers to earn money.

Become a Bolt Food Courier partner:
Have a car, bike, or motorbike? Earn money delivering meals with Bolt Food: https://bolt.eu/en/food/courier/.

Partner with Bolt Food:
Are you a restaurant or grocery store? Boost your sales by joining Bolt Food: https://bolt.eu/en/food/partner/.

Get in touch with us via food@bolt.eu

Follow us on Facebook: https://www.facebook.com/boltfood.

- - - - - - - - - - - - - - - - - - - - - - - - - - - - - - - - - - - - - - - -
*Only available in selected markets.",2019-08-19T07:00:00Z,2025-11-18T08:35:04Z
pw,Palau,Food & Drink,6023,7,6747400249,You Scan - Label Scanner,Suman Sigdel,https://apps.apple.com/pw/app/you-scan-label-scanner/id6747400249?uo=4,0.0,0,0,Food & Drink,"You Scan - Food Scan, Label Scanner mobile app that allows you to scan the barcodes or labels (nutrition, product) of food and personal care products and instantly see their impact on your health. A rating and detailed information help you understand the analysis of each product. A better alternative to Yuka - Food & Cosmetic Scanner. 


When a product has a negative impact on your health, Food Scan also recommends similar but healthier alternative products.


It's super easy, just:

- Scan any food barcode or food label  to see the list of potentially harmful, questionable, added sugar or bioengineered ingredients.
- Tap on each ingredient to understand its health impact, backed by scientific studies.
- No barcode? No problem. Just snap a pic of the ingredients list and Food Scan can gather insights, instantly.
- A better alternative to Yuka, One Label, Olive, Fastic and other label scanner apps. We have coverage across thousands of products
- Search by product to see top-rated products based on keywords.

If you're interested in supporting Food Scan's mission to increase access to healthy food, we offer a yearly subscription called the Food Scan Premium.

EULA: https://www.apple.com/legal/internet-services/itunes/dev/stdeula/

Terms of service: https://apps.aayush.art/tos

Privacy Policy :  https://apps.aayush.art/privacy",2025-06-20T07:00:00Z,2025-09-14T11:49:03Z
pw,Palau,Food & Drink,6023,8,1196302015,ToYou. Food & Grocery Delivery,Aram Meem LLC,https://apps.apple.com/pw/app/toyou-food-grocery-delivery/id1196302015?uo=4,0.0,0,0,Food & Drink,"The fastest delivery in the Kingdom for food, groceries, gifts, flowers & more.

Hungry? Need groceries or a last-minute gift? ToYou has you covered. 
Order from top restaurants like McDonald's, Albaik, and Starbucks, or get groceries, flowers, and more delivered fast – all in one super app.

Why ToYou?

- All-in-One Delivery Solution – thousands of merchants covering all your needs across the Kingdom.
- Secure & Flexible Payments – Credit card, Apple Pay, ToYou Wallet, or pay later with Tabby & Tamara.
- Real-Time Order Tracking – Track your order live with Google Maps. 
- Exclusive Deals & Promotions – Enjoy cashback & discounts on food, drinks, and more.
- Thousands of Merchants – Order everything you desire from over +27К merchants.

Download ToYou today and benefit from our new users' offer:
30 Days of free delivery + 50 SAR credit in your Wallet.

We deliver all that matters.",2018-09-12T13:23:06Z,2025-10-21T11:01:57Z
pw,Palau,Food & Drink,6023,9,6738700305,Muftaax Driver,MUFTAAX LLC,https://apps.apple.com/pw/app/muftaax-driver/id6738700305?uo=4,0.0,0,0,Food & Drink,"Muftaax Driver is the ultimate platform for drivers looking to earn money by delivering food and providing ride-hailing services. Whether you’re delivering delicious meals from top restaurants or transporting passengers to their destinations, Muftaax ensures a smooth and efficient experience for both drivers and customers.

Why Join Muftaax Driver?

Flexible Earnings – Work on your schedule and maximize your income.

Food & Ride Delivery – Take food orders or offer rides with multiple stops.

Real-Time Tracking – Get navigation support and live tracking for seamless deliveries.

Secure Payments – Receive earnings safely with multiple payment options.

User-Friendly Interface – Simple and intuitive design to manage your tasks efficiently.

Join Muftaax Driver today and start earning while delivering convenience to customers!",2025-04-23T07:00:00Z,2025-10-29T12:59:19Z
pw,Palau,Food & Drink,6023,10,373034841,Yemeksepeti: Food & Grocery,YEMEK SEPETI ELEKTRONIK ILETISIM PERAKENDE GIDA LOJISTIK ANONIM SIRKETI,https://apps.apple.com/pw/app/yemeksepeti-food-grocery/id373034841?uo=4,0.0,2,1,Food & Drink,"Yemeksepeti is with you, whatever you have in mind is at your door!

Since 2001, as Yemeksepeti, we are the first brand that comes to mind when it comes to online food ordering, with our business partners and more than 50 thousand restaurants in Turkey and the TRNC!

Moreover, we are at your door with Yemeksepeti Market and Yemeksepeti Mahalle, not only for food orders, but also for all your grocery and daily shopping needs!


Are you hungry?
Choose the restaurant, add the meal to your basket, pay online or at the door as you wish. The rest is easy, your order is at your door quickly!


Need grocery shopping in minutes?

Yemeksepeti Market is at your service! Thousands of market products can be delivered at any time, within minutes!


Do you want your daily needs at your door without leaving your home?

Yemeksepeti Mahalle is also here! All the local shops you know and trust around your neighbourhood, such as supermarkets, delicatessens, greengrocers, butchers, fishmongers and pet shops, are at your door with various campaigns!

Download the app, sign up for free. After choosing your location, order your food, market or daily needs quickly!


What awaits you at Yemeksepeti?

-With Yemeksepeti, your favourite restaurants such as Burger King, McDonald's, KFC, Popeyes, Domino's Pizza, Little Caesars, Pizza Hut, Komagene or the best restaurants in your neighbourhood that you can discover by ranking them according to their scores! Besides, all cuisine options!

-With Yemeksepeti Market and Yemeksepeti Mahalle, tens of categories and thousands of products for your grocery shopping and daily needs!

-Thousands of discounts every day for your food, grocery and daily needs!

-Online or at the door, the option to pay as you wish!

-24/7 Live Support team, always ready to support you with your order!


All you have to do is think about your needs and take a look at the options around you!

Contact Us:

Facebook: https://www.facebook.com/Yemeksepeti 
Twitter: https://twitter.com/yemeksepeti 
Instagram: https://www.instagram.com/yemeksepeti 
Youtube: https://www.youtube.com/user/yemeksepeti

For all of your queries: info@yemeksepeti.com",2012-06-02T22:42:50Z,2025-11-18T20:26:36Z
pw,Palau,Food & Drink,6023,11,6450051327,City Crepe,DIGIX FOR DIGITAL TRANSFORMATION LLC,https://apps.apple.com/pw/app/city-crepe/id6450051327?uo=4,0.0,0,0,Food & Drink,City Crepe is a new app that enables customers to explore City Crepe's products and order online through it.,2023-06-16T07:00:00Z,2025-03-18T14:30:47Z
pw,Palau,Food & Drink,6023,12,1055344588,Nana نعناع,Central Stores For Information Technology,https://apps.apple.com/pw/app/nana-%D9%86%D8%B9%D9%86%D8%A7%D8%B9/id1055344588?uo=4,0.0,0,0,Food & Drink,"Short on time?
Running out of groceries and there's no one to get them for you?
Craving a meal and can't get the missing ingredients?
Movie night in need of snacks?
Nana has you covered
Download the app and we're on our way

Who's Nana?
Nana is there when you need it most
It's there to support you in your time of need.
Need speed? you've got Nana Express, your fastest fix for your daily grocery needs within 15mins
Want to order your weekly or monthly groceries? Nana Hyper takes all the hassle away with more than 20,000 products

Where are we?
Nana is available in Saudia Arabia & Egypt

Why Nana?
Our shoppers are pros! They hand pick the best products for you
Pay the way that suits you most, cash or online
Schedule your delivery the way you like, as long as your comfortable

All that... in one app

*Yes we're one app, but you might sense a little difference in our interface depending on where you live",2015-12-02T21:55:10Z,2025-11-21T13:35:51Z
pw,Palau,Food & Drink,6023,13,1492871841,Vuba Vuba,ESICIA LTD,https://apps.apple.com/pw/app/vuba-vuba/id1492871841?uo=4,0.0,0,0,Food & Drink,"Vuba Vuba is a pan African e-commerce platform that provides a convenient solution for residents in Kigali, and other parts of the country to order meals and daily essentials for delivery to their homes or offices within 1 hour.
[:mav: 2.0.28]",2019-12-29T08:00:00Z,2025-08-19T21:09:59Z
pw,Palau,Food & Drink,6023,14,1063183999,盒马 - 鲜美生活,"Shanghai Heli Network Technical Service Co., Ltd.",https://apps.apple.com/pw/app/%E7%9B%92%E9%A9%AC-%E9%B2%9C%E7%BE%8E%E7%94%9F%E6%B4%BB/id1063183999?uo=4,0.0,5,1,Food & Drink,"盒马是中国首家以数据和技术驱动的新零售平台。通过重构零售产业 “人、货、场”，打造了“盒马鲜生”、“盒马X会员店”、“盒马NB”等业态，致力于满足消费者对美好生活的向往，用科技和创新引领万千家庭的“鲜·美·生活”。
盒马首推“手指点点30分钟送达”模式，让新鲜与美味，方便直达您的餐桌。通过盒马APP，不仅可以轻松买到新鲜实惠的商品，更有实物视频展示、真实买家秀和试吃测评，还可以与盒粉们分享每一次发现的好货与下厨的乐趣。
盒马积极布局上游农产品基地和工厂，通过产业深耕，重塑供应链。让商品品质更好，价格更优，推动产业进步。
盒马坚持“商品力是第一竞争力”，不断提高采购标准、优化商品工艺，改进物流链路，不断给消费者提供更好的产品和服务。
盒马启动全球供应链战略，推出全球直采，把全球好货，带进了中国家庭。
盒马建设遍布全国的供应链网络和城市央厨，保障了食材的安全、新鲜、美味。
盒马建立了百余个“盒马村”，促进一二三产的融合，将优质农产品加工成不同商品形态，送上一二线城市消费者餐桌。
一直以来，盒马秉持“鲜·美·生活”的品牌理念，用可信赖的商品品质，有活力的产品创新，懂生活的服务理念，只为让消费者“买得到”、“买得好”、 “买得放心”、“买得方便”、 “买得开心”！",2016-01-06T08:45:08Z,2025-11-18T01:30:55Z
pw,Palau,Food & Drink,6023,15,451001072,"Talabat: Food, grocery & more",Talabat General Trading and Contracting Company,https://apps.apple.com/pw/app/talabat-food-grocery-more/id451001072?uo=4,0.0,4.83333,60,Food & Drink,"Hey! Looking for the quickest food delivery? That’s easy with our new talabat app.

Whether you want a pizza, burger or groceries, choose from thousands of markets and restaurants in your city and put your hunger to an end. We’ve got it all – fast delivery, unlimited options, easy online payment and vouchers all at your fingertips.

Order your favorite food and get it delivered to wherever you are, but also get your groceries delivered to you with more cities to come. Your needs, done - simply download our app, choose your food or groceries and pay in a few taps via card or cash upon delivery. 

Browse a multitude of restaurant menus and order from countless stores. With our filters and smart search functions, you can find the exact menu or product you want in no time, available to personalize at your request.

""Pay online or in cash""
Add info to your account on our new talabat app to speed up your order process. Pay in cash or save card details to pay online, reorder your favorites anytime and save addresses so you’re ready for delivery wherever you are. Like planning ahead? Pick what time you want us to deliver to avoid hunger kicking in.

""Track your order from start to finish""
That’s right; follow your delivery from the moment it’s confirmed to the second we hand it to you. With notifications, you'll always be updated and our help center will answer any questions about your delivery – we’ve got you.

""Find exclusive deals""
Downloading the talabat app makes you a part of our fam. We’re more than food delivery; discover vouchers, promotions and deals and treat yourself to that midweek pizza or Friday night burger more often. By opting in for notifications, we'll also share new restaurants, supermarkets and stores in your area, so you’ll never miss out on the latest offers again.

Find us in Kuwait, the United Arab Emirates, Bahrain, Oman, Qatar, Jordan, the Kingdom of Saudi Arabia and Egypt.

Happy ordering.",2012-06-03T17:59:11Z,2025-11-20T06:58:24Z
pw,Palau,Food & Drink,6023,16,1502940286,星厨闪电,"SAS (Tianjin) Technology Co., Ltd.",https://apps.apple.com/pw/app/%E6%98%9F%E5%8E%A8%E9%97%AA%E7%94%B5/id1502940286?uo=4,0.0,0,0,Food & Drink,"星厨闪电，你的共享厨房管家。
1、外卖平台订单数据分析，帮你及时掌握动态，调整策略。
2、商户账单线上查看明细，手机在线支付，轻松又省心。
3、新签档口线上电子签约，方便快捷有保障。",2020-03-18T07:00:00Z,2025-08-04T04:35:19Z
pw,Palau,Food & Drink,6023,17,1058959277,Uber Eats: Food & Groceries,"Uber Technologies, Inc.",https://apps.apple.com/pw/app/uber-eats-food-groceries/id1058959277?uo=4,0.0,4.88889,27,Food & Drink,"Get food delivery to your doorstep from thousands of amazing local and national restaurants. Find the meal you crave and order food from restaurants easily with the Uber Eats app. Track your order in real-time.

FIND YOUR FAVOURITE FOOD & RESTAURANTS
Order food from nearby restaurants and search by cuisine, restaurant name, dish, and meal. 
Food delivery options for you to order and enjoy such as pizza, burritos, burgers, sushi, fish and chips, doughnuts and Chinese takeout.
Prefer pickup? Skip the line and reservations and choose to pick up your order instead. Choose your favourite delivery options with the Uber Eats app now.

SUBSCRIBE TO UBER ONE
For £5.99 per month, Uber One subscribers enjoy £0 delivery fee and up to 5% off orders over £15 at participating non-grocery stores (and 5% off orders over £25 at participating grocery stores) available on Uber Eats. Members are also eligible for rewards, perks, coupons, and offers. View full Uber One Terms & Conditions in app.

ORDER ALMOST ANYTHING, ANYTIME
Order household needs from your favourite pharmacies, supermarkets, and pet shops. Baby food or nappies, pharmacy needs, beauty products and cosmetics. Grocery staples like bread and milk, bananas and produce, flowers and plants, packaged foods or frozen treats. 

You can even order alcoholic drinks including beer, wine, spirits and cocktails.*

SIMPLE DELIVERY ORDERING
Pick your food order from any menu and add it to your cart with a few taps. That’s it.
Uber Eats makes it easy to order food delivery online or through the app and have it delivered by restaurants and delivery people near you.
Or, schedule your order in advance for a delivery person to pick it up later. Your choice!

ORDER FOOD AHEAD WITH PICKUP
Now you can also order food ahead for Pickup instead of just ordering delivery. Select Pickup, add food items to your cart, and skip the lines to the restaurant to get your food.

REAL-TIME ORDER TRACKING
Track your food delivery order on a map as it heads your way.
See the estimated arrival time at your address.
Get notified when your order arrives.

FIND SOME OF YOUR FAVOURITE NATIONAL RESTAURANTS
Some of our food delivery partners include: Pizza Hut, Domino’s Pizza, Burger King, Dunkin', KFC, McDonald's, Starbucks, Subway, Taco Bell,Costa Coffee, Kaspas, Gourmet Burger Kitchen, Franco Manca, Dixy Chicken, Chipotle, Chaiiwala, Amigos Burgers Shakes, Papa John’s, Krispy Kreme.  

FIND PHARMACIES, GROCERY STORES, AND MORE
Order from grocery stores such as Asda, Sainsbury Supermarket, Waitrose, The Co-op, Iceland, M&S Food, and Londis. You can also order from pharmacies such as Boots via Uber Eats, as well as from other delivery partners in the convenience and retail spaces.

ABOUT UBER EATS
Uber Eats is the way to order the food you love through an easy delivery experience. Uber Eats is available in hundreds of cities around the world. Enter your delivery address to explore restaurant and grocery delivery options near you.

AVAILABLE INTERNATIONALLY

Join others in your city who use the Uber Eats app to order from their favourite restaurants and schedule delivery.

Uber Eats is currently available in cities and metro areas including Adelaide, Amsterdam, Atlanta, Auckland, Austin, Baltimore, Brussels, Cape Town, Chicago, Dallas, Denver, Johannesburg, Glasgow, London, Los Angeles, Madrid, Melbourne, Mexico City, Miami, Milan, Nashville, New Orleans, New York, Ottawa, Paris, Philadelphia, San Diego, San Francisco, Seattle, Stockholm, Sydney, Taipei, Tokyo, Toronto, Warsaw, and Washington DC. Uber Eats helps you find food delivery around the world. Order delivery in countries around the world. See full list of available countries on our website. Uber content/messages human- or machine-translated as per device settings; accuracy not guaranteed

*Alcohol is only available in select markets. Must be at least 18 to purchase. Item availability varies by market. See the Uber Eats app for details.",2016-06-06T21:35:56Z,2025-11-17T16:26:42Z
pw,Palau,Food & Drink,6023,18,6738700273,Muftaax,MUFTAAX LLC,https://apps.apple.com/pw/app/muftaax/id6738700273?uo=4,0.0,0,0,Food & Drink,"Muftaax is a versatile app designed to simplify your life by offering seamless food ordering from top restaurants and hassle-free ride-hailing services with multiple stops. Whether you're craving your favorite meal or needing a ride across the city, Muftaax ensures a fast, reliable, and smooth experience.

Key Features:

** Food Delivery – Order from various restaurants and get meals delivered to your doorstep.

** Ride Booking – Travel easily with multiple stops for added convenience.

** Live Tracking – Track your food orders and rides in real time.

** Secure Payments – Multiple payment options for safe and easy transactions.

** User-Friendly Interface – Simple, intuitive design for effortless navigation.",2025-03-20T07:00:00Z,2025-11-07T09:12:39Z
